Source,GoogleTranslate,human1,human2
"Я затворил за собою дверь моей комнаты, засветил свечку и бросился на постель; только сон на этот раз заставил себя ждать более обыкновенного. Уж восток начинал бледнеть, когда я заснул, но – видно, было написано на небесах, что в эту ночь я не высплюсь. В четыре часа утра два кулака застучали ко мне в окно. Я вскочил: что такое?.. «Вставай, одевайся!» – кричало мне несколько голосов. Я наскоро оделся и вышел. «Знаешь, что случилось?» – сказали мне в один голос три офицера, пришедшие за мною; они были бледны как смерть.","I closed the door of my room behind me, lit the candle, and flung myself on the bed; only the dream this time forced itself to wait for something more ordinary. The east was already beginning to turn pale when I fell asleep, but apparently it was written in heaven that I would not sleep that night. At four o'clock in the morning two fists pounded on my window. I jumped up: what is it? .. ""Get up, get dressed!"" several voices shouted at me. I quickly got dressed and went out. ""Do you know what happened?"" - three officers who came for me said to me in one voice; they were as pale as death.","I closed the door to my room behind me and lit the candle and fell onto my bed. But slumber made me wait for it longer than usual. The east was already paling when I fell asleep, but apparently it was written in the skies that I wouldn’t get a good night’s sleep. At four o’clock in the morning, two fists knocked on my window. I jumped up. “What is it?” “Get up! Get dressed!” various voices cried to me. I quickly dressed and went out. “Do you know what has happened?” three officers asked me in unison, coming for me. They were as pale as death.","I closed the door of my room, lit a candle and threw myself on my bed; however, sleep made me wait for it longer than usual. The east was already beginning to pale when I fell asleep, but apparently it was written in heaven that I was not to get my fill of sleep that night. At four in the morning, two fists began to beat against my window. I jumped up: what was the matter? “Get up, get dressed!” shouted several voices. I dressed quickly and went out. “Do you know what’s happened?” said, with one voice, the three officers who had come to fetch me. They were as pale as death."
"– Я слышал, княжна, что, будучи вам вовсе незнаком, я имел уже несчастье заслужить вашу немилость… что вы меня нашли дерзким… неужели это правда?","“I heard, princess, that, being a complete stranger to you, I already had the misfortune to deserve your disgrace ... that you found me impudent ... is that really true?","“I have heard, princess, that though completely unacquainted with you, I already have the unhappiness of having earned your disfavor . . . that you found me to be audacious .","“I hear, princess, that despite my being completely unknown to you, I have already had the misfortune to earn your displeasure … that you’ve found me insolent… Can this be true?”"
– Вы нынче умрете! – сказал я ему.,“You are going to die today!” I told him.,“You will die today!” I said to him.,"“Tonight you will die,” I said to him."
– Это моя тайна.,- This is my secret.,“That is my secret.”,“That’s my secret.”
"– Дьявол, а не женщина! – отвечал он, – только я вам даю мое честное слово, что она будет моя…","“Devil, not a woman!” - he answered, - only I give you my word of honor that she will be mine ...","“‘A devil, not a woman!’ he replied. ‘Only I’ll give you my honest word, that she will be mine . . .’","‘ A demon, not a woman!’ he answered."
"– Максим Максимыч, – сказал я, подошедши к нему, – а что это за бумаги вам оставил Печорин?","“Maxim Maksimych,” I said, going up to him, “what kind of papers did Pechorin leave you with?”","“Maxim Maximych,” I said, walking up to him, “and what are these papers that Pechorin has left with you?”","“Maksim Maksimich,” I said, going up to him, “what are those papers that Pechorin left with you?”"
Тут разговор переменил направление и к этому уж более не возвращался.,Here the conversation changed direction and never returned to it.,Here the conversation changed direction and did not return to this again.,"Here the conversation took another direction, and did not return to that subject any more."
"Убийца заперся в пустой хате, на конце станицы. Мы шли туда. Множество женщин бежало с плачем в ту же сторону; по временам опоздавший казак выскакивал на улицу, второпях пристегивая кинжал, и бегом опережал нас. Суматоха была страшная.","The murderer locked himself in an empty hut, at the end of the village. We were going there. Many women ran crying in the same direction; from time to time a late Cossack jumped out into the street, hastily fastening his dagger, and ran ahead of us. The commotion was terrible.","The murderer had locked himself in an empty hut at the end of the stanitsa. We went there. A mass of women were weeping while running in the same direction. From time to time a tardy Cossack galloped out onto the street, hurriedly fastening his dagger to his belt, and outstripping us at a gallop. The turmoil was terrible.","The assassin had locked himself up in an empty hut on the outskirts of the settlement: we proceeded thither. A great many women ran, wailing, in the same direction. Here and there, some belated Cossack rushed out into the street fastening on his dagger, and passed us at a run. The commotion was terrible."
Мне надоела эта длинная церемония.,I'm tired of this long ceremony.,I was becoming fed up with this long ceremony.,I became bored with this long procedure.
"Два часа ночи… не спится… А надо бы заснуть, чтоб завтра рука не дрожала. Впрочем, на шести шагах промахнуться трудно. А! господин Грушницкий! ваша мистификация вам не удастся… мы поменяемся ролями: теперь мне придется отыскивать на вашем бледном лице признаки тайного страха. Зачем вы сами назначили эти роковые шесть шагов? Вы думаете, что я вам без спора подставлю свой лоб… но мы бросим жребий!.. и тогда… тогда… что, если его счастье перетянет? если моя звезда наконец мне изменит?.. И не мудрено: она так долго служила верно моим прихотям; на небесах не более постоянства, чем на земле.","Two o'clock in the morning ... I can't sleep ... But I should fall asleep so that tomorrow my hand does not tremble. However, it is difficult to miss at six steps. BUT! Mr Grushnitsky! you will not succeed in your hoax ... we will switch roles: now I will have to look for signs of secret fear on your pale face. Why did you yourself appoint these fatal six steps? You think that I will turn my forehead to you without a dispute ... but we will cast lots! .. and then ... then ... what if his happiness outweighs? if my star finally betrays me? .. And no wonder: for so long she served faithfully to my whims; there is no more constancy in heaven than on earth.","I cannot sleep . . . But I must fall asleep, so that tomorrow my hand won’t shake. However, at six paces, it is hard to miss. Ah! Mr. Grushnitsky! You won’t succeed in your hoax . . . We will swap roles. Now it is I who shall look for the symptoms of secret fear on your pale face. Why did you set yourself these fateful six paces? You think that I will offer you my forehead without a struggle . . . but we are casting lots! . . . But then . . . then . . . what if his luck outweighs mine . . . if my star has at last betrayed me? . . . It would be no surprise: it has faithfully served my whims for so long, there is no more constancy in the heavens than on earth.","Two o’clock in the morning … Sleep does not come … Yet I ought to have some sleep so that my hand does not shake tomorrow. Anyway, it would be difficult to miss at six paces. Ah, Mr. Grushnitski! Your mystification will not come off … We shall exchange parts: it is now I who will search your pale face for signs of secret fear. Why did you designate yourself those fatal six paces? You think that I shall present my forehead to you without arguing … But we shall cast lots … and then … then … what if his luck outweighs mine? What if my star at last betrays me? … It would hardly be strange, it has so long served my whims faithfully. There is no more constancy in heaven than there is on earth."
"– А что такое? Расскажите, пожалуйста.","– What is it? Tell me, please.",“What was it? Tell me please.”,"“And what was it? Do tell me, please.”27"
"– Чтоб вам доказать, доктор, ложность этих слухов, объявляю вам по секрету, что завтра я переезжаю в Кисловодск…","- To prove to you, doctor, the falsity of these rumors, I announce to you in confidence that tomorrow I am moving to Kislovodsk ...","“In order to prove to you the falsity of these rumors, doctor, I will announce to you in confidence that tomorrow I am leaving for Kislovodsk . . .”","“In order to prove to you, doctor, that these rumors are false, let me inform you in secret that tomorrow I am moving to Kislovodsk.”"
"В это время один офицер, сидевший в углу комнаты, встал, и медленно подойдя к столу, окинул всех спокойным взглядом. Он был родом серб, как видно было из его имени.","At this time, one officer, who was sitting in the corner of the room, got up, and slowly approaching the table, looked around at everyone with a calm look. He was a Serb by birth, as was clear from his name.","At this time, an officer who had been sitting in the corner of the room stood and walked slowly up to the table, throwing a cool glance at the company. He was a Serbian type, which was evident from his name.","At this moment, an officer, who had been sitting in a corner of the room, got up and, slowly coming up to the table, surveyed all present with a calm and solemn gaze. He was of Serbian origin, as was apparent from his name."
– Сегодня без вас пришла старуха и с ней дочь.,“Today an old woman came without you and her daughter with her.,"“Today, when you were gone, an old woman came and with her a daughter.”","“When you were out today, there came an old woman, and her daughter.”"
– Гуд-гора.,- Good mountain.,“Gud Mountain.”,“Mount Gud.”9
"Около семи часов вечера я гулял на бульваре. Грушницкий, увидав меня издали, подошел ко мне: какой-то смешной восторг блистал в его глазах. Он крепко пожал мне руку и сказал трагическим голосом:","About seven o'clock in the evening I was walking on the boulevard. Grushnitsky, seeing me from afar, came up to me: a kind of ridiculous delight shone in his eyes. He shook my hand warmly and said in a tragic voice:","At around seven o’clock in the evening I was strolling along the boulevard. Grushnitsky, seeing me from a distance, walked up to me: some kind of amusing delight was shining in his eyes. He shook my hand tightly and said in a tragic voice:","Around seven tonight, I was out strolling on the boulevard. Grushnitski, on seeing me in the distance, came up to me: a kind of absurd exaltation shone in his eyes. He gripped my hand and said in a tragic voice:"
"– Бедная шинель! – сказал я, усмехаясь, – а кто этот господин, который к ним подходит и так услужливо подает им стакан?","- Poor overcoat! - I said, grinning, - and who is this gentleman who comes up to them and so obligingly gives them a glass?","“The poor greatcoat!” I said, bursting into laughter, “and who is the gentleman who is walking up to them and so courteously offering them a glass?”","“Poor coat,” I said with a smile. “And who is the gentleman going up to them and so helpfully offering them tumblers?”"
"Я вернулся домой, волнуемый двумя различными чувствами. Первое было грусть. «За что они все меня ненавидят? – думал я. – За что? Обидел ли я кого-нибудь? Нет. Неужели я принадлежу к числу тех людей, которых один вид уже порождает недоброжелательство?» И я чувствовал, что ядовитая злость мало-помалу наполняла мою душу. «Берегись, господин Грушницкий! – говорил я, прохаживаясь взад и вперед по комнате. – Со мной этак не шутят. Вы дорого можете заплатить за одобрение ваших глупых товарищей. Я вам не игрушка!..»","I returned home, agitated by two different feelings. The first was sadness. Why do they all hate me? I thought. - For what? Have I offended anyone? No. Am I really one of those people whose mere sight already breeds ill-will? And I felt that poisonous anger gradually filled my soul. “Beware, Mr. Grushnitsky! I said as I paced up and down the room. - They don't joke with me. You can pay dearly for the approval of your stupid comrades. I'm not your toy!""","I returned home, agitated by two different feelings. The first was sorrow. “Why do they all hate me so much?” I thought. Why? Have I insulted someone? No. Surely I am not one of those people who can incite ill will at first appearance? And I felt a poisonous malevolence, little by little, filling my soul. “Watch yourself, Mr. Grushnitsky!” I was saying, walking up and down my room. “You can’t play with me like this. You may pay dearly for the approval of your stupid comrades. I am not your toy!”","I returned home, agitated by two different emotions. The first was sadness. “What do they all hate me for?” I thought. “What for? Have I offended anybody? No. Could it be that I belong to the number of those people whose appearance alone is sufficient to produce ill will?” And I felt a venomous rancor gradually filling my soul. “Take care, Mr. Grushnitski!” I kept saying, as I paced to and fro in my room, “I am not to be trifled with like this. You may have to pay dearly for the approval of your stupid cronies. I am not a plaything for you!”"
II. Княжна Мери,II. Princess Mary,2 PRINCESS MARY,"And besides, what do I care about human joys and sorrows—I, a military man on the move, and holder, moreover, of a road- pass issued to those on official business! Princess Mary"
– Откуда?,- Where?,“Where have you come from?”,“Where do you come from?”
– Печорин! давно ли здесь?,- Pechorin! how long have you been here?,“Pechorin! Have you been here long?”,“Pechorin! Have you been here long?”
"– Завтра будет славная погода! – сказал я. Штабс-капитан не отвечал ни слова и указал мне пальцем на высокую гору, поднимавшуюся прямо против нас.",Tomorrow the weather will be nice! - I said. The captain did not answer a word and pointed to me with his finger at a high mountain that rose directly in front of us.,“Tomorrow will be glorious weather!” I said. The staff captain didn’t say a word and pointed his finger at the high mountain that was rising in front of us.,"“It will be fine tomorrow!” I said. The junior captain did not answer a word, and pointed out to me with his finger a high mountain rising directly in front of us."
"Дойдя до середины комнаты, она пошатнулась; я вскочил, подал ей руку и довел ее до кресел.","When she reached the middle of the room, she staggered; I jumped up, gave her my hand, and led her to an armchair.","Walking to the middle of the room, she swayed. I jumped up, gave her my arm, and led her to an armchair.","On reaching the middle of the room, she swayed; I jumped up,122 gave her my arm and led her to an armchair."
"За полчаса до бала явился ко мне Грушницкий полном сиянии армейского пехотного мундира. К третьей пуговице пристегнута была бронзовая цепочка, на которой висел двойной лорнет; эполеты неимоверной величины были загнуты кверху в виде крылышек амура; сапоги его скрипели; в левой руке держал он коричневые лайковые перчатки и фуражку, а правою взбивал ежеминутно в мелкие кудри завитой хохол. Самодовольствие и вместе некоторая неуверенность изображались на его лице; его праздничная наружность, его гордая походка заставили бы меня расхохотаться, если б это было согласно с моими намерениями.","Half an hour before the ball, Grushnitsky appeared to me in the full radiance of an army infantry uniform. Attached to the third button was a bronze chain from which hung a double lorgnette; epaulettes of incredible size were bent upwards in the form of cupid's wings; his boots creaked; in his left hand he held brown kid gloves and a cap, and with his right hand he constantly fluffed a curled tuft of hair into small curls. Self-satisfaction and at the same time a certain uncertainty were depicted on his face; his festive appearance, his proud gait, would make me burst out laughing, if it were in accordance with my intentions.","Half an hour before the ball began, Grushnitsky appeared at my place in the total brilliance of a full dress infantry uniform. There was a little bronze chain attached to his third button, on which hung a double lorgnette; his epaulets of incredible size were turned up like the little wings of Cupid; his boots squeaked; in his left hand he held brown kid-gloves and a military cap, and with his right hand he fluffed up the wavy tuft of his crested hair into little curls. His face expressed self-satisfaction with a touch of uncertainty. His festive appearance and his proud demeanor would have made me laugh if it had been in accordance with my plans.","Half an hour before the ball, Grushnitski appeared before me in the full splendor of an infantry army officer’s uniform. To the third button, he had attached a bronze chainlet from which hung a double lorgnette; epaulets of incredible size were turned upward like the wings of a cupid; his boots squeaked; in his left hand, he held a pair of brown kid gloves and his cap, and with his right he kept fluffing up, every moment, his shock of hair, which was waved in small curls. Self-satisfaction and, at the same time, a certain lack of assurance were expressed in his countenance: his festive exterior, his proud gait, would have made me burst out laughing, had that been in accordance with my plans."
"– Зачем же ты надеялся? Желать и добиваться чего-нибудь – понимаю, а кто ж надеется?","Why did you hope? To wish and achieve something - I understand, but who hopes?","“Why did you have hope? To want and strive for something, I understand, but who entertains hopes?”",“Why then did you hope? I can understand people who desire something and strive for it; but who wants to hope?”
"– Вы счастливы в игре, – сказал я Вуличу…","“You are happy in the game,” I said to Vulich ...","“You are lucky in gambling,” I said to Vulich.",“You’re a lucky gambler!” I said to Vulich.
– Да куда же?,"- Yes, where to?",“Where to?!”,“Where to?”
Я пожал плечами и раскланялся с секундантами Грушницкого.,I shrugged my shoulders and bowed to Grushnitsky's seconds.,I shrugged my shoulders and exchanged bows with Grushnitsky’s seconds.,I shrugged my shoulders and bowed to Grushnitski’s seconds as I took leave of them.
"– Знаете, княжна, – сказал я с некоторой досадой, – никогда не должно отвергать кающегося преступника: с отчаяния он может сделаться еще вдвое преступнее… и тогда…","“You know, princess,” I said with some annoyance, “one should never reject a penitent criminal: out of desperation, he can become twice as criminal ... and then ...","“Do you know, princess,” I said with a certain vexation, “one must never reject a penitent criminal: he might do something doubly criminal out of despair . . . and then . . .”","“Do you know, princess,” I said with some vexation, “one should never turn down a repentant criminal: out of sheer despair he may become twice as criminal as before, and then… .” Laughter and whispering among the people around us made me turn and interrupt my sentence."
Вещи драгоценные.,Precious things.,with its riches floats,costly things;
