Source,GoogleTranslate,human1,human2
"– Посмотри-ка, Бэла, – сказал я, – у тебя глаза молодые, что это за джигит: кого это он приехал тешить?..","“Look, Bela,” I said, “you have young eyes, what kind of horseman is this: whom did he come to amuse? ..","“‘Look there, Bela,’ I said, ‘you have young eyes, who is this dzhigit—and who is he here to entertain?’ “She looked over and cried out, ‘It’s Kazbich!’ “‘Ach, that scamp! What—has he come to laugh at us?’","Take a look, Bela,’ I said, ‘you’ve got young eyes, who is that fancy horseman? Whom has he come to entertain?’"
– На что мне тебя? – был ответ.,- What do I need you for? was the answer.,“What are you to me?” was the reply.,“What use are you to me?” was the answer.
"Грушницкий целый вечер преследовал княжну, танцевал или с нею, или вис-e-вис; он пожирал ее глазами, вздыхал и надоедал ей мольбами и упреками. После третьей кадрили она его уж ненавидела.","Grushnitsky pursued the princess the whole evening, dancing either with her or vis-e-vis; he devoured her with his eyes, sighed, and bored her with entreaties and reproaches. After the third quadrille, she already hated him.","Grushnitsky pursued the princess the whole evening, dancing either with her or vis-à-vis. He devoured her with his eyes, sighed often, and exasperated her with his entreaties and reproaches. By the third quadrille, she already detested him.","All evening Grushnitski pursued the young princess, either dancing with her or being her vis-à-vis; he devoured her with his eyes, sighed and pestered her with entreaties and reproaches. After the third quadrille, she already detested him."
"– Я вам советую перед смертью помолиться богу, – сказал я ему тогда.","“I advise you to pray to God before you die,” I told him then.","“I advise you to pray to God before you die,” I said to him then.","“I advise you to say your prayers before dying,” I then said to him."
"Она обернулась ко мне бледная, как мрамор, только глаза ее чудесно сверкали.","She turned to me pale as marble, only her eyes sparkled wonderfully.","She turned to me, pale as marble—only her eyes sparkled marvelously.",She turned to me as pale as marble; only her eyes glittered marvelously.
"Утро было свежее, но прекрасное. Золотые облака громоздились на горах, как новый ряд воздушных гор; перед воротами расстилалась широкая площадь; за нею базар кипел народом, потому что было воскресенье; босые мальчики-осетины, неся за плечами котомки с сотовым медом, вертелись вокруг меня; я их прогнал: мне было не до них, я начинал разделять беспокойство доброго штабс-капитана.","The morning was crisp but beautiful. Golden clouds piled up on the mountains like a new row of airy mountains; in front of the gate was a wide square; behind it the market was seething with people, because it was Sunday; barefoot Ossetian boys, carrying knapsacks of honeycomb over their shoulders, spun around me; I drove them away: I had no time for them, I began to share the anxiety of the good staff captain.","The morning was cooler, but beautiful. Golden clouds towered over the hills: another row of mountains, made of air. A wide square extended in front of the gate, beyond which a bazaar seethed with people, since it was Sunday. Barefoot Ossetian boys carrying sacks of honeycombs circled around me again and again. I chased them off. I didn’t want anything from them, and I was starting to share the anxieties of the good staff captain.","The morning was fresh, but fine. Golden clouds had accumulated on the mountains like an additional, airy range. A wide square spread before the gate; beyond it, a market-place was seething with people, it being Sunday; barefooted Ossetian lads, carrying on their shoulders sacks52 of honey combs, swarmed around me; I chased them away. I could not be bothered by them. I was beginning to share the restlessness of my good captain."
"Происшествие этого вечера произвело на меня довольно глубокое впечатление и раздражило мои нервы; не знаю наверное, верю ли я теперь предопределению или нет, но в этот вечер я ему твердо верил: доказательство было разительно, и я, несмотря на то, что посмеялся над нашими предками и их услужливой астрологией, попал невольно в их колею, но я остановил себя вовремя на этом опасном пути и, имея правило ничего не отвергать решительно и ничему не вверяться слепо, отбросил метафизику в сторону и стал смотреть под ноги. Такая предосторожность была очень кстати: я чуть-чуть не упал, наткнувшись на что-то толстое и мягкое, но, по-видимому, неживое. Наклоняюсь – месяц уж светил прямо на дорогу – и что же? предо мною лежала свинья, разрубленная пополам шашкой… Едва я успел ее осмотреть, как услышал шум шагов: два казака бежали из переулка, один подошел ко мне и спросил, не видал ли я пьяного казака, который гнался за свиньей. Я объявил им, что не встречал казака, и указал на несчастную жертву его неистовой храбрости.","The incident of that evening made a rather deep impression on me and irritated my nerves; I don’t know for sure whether I now believe in predestination or not, but that evening I firmly believed it: the proof was striking, and despite the fact that I laughed at our ancestors and their helpful astrology, I involuntarily fell into their rut, but I He stopped himself in time on this dangerous path and, having the rule not to reject anything resolutely and not to trust anything blindly, he threw metaphysics aside and began to look under his feet. Such a precaution was very useful: I almost fell, bumping into something thick and soft, but, apparently, inanimate. I bend over - the moon is already shining right on the road - and what? in front of me lay a pig, cut in half with a saber ... I had hardly had time to examine it when I heard the noise of steps: two Cossacks fled from the alley, one came up to me and asked if I had seen a drunken Cossack who was chasing a pig. I announced to them that I had not met a Cossack, and pointed out the unfortunate victim of his violent courage.","The incidents of the evening had made a rather deep impression on me and agitated my nerves. I do not know whether now I do indeed believe in predestination or not, but I firmly believed in it that night. The proof was striking, and despite the fact that I had mocked our ancestors and their obliging astrology, I had fallen involuntarily into their trap but stopped myself from following this dangerous path just in time. And having the rule of never rejecting anything absolutely, and never believing in anything blindly, I threw out metaphysics and started to look beneath my feet. Such precaution was very apt. I nearly fell, stumbling on something fat and soft, but by all appearances, not living. I stooped—the moon was shining directly onto the road—and what was it? In front of me lay a swine, cleaved in half by a saber . . . I had barely managed to examine it when I heard the noise of footsteps. Two Cossacks were running from the alley; one walked up to me and asked if I had seen a drunk Cossack chasing a swine. I declared to them that I had not met said Cossack and pointed to the unfortunate victim of his frenzied bravery.","The event of the evening had made a rather deep impression upon me and had irritated my nerves. I do not know for certain if I now believe in predestination or not, but that night I firmly believed in it: the proof was overwhelming, and despite my laughing at our ancestors and their obliging astrology, I had involuntarily slipped into their tracks. But I stopped myself in time on this dangerous path; and as I have, for rule, never to reject anything decisively, nor trust blindly in anything, I brushed metaphysics aside and began to look under my feet. Such a precaution proved much to the point: I very nearly fell, having stumbled over something fat and soft, but apparently inanimate. Down I bent. The moon now shone right upon the road—and what did I see? Before me lay a pig, slashed in two by a sword. Hardly had I time to inspect it, when I heard the sound of footfalls. Two Cossacks came running out of a lane; one of them came up to me and asked if I had not seen a drunken Cossack chasing a pig. I informed them that I had not encountered the Cossack, and pointed to the unfortunate victim of his frenzied valor."
"После этой трагической фразы, сказанной с приличною важностью, он отошел на свое место; Иван Игнатьич со слезами обнял также Грушницкого, и вот он остался один против меня. Я до сих пор стараюсь объяснить себе, какого роду чувство кипело тогда в груди моей: то было и досада оскорбленного самолюбия, и презрение, и злоба, рождавшаяся при мысли, что этот человек, теперь с такою уверенностью, с такой спокойной дерзостью на меня глядящий, две минуты тому назад, не подвергая себя никакой опасности, хотел меня убить как собаку, ибо раненный в ногу немного сильнее, я бы непременно свалился с утеса.","After this tragic phrase, spoken with decent gravity, he retired to his seat; Ivan Ignatich also embraced Grushnitsky with tears, and now he was left alone against me. I still try to explain to myself what kind of feeling then boiled in my chest: it was the annoyance of offended pride, and contempt, and the anger that was born at the thought that this man, now with such confidence, with such calm impudence, was looking at me , two minutes ago, without exposing himself to any danger, wanted to kill me like a dog, for if I had been wounded in the leg a little more, I would certainly have fallen off the cliff.","With this tragic phrase, delivered with decorous importance, he walked to his place. Grushnitsky was then also embraced by a teary-eyed Ivan Ignatievitch and then remained alone before me. I am still trying to explain to myself what kind of feeling was agitating then in my breast: it was the vexation of insulted vanity, and contempt, and anger, borne of the thought that this man, looking at me now with such assurance, with such calm impertinence, had, but two minutes ago, without exposing himself to any danger, wanted to kill me like a dog, for if he had wounded me a little more forcefully, I would have definitely fallen from the crag.","After this tragic phrase, delivered with appropriate dignity, he withdrew to his place. Ivan Ignatievich, with tears, likewise embraced Grushnitski, and now he was left alone facing me. To this day I try to explain to myself what kind of feeling was boiling then in my breast. It was the irritation of injured vanity, and contempt, and wrath which arose at the thought that this man, now looking at me with such confidence and such calm insolence, had tried, two minutes before, without exposing himself to any danger, to kill me like & dog, for if I had been wounded in the leg a little more severely, I would have certainly fallen off the cliff."
"Признаюсь, и на мою долю порядочно досталось. Как я только проведал, что черкешенка у Григорья Александровича, то надел эполеты, шпагу и пошел к нему.","I confess, and I got a fair share. As soon as I found out that Grigory Alexandrovich had a Circassian, I put on epaulettes, a sword and went to him.","“I admit that I saw a fair amount of trouble for it too. As soon as I learned that the Circassian girl was with Grigory Alexandrovich, I donned my epaulets and sword, and I went to him.","“I must confess that I also got my share of trouble. As soon as I discovered that the Circassian girl was at Pechorin’s quarters, I put on my epaulets and my sword, and went to him."
"– Господа! – сказал он медленно, освобождая свои руки, – кому угодно заплатить за меня двадцать червонцев?","- Lord! he said slowly, freeing his hands, “is anyone willing to pay twenty chervonets for me?","“Gentlemen!” he said slowly, freeing his hands. “Whom would it please to pay twenty gold pieces on my behalf?”","they cried to him. “Gentlemen,” he said slowly, freeing his arms, “who is willing to pay twenty gold pieces for me?”"
Грушницкий с своей шайкой бушует каждый день в трактире и со мной почти не кланяется.,Grushnitsky with his gang rages every day in the tavern and hardly bows to me.,Grushnitsky and his gang rage in the tavern every day and barely bow when they see me.,"Grushnitski with his gang, every day, carouses at the tavern, and hardly nods to me."
"– А он ваш друг? – сказала она, показывая некоторое сомнение.","- Is he your friend? she said, showing some doubt.","“Is he your friend?” she said, displaying a certain doubt.","“Why, is he your friend?” she said, revealing some doubt."
"– Не хотите ли подбавить рому? – сказал я своему собеседнику, – у меня есть белый из Тифлиса; теперь холодно.","""Would you like some more rum?"" - I said to my interlocutor, - I have a white man from Tiflis; it's cold now.",“You wouldn’t like to add some rum?” I said to my interlocutor. “I have white rum from Tiflis.,“Would you not like to add some rum?” I said to my interlocutor. “I have white rum from Tiflis; it is a cold night.”
В девятом часу мы вместе пошли к княгине.,At nine o'clock we went together to the princess.,At nine o’clock we went to the Princess Ligovsky together.,"Around half past eight, we went together to the princess’s house."
"– Я? ни за что не покажусь княжне, пока не готов будет мундир.",- I? I will never show myself to the princess until my uniform is ready.,“Me? I will absolutely not show myself to the princess until my uniform is ready.”,“I? For nothing in the world shall I show myself to the young princess till my uniform is ready.”
"Тихо было все на небе и на земле, как в сердце человека в минуту утренней молитвы; только изредка набегал прохладный ветер с востока, приподнимая гриву лошадей, покрытую инеем. Мы тронулись в путь; с трудом пять худых кляч тащили наши повозки по извилистой дороге на Гуд-гору; мы шли пешком сзади, подкладывая камни под колеса, когда лошади выбивались из сил; казалось, дорога вела на небо, потому что, сколько глаз мог разглядеть, она все поднималась и наконец пропадала в облаке, которое еще с вечера отдыхало на вершине Гуд-горы, как коршун, ожидающий добычу; снег хрустел под ногами нашими; воздух становился так редок, что было больно дышать; кровь поминутно приливала в голову, но со всем тем какое-то отрадное чувство распространялось по всем моим жилам, и мне было как-то весело, что я так высоко над миром: чувство детское, не спорю, но, удаляясь от условий общества и приближаясь к природе, мы невольно становимся детьми; все приобретенное отпадает от души, и она делается вновь такою, какой была некогда, и, верно, будет когда-нибудь опять. Тот, кому случалось, как мне, бродить по горам пустынным, и долго-долго всматриваться в их причудливые образы, и жадно глотать животворящий воздух, разлитый в их ущельях, тот, конечно, поймет мое желание передать, рассказать, нарисовать эти волшебные картины. Вот наконец мы взобрались на Гуд-гору, остановились и оглянулись: на ней висело серое облако, и его холодное дыхание грозило близкой бурею; но на востоке все было так ясно и золотисто, что мы, то есть я и штабс-капитан, совершенно о нем забыли… Да, и штабс-капитан: в сердцах простых чувство красоты и величия природы сильнее, живее во сто крат, чем в нас, восторженных рассказчиках на словах и на бумаге.","Everything was quiet in heaven and on earth, as in the heart of a person at the moment of morning prayer; only occasionally a cool wind from the east came up, lifting the horses' manes, covered with hoarfrost. We set off; with difficulty, five thin nags dragged our wagons along the winding road to Good Mountain; we walked behind, placing stones under the wheels when the horses were exhausted; it seemed that the road led to heaven, because, as far as eyes could see, it kept rising and finally disappeared in a cloud that had been resting on the top of Mount Gud-mountain since evening, like a kite waiting for prey; the snow crunched under our feet; the air became so thin that it hurt to breathe; the blood constantly rushed to my head, but with all that, some kind of gratifying feeling spread through all my veins, and I was somehow glad that I was so high above the world: a childish feeling, I don’t argue, but, moving away from the conditions of society and approaching to nature, we unwittingly become children; everything acquired falls away from the soul, and it becomes again such as it once was, and, surely, will someday be again. Anyone who happened, like me, to wander through the desert mountains, and for a long, long time peer into their bizarre images, and eagerly swallow the life-giving air spilled in their gorges, he, of course, will understand my desire to convey, tell, draw these magical pictures. Finally, we climbed the Gud-mountain, stopped and looked around: a gray cloud hung on it, and its cold breath threatened a coming storm; but in the east everything was so clear and golden that we, that is, I and the staff captain, completely forgot about him ... Yes, and the staff captain: in the hearts of simple people, the feeling of beauty and grandeur of nature is stronger, more alive a hundred times than in us enthusiastic storytellers in words and on paper.","All was quiet on the earth and in the sky, like the heart of a person during the minute of morning prayer. But, occasionally a cool wind would spring up from the east, lifting the manes of the horses, which were coated in frost. We set off; five skinny nags hauled our carts with difficulty along the winding road up Gud Mountain. We walked on foot behind them, putting rocks behind the wheels when the horses ran out of strength. It looked as though the road led to the sky because as far as the eye could see, it kept ascending, and finally, became lost in the clouds, which had rested on the heights of Gud Mountain since the day before, like a kite awaiting its prey. The snow crunched under our feet; the air became so rare that it was painful to breathe; blood flooded into our heads every minute, and with it, some sort of gratifying feeling spread to every vein. I was so delighted to be so high above the world: it was a childlike feeling, I won’t deny it, but withdrawing from the demands of society, and drawing near to nature, we become children without meaning to, and everything that has been acquired falls away from the soul—and it becomes as it once was, and probably will be once again. A person who has found himself wandering, like me, among desert mountains for a long, long time, and peering at their fantastical shapes, and who has greedily swallowed the life-giving air which pours into its gorges—that person, I’m certain, will understand my desire to relate, to tell, to paint these magical pictures. And so, at last, we gained the summit of Gud Mountain, stopped and looked around: there was a gray cloud suspended over it, and its cold breath threatened an approaching storm. But in the east, everything was so clear and golden, that we, that is the staff captain and I, forgot about it completely . . . Yes, even the staff captain forgot: the simple people among us have hearts in which the feeling of beauty, and the grandeur of nature, is stronger—a hundredfold more vivid than in us, the rapturous storytellers in words and on paper.","All was silent in heaven and on earth, as it is in the heart of man at the moment of his morning prayer; only once in a while, a cool wind would come rippling from the east, raising a little the rime-covered manes of the horses. We set out; five skinny nags dragged our carriages with difficulty along the road winding up Mount Gud. We followed on foot, chocking the wheels with stones whenever the horses became exhausted; the road seemed to lead up into the sky because, as far as the eye could see, it kept ascending and, finally, it lost itself in the cloud which, since the previous evening, had been resting on the summit of Mount Gud, like a vulture awaiting its prey; the snow crunched underfoot; the air was becoming so rare, that it was painful to breathe; the blood kept rushing to our heads every moment, but despite all this, a delightful kind of feeling spread along all my veins, and I felt somehow elated at being so far above the world—a childish feeling, no doubt, but, on getting away from social conventions and coming closer to nature, we cannot help becoming children: all the things that have been acquired are shed by the soul, and it becomes again as it was once, and as it is surely to be again some day. He who, like me, has had occasion to wander over wild mountains and scrutinize, for a long time, their fantastic shapes, and avidly swallow the vivifying air pervading their gorges, will certainly understand my desire to render, to relate, to paint those magical images. Finally, we got to the top of Mount Gud, stopped, and looked around us: upon it hung the gray cloud whose cold breath threatened us with a gathering storm; but everything was so limpid and golden-bright in the east that we, that is to say the junior captain and I, completely forgot that cloud. Yes, the junior captain too: in simple hearts, the sense of the beauty and grandeur of nature is a hundred times stronger and more vivid than it is in us, enthusiastic tellers of tales, oral or written.38"
