Source,GoogleTranslate,human1,human2
"– Меня? – крикнул Азамат в бешенстве, и железо детского кинжала зазвенело об кольчугу. Сильная рука оттолкнула его прочь, и он ударился об плетень так, что плетень зашатался. «Будет потеха!» – подумал я, кинулся в конюшню, взнуздал лошадей наших и вывел их на задний двор. Через две минуты уж в сакле был ужасный гвалт. Вот что случилось: Азамат вбежал туда в разорванном бешмете, говоря, что Казбич хотел его зарезать. Все выскочили, схватились за ружья – и пошла потеха! Крик, шум, выстрелы; только Казбич уж был верхом и вертелся среди толпы по улице, как бес, отмахиваясь шашкой.","- Me? - shouted Azamat in a rage, and the iron of the children's dagger rang against the chain mail. A strong hand pushed him away, and he hit the fence so that the fence staggered. ""There will be fun!"" - I thought, rushed to the stable, bridle our horses and led them to the backyard. Two minutes later there was a terrible uproar in the sakla. Here's what happened: Azamat ran in there in a torn beshmet, saying that Kazbich wanted to kill him. Everyone jumped out, grabbed their guns - and the fun began! Scream, noise, shots; only Kazbich was already on horseback and circling among the crowd along the street like a demon, waving his saber.","“‘Me!?’ cried Azamat in a fury, and the iron of the child’s dagger began to ring against the chain mail shirt. A strong hand pushed him swiftly off, and the boy struck so hard against the wattle fencing that it started to sway. “‘Let the games begin!’ I thought, and rushed into the stable, bridled our horses, and led them out into the back courtyard. After just two minutes, there was a terrible commotion in the saklya. This is what had happened: Azamat had run inside with a torn beshmet, saying that Kazbich had tried to knife him. Everyone grabbed up their weapons and leapt out—and the fun began! A cry, a noise, shots; but Kazbich was already mounted, and twirled down the street among the crowd, like a demon, brushing them off with his saber.","“Throw me?’ screamed Azamat in a rage, and the iron of a child’s dagger rang against chain-armor. A strong arm pushed him away, and he hit the fence so hard that it shook. “Now we shall have some sport!’ I thought, dashed into the stable, bridled our horses and led them out into the back yard. Two minutes later, there was a terrible uproar indoors. Here’s what had happened: Azamat had burst in, his beshmet torn, saying that Kazbich had wanted to cut his throat. Everybody dashed out, grabbed their rifles—and the sport began! There was shouting, noise, rifle shots; but Kazbich was already on his horse and was wheeling in the midst of the crowd along the street, like a devil, swinging his sword in defense."
"И точно, такую панораму вряд ли где еще удастся мне видеть: под нами лежала Койшаурская долина, пересекаемая Арагвой и другой речкой, как двумя серебряными нитями; голубоватый туман скользил по ней, убегая в соседние теснины от теплых лучей утра; направо и налево гребни гор, один выше другого, пересекались, тянулись, покрытые снегами, кустарником; вдали те же горы, но хоть бы две скалы, похожие одна на другую, – и все эти снега горели румяным блеском так весело, так ярко, что кажется, тут бы и остаться жить навеки; солнце чуть показалось из-за темно-синей горы, которую только привычный глаз мог бы различить от грозовой тучи; но над солнцем была кровавая полоса, на которую мой товарищ обратил особенное внимание. «Я говорил вам, – воскликнул он, – что нынче будет погода; надо торопиться, а то, пожалуй, она застанет нас на Крестовой. Трогайтесь!» – закричал он ямщикам.","And indeed, it is unlikely that I will be able to see such a panorama anywhere else: below us lay the Koyshaur valley, crossed by the Aragva and another river, like two silver threads; a bluish mist slid over it, escaping into the neighboring gorges from the warm rays of the morning; to the right and to the left the crests of the mountains, one higher than the other, crossed, stretched, covered with snow and bushes; in the distance the same mountains, but at least two rocks similar to one another - and all these snows burned with a ruddy sheen so cheerfully, so brightly, that it seems one could live here forever; the sun barely peeked out from behind a dark blue mountain, which only the accustomed eye could distinguish from a thundercloud; but there was a bloody streak above the sun, to which my comrade paid particular attention. “I told you,” he exclaimed, “that the weather will be today; we must hurry, otherwise, perhaps, she will find us on Krestovaya. Get under way!” he shouted to the coachmen.","Indeed, it is likely that I shall never again see the likes of this panorama: the Koyshaursky Valley lay below us, intersected by the Aragva River and another a small river, like two silver threads. A light bluish mist was crawling along it, fleeing the warm rays of morning to the neighboring canyons. On the left and the right, the hackles of the mountains, one higher than the next, were criss-crossing and stretching along, covered in snows, bushes. In the distance, there were similar hills, where no two rock-faces were alike—and the snows burned with a rosy luster, so uplifting, so bright, that it seemed you could live here forever. The sun was just showing itself from behind the dark-blue mountains, which only an accustomed eye could discern from the thunderclouds; but there were blood-red streaks above the sun, to which my comrade was paying particular attention. “I told you,” he exclaimed, “that there would be a lot of weather today—we must hurry, otherwise, it will catch us on the Krestovaya. Move along!” he cried to the cart drivers.","And indeed, I doubt if I shall ever see such a panorama anywhere again: below us, lay the Koyshaur Valley, crossed by the Aragva and by another river, as by two silver threads; a pale, bluish haze glided over it, heading for the neighboring canyons, away from the warm rays of morning ; right and left, the crests of mountains, each higher than the next, intersected and stretched out, covered with snow or shrubs; in the distance, more mountains, but no two cliffs were alike; and all these snows burned with a ruddy glow, so merrily so brightly, that it made one wonder why one should not stay here forever; the sun peeped from behind a dark-blue mountain which only a practiced eye could have distinguished from a storm-cloud; but above the sun there was a blood-red band, to which my companion paid particular attention. “I told you,” he exclaimed, “that we’d have some nasty weather tonight; we’ve got to hurry, or else it may well catch us on the Mountain of the Cross. Get going!” he shouted to the drivers."
"Старик нахмурил брови… он был печален и сердит, хотя старался скрыть это.","The old man frowned... he was sad and angry, although he tried to hide it.","The old man crossed his brows . . . He was sad and angry, though he tried to hide it.","The old man frowned. He was sad and cross, though he tried to conceal it."
"– Хорошо! – сказал я капитану, – если так, то мы будем с вами стреляться на тех же условиях… – Он замялся.","- Good! - I said to the captain, - if so, then we will shoot with you on the same conditions ... - He hesitated.","“Good!” I said to the captain, “if that is so, then you and I will shoot under the very same conditions . . .” He stopped short.","“All right!” I said to the captain. “If so, you and I will have a duel on the same conditions.” He faltered."
"– Следственно, вы меня любить не можете…","""So you can't love me...""","I continued, “Therefore, you cannot love me . . .”","I went on: “Consequently, you cannot love me. … “"
– Не думаю.,- I don't think.,“I don’t think so.”,“I don’t think so.”
"– Простите меня, княжна! Я поступил как безумец… этого в другой раз не случится: я приму свои меры… Зачем вам знать то, что происходило до сих пор в душе моей! Вы этого никогда не узнаете, и тем лучше для вас. Прощайте.","“Forgive me, princess! I acted like a madman ... this will not happen another time: I will take my measures ... Why do you need to know what has happened in my soul so far! You will never know, and so much the better for you. Farewell.","“Forgive me, princess! I have behaved like a madman . . . it won’t happen again. I will take measures . . . If only you knew what has been happening in my soul until now! You will never know, and all the better for you. Farewell.”","“Forgive me, princess, I have acted like a madman … This will not happen again: I will see to it … Why must you know what, up to now, has been taking place in my soul?108 You will never learn it, and so much the better for you. Adieu.”"
"– А что? – спросил я у Максима Максимыча, – в самом ли деле он приучил ее к себе, или она зачахла в неволе, с тоски по родине?","- And what? - I asked Maxim Maksimych, - did he really accustom her to him, or did she wither away in captivity, from longing for her homeland?","“And then?” I asked Maxim Maximych. “Did he really train her to be his or did she wither away in her unwillingness, out of longing for her motherland?”","“And what happened?” I asked Maksim Maksimich. “Did he actually tame her, or did she pine away in captivity from homesickness?”"
"– Все равно. Не хотите ли чаю? Если б вы знали, какая мучит меня забота!",- Doesn't matter. Would you like some tea? If only you knew what an anxiety torments me!,“‘All the same. Would you like some tea? If you only knew what worries are troubling me!’,“‘Makes no difference. How about some tea? If you only knew what a worry torments me!’
"– Ну, как угодно! – Я стал пить чай один; минут через десять входит мой старик:","- Well, whatever! - I began to drink tea alone; ten minutes later my old man enters:","“As you like!” I started drinking my tea alone, and about ten minutes later my old friend came in.","“Well, please yourself!” I started to have tea by myself; ten minutes later, the old fellow came in."
"Я ушел один и, встретив княжну Мери, позвал ее на мазурку. Она казалась удивлена и обрадована.","I left alone and, meeting Princess Mary, invited her to the mazurka. She seemed surprised and delighted.","I went out alone and encountered Princess Mary, whereupon I invited her to dance the mazurka. She seemed to be surprised and glad.","I went alone and, upon meeting Princess Mary, asked her to dance the mazurka with me. She seemed surprised and pleased."
"Много красавиц в аулах у нас,","We have many beauties in the villages,","“Kazbich said nothing for a long, long time; finally, instead of an answer, he struck up an ancient song in a low voice: The many lovely girls of our land,","“We have many beautiful girls in our villages,"
"– Я вам удивляюсь, – сказал доктор, пожав мне крепко руку. – Дайте пощупать пульс!.. О-го! лихорадочный!.. но на лице ничего не заметно… только глаза у вас блестят ярче обыкновенного.","“I am surprised at you,” said the doctor, shaking my hand firmly. - Let me feel the pulse! .. Oh-hoo! feverish! .. but nothing is noticeable on your face ... only your eyes shine brighter than usual.","“You surprise me,” said the doctor, taking me firmly by the hand. “Let me take your pulse! . . . Oho! A fever! . . . But nothing is evident from the face . . . only your eyes are shining more brightly than usual.”","“I am amazed at you,” said the doctor, giving my hand a strong squeeze. “let me feel your pulse! … Oho! it’s feverish! … But nothing shows in your face … Only your eyes shine brighter than usual.”"
"Я возвращался домой пустыми переулками станицы; месяц, полный и красный, как зарево пожара, начинал показываться из-за зубчатого горизонта домов; звезды спокойно сияли на темно-голубом своде, и мне стало смешно, когда я вспомнил, что были некогда люди премудрые, думавшие, что светила небесные принимают участие в наших ничтожных спорах за клочок земли или за какие-нибудь вымышленные права!.. И что ж? эти лампады, зажженные, по их мнению, только для того, чтобы освещать их битвы и торжества, горят с прежним блеском, а их страсти и надежды давно угасли вместе с ними, как огонек, зажженный на краю леса беспечным странником! Но зато какую силу воли придавала им уверенность, что целое небо со своими бесчисленными жителями на них смотрит с участием, хотя немым, но неизменным!.. А мы, их жалкие потомки, скитающиеся по земле без убеждений и гордости, без наслаждения и страха, кроме той невольной боязни, сжимающей сердце при мысли о неизбежном конце, мы не способны более к великим жертвам ни для блага человечества, ни даже для собственного счастия, потому знаем его невозможность и равнодушно переходим от сомнения к сомнению, как наши предки бросались от одного заблуждения к другому, не имея, как они, ни надежды, ни даже того неопределенного, хотя и истинного наслаждения, которое встречает душа во всякой борьбе с людьми или судьбою…","I returned home through the empty lanes of the village; the moon, full and red, like the glow of a fire, began to appear from behind the jagged horizon of houses; the stars shone calmly on the dark blue vault, and it became funny to me when I remembered that there were once wise people who thought that the luminaries of heaven take part in our insignificant disputes for a piece of land or for some fictitious rights! .. And that well? these lamps, lit, in their opinion, only to illuminate their battles and celebrations, burn with their former brilliance, and their passions and hopes have long been extinguished with them, like a light lit at the edge of the forest by a careless wanderer! But on the other hand, what strength of will gave them the confidence that the whole sky with its countless inhabitants was looking at them with participation, although dumb, but unchanged! .. And we, their pitiful descendants, wandering the earth without conviction and pride, without pleasure and fear, besides that involuntary fear that grips the heart at the thought of an inevitable end, we are no longer capable of great sacrifices, either for the good of mankind, or even for our own happiness, therefore we know its impossibility and indifferently pass from doubt to doubt, as our ancestors rushed from one delusion to another, having, like them, neither hope, nor even that indefinite, albeit true pleasure that the soul meets in any struggle with people or fate ...","I was returning home along the empty lanes of the stanitsa; the moon, full and red, like the glow of a fire, was beginning to show itself from behind the jagged horizon of houses. The stars calmly shone in the dark-blue vault of the sky, and I was amused to remember that there were once very sage people who thought that heavenly bodies took part in our insignificant arguments over little tufts of earth or over various invented rights . . . ! And what happened? These lamps which were lit, in their opinion in order to illuminate their battles and victories, still burn with their original brilliance, while their own passions and hopes were extinguished long ago along with their very selves, like small fires lit at the edge of a wood by a careless wanderer! And then what force of will gave them the conviction that the whole sky, with its innumerable population, was watching them with constant concern, mute though it may have been! . . . And we, their pitiful descendants, wandering the earth without conviction or pride, without pleasure or fear, but with that involuntary dread that grips the heart at the thought of an inescapable end—we are no longer able to be great martyrs, not for the good of mankind, nor even for the sake of our own happiness, because we know it is impossible. And we shift indifferently from one doubt to another, just as our ancestors rushed from one delusion to the next, but without having, as they did, either hope or even that indeterminate but real pleasure that meets the soul in every struggle with people or fate . . .","I was walking home along the empty alleys of the settlement. The moon, full and red, like the glow of a conflagration, began to appear from behind the uneven line of roofs; the stars shone calmly upon the dark-blue vault, and it amused me to recall that, once upon a time, there were sages who thought that the heavenly bodies took part in our trivial conflicts for some piece of land or some imaginary rights. And what happened? These lampads, lit, in the opinion of those sages, merely to illumine their battles and festivals, were burning as brightly as ever, while their passions and hopes had long been extinguished with them, like a small fire lit on the edge of the forest by a carefree wayfarer! But on the other hand, what strength of will they derived from the certitude that the entire sky with its countless inhabitants was looking upon them with mute but permanent sympathy! Whereas we, their miserable descendants, who roam the earth without convictions or pride, without rapture or fear (except for that instinctive dread that compresses our hearts at the thought of the inevitable end), we are no longer capable of great sacrifice, neither for the good of mankind, nor even for our own happiness, because we know its impossibility, and pass with indifference from doubt to doubt, just as our ancestors rushed from one delusion to another. But we, however, do not have either their hopes or even that indefinite, albeit real, rapture that the soul encounters in any struggle with men or with fate."
"Правда, теперь вспомнил: один раз, один только раз я любил женщину с твердой волей, которую никогда не мог победить… Мы расстались врагами, – и то, может быть, если б я ее встретил пятью годами позже, мы расстались бы иначе…","True, now I remember: once, only once, I loved a woman with a strong will, whom I could never defeat ... We parted as enemies - and then, maybe, if I had met her five years later, we would have parted differently ...","It’s true, I now remember: once, only once, I loved a woman with a firm will, whom I could never conquer . . . We parted as enemies—and yet, maybe, if we had met some five years later, we might have parted differently . . .","True, I remember now—once, only once did I love a strong-willed woman, whom I could never conquer. We parted enemies—but even so, perhaps, had our meeting occurred five years later, we would have parted differently."
Я уехал один.,I left alone.,I departed alone.,I drove off alone.
"Все нашли, что мы говорим вздор, а, право, из них никто ничего умнее этого не сказал. С этой минуты мы отличили в толпе друг друга. Мы часто сходились вместе и толковали вдвоем об отвлеченных предметах очень серьезно, пока не замечали оба, что мы взаимно друг друга морочим. Тогда, посмотрев значительно друг другу в глаза, как делали римские авгуры[18], по словам Цицерона, мы начинали хохотать и, нахохотавшись, расходились довольные своим вечером.","Everyone found that we were talking nonsense, and, really, none of them said anything smarter than that. From that moment on, we distinguished each other in the crowd. We often got together and talked together about abstract subjects very seriously, until both of us noticed that we were mutually fooling each other. Then, looking significantly into each other's eyes, as the Roman augurs[18] did, according to Cicero, we began to laugh and, having laughed, dispersed satisfied with our evening.","Everyone found that we were talking nonsense, but, really, not one of them said anything any cleverer than that. From that minute, we had singled each other out in the crowd. The two of us often met and discussed abstract subjects that were very serious, neither of us noticing that we were but pulling the wool over each other’s eyes. Then, having looked meaningfully into each other’s eyes, as did the Roman augurs according to Cicero, we started guffawing and having laughed ourselves out, went our separate ways, satisfied with our evening.","Everybody found that we were talking nonsense, but, really, not one of them said anything more intelligent than that Henceforth, we distinguished each other in the crowd. We would often see each other and discuss, together, with great seriousness, abstract matters, until we noticed that we were gulling each other. Then, after looking meaningly into each other’s eyes, we began to laugh as Roman augurs85 did, according to Cicero, and having had our fill of mirth, we would separate well-content with our evening."
– Боже мой! – произнесла она едва внятно.,- My God! she said almost incomprehensibly.,"“My God!” she uttered, barely distinguishably.",“Oh God!” she uttered almost inaudibly.
"– А я пойду шататься, – я ни за что теперь не засну… Послушай, пойдем лучше в ресторацию, там игра… мне нужны нынче сильные ощущения…","- And I'll go staggering - I won't fall asleep for anything now ... Listen, let's go to a restaurant, there's a game ... I need strong sensations now ...","“And I am off to wander—I’m not at all able to fall asleep these days . . . Listen, why don’t we go to the restaurant, where we can gamble . . . I need strong sensations today . . .”","“And I shall go roaming; I could never fall asleep now … Look, let’s better go to the restaurant, there is gambling there … tonight I require strong sensations… .”"
"Я был вознагражден глубоким, чудесным взглядом.","I was rewarded with a deep, wonderful look.",I was rewarded with a deep and miraculous look.,"I was rewarded by a deep, wonderful glance."
– Да ведь вы же были у него?,"""But you were with him, weren't you?""",“But weren’t you just with him?”,“But haven’t you been to see him?”
"Например, способ обыкновенный:","For example, the usual way:","For example, this is the usual way:","Here, for instance, is the normal method:"
