Source,GoogleTranslate,human1,human2
"Мне послышалось, что он заплакал: а надо вам сказать, что Азамат был преупрямый мальчишка, и ничем, бывало, у него слез не выбьешь, даже когда он был помоложе.","I heard that he was crying: but I must tell you that Azamat was a stubborn boy, and nothing happened to knock out his tears, even when he was younger.","“I could hear that he had started to weep—but I must tell you that Azamat was a very persistent little boy, and sometimes, nothing would drive away his tears, even when he was younger.","“I thought I heard him start crying: and you must know that Azamat was a most stubborn boy, and there was no way you could knock a tear out of him, even when he was younger."
"И долго я лежал неподвижно и плакал горько, не стараясь удерживать слез и рыданий; я думал, грудь моя разорвется; вся моя твердость, все мое хладнокровие – исчезли как дым. Душа обессилела, рассудок замолк, и если б в эту минуту кто-нибудь меня увидел, он бы с презрением отвернулся.","And for a long time I lay motionless and wept bitterly, not trying to hold back my tears and sobs; I thought my chest would burst; all my firmness, all my composure - vanished like smoke. The soul was exhausted, the mind fell silent, and if at that moment someone saw me, he would have turned away with contempt.","For a long time I lay motionless and wept bitterly, not making any attempt to restrain my tears and sobbing. I thought that my breast would explode. All my hardness, all my cool indifference, disappeared like smoke. My soul lost its strength, my reason went quiet, and if someone had seen me at that minute, they would have turned away in disdain.","And for a long time, I lay motionless and cried bitterly, not attempting to hold back the tears and sobs. I thought my chest would burst; all my firmness, all my coolness vanished like smoke; my soul wilted, my reason was mute and if, at that moment, anyone had seen me, he would have turned away in contempt."
"Перечитывая эту страницу, я замечаю, что далеко отвлекся от своего предмета… Но что за нужда?.. Ведь этот журнал пишу я для себя, и, следовательно, все, что я в него ни брошу, будет со временем для меня драгоценным воспоминанием.","Rereading this page, I notice that I have digressed far from my subject ... But what is the need? .. After all, I write this journal for myself, and, consequently, everything that I throw into it will eventually become a precious memory for me.","As I re-read this page, I notice that I have substantially digressed from my subject . . . But what of it? . . . I am, after all, writing these diaries for myself, and therefore, whatever I throw into it, will become, in time, precious recollections.","On re-reading this page, I notice that I have strayed far from my subject … But what does it matter? … I write this journal for myself and, consequently, anything that I may toss into it will become, in time, for me, a precious memory."
Она заплакала.,She started crying.,She started to weep.,She began to cry.
* * *,* * *,Two o’clock at night . . .,. . . . . . . . . .
"– Скажи, любезный, – закричал я ему в окно, – что это – оказия пришла, что ли?","- Tell me, my dear, - I shouted to him through the window, - what is this - an opportunity has come, or what?","“Tell me, my good man,” I cried to him from the window, “is this the Opportunity that has arrived?”","“Say, my good man,” I cried to him from the window, “has the convoy arrived or what?”"
"Выстрел раздался. Пуля оцарапала мне колено. Я невольно сделал несколько шагов вперед, чтоб поскорей удалиться от края.",The shot rang out. The bullet grazed my knee. I involuntarily took a few steps forward in order to quickly move away from the edge.,"A shot rang out. The bullet scratched my knee. I couldn’t help taking a few steps forward, to move away from the edge as soon as possible.","The shot rang out The bullet grazed my knee. Involuntarily, I took several steps forward so as to get away, as soon as possible, from the brink."
– Зачем же подавать надежды?,Why give hope?,"“Why would she give me hope, then?”",“Why then give me hopes?”
Печорин чуть-чуть побледнел и отвернулся…,Pechorin turned a little pale and turned away...,"Pechorin went slightly pale, and turned away .",Pechorin paled slightly and turned away.57
"– Ваше благородие, – сказал наконец один, – ведь мы нынче до Коби не доедем; не прикажете ли, покамест можно, своротить налево? Вон там что-то на косогоре чернеется – верно, сакли: там всегда-с проезжающие останавливаются в погоду; они говорят, что проведут, если дадите на водку, – прибавил он, указывая на осетина.","“Your honor,” said one at last, “because we won’t get to Kobe today; Would you like me to turn to the left while I can? Over there, something is turning black on the slope - it’s true, sakli: there, travelers always stop in the weather; they say they will, if you give me vodka,” he added, pointing to the Ossetian.","“Your Honor,” one of them said finally, “it seems we won’t get to Koba today. Will you not give the order, while you can, for us to turn left? You see, those are probably saklyas over there that blacken the landscape on the hillside. Travelers always stop there in bad weather; they’re saying that they’ll lead us through if you give them a little something for vodka,” he added, pointing to the Ossetians.","“Your Excellency,” said one of the coachmen at last, “we’ll never make Kobi today: won’t you have us turn off to the left while we still can? Over there, on the mountainside, there’s a black blur , must be huts; travelers always stop there in bad weather, sir. He says he’ll show the way, if you tip him,” he added, pointing to one of the Ossetians."
– А где Печорин? – спросил я.,- And where is Pechorin? I asked.,“‘But where’s Pechorin?’ I asked.,“‘And where is Pechorin?’ I asked.
Вечером многочисленное общество отправилось пешком к провалу.,"In the evening, a large society went on foot to the failure.",In the evening a large gathering set off to the chasm on foot.,"In the evening, a numerous party set out on foot for The Hollow."
"– Вы странный человек! – сказала она потом, подняв на меня свои бархатные глаза и принужденно засмеявшись.","You are a strange person! she said later, raising her velvety eyes to me and forced a laugh.","“You are an odd person!” she said then, lifting her velvet eyes to me and forcing a laugh.","“You’re a bizarre person!” she presently said, raising upon me her velvety eyes and laughing in a constrained way."
"– Бросьте жребий, доктор! – сказал капитан.","“Draw lots, doctor!” the captain said.","“Cast lots, Doctor!” said the captain.","“Spin the coin, doctor!” said the captain."
"– О, я горько ошибся!.. Я думал, безумный, что по крайней мере эти эполеты дадут мне право надеяться… Нет, лучше бы мне век остаться в этой презренной солдатской шинели, которой, может быть, я обязан вашим вниманием…","“Oh, I was bitterly mistaken!.. I thought, madly, that at least these epaulettes would give me the right to hope… No, it would be better for me to remain for a century in that despicable soldier’s greatcoat, to which, perhaps, I owe your attention…”","“Oh, I have been bitterly mistaken! . . . I thought, like a lunatic, that at least these epaulets would give me the right to hope . . . No, I would have been better off keeping that contemptible soldier’s greatcoat forever, to which I perhaps owed your attention . . .”","“Oh, I’ve made a bitter mistake! … I thought, in my folly, that at least these epaulets would give me the right to hope … No, it would have been better for me had I remained all my life in that miserable soldier’s coat to which, maybe, I owed your attention.”"
"– Что для меня Россия! – отвечал ее кавалер, – страна, где тысячи людей, потому что они богаче меня, будут смотреть на меня с презрением, тогда как здесь – здесь эта толстая шинель не помешала моему знакомству с вами…","- What is Russia for me! - answered her gentleman, - a country where thousands of people, because they are richer than me, will look at me with contempt, while here - here this thick overcoat did not prevent my acquaintance with you ...","“What is Russia to me!” replied her cavalier. “A country where thousands of people will look at me with contempt since they are richer than I am, when here, here, this thick greatcoat didn’t prevent me from making acquaintance with you . . .”","“What is Russia to me?” answered her companion, “a country where thousands of people will look on me with contempt because they are richer than I am —whereas here—here this thick soldier’s coat has not prevented me from making your acquaintance… .”"
"– Азамат! – сказал Григорий Александрович, – завтра Карагез в моих руках; если нынче ночью Бэла не будет здесь, то не видать тебе коня…","- Azamat! - said Grigory Alexandrovich, - tomorrow Karagyoz is in my hands; if Bela isn't here tonight, you won't see the horse...","“‘Azamat!’ said Grigory Alexandrovich. ‘Tomorrow Karagyoz will be in my hands. If Bela isn’t here tonight, then you won’t set eyes on your horse . . .’","Azamat!’ said Pechorin, Tomorrow, Karagyoz will be in my hands; if Bela is not here tonight, you’ll never see that steed …’"
"К утру бред прошел; с час она лежала неподвижная, бледная, и в такой слабости, что едва можно было заметить, что она дышит; потом ей стало лучше, и она начала говорить, только как вы думаете о чем?.. Этакая мысль придет ведь только умирающему!.. Начала печалиться о том, что она не христианка, и что на том свете душа ее никогда не встретится с душою Григория Александровича, и что иная женщина будет в раю его подругой. Мне пришло на мысль окрестить ее перед смертию; я ей это предложил; она посмотрела на меня в нерешимости и долго не могла слова вымолвить; наконец отвечала, что она умрет в той вере, в какой родилась. Так прошел целый день. Как она переменилась в этот день! бледные щеки впали, глаза сделались большие, губы горели. Она чувствовала внутренний жар, как будто в груди у ней лежала раскаленное железо.","By morning the delirium had passed; for an hour she lay motionless, pale, and in such weakness that one could hardly notice that she was breathing; then she felt better, and she began to talk, only what do you think about? .. Such a thought will only come to a dying person! .. She began to grieve that she was not a Christian, and that in the next world her soul would never meet with the soul Grigory Alexandrovich, and that another woman will be his girlfriend in paradise. It occurred to me to baptize her before her death; I offered it to her; she looked at me in indecision and for a long time could not utter a word; finally answered that she would die in the faith in which she was born. So the whole day passed. How she has changed that day! her pale cheeks were sunken, her eyes grew large, her lips burned. She felt an inner heat, as if she had a red-hot iron in her chest.","“The delirium lifted toward morning. For an hour, she lay there motionless and pale, with such feebleness that it was barely possible to see her breathing. Then she seemed better, and she started talking—but what do you think she was on about? . . . This kind of thing only occurs to the dying! She had started lamenting the fact that she wasn’t a Christian, and that in the other world, her soul wouldn’t meet Pechorin’s, and that some other woman would become his companion in heaven. I had an idea to christen her before she died and I suggested it to her. She looked at me with indecision and couldn’t utter anything for a long while. Eventually, she responded saying she would die of the same faith with which she was born. A whole day passed in this way. How she changed over the course of that day! Her pale cheeks sank, her eyes grew larger and larger, her lips burned. She felt an inner heat, as though there was a piece of burning-hot iron in her breast.","“Toward morning her delirium ceased; for an hour or so she lay motionless and pale, and in such a state of weakness that one could hardly notice if she were breathing or not; then she felt better, and began to speak, and what do you think she spoke about? An idea like that could only have occurred to a dying person! She began to grieve that she was not a Christian, and that in the next world her soul would not meet Pechorin’s soul, and that some other woman would be his sweetheart in heaven. The thought occurred to me to have her baptized before her death; this I suggested to her. She looked at me hesitantly, and for a long time could not say a word; at last she replied that she would die in the same faith in which she was born. Thus passed a whole day. How she changed in the course of that day! Her pale cheeks sank in, her eyes became so very, very large, her lips burned. She felt an inner heat as if red-hot iron lay in her breast."
"Лакей мой сказал мне, что заходил Вернер, и подал мне две записки: одну от него, другую… от Веры.","My footman told me that Werner had come in and handed me two notes: one from him, the other ... from Vera.","My lackey told me that Werner had come by and delivered two notes. One from him, the other . . . from Vera.","My valet told me that Werner had called, and handed me two notes: one from Werner himself, the other … from Vera."
– Как же у них празднуют свадьбу? – спросил я штабс-капитана.,How do they celebrate their wedding? I asked the staff captain.,“How do they celebrate weddings?” I asked the staff captain.,“How do they celebrate a wedding?” I asked the junior captain.
"– Да, я имел там некоторую практику.","Yes, I had some practice there.","“Yes, I have practiced there a bit.”","“Yes, I had a fair amount of practice there.”"
"– Я подожду только той минуты, когда твой разговор ей наскучит… Прощай!..",- I will only wait for the moment when your conversation will bore her ... Farewell! ..,“I am waiting for the moment when your conversation bores her . . . Farewell!”,“I shall only wait for the moment when your conversation begins to bore her … Good-by.”
Монета взвилась и упала звеня; все бросились к ней.,The coin rose and fell clinking; everyone rushed to her.,The coin soared up and fell ringing. Everyone rushed toward it.,The coin soared up and fell with a tinkle; everyone rushed toward it.
"Она призадумалась, не спуская с него черных глаз своих, потом улыбнулась ласково и кивнула головой в знак согласия. Он взял ее руку и стал ее уговаривать, чтоб она его целовала; она слабо защищалась и только повторяла: «Поджалуста, поджалуста, не нада, не нада». Он стал настаивать; она задрожала, заплакала.","She became thoughtful, not taking her black eyes off him, then smiled kindly and nodded her head in agreement. He took her hand and began to persuade her to kiss him; she weakly defended herself and only repeated: ""Pity, pity, not nada, not nada."" He began to insist; she trembled, wept.","“She became pensive, not lowering her black eyes from him. And then she smiled affectionately and nodded her head in a sign of agreement. He took her hand and started to persuade her to kiss him; she weakly defended herself and only repeated, ‘Pleeze, pleeze, duon’t, duon’t.’ He started to insist; she trembled, and started to cry.","She lapsed into thought, never taking her black eyes off him, then she smiled sweetly and nodded her head in sign of assent. He took her hand and began persuading her to kiss him; she weakly defended herself, and only repeated in broken Russian: ‘Please, please, don’t, don’t.’ He insisted, she started trembling and began to cry."
Я принял серьезный вид и отвечал ему:,I took on a serious face and answered him:,I assumed a serious air and responded to him:,I assumed a serious air and replied to him:
"– Что с вами? – сказал я, взяв ее руку.",- What's wrong with you? I said taking her hand.,"“What is wrong with you?” I said, taking her hand.","“What is the matter with you?” I said, taking her hand."
"Грушницкий мне не кланяется уж несколько времени, а нынче раза два посмотрел на меня довольно дерзко. Все это ему припомнится, когда нам придется расплачиваться.","Grushnitsky has not bowed to me for some time now, and today he looked at me rather insolently a couple of times. He will remember all this when we have to pay.","Grushnitsky hasn’t bowed to me for a while now, and the last two times he has looked at me rather impertinently. He will be reminded of this when it comes to settling our score.","Grushnitski does not greet me since some time ago, and tonight, once or twice, he glanced at me rather insolently. All this shall be remembered when the time comes to settle our accounts."
"– Да покажите мне ее, – сказал я.","“Show me her,” I said.","“‘Well, show her to me,’ I said. “‘She is behind that door.","“‘You can at least show her to me,’ I said."
"Я до вечера просидел дома, запершись в своей комнате. Приходил лакей звать меня к княгине, – я велел сказать, что болен.","I stayed at home until evening, shutting myself up in my room. A footman came to call me to the princess - I ordered to say that I was ill.","I sat at home until evening, and shut myself in my room. A lackey came to call me to the Princess Ligovsky—I ordered him to tell them I was ill.","Till evening I remained at home, locked up in my room. A footman came with an invitation from the old princess—I had him told that I was ill."
– И есть за что…,- And there is something for ...,“And for good reason . . .”,"“And there is a good reason for that” “Oh, really?”"
"– А вот я вам расскажу. Верст шесть от крепости жил один мирной князь. Сынишка его, мальчик лет пятнадцати, повадился к нам ездит: всякий день, бывало, то за тем, то за другим; и уж точно, избаловали мы его с Григорием Александровичем. А уж какой был головорез, проворный на что хочешь: шапку ли поднять на всем скаку, из ружья ли стрелять. Одно было в нем нехорошо: ужасно падок был на деньги. Раз, для смеха, Григорий Александрович обещался ему дать червонец, коли он ему украдет лучшего козла из отцовского стада; и что ж вы думаете? на другую же ночь притащил его за рога. А бывало, мы его вздумаем дразнить, так глаза кровью и нальются, и сейчас за кинжал. «Эй, Азамат, не сносить тебе головы, – говорил я ему, яман[2] будет твоя башка!»","- And here I will tell you. About six versts from the fortress lived a peaceful prince. His son, a boy of about fifteen, got into the habit of going to us: every day, it happened, now for one, then for another; and certainly, we spoiled him with Grigory Alexandrovich. And what a thug he was, nimble for whatever you want: whether to raise his hat at full gallop, whether to shoot from a gun. One thing was not good about him: he was terribly greedy for money. Once, for a laugh, Grigory Alexandrovich promised to give him a gold piece if he would steal the best goat from his father's herd for him; and what do you think? the next night he dragged him by the horns. And it happened that we would take it into our head to tease him, so his eyes would fill up with blood, and now for the dagger. “Hey, Azamat, don’t blow your head off,” I told him, yaman [2] will be your head!”","“Well, I’ll explain. About six versts from the fortress lived a peaceable prince.8 His young son, a boy of about fifteen, took to visiting us every day for one reason or another. Grigory Alexandrovich and I spoiled him, we did. And he was such a rascal, and nimble at whatever he did—whether he was picking up a hat at full gallop or firing a rifle. There was just one thing about him that was no good: he had a terrible weakness for money. Once, for a laugh, Grigory Alexandrovich promised him a gold piece if he would steal the best goat in his father’s herd. And what do you think? The very next night he dragged it in by its horns. But if we ever thought to tease him, his eyes would fill with blood, and he’d be at the ready with his dagger. “‘Eh, Azamat, don’t lose your head now,’ I told him, ‘you’ll get it cut off!’","“Well, let me tell you. About four miles from the fort, there lived a neutral prince. His young son, a boy of fifteen or so, took to riding over to our place: every day he would come for one thing or another. We had really spoiled him, Pechorin15 and I. And what a daredevil he was, game for anything—picking up a cap at full gallop or shooting a rifle. There was one thing bad about him: he had an awful weakness for money. Once, in jest, Pechorin promised him a gold piece if he would steal for him the best goat from his father s herd. And what do you think? The very next night, there he came, dragging the goat by the horns. And sometimes, we would start teasing him, and then his eyes would get all bloodshot, and his hand would at once fly to his dagger. Hey, Azamat, you won’t keep your head long on your shoulders,’ I would say to him, ‘yaman [bad] it will be with your head!’"
"Стали разъезжаться. Сажая княжну в карету, я быстро прижал ее маленькую ручку к губам своим. Было темно, и никто не мог этого видеть.","They began to leave. Putting the princess into the carriage, I quickly pressed her little hand to my lips. It was dark and no one could see it.","People started to leave. Having seated the princess in her carriage, I quickly pressed her little hand to my lips. It was dark, and no one could have seen it.","People began to leave. As I handed the princess into her carriage, I rapidly pressed her small hand to my lips. It was dark, and no one could see it."
