Source,GoogleTranslate,human1,human2
"‘Bij Slagter vertelde de vrouw, want mijnheer sliep, dat haar man op zijn tocht rond de grachten het gat bij ons ontdekt had en met een er bij gehaalde agent het perceel doorgelopen was. Hij zou Dinsdag bij Kraler komen en dan verder vertellen. Op het politiebureau wisten ze nog niets van de inbraak af, maar noteerden het meteen om ook Dinsdag te komen kijken. Op de terugweg liep Henk toevallig even bij onze aardappelleverancier om de hoek aan en vertelde dat er ingebroken was. ‘Dat weet ik’, zei deze doodleuk, ‘ik kwam gisteravond met mijn vrouw langs uw perceel en zag een gat in de deur. Mijn vrouw wou al doorlopen, maar ik keek even met de lantaarn; toen liepen de dieven meteen weg. Voor alle zekerheid heb ik de politie maar niet opgebeld, daar ik dat bij u niet wou doen, ik weet wel niets, maar ik vermoed veel’.","'At Slagter's house, the woman told me, because the gentleman was sleeping, that her husband had discovered the hole with us on his trip around the canals and had walked through the plot with a police officer who had been called in. He would come to Kraler on Tuesday and then tell him more. At the police station, they knew nothing about the burglary, but immediately noted it down to come and have a look on Tuesday. On the way back Henk happened to stop by our potato supplier around the corner and told him that there had been a break-in. 'I know,' said this one coolly, 'I passed your property with my wife last night and saw a hole in the door. My wife wanted to walk on, but I looked briefly with the lantern; then the thieves immediately ran away. Just to be sure, I didn't call the police, because I didn't want to do that with you, I don't know anything, but I suspect a lot.""","Mr. Sleegers was asleep, but his wife told Jan that her husband had discovered the hole in the door while making his rounds. He called in a policeman, and the two of them searched the building. Mr. Sleegers, in his capacity as night watchman, patrols the area every night on his bike, accompanied by his two dogs. His wife said he would come on Tuesday and tell Mr. Kugler the rest. No one at the police station seemed to know anything about the break-in, but they made a note to come first thing Tuesday morning to have a look. On the way back Jan happened to run into Mr. van Hoeven, the man who supplies us with potatoes, and told him of the break-in. “I know,” Mr. van Hoeven calmly replied. “Last night when my wife and I were walking past your building, I saw a gap in the door. My wife wanted to walk on, but I peeked inside with a flashlight, and that’s when the burglars must have run off. To be on the safe side, I didn’t call the police. I thought it wouldn’t be wise in your case. I don’t know anything, but I have my suspicions.”","Mr. Sleegers was asleep, but his wife told Jan that her husband had found the hole in our door when he was doing his tour round the canals, and that he had called a policeman, who had gone through the building with him. He would be coming to see Kugler on Tuesday and would tell him more then. At the police station they knew nothing of the burglary yet, but the policeman had made a note of it at once and would come and look round on Tuesday. On the way back Jan happened to meet our green-grocer at the corner, and told him that the house had been broken into. “I know that,” he said quite coolly. “I was passing last evening with my wife and saw the hole in the door. My wife wanted to walk on, but I just had a look in with my torch, then the thieves cleared at once. To be on the safe side, I didn’t ring up the police, as with you I didn’t think it was the thing to do. I don’t know anything, but I guess a lot.”"
"Ik kreeg een mikpoppetje, vader boekensteunen, enz. enz. Het was in ieder geval allemaal leuk bedacht en daar we alle acht nog nooit in ons leven Sinterklaas gevierd hebben, was deze première goed op zijn plaats.","I got an aim doll, father bookends, etc. etc. Anyway, it was all nice thought and since all eight of us have never celebrated Sinterklaas in our lives, this premiere was well suited.","I received a Kewpie doll, Father got bookends, and so on. Well anyway, it was a nice idea, and since the eight of us had never celebrated St. Nicholas Day before, this was a good time to begin.","I got a doll, whose skirt is a bag for odds and ends, Daddy got book ends, and so on. In any case it was a nice idea and as none of us had ever celebrated St. Nicholas, it was a good way of starting."
"‘Zeg, Putti, waarom bombarderen de Engelsen nu niet?’","""Say, Putti, why aren't the English bombing now?""","“Tell me, Putti, why aren’t the British carrying out any bombing raids today?”","“I say, Putti, why aren’t there any English air raids now?”"
Je Anne.,your Anne.,"In the meantime, the Dussel drama has been resolved. Saturday evening at dinner he apologized in beautiful Dutch. Mr. van Daan was immediately reconciled. Dussel must have spent all day practicing his speech. Sunday, his birthday, passed without incident. We gave him a bottle of good wine from 1919, the van Daans (who can now give their gift after all) presented him with a jar of piccalilli and a package of razor blades, and Mr. Kugler gave him a jar of lemon syrup (to make lemonade), Miep a book, Little Martin, and Bep a plant. He treated everyone to an egg. Yours, Anne M. Frank","In the meantime the Dussel drama has righted itself again. At supper on Saturday evening he apologized in beautiful Dutch. van Daan was nice about it straight away, it must have taken Dussel a whole day to learn that little lesson off by heart. Sunday, his birthday, passed peacefully. We gave him a bottle of good 1919 wine, from the van Daans (who could give their presents now after all), a bottle of piccalilli and a packet of razor blades, ajar of lemon jam from Kugler, a book. Little Martin, from Miep, and a plant from Elli. He treated each one of us to an egg. Yours, Anne"
"Het werd mij wonderlijk te moede, telkens als ik in zijn donkerblauwe ogen keek en hij daar zat met die geheimzinnige glimlach om zijn mond. Ik kon uit alles zo zijn innerlijk lezen, ik zag op zijn gezicht nog die hulpeloosheid en die onzekerheid hoe zich te houden en tegelijkertijd een zweem van het besef van zijn mannelijkheid. Ik zag zo die verlegen houding en werd zo zacht van binnen, ik kon het niet laten telkens en telkens weer die donkere ogen te ontmoeten en smeekte haast met heel mijn hart: o vertel me toch wat er in je omgaat, o kijk toch over die noodlottige babbelzucht heen.","It amazes me wonderfully every time I looked into his dark blue eyes and he sat there with that mysterious smile on his mouth. I could read his interior from everything, I still saw on his face that helplessness and that uncertainty how to hold himself and at the same time a hint of the realization of his masculinity. I saw so that shy attitude and became so soft inside, I could not help meeting those dark eyes again and again and begged almost with all my heart: O tell me what's on your mind, O look over that fatal chatter.","It gave me a wonderful feeling when I looked into his dark blue eyes and saw how bashful my unexpected visit had made him. I could read his innermost thoughts, and in his face I saw a look of helplessness and uncertainty as to how to behave, and at the same time a flicker of awareness of his masculinity. I saw his shyness, and I melted. I wanted to say, “Tell me about yourself. Look beneath my chatty exterior.”","It gave me a queer feeling each time I looked into his deep blue eyes, and he sat there with that mysterious laugh playing round his lips. I was able to read his inward thoughts. I could see on his face that look of helplessness and uncertainty how to behave, and, at the same time, a trace of his sense of manhood. I noticed his shy manner and it made me feel very gentle; I couldn’t refrain from meeting those dark eyes again and again, and with my whole heart I almost beseeched him: oh, tell me, what is going on inside you, oh, can’t you look beyond this ridiculous chatter?"
"Vanavond, toen Elli er nog was, werd er lang, hard en doordringend gebeld. Op dat ogenblik werd ik wit, kreeg buikpijn en hartkloppingen en dat allemaal van de angst.","Tonight, while Elli was still there, the bell rang long, loud, and piercing. At that moment I turned white, had a stomachache and palpitations, all because of the fear.","This evening, when Bep was still here, the doorbell rang long and loud. I instantly turned white, my stomach churned, and my heart beat wildly—and all because I was afraid.","This evening, while Bep was still here, there was a long, loud, penetrating ring at the door. I turned white at once, got a tummy-ache and heart palpitations, all from fear."
Dit keer vervolg van de Achterhuis-dagindeling. Na het schaftuurtje is de middagtafel aan de beurt:,This time continuation of the Secret Annex daily schedule. After lunch it is the turn of the afternoon table:,"We now continue with a typical day in the Annex. Since we’ve already had lunch, it’s time to describe dinner.",To continue with the 'Secret Annexe’ daily timetable. I shall now describe the evening meal:
"Daarmee begint en eindigt altijd de hele woordenstroom: ‘als Anne mijn dochter was’. Nu, gelukkig ben ik dat niet.","The whole stream of words always begins and ends with that: 'if Anne were my daughter'. Well, luckily I'm not.",If Anne were my daughter …” This is always how her tirades begin and end: “If Anne were my daughter …” Thank goodness I’m not.,"These are always her first and last words, “If Anne were my daughter.” Thank heavens I’m not!"
"Nu over iets anders: Je weet al lang dat mijn liefste wens is eenmaal journaliste en later een beroemd schrijfster te worden. Of ik deze grootheidsneigingen (of - waanzin?) ooit tot uitvoering zal kunnen brengen, zal nog moeten blijken, maar onderwerpen heb ik tot nu toe nog wel. Na de oorlog wil ik in ieder geval een boek getiteld ‘Het Achterhuis’ uitgeven. Of dat lukt blijft ook nog de vraag, maar mijn dagboek zal daarvoor kunnen dienen.","Now about something else: You've known for a long time that my dearest wish is to become a journalist one day and later a famous writer. Whether I will ever be able to carry out these grandiose tendencies (or - madness?) remains to be seen, but I still have subjects so far. After the war I want to publish a book entitled 'The Secret Annex'. Whether that will work remains to be seen, but my diary will serve that purpose.","And now something else. You’ve known for a long time that my greatest wish is to be a journalist, and later on, a famous writer. We’ll have to wait and see if these grand illusions (or delusions!) will ever come true, but up to now I’ve had no lack of topics. In any case, after the war I’d like to publish a book called The Secret Annex. It remains to be seen whether I’ll succeed, but my diary can serve as the basis. I also need to finish “Cady’s Life.” I’ve thought up the rest of the plot. After being cured in the sanatorium, Cady goes back home and continues writing to Hans. It’s 1941, and it doesn’t take her long to discover Hans’s Nazi sympathies, and since Cady is deeply concerned with the plight of the Jews and of her friend Marianne, they begin drifting apart. They meet and get back together, but break up when Hans takes up with another girl. Cady is shattered, and because she wants to have a good job, she studies nursing. After graduation she accepts a position, at the urging of her father’s friends, as a nurse in a TB sanatorium in Switzerland. During her first vacation she goes to Lake Como, where she runs into Hans. He tells her that two years earlier he’d married Cady’s successor, but that his wife took her life in a fit of depression. Now that he’s seen his little Cady again, he realizes how much he loves her, and once more asks for her hand in marriage. Cady refuses, even though, in spite of herself, she loves him as much as ever. But her pride holds her back. Hans goes away, and years later Cady learns that he’s wound up in England, where he’s struggling with ill health. When she’s twenty-seven, Cady marries a well-to-do man from the country, named Simon. She grows to love him, but not as much as Hans. She has two daughters and a son, Lilian, Judith and Nico. She and Simon are happy together, but Hans is always in the back of her mind until one night she dreams of him and says farewell.","Now, about something else: you’ve known for a long time that my greatest wish is to become a journalist someday and later on a famous writer. Whether these leanings towards greatness (or insanity?) will ever materialise remains to be seen, but I certainly have the subjects in my mind. In any case, I want to publish a book entitled The Secret Annexe after the war. Whether I shall succeed or not, I cannot say, but my diary will be a great help."
"De vijf delen Springer Kunstgeschiedenis, een stel ondergoed, twee ceintuurs, een zakdoek, twee flesjes yoghurt, een potje jam, een kruidkoek, een plantkundeboek van vader en moeder. Doublé armband van Margot, Patria-boek van de Van Daans, biomals en lathyrus van Dussel, snoep en schriften van Miep en Elli en het hoogtepunt: het boek Maria Theresia en drie plakjes volvette kaas van Kraler. Van Peter een fijne bos pioenrozen, de arme jongen heeft zich zoveel moeite gegeven om wat te vinden, maar niets is gelukt.","The five parts Springer Art history, a pair of underwear, two belts, a handkerchief, two bottles of yogurt, a jar of jam, a gingerbread, a botany book from father and mother. Doublé bracelet by Margot, Patria book by the Van Daans, biomals and lathyrus by Dussel, sweets and notebooks by Miep and Elli and the highlight: the book Maria Theresia and three slices of full-fat cheese by Kraler. From Peter a nice bunch of peonies, the poor boy has gone to so much trouble to find some, but nothing has worked.","Springer’s five-volume art history book, a set of underwear, two belts, a handkerchief, two jars of yogurt, a jar of jam, two honey cookies (small), a botany book from Father and Mother, a gold bracelet from Margot, a sticker album from the van Daans, Biomalt and sweet peas from Dussel, candy from Miep, candy and notebooks from Bep, and the high point: the book Maria Theresa and three slices of full-cream cheese from Mr. Kugler. Peter gave me a lovely bouquet of peonies; the poor boy had put a lot of effort into finding a present, but nothing quite worked out.","All ﬁve parts of Sprenger’s History of Art, a set of underwear, a handkerchief, two bottles of yoghurt, a pot of jam, a spiced gingerbread cake, and a book on botany from Mummy and Daddy, a double bracelet from Margot, a book from the van Daans, sweet peas from Dussel, sweets and exercise books from Miep and Bep and, the high spot of all, the book Maria Theresa and three slices of full-cream cheese from Kugler. A lovely bunch of peonies from Peter, the poor boy took a lot of trouble to try and find something, but didn’t have any luck."
"‘We zullen het huis niet meer uit kunnen, het magazijn is zo wankel, dat zakt bij zo'n overstroming beslist in elkaar’.","""We won't be able to leave the house anymore, the warehouse is so shaky that it will definitely collapse in a flood like this.""",“We won’t even be able to leave the house. The warehouse is so unstable it’ll collapse if there’s a flood.”,"“We shan’t be able to get out of the house anyway; the warehouse will definitely collapse if there is a uood, it is so wobbly already.”"
"Mijn brief van gisteren was nog lang niet af, toen ik met schrijven op moest houden. Ik kan de lust niet bedwingen om je nog een onenigheid mede te delen, maar voordat ik daaraan begin dit:","My letter from yesterday was far from finished when I had to stop writing. I can't help but feel the urge to share one more disagreement with you, but before I get into it, this:","I had to stop yesterday, though I was nowhere near finished. I’m dying to tell you about another one of our clashes, but before I do I’d like to say this","I had to stop yesterday, long before I’d finished. I just must tell you about another quarrel, but before I start on that, something else."
"Het heeft geen doel, dat ik je steeds weer tot in de kleinste bijzonderheden ruzies en disputen beschrijf. Ik vind het voldoende als ik je vertel, dat we zeer veel dingen, zoals vet, boter en vlees gedeeld hebben en onze eigen aardappels bakken. Sinds enige tijd eten we er wat roggebrood extra bij, omdat we om vier uur al reikhalzend naar het middageten uitzagen en onze rammelende magen haast niet in bedwang konden houden.","It is no purpose that I keep describing quarrels and disputes to you in the smallest detail. I think it is enough if I tell you that we have shared a lot of things, such as fat, butter and meat and bake our own potatoes. For some time now we have been eating some extra rye bread, because at four o'clock we were eagerly looking forward to lunch and could hardly contain our rumbling stomachs.",There’s no reason for me to go on describing all our quarrels and arguments down to the last detail. It’s enough to tell you that we’ve divided many things like meat and fats and oils and are frying our own potatoes. Recently we’ve been eating a little extra rye bread because by four o’clock we’re so hungry for dinner we can barely control our rumbling stomachs.,"There is no point in telling you every time the exact details of our rows and arguments. Let it suﬃce to tell you that we have divided up a great many things, such as butter and meat, and that we fry our own potatoes. For some time now we’ve been eating some extra rye bread because by 4 o’clock in the afternoon we are longing for our supper so much that we hardly know how to control our rumbling tummies."
Mevrouw Van Daan:,Mrs. Van Daan:,Mrs. van Daan: “I’d stopped wanting to be queen of the kitchen long ago.,Mrs. van Daan: “
"Haast zou ik vergeten te vermelden, dat vaders ziekte weer helemaal over is.",I almost forgot to mention that father's illness is completely over.,I almost forgot to mention that Father has recovered from his illness.,I’d almost forgotten to mention that Daddy is quite better
‘Laten we daar niet over praten’.,"""Let's not talk about that.""",“Let’s drop the subject.” “Why?,"“Let’s not talk, about it.”"
"Als er zo iets is, komen er altijd een heleboel dingen bij elkaar, zo ook nu. No 1 was, dat de Westertorenklok niet speelde, en dat gaf me juist altijd zo'n geruststellend gevoel.","When there is such a thing, a lot of things always come together, even now. No 1 was that the Westertoren clock didn't play, and that always gave me such a reassuring feeling.","Incidents like these are always accompanied by other disasters, and this was no exception. Number one: the Westertoren bells stopped chiming, and I’d always found them so comforting.","When something like that happens, heaps of other things seem to come at the same time, as now. Number one was that the clock at the Westertoren, which I always find so reassuring, did not strike!"
"Maandag, 20 Maart 1944","Monday, March 20, 1944","MONDAY, MARCH 20, 1944","Monday, 20 March, 1944"
"Woensdag, 10 Mei 1944","Wednesday, May 10, 1944","Since I think I’ve mentioned the new cleaning lady, I just want to note that she’s married, sixty years old and hard of hearing! Very convenient, in view of all the noise that eight people in hiding are capable of making. Oh, Kit, it’s such lovely weather. If only I could go outside! WEDNESDAY, MAY 10, 1944","Wednesday, 10 May, 1944"
"Het gaat hen nooit vervelen. Ik heb iets uitgevonden en de uitwerking daarvan is denderend; het is net of je iemand met een speld prikt en hem daardoor op laat springen. Precies zo werkt mijn middel: begin over de politiek; één vraag, één woord, één zin en dadelijk zit de hele familie er midden in!","They never get bored. I've invented something and the effect is amazing; it's like poking someone with a pin and making them jump. That's exactly how my remedy works: start on politics; one question, one word, one sentence and immediately the whole family is in the middle of it!","And so it goes from early in the morning to late at night; the funny part is that they never get tired of it. I’ve discovered a trick, and the effect is overwhelming, just like pricking someone with a pin and watching them jump. Here’s how it works: I start talking about politics. All it takes is a single question, a word or a sentence, and before you know it, the entire family is involved!","They never seem to tire of it. I have discovered something— the effects of which are just like pricking someone with a pin and waiting to see how they jump. This is what I do : begin on politics. One question, one word, one sentence, and at once they’re off!"
"Het is geen verbeelding dat het zien van de hemel, de wolken, de maan en de sterren mij rustig en afwachtend maakt. Dit middel is veel beter dan valeriaan of broom, de natuur maakt mij deemoedig en gereed om alle slagen dapper op te vangen.","It is no imagination that seeing the sky, the clouds, the moon and the stars makes me calm and expectant. This remedy is much better than valerian or bromine, nature makes me humble and ready to take all blows bravely.","It’s not just my imagination—looking at the sky, the clouds, the moon and the stars really does make me feel calm and hopeful. It’s much better medicine than valerian or bromide. Nature makes me feel humble and ready to face every blow with courage! As luck would have it, I’m only able—except for a few rare occasions—to view nature through dusty curtains tacked over dirt-caked windows; it takes the pleasure out of looking. Nature is the one thing for which there is no substitute! One of the many questions that have often bothered me is why women have been, and still are, thought to be so inferior to men. It’s easy to say it’s unfair, but that’s not enough for me ; I’d really like to know the reason for this great injustice! Men presumably dominated women from the very beginning because of their greater physical strength; it’s men who earn a living, beget children and do as they please … Until recently, women silently went along with this, which was stupid, since the longer it’s kept up, the more deeply entrenched it becomes. Fortunately, education, work and progress have opened women’s eyes. In many countries they’ve been granted equal rights; many people, mainly women, but also men, now realize how wrong it was to tolerate this state of affairs for so long. Modern women want the right to be completely independent! But that’s not all. Women should be respected as well! Generally speaking, men are held in great esteem in all parts of the world, so why shouldn’t women have their share? Soldiers and war heroes are honored and commemorated, explorers are granted immortal fame, martyrs are revered, but how many people look upon women too as soldiers? In the book Men Against Death I was greatly struck by the fact that in childbirth alone, women commonly suffer more pain, illness and misery than any war hero ever does. And what’s her reward for enduring all that pain? She gets pushed aside when she’s disfigured by birth, her children soon leave, her beauty is gone. Women, who struggle and suffer pain to ensure the continuation of the human race, make much tougher and more courageous soldiers than all those big-mouthed freedom-fighting heroes put together! I don’t mean to imply that women should stop having children; on the contrary, nature intended them to, and that’s the way it should be. What I condemn are our system of values and the men who don’t acknowledge how great, difficult, but ultimately beautiful women’s share in society is.","It’s not imagination on my part when I say that to look up at the sky , the clouds, the moon, and the stars makes me calm and patient. It’s a better medicine than either valerian or bromide. Mother Nature makes me humble and prepared to face every blow courageously."
