Source,GoogleTranslate,human1,human2
"Miep stuurde ons een krentenmik met het opschrift ‘Vrolijke Pinksteren’. Het is haast alsof ze spot, onze stemming en onze angst zijn heus niet ‘vrolijk’. We zijn allemaal banger geworden na de aangelegenheid met den groenteman, je hoort weer van alle kanten ‘sst. sst.’, alles gebeurt zachter. De politie heeft daar de deur geforceerd, dus daar zijn wij ook niet veilig voor! Als ook wij eens ... neen, ik mag het niet neerschrijven, maar de vraag laat zich vandaag niet wegduwen, integendeel, al de eens doorgemaakte angst staat weer voor me in al zijn verschrikking.","Miep sent us a currant mik with the inscription 'Happy Pentecost'. It's almost as if she's mocking, our mood and our fear are definitely not 'joyful'. We've all become more scared after the affair with the greengrocer, you're hearing shush again from all sides. shh.”, everything is softer. The police forced the door there, so we are not safe from that either! If we too ... no, I am not allowed to write it down, but the question cannot be pushed away today, on the contrary, all the fear once experienced stands before me again in all its terror.","Miep sent us a raisin bread with “Happy Pentecost” written on top. It’s almost as if she were mocking us, since our moods and cares are far from “happy.” We’ve all become more frightened since the van Hoeven business. Once again you hear “shh” from all sides, and we’re doing everything more quietly. The police forced the door there; they could just as easily do that here too! What will we do if we’re ever … no, I mustn’t write that down. But the question won’t let itself be pushed to the back of my mind today; on the contrary, all the fear I’ve ever felt is looming before me in all its horror.","Miep sent us a currant cake made up in the shape of a doll with the words 'Happy Whitsun’ on the note attached to it. It’s almost as if she’s ridiculing us; our present frame of mind and our uneasiness could hardly be called 'happy.’ The fate of the vegetable man has made us more nervous, you hear 'ssh, ssh’ from all sides again, and we’re being quieter over everything. The police forced the door there, so they could do it to us too! If one day we too should … no, I mustn’t write it, but I can’t put the question out of my mind today. On the contrary, all the fear I’ve already been through seems to face me again in all its frightfulness."
‘Daar ben ik mee geboren. Dat zit ook in mijn kin. Dat is het enige schoonheidsding dat ik bezit’.,"""I was born with that. That's in my chin too. That's the only beauty thing I own.""",But to get back to the subject. How on earth can you explain what it all looks like without any models? Shall I try anyway?,"“I was born with them, I’ve got one in my chin too. That’s my only beauty!”"
"Om elf uur zaten we met Henk, die terug was, rond de tafel en het werd langzamerhand weer gezellig. Henks verhaal was als volgt:","At eleven o'clock we sat around the table with Henk, who had returned, and things gradually got cozy again. Hank's story was as follows:","At eleven o’clock Jan was back and joined us at the table, and gradually everyone began to relax. Jan had the following story to tell:","At eleven o’clock we sat round the table with Jan, who was back by that time, and slowly things began to be more normal and cozy again. Jan’s story was as follows:"
Aan de afwas begon Elli met moeder en mevrouw Van Daan over haar mismoedigheid te praten. Hoe helpen die twee haar?,"While doing the dishes, Elli began to talk to Mother and Mrs. Van Daan about her despondency. How do those two help her?","While doing the dishes, Bep began talking to Mother and Mrs. van Daan about how discouraged she gets. What help did those two offer her?",During dish washing Bep began telling Mummy and Mrs. van Daan that she felt very discouraged at times. And what help do you think they gave her?
"Moeder en ik schieten de laatste tijd wel beter met elkaar op, maar vertrouwelijk zijn we nooit. Margot is kattiger dan ooit en vader heeft iets waarmee hij niet voor de dag wil komen, maar is toch altijd een schat.","Mother and I have gotten along better lately, but we're never intimate. Margot is cattier than ever and Dad has something he doesn't want to show, but is always a treasure.",There’s a new division of butter and margarine.,"Lately Mummy and I have been getting on better together, but we still never confide in each other. Margot is more catty then ever and Daddy has got something he is keeping to himself, but he remains the same darling."
"Alle mensen proberen een oud toestel te bemachtigen om dat in plaats van hun ‘moed-houd-bron’ in te leveren. Het is heus waar, als de berichten van buiten steeds slechter worden, helpt de radio met haar wonder-stem, dat we de moed niet verliezen door elke keer weer te zeggen: ‘Kop op, houd goede moed, er komen ook weer andere tijden!’","All people are trying to get hold of an old device to hand it in instead of handing in their ""brave-hold resource"". It's true, when the messages from outside get worse and worse, the radio with its wonderful voice helps that we don't lose heart by saying over and over again: 'Cheer up, be of good cheer, there will be other times too. !'","All over the country people are trying to get hold of an old radio that they can hand over instead of their “morale booster.” It’s true: as the reports from outside grow worse and worse, the radio, with its wondrous voice, helps us not to lose heart and to keep telling ourselves, “Cheer up, keep your spirits high, things are bound to get better!”","Everyone is trying to get hold of an old set and to hand that in instead of their 'source of courage.’ It is really true that as the news from outside gets worse, so the radio with its miraculous voice helps us to keep up our morale and to say again, “Chins up, stick it out, better times will come!”"
"Lieve Kitty,","Dear kitty,","Dearest Kitty,","Dear Kitty,"
"Donderdag, 9 Juli 1942","Thursday, July 9, 1942","THURSDAY, JULY 9, 1942","Thursday, 9 July, 1942"
"Maar laat ik je niet ophouden over oude nare heren te zeuren, het wordt er toch niet beter door en al mijn wraakmiddelen, zoals lamp uitschroeven, deur afsluiten, kleren verstoppen, moet ik om de vrede te bewaren, achterwege laten.","But don't let me stop you whining about old nasty gentlemen, it won't make it any better, and all my means of revenge, such as unscrewing the lamp, shutting the door, hiding clothes, I must to keep the peace.","But I mustn’t waste any more of your time griping about disgusting old men. It won’t help matters anyway. My plans for revenge, such as unscrewing the lightbulb, locking the door and hiding his clothes, have unfortunately had to be abandoned in the interests of peace.","But I won’t bore you any longer on the subject of old men. It won’t make things any better and all my plans of revenge (such as disconnecting the lamp, shutting the door, hiding his clothes) must be abandoned in order to keep the peace."
Je Anne.,your Anne.,"Yours, Anne PS.","Yours, Anne"
"Het is misschien vermakelijk voor jou - voor mij allerminst - om te horen wat we vandaag zullen eten. Op het ogenblik zit ik, daar de werkster beneden is, aan de zeildoektafel bij de Van Daans, heb een zakdoek in mijn mond en tegen mijn neus geduwd, die doordrenkt is van welriekend vóórduiks parfum. Je zult er op die manier niet veel van snappen, dus weer:","It may be amusing for you - least of all for me - to hear what we will be eating today. At the moment, as the maid is downstairs, I am sitting at the tarpaulin table at the Van Daans, have pressed a handkerchief in my mouth and against my nose, which is drenched with fragrant predive perfume. You won't understand much that way, so again:","It might be amusing for you (though not for me) to hear what we’re going to eat today. The cleaning lady is working downstairs, so at the moment I’m seated at the van Daans’ oilcloth-covered table with a handkerchief sprinkled with fragrant prewar perfume pressed to my nose and mouth. You probably don’t have the faintest idea what I’m talking about, so let me “begin at the beginning.”","Perhaps it would be entertaining for you—though not in the least for me—to hear what we are going to eat today. As the charwoman is at work downstairs, I’m sitting on the van Daans’ table at the moment. I have a handkerchief soaked in some good scent (bought before we came here) over my mouth and held against my nose. You won’t gather much from this, so let’s 'begin at the beginning.’"
"Toen ik bij Peter kwam, verontschuldigde ik me, dat ik hem nog eens moest storen. Hij stond op, ging tussen de trap en de muur staan, pakte mijn arm vast toen ik al op de trap stond en wilde me met alle geweld tegenhouden. ‘Ik ga wel’, zei hij. Ik antwoordde, dat dat heus niet nodig was en dat ik nu geen kleine behoefde te halen. Toen was hij overtuigd en liet mijn arm los. Op de terugweg kwam hij het luik openen en pakte weer de pan van me aan. Bij de deur vroeg ik: ‘Wat ben je aan het doen?’ ‘Frans’, was het antwoord. Ik vroeg of ik de lessen eens mocht inkijken, waste mijn handen en ging tegenover hem op de divan zitten.","When I got to Peter, I apologized that I had to disturb him again. He got up, went between the stairs and the wall, grabbed my arm when I was already on the stairs and tried to stop me with all his might. “I will,” he said. I replied that that was really not necessary and that I did not need to get a small one now. Then he was convinced and let go of my arm. On the way back he came to open the hatch and took the pan from me again. At the door I asked, ""What are you doing?"" ""French,"" was the reply. I asked if I could have a look at the lessons, washed my hands and sat down on the couch opposite him.","When I entered Peter’s room, I apologized for disturbing him again. As I was going up the stairs, he stood up, went over to stand between the stairs and the wall, grabbed my arm and tried to stop me. “I’ll go,” he said. “I have to go upstairs anyway.” I replied that it wasn’t really necessary, that I didn’t have to get only the small ones this time. Convinced, he let go of my arm. On my way back, he opened the trapdoor and once again took the pan from me. Standing by the door, I asked, “What are you working on?” “French,” he replied. I asked if I could take a look at his lessons. Then I went to wash my hands and sat down across from him on the divan.","When I came into Peter’s room, I apologised at having to disturb him again. When I was already on the stairs, he got up, and went and stood between the door and the wall, firmly took hold of my arm, and wanted to hold me back by force. “I’ll go,” he said. I replied that it really wasn’t necessary and that I didn’t have to get particularly small ones this time. Then he was convinced and let my arm go. On the way down, he came and opened the trap door and took the pan again. When I reached the door, I asked, “What are you doing?” “French,” he replied. I asked if I might glance through the exercises, washed my hands, and went and sat on the divan opposite him."
"Maar om op ons opvoedingsthema terug te komen. Gisteren viel na mevrouws laatste woorden een stilte in. Dan antwoordde vader: ‘Ik vind dat Anne zeer goed opgevoed is, ze heeft toch tenminste al zoveel geleerd dat ze op uw lange preken geen antwoord meer geeft. Wat de groenten betreft kan ik u niets anders antwoorden dan vice versa’.","But to return to our parenting theme. Yesterday, after Mrs.'s last words, a silence fell. Then father answered: 'I think Anne has been very well brought up, at least she has learned so much already that she no longer answers your long sermons. As for the vegetables, I can only answer you vice versa.""","But to get back to the subject of raising children, yesterday a silence fell after Mrs. van D. finished her little speech. Father then replied, “I think Anne is very well brought up. At least she’s learned not to respond to your interminable sermons. As far as the vegetables are concerned, all I have to say is look who’s calling the kettle black.”","But to come back to this 'upbringing’ business. There  was a deadly silence after Mrs. van Daan had finished speaking yesterday. Then Daddy said, “I think Anne is extremely well brought up she has learned one thing anyway, and that is to make no reply to your long sermons. As to the vegetables, look at your own plate.”"
Heb je het niet makkelijk; een ieder wil zijn,Don't you have it easy; everyone wants to be,It begins with the usual summary of the year’s events and then continues:,"Though youngest here, you are no longer small, But life is very hard, since one and all"
"Ik weet wel, dat ik wanhopig van jaloezie zou zijn, maar Margot zegt alleen, dat ik geen medelijden met haar moet hebben.","I know I'd be desperate with jealousy, but Margot just says I shouldn't feel sorry for her.","I know I’d be insanely jealous, but Margot just says I shouldn’t feel sorry for her.","I know quite well that I’d be desperately jealous, but Margot only says that I needn’t pity her."
"Lieve Kitty,","Dear kitty,","Bep is currently able to get hold of notebooks, especially journals and ledgers, useful for my bookkeeping sister!","Dear Kitty,"
"Vader, moeder en Margot laten me dan bij tijd en wijle onverschillig, ik dwaal van de ene naar de andere kamer, de trap af en weer op en heb een gevoel als een zangvogel, wiens vleugels hardhandig uitgerukt zijn en die in een volslagen duisternis tegen de spijlen van zijn nauwe kooi aanvliegt. ‘Naar buiten, lucht en lachen’, schreeuwt het in me. Ik antwoord niet eens meer, ga op een divan liggen en slaap om de tijd, de stilte, de verschrikkelijke angst ook, te verkorten, want te doden zijn ze niet.","Father, mother and Margot then leave me indifferent at times, I wander from one room to another, down the stairs and up again, feeling like a songbird, whose wings have been plucked out violently, and which flies against it in utter darkness. flies at the bars of his narrow cage. 'Out, air and laugh', it screams inside me. I don't even answer anymore, lie down on a couch and sleep to shorten the time, the silence, the terrible fear too, because they can't be killed.","At times like these, Father, Mother and Margot don’t matter to me in the least. I wander from room to room, climb up and down the stairs and feel like a songbird whose wings have been ripped off and who keeps hurling itself against the bars of its dark cage. “Let me out, where there’s fresh air and laughter!” a voice within me cries. I don’t even bother to reply anymore, but lie down on the divan. Sleep makes the silence and the terrible fear go by more quickly, helps pass the time, since it’s impossible to kill it. Yours, Anne SATURDAY, OCTOBER 30, 1943 Dearest Kitty, Mother’s nerves are very much on edge, and that doesn’t bode well for me. Is it just a coincidence that Father and Mother never scold Margot and always blame me for everything? Last night, for example, Margot was reading a book with beautiful illustrations; she got up and put the book aside for later. I wasn’t doing anything, so I picked it up and began looking at the pictures. Margot came back, saw “her” book in my hands, knitted her brow and angrily demanded the book back. I wanted to look through it some more. Margot got madder by the minute, and Mother butted in: “ Margot was reading that book; give it back to her.” Father came in, and without even knowing what was going on, saw that Margot was being wronged and lashed out at me: “I’d like to see what you’d do if Margot was looking at one of your books!” I promptly gave in, put the book down and, according to them, left the room “in a huff.” I was neither huffy nor cross, but merely sad. It wasn’t right of Father to pass judgment without knowing what the issue was. I would have given the book to Margot myself, and a lot sooner, if Father and Mother hadn’t intervened and rushed to take Margot’s part, as if she were suffering some great injustice. Of course, Mother took Margot’s side; they always take each other’s sides. I’m so used to it that I’ve become completely indifferent to Mother ’s rebukes and Margot’s moodiness. I love them, but only because they’re Mother and Margot. I don’t give a darn about them as people. As far as I’m concerned, they can go jump in a lake. It’s different with Father. When I see him being partial to Margot, approving Margot’s every action, praising her, hugging her, I feel a gnawing ache inside, because I’m crazy about him. I model myself after Father, and there’s no one in the world I love more. He doesn’t realize that he treats Margot differently than he does me: Margot just happens to be the smartest, the kindest, the prettiest and the best. But I have a right to be taken seriously too. I’ve always been the clown and mischief maker of the family; I’ve always had to pay double for my sins: once with scoldings and then again with my own sense of despair. I’m no longer satisfied with the meaningless affection or the supposedly serious talks. I long for something from Father that he’s incapable of giving. I’m not jealous of Margot; I never have been. I’m not envious of her brains or her beauty. It’s just that I’d like to feel that Father really loves me, not because I’m his child, but because I’m me, Anne. I cling to Father because my contempt of Mother is growing daily and it’s only through him that I’m able to retain the last ounce of family feeling I have left. He doesn’t understand that I sometimes need to vent my feelings for Mother. He doesn’t want to talk about it, and he avoids any discussion involving Mother’s failings. And yet Mother, with all her shortcomings, is tougher for me to deal with. I don’t know how I should act. I can’t very well confront her with her carelessness, her sarcasm and her hard-heartedness, yet I can’t continue to take the blame for everything. I’m the opposite of Mother, so of course we clash. I don’t mean to judge her; I don’t have that right. I’m simply looking at her as a mother. She’s not a mother to me —I have to mother myself. I’ve cut myself adrift from them. I’m charting my own course, and we’ll see where it leads me. I have no choice, because I can picture what a mother and a wife should be and can’t seem to find anything of the sort in the woman I’m supposed to call “Mother.” I tell myself time and again to overlook Mother’s bad example. I only want to see her good points, and to look inside myself for what’s lacking in her. But it doesn’t work, and the worst part is that Father and Mother don’t realize their own inadequacies and how much I blame them for letting me down. Are there any parents who can make their children completely happy? Sometimes I think God is trying to test me, both now and in the future. I’ll have to become a good person on my own, without anyone to serve as a model or advise me, but it’ll make me stronger in the end. Who else but me is ever going to read these letters? Who else but me can I turn to for comfort? I’m frequently in need of consolation, I often feel weak, and more often than not, I fail to meet expectations. I know this, and every day I resolve to do better. They aren’t consistent in their treatment of me. One day they say that Anne’s a sensible girl and entitled to know everything, and the next that Anne’s a silly goose who doesn’t know a thing and yet imagines she ’s learned all she needs to know from books! I’m no longer the baby and spoiled little darling whose every deed can be laughed at. I have my own ideas, plans and ideals, but am unable to articulate them yet. Oh well. So much comes into my head at night when I’m alone, or during the day when I’m obliged to put up with people I can’t abide or who invariably misinterpret my intentions. That’s why I always wind up coming back to my diary—I start there and end there because Kitty’s always patient. I promise her that, despite everything, I’ll keep going, that I’ll find my own way and choke back my tears. I only wish I could see some results or, just once, receive encouragement from someone who loves me. Don’t condemn me, but think of me as a person who sometimes reaches the bursting point!","At such times Daddy, Mummy, and Margot leave me cold. I wander from one room to another, downstairs and up again, feeling like a songbird whose wings have been clipped and who is hurling himself in utter darkness against the bars of his cage. “Go outside, laugh, and take a breath of fresh air,” a voice cries within me, but I don’t even wish to respond any more; I go and lie on the divan and sleep, to make the time pass more quickly, and the stillness and the terrible fear, because there is no way of killing them."
"Om half negen stonden we op, Peter deed zijn gymschoenen aan om zachter te lopen bij de ronde door het huis en ik stond er bij. Hoe het zo plotseling kwam, ik weet het niet, maar voordat wij naar beneden gingen, gaf hij mij een zoen, tussen mijn haar, half op mijn linkerwang, half op mijn oor. Ik rende naar beneden, zonder omkijken en ben erg verlangend naar vandaag.","We got up at half past eight, Peter put on his sneakers to walk more softly on the round the house and I stood by. How it came so suddenly, I don't know, but before we went downstairs he gave me a kiss, between my hair, half on my left cheek, half on my ear. I ran downstairs without looking back and am very longing for today.","At nine-thirty we stood up. Peter put on his tennis shoes so he wouldn’t make much noise on his nightly round of the building, and I was standing next to him. How I suddenly made the right movement, I don’t know, but before we went downstairs, he gave me a kiss, through my hair, half on my left cheek and half on my ear. I tore downstairs without looking back, and I long so much for today. Sunday morning, just before eleven.","We got up at half past eight. Peter put on his gym shoes, so that when he toured the house he wouldn’t make a noise, and I stood beside him. How it came about so suddenly, I don’t know, but before we went downstairs he kissed me, through my hair, half on my left cheek, half on my ear, I tore downstairs without looking round, and am simply longing for today!"
"No 2: Dat mijnheer Vossen de vorige avond eerder weggegaan was en wij dus niet zeker wisten, of Elli de sleutel nog had kunnen bemachtigen en misschien vergeten had de deur af te sluiten.",No 2: That Mr. Vossen had left early the previous evening and so we weren't sure if Elli had been able to get the key and perhaps forgot to lock the door.,"Number two: Mr. Voskuijl left early last night, and we weren’t sure if he’d given Bep the key and she’d forgotten to lock the door.","Number two was that, Mr. Vossen having left earlier than usual the previous evening, we didn’t know definitely whether Bep had been able to get hold of the key, and had perhaps forgotten to shut the door."
"‘Er is een groot verschil, mevrouw Van Daan’, zei moeder, ‘tussen Margot en Peter, ten eerste is Margot een meisje, en meisjes zijn altijd rijper dan jongens, ten tweede heeft Margot al meer serieuze boeken gelezen en zoekt niet naar dingen die voor haar verboden zijn, ten derde is Margot veel ontwikkelder en verstandiger, wat haar vier H.B.S.- jaren meebrengen’. Mevrouw stemde daarmee in, maar vond het toch in principe verkeerd jonge kinderen boeken voor volwassenen te laten lezen.","'There is a big difference, Mrs Van Daan', said Mother, 'between Margot and Peter, firstly Margot is a girl, and girls are always more mature than boys, secondly Margot has already read more serious books and does not look for things which are forbidden to her, thirdly, Margot is much more educated and sensible, which brings her four H.B.S. years'. Mrs. agreed, but thought it was in principle wrong to let young children read books for adults.","“You see, Mrs. van Daan,” Mother said, “there’s a big difference between Margot and Peter. To begin with, Margot’s a girl, and girls are always more mature than boys. Second, she’s already read many serious books and doesn’t go looking for those which are no longer forbidden. Third, Margot’s much more sensible and intellectually advanced, as a result of her four years at an excellent school.” Mrs. van Daan agreed with her, but felt it was wrong as a matter of principle to let youngsters read books written for adults.","“There  is  a  great  difference,  Mrs.  van  Daan,”  said Mummy, “between Margot and Peter. In the first place, Margot is a girl and girls are always more grown-up than boys; secondly, Margot has read quite a lot of serious books, and does not go in search of things that are forbidden to her; thirdly, Margot is far more developed and intelligent, shown by the fact of her being in the fourth form at school.” Mrs.  van  Daan  agreed,  but  still  thought   it  was  wrong in principle to let children read books which were written for grown-ups."
