Source,GoogleTranslate,human1,human2
"Om één uur komt Henk met de mededeling, het was de postbode. Peter snelt de trap weer af. Rang, de bel, rechtsomkeert. Ik ga luisteren of er iemand komt, eerst aan de kastdeur, dan zachtjes boven aan de trap. Ten slotte hangen Peter en ik als twee dieven over de leuning en luisteren naar het lawaai dat van beneden komt. Geen vreemde stem, Peter gaat stiekem de trap af, blijft halverwege staan en roept: ‘Elli!’ Geen antwoord, nog eens: ‘Elli!’ Het lawaai in de keuken is harder dan Peters stem. Hij de trap af, de keuken in. Ik sta gespannen naar beneden te kijken: ‘Maak dat je naar boven komt, Peter, de accountant is er, je moet weg!’ Het is de stem van Koophuis. Zuchtend komt Peter boven, de kastdeur gaat dicht. Half twee komt Kraler eindelijk. ‘O jeminee, ik zie niets anders meer dan aardbeien, mijn ontbijt aardbeien, Henk eet aardbeien, Koophuis snoept aardbeien, Miep kookt aardbeien, ik ruik aardbeien, wil ik dat rode goedje kwijt en ga naar boven, dan worden hier gewassen ... aardbeien’.","At one o'clock Henk comes with the announcement, it was the postman. Peter rushes down the stairs again. Rank, the bell, turn back. I go to listen for someone to come, first at the closet door, then softly at the top of the stairs. Finally, Peter and I hang over the railing like two thieves, listening to the noise coming from below. No strange voice, Peter sneaks down the stairs, stops halfway and yells, ""Elli!"" No answer, again: ""Elli!"" The noise in the kitchen is louder than Peter's voice. He goes down the stairs, into the kitchen. I look down tensely: 'Make yourself come up, Peter, the accountant is here, you have to go!' It is Koophuis's voice. Sighing, Peter comes upstairs, the cupboard door closes. Kraler finally arrives at half past two. 'Oh dear, I see nothing more than strawberries, my breakfast strawberries, Henk eats strawberries, Koophuis eats strawberries, Miep cooks strawberries, I smell strawberries, if I want to get rid of that red stuff and go upstairs, they will be washed here... strawberries'.","Jan came up at one to tell us it had been the mailman. Peter hurried downstairs again. Ding-dong … the doorbell, about-face. I listened to hear if anyone was coming, standing first at the bookcase, then at the top of the stairs. Finally Peter and I leaned over the banister, straining our ears like a couple of burglars to hear the sounds from downstairs. No unfamiliar voices. Peter tiptoed halfway down the stairs and called out, “Bep!” Once more: “Bep!” His voice was drowned out by the racket in the kitchen. So he ran down to the kitchen while I nervously kept watch from above. “Go upstairs at once, Peter, the accountant’s here, you’ve got to leave!” It was Mr. Kugler’s voice. Sighing, Peter came upstairs and closed the bookcase. Mr. Kugler finally came up at one-thirty. “My gosh, the whole world’s turned to strawberries. I had strawberries for breakfast, Jan’s having them for lunch, Kleiman’s eating them as a snack, Miep ’s boiling them, Bep’s hulling them, and I can smell them everywhere I go. I come upstairs to get away from all that red and what do I see? People washing strawberries!”","At 1 o’clock Jan came and told us that it was the postman. Peter hurried downstairs again. Ting-a-ling... the bell, right about turn. I tried to hear if anyone was coming, standing first at our cupboard door and then at the top of the stairs. Finally, Peter and I both leant over the banisters like a couple of thieves, listening to the din downstairs. No strange voices. Peter sneaked down, stopped halfway, and called out: “Elli!” No answer, one more: “Elli!” Peter’s voice was drowned by the din in the kitchen. He went right down into the kitchen. I stood looking down tensely. “Get upstairs at once. Peter. The accountant is here, clear out!” It was Kleiman speaking. Peter came upstairs sighing and closed the cupboard door. Finally Kugler arrived at half past one. “Oh, dear me, I see nothing but strawberries. strawberries at breakfast, strawberries stewed by Miep , I smell strawberries, must have a rest from them and go upstairs— what is being washed up here... strawberries.”"
"Lieve Kitty,","Dear kitty,","Dearest Kitty,",Dear Kitty
"Lieve Kitty,","Dear kitty,","Dearest Kitty,","Dear Kitty,"
"Nieuwe problemen: mevrouw is wanhopig, spreekt van een kogel door de kop, gevangenis, ophangen en zelfmoord. Zij is jaloers, dat Peter mij wel en haar niet zijn vertrouwen schenkt. Ze is beledigd dat Dussel niet voldoende op haar flirterijen ingaat, bang dat haar man al het bontmantel-geld oprookt, maakt ruzie, scheldt, huilt, beklaagt zich, lacht en begint dan weer met ruzie.","New problems: madam is desperate, talks of a bullet through the head, prison, hanging and suicide. She is jealous that Peter trusts me and not her. She is offended that Dussel doesn't go into her flirtations enough, afraid that her husband will smoke all the fur-cloak money, argues, scolds, cries, complains, laughs and then starts arguing again.","New problems: Mrs. van D. is at her wits’ end. She’s talking about getting shot, being thrown in prison, being hanged and suicide. She’s jealous that Peter confides in me and not in her, offended that Dussel doesn’t respond sufficiently to her flirtations and afraid her husband’s going to squander all the fur-coat money on tobacco. She quarrels, curses, cries, feels sorry for herself, laughs and starts all over again.","New problems: Mrs. van Daan is desperate, talks about a bullet through her head, prison, hanging and suicide. She’s jealous that Peter confides in me and not her. She’s  offended that Dussel doesn’t respond to her uirtations, afraid that her husband is smoking all the fur-coat money away, she quarrels, uses abusive language, cries, pities herself, laughs and then starts a fresh quarrel again."
"Ik wil verder komen, ik kan me niet voorstellen, dat ik zou moeten leven zoals moeder, mevrouw Van Daan en al die vrouwen, die hun werk doen en die later vergelen zijn. Ik moet iets hebben naast man en kinderen, waar ik me aan wijden kan!","I want to move on, I can't imagine that I should have to live like mother, Mrs. Van Daan and all those women who do their work and who later turn yellow. I must have something besides husband and children that I can devote myself to!","But I want to achieve more than that. I can’t imagine having to live like Mother, Mrs. van Daan and all the women who go about their work and are then forgotten. I need to have something besides a husband and children to devote myself to!","I want to get on, I can’t imagine that I would have to lead the same sort of life as Mummy and Mrs. van Daan and all the women who do their work and are then forgotten. I must have something besides a husband and children, something that I can devote myself to!"
"Lieve Kitty,","Dear kitty,","Dearest Kitty, I (there I go again!)","Dear Kitty,"
"Maar één ding weet ik nu en dat is dit: je leert de mensen pas goed kennen, als je een keer echte ruzie met ze gemaakt hebt. Pas dan kan je hun karakter beoordelen!",But one thing I know now and that is this: you only get to know people well once you have had a real fight with them. Only then can you judge their character!,I’ve learned one thing: you only really get to know a person after a fight. Only then can you judge their true character!,"Anyhow, I’ve learned one thing now. You only really get to know people when you’ve had a jolly good row with them. Then and then only can you judge their true characters!"
"Lieve Kitty,","Dear kitty,","Dearest Kitty,","Dear Kitty,"
"Lieve Kitty,","Dear kitty,","Dearest Kitty,","Dear Kitty,"
Gedurende het gehele jaar geopend.,Open all year round.,Open all year round:,Open	 all	the	year	round.	
"Lieve Kitty,","Dear kitty,","Dearest Kitty,","Dear Kitty,"
"Moeder is verschrikkelijk zenuwachtig en dat is voor mij altijd erg gevaarlijk. Zou het toeval zijn dat vader en moeder nooit Margot een standje geven en dat alles altijd op mij neerkomt? Gisteravond bijvoorbeeld: Margot las een boek, waarin prachtige tekeningen stonden; zij stond op, ging naar boven en legde het boek opzij om het straks verder te lezen. Ik had net niets te doen, pakte het en bekeek de platen. Margot kwam terug, zag ‘haar’ boek in mijn hand, trok een rimpel in haar voorhoofd en vroeg het boek terug. Ik wilde nog eventjes verder kijken, Margot werd steeds kwader, moeder mengde zich er in met de woorden: ‘Dat boek leest Margot, geef het dus aan haar’. Vader kwam de kamer binnen, wist niet eens waar het over ging, zag dat Margot iets misdaan werd en viel tegen mij uit: ‘Ik zou jou eens willen zien als Margot in jouw boek zou bladeren!’","Mother is terribly nervous and that is always very dangerous for me. Could it be a coincidence that Mother and Father never scold Margot and that everything always comes down to me? For example, last night: Margot read a book with beautiful drawings; she got up, went upstairs, and set the book aside to continue reading later. I just had nothing to do, picked it up and looked at the records. Margot came back, saw 'her' book in my hand, wrinkled her forehead and asked for the book back. I wanted to look a little further, Margot became more and more angry, Mother mixed in with the words: 'Margot reads that book, so give it to her'. Father came into the room, didn't even know what it was about, saw that Margot was doing something wrong, and snapped at me, ""I'd like to see you if Margot flipped through your book!""","Bep stayed with us Friday evening. It was fun, but she didn’t sleep very well because she’d drunk some wine. For the rest, there’s nothing special to report. I had an awful headache yesterday and went to bed early. Margot’s being exasperating again.","Mummy is frightfully irritable and that always seems to herald unpleasantness for me. Is it just chance that Daddy and Mummy never rebuke Margot and that they always take out everything on me? Yesterday evening, for instance: Margot was reading a book with lovely drawings in it; she got up and went upstairs, put the book down, ready to go on with it later. I wasn’t doing anything, so picked up the book and started looking at the pictures. Margot came back, saw 'her’ book in my hands, wrinkled her forehead and asked for the book back. Just because I wanted to look a little further on, Margot got more and more angry. Then Mummy joined in, “Give the book to Margot, she was reading it,” she said. Daddy came into the room. He didn’t even know what it was all about, but saw the injured look on Margot’s face and promptly dropped on me, “I’d like to see what you’d say if Margot ever started looking at one of your books!”"
"Pim stelt zich altijd op het standpunt van den ouderen vader, die ook wel eens zulke voorbijgaande neigingen gehad heeft, maar die met mij toch niet meer als vriend kan meeleven, hoe ijverig hij daar ook naar zoekt.","Pim always takes the standpoint of the elderly father, who has sometimes had such transient tendencies, but who can no longer sympathize with me as a friend, no matter how diligently he searches for it.","Pim always acts like the elderly father who once had the same fleeting impulses, but who can no longer relate to me as a friend, no matter how hard he tries.","Pim always takes up the older, fatherly attitude, telling me that he too has had similar passing tendencies. He’s not able to connect with me like a friend, however hard he tries."
"Moeder denkt dat Peter verliefd op mij is, eerlijk gezegd wou ik maar dat het waar was, dan zijn we quitte en kunnen elkaar veel makkelijker bereiken. Ze zegt verder, dat hij mij zoveel aankijkt. Nu is het wel waar, dat we elkaar meer dan eens in de kamer beknipogen en dat hij naar mijn wangenkuiltjes kijkt, daar kan ik toch niets aan doen! Is het wel?","Mother thinks Peter is in love with me, honestly I wish it were true, then we'll be even and it's much easier to reach each other. She goes on to say that he looks at me so much. Now it is true that we wink at each other more than once in the room and that he looks at my dimples, I can't help that! Is it?","Furthermore, Mother thinks Peter’s in love with me. To tell you the truth, I wish he were. Then we’d be even, and it’d be a lot easier to get to know each other. She also claims he’s always looking at me. Well, I suppose we do give each other the occasional wink. But I can’t help it if he keeps admiring my dimples, can I?","Mummy thinks that Peter is in love with me; quite frankly, I only wish he were, then we’d be quits and really be able to get to know each other. She also says that he keeps on looking at me. Now, I suppose that’s true, but still I can’t help it if he looks at my dimples and we wink at each other occasionally, can I?"
"Veel verandering komt er in ons leven hier niet. Mijnheer Van Daan en ik liggen altijd overhoop, daarentegen houdt hij veel van Margot. Mama doet soms alsof ik een baby ben en dat kan ik niet uitstaan. Verder gaat het wel wat beter. Peter vind ik nog steeds niet aardiger, het is een vervelende jongen, hij luiert de hele dag op zijn bed, timmert een beetje en gaat dan weer dutten. Wat een stomkop!","There will not be much change in our lives here. Mr Van Daan and I are always at odds, on the other hand he loves Margot very much. Mommy sometimes acts like I'm a baby and I can't stand that. Other than that, things are going a bit better. I still don't like Peter, he's an annoying boy, he lazes all day on his bed, does a little hammering and then goes back to nap. What a dumb ass!","There’s little change in our lives here. Peter’s hair was washed today, but that’s nothing special. Mr. van Daan and I are always at loggerheads with each other. Mama always treats me like a baby, which I can’t stand. For the rest, things are going better. I don’t think Peter’s gotten any nicer. He’s an obnoxious boy who lies around on his bed all day, only rousing himself to do a little carpentry work before returning to his nap. What a dope! Mama gave me another one of her dreadful sermons this morning.","There is little change in our life here. Mr. van Daan and I usually manage to upset each other, it’s just the opposite with Margot whom he likes very much. Mummy sometimes treats me just like a baby, which I can’t bear. Otherwise things are going better. I still don’t like Peter any more, he is so-boring; he uops lazily on his bed half the time, does a bit of carpentry, and then goes back for another snooze. What a fool!"
"Eenmaal bij het grote bed aangeland, is de ergste schrik al heen, behalve als het schieten erg hard mocht zijn.","Once arrived at the big bed, the worst fear is already gone, unless the shooting should be very hard.","Once I’ve reached the big bed, the worst is over, except when the shooting is extra loud.","Once I’ve landed in the big bed, the worst is over, except if the firing gets very bad."
Je Anne.,your Anne.,"MONDAY, JULY 26, 1943","Yours, Anne"
"'s Avonds zei hij nog iets, dat ik mooi vond. We hadden het over een filmster die hij eens van mij gekregen heeft en die nu zeker al anderhalf jaar in zijn kamer hangt. Hij vond die zo leuk en ik bood hem aan hem eens wat andere filmsterren te geven.",In the evening he said something that I liked. We were talking about a movie star he once got from me and who has been hanging in his room for at least a year and a half now. He liked it so much and I offered to give him some other movie stars.,"That evening he said something else I thought was nice. We were talking about the picture of a movie star I’d once given him, which has been hanging in his room for at least a year and a half. He liked it so much that I offered to give him a few more.","In the evening, he said something else that I thought was nice. We were talking about a picture of a film star that I’d given him once, which has now been hanging in his room for at least a year and a half. He liked it very much and I offered to give him a few more sometime."
"Dussel zei, dat mijnheer Van Daan met zwijgen begonnen was en hij was dan ook niet van plan zijn zwijgen te verbreken.",Dussel said that Mr. Van Daan had started with silence and he had no intention of breaking his silence.,Dussel said Mr. van Daan had started the silent treatment and he had no intention of breaking it.,"Mr. Dussel said that Mr. van Daan started the silence, so he was not going to be the one to break it."
"Een beetje je leraar, jou dikwijls tot pijn.","A little your teacher, often to your pain.",It begins with the usual summary of the year’s events and then continues:,"Aspire to be your teacher, thus and thus: “We have experience, take a tip from us.”"
"Miep en Kraler ondervinden het meest de last van ons achten, Miep in haar werk, Kraler, die de kolossale verantwoording soms te machtig wordt en die bijna niet meer spreken kan van ingehouden zenuwen en opwinding. Koophuis en Elli zorgen ook goed voor ons, zeer goed zelfs, maar eenmaal is voor hen ook het Achterhuis vergeten, al is het dan maar voor een paar uurtjes, een dag, twee dagen misschien. Ze hebben hun eigen zorgen, Koophuis voor zijn gezondheid, Elli om haar verloving die er niet erg rooskleurig uitziet en naast die zorgen hebben ze ook hun uitstapjes, hun visites, hun hele leven van gewone mensen. Voor hen wijkt de spanning soms, al is het maar voor een korte tijd, voor ons wijkt ze nooit. Twee jaar lang duurt het nu al en hoe lang nog zullen wij aan deze haast ondraaglijke, steeds groeiende druk weerstand moeten blijven bieden?","Miep and Kraler suffer the most from our esteem, Miep in her work, Kraler, who sometimes becomes too powerful for the colossal responsibility and who can hardly speak of suppressed nerves and excitement. Koophuis and Elli also take good care of us, very well in fact, but once they also forget the Secret Annex, even if only for a few hours, a day, maybe two days. They have their own worries, Koophuis for his health, Elli for her engagement that doesn't look very rosy and besides those worries they also have their trips, their visits, their whole lives of ordinary people. For them the tension sometimes subsides, if only for a short time, for us it never subsides. It has been two years now and how much longer will we have to resist this almost unbearable, ever-increasing pressure?","Miep and Mr. Kugler bear the greatest burden for us, and for all those in hiding—Miep in everything she does and Mr. Kugler through his enormous responsibility for the eight of us, which is sometimes so overwhelming that he can hardly speak from the pent-up tension and strain. Mr. Kleiman and Bep also take very good care of us, but they’re able to put the Annex out of their minds, even if it’s only for a few hours or a few days. They have their own worries, Mr. Kleiman with his health and Bep with her engagement, which isn’t looking very promising at the moment. But they also have their outings, their visits with friends, their everyday lives as ordinary people, so that the tension is sometimes relieved, if only for a short while, while ours never is, never has been, not once in the two years we’ve been here. How much longer will this increasingly oppressive, unbearable weight press down on us?","Miep and Kugler carry the heaviest burden of the eight in hiding, Miep in all she does, and Kugler through his enormous sense of responsibility for all of us, which is sometimes so much for him that he can hardly talk from pent-up nerves and strain. Kleiman and Bep look after us well too, but they can forget us at times, even if it’s only for a few hours, or a day, or even two days. They have their own worries, Kleiman over his health, Bep over her engagement, which is not altogether rosy, and they also have their little outings, visits to friends, and the whole life of ordinary people. For them the burden is sometimes lifted, even if it is only for a short time, but for us it never lifts for a moment. We’ve been here for two years now, how long have we still to put up with this almost unbearable, ever increasing pressure?"
Je Anne.,your Anne.,Anne,"Yours, Anne"
"Zondag, 19 Maart 1944","Sunday, March 19, 1944","SATURDAY, MARCH 18, 1944","Sunday, 19 March, 1944"
"Vrijdag, 3 Juli 1942","Friday, July 3, 1942","and there was Peter Schiff with two other boys; it was the first time he’d said hello to me in ages, and it really made me feel good.","Friday, 3 July, 1942"
"Niets werd meer gehoofd in huis, maar er brandde licht op onze overloop, juist voor de kast. Zou dat zijn, omdat de kast geheimzinnig was? Had de politie misschien het licht vergeten? Kwam er nog iemand om het uit te doen? De tongen kwamen los, niemand was meer in huis, misschien wel een bewaker voor de deur.","There was no head in the house anymore, but a light was burning on our landing, just in front of the closet. Could that be because the closet was mysterious? Could the police have forgotten the light? Did anyone else come to take it off? Tongues came loose, no one was in the house, maybe even a guard at the door.","We stayed like this until eleven-thirty. There were no more sounds in the house, but a light was shining on our landing, right in front of the bookcase. Was that because the police thought it looked so suspicious or because they simply forgot? Was anyone going to come back and turn it off? We found our tongues again. There were no longer any people inside the building, but perhaps someone was standing guard outside.","There was not another sound in the house, but a light was burning on our landing, right in front of the cupboard. Could that be because it was a secret cupboard? Perhaps the police had forgotten the light? Would someone come back to put it out? Tongues loosened, there was no one in the house any longer, perhaps there was someone on guard outside."
"Zondagmorgen, 7 Mei 1944","Sunday morning, May 7, 1944","SUNDAY MORNING, MAY 7, 1944","Sunday Morning, 7 May, 1944"
‘Waarom zou ik verliefd zijn?’ Mijn antwoord was vrij onnozel.,“Why should I be in love?” My answer was quite silly.,"“Why should I be in love?” It was a pretty silly answer (or, rather, question).",“Why should I be in love?” My answer was rather silly.
"‘'t Kan verkeren’, zei Bredero. Ja werkelijk, zo gewoon zou ik er nooit met een meisje over gesproken hebben. Ik weet ook zeker dat moeder dit nooit bedoelde, toen ze me voor de jongens waarschuwde. Ondanks alles was ik de hele dag een beetje uit mijn gewone doen, toen ik over ons gesprek nadacht, leek het me toch eigenaardig. Maar op één punt ben ik tenminste wijzer geworden: er zijn ook jonge mensen en nog wel van de andere sexe, die ongedwongen en zonder grappen kunnen spreken.","""It could be,"" Bredero said. Yes really, I would never have talked about it with a girl like that. I'm also sure Mother never meant this when she warned me about the boys. In spite of everything, I was a little out of the ordinary all day, and when I thought about our conversation, it seemed odd to me. But on one point I have at least become wiser: there are also young people, of the opposite sex, who can speak casually and without jokes.","Yes, it really did happen. I’d never have talked to a girl about this in such a normal tone of voice. I’m also certain that this isn’t what Mother meant when she warned me about boys. All the same, I wasn’t exactly my usual self for the rest of the day. When I thought back to our talk, it struck me as odd. But I’ve learned at least one thing: there are young people, even those of the opposite sex, who can discuss these things naturally, without cracking jokes.","“It actually happened, yes it did. Really I would never have been able to discuss these things in such a normal way with a girl. I know too definitely that Mummy didn’t mean it that way when she warned me not to discuss the subject with boys. I wasn’t quite my usual self for the rest of the day though, in spite of everything. When I thought over our talk, it still seemed rather odd. But at least I’m wiser about one thing, that there really are young people—and of the opposite sex too—who can discuss these things naturally without making fun of them."
"Lieve Kitty,","Dear kitty,","Dearest Kitty,","Dear Kitty,"
"Na twee uur zat het arme kind (hm, hm., alweer te werken, smal- en breedneusapen waren aan de beurt. Kitty, zeg gauw hoeveel tenen een nijlpaard heeft!!","After two hours the poor child was (hm, hm., working again, narrow-nosed and new-faced monkeys. Kitty, tell me how many toes a hippo has!!","Old World and New World monkeys were next. Kitty, tell me quickly, how many toes does a hippopotamus have?","Just after two, the poor child (hm, hm!) sat working again, this time studying narrow and broadnosed monkeys. Kitty, tell me quickly how many toes a hippopotamus has!"
"Lieve Kitty,","Dear kitty,","Dearest Kitty,","Dear Kitty, Phew! Oh dear,"
"Hoofdingang gegrendeld, Kraler moet door de tweede deur weggegaan zijn. De schrijfmachines en rekenmachine zijn veilig in de zwarte kist op privé-kantoor.","Main entrance locked, Kraler must have left through the second door. The typewriters and calculator are safe in the black box in the private office.",Main entrance bolted; Kugler must have left through second door. Typewriter and adding machine safe in black chest in private office. Miep’s or Bep’s laundry in washtub in kitchen.,"Main entrance bolted, Kugler must have used the second door when he left. The typewriters and adding machine are safe in the black case in the private oﬃce."
