Source,GoogleTranslate,human1,human2
"‘Ik moet mijn pensum halen alles op zijn tijd afmaken. Politiek “oitschtekent”, dat we gepakt worden is “unmooglijk”.","“I have to get my pensum and finish everything in due time. Politically “oitschtekent”, that we get caught is “unpossible”.","Mr. Dussel: “I must complete the task I’ve set for myself, everything must be finished on time. The political situation is looking ‘gut,’ it’s ‘eempossible’ for us to get caught.","Mr. Dussel: “I must get my task for today, everything must be finished on time. Political situation 'out schtanding’"
"Het was niet goed van vader te oordelen zonder de strijdvraag te weten. Ik had het boek vanzelf aan Margot gegeven en ik zou het nog veel gauwer gedaan hebben als vader en moeder er zich niet in hadden gemengd en, alsof het het grootste onrecht betrof, dadelijk Margot in bescherming hadden genomen.","It was not right to judge father without knowing the issue. I would have given the book to Margot of course, and I would have done it much sooner if Mother and Father had not interfered and, as if it were the greatest injustice, had immediately taken Margot under his feet.","I asked Margot and Peter to help, but they were too lazy, so I put it away.","It wasn’t right of Daddy to judge without knowing what the squabble was about. I would have given Margot the book myself, and much more quickly, if Mummy and Daddy hadn’t interfered. They took Margot’s part at once, as though she were the victim of some great injustice."
"Zo liepen we dan door de stromende regen, vader, moeder en ik, elk met een school- en boodschappentas, tot bovenaan toe volgepropt met de meest door elkaar liggende dingen.","That's how we walked through the pouring rain, father, mother and I, each with a school and shopping bag, stuffed to the top with the most mixed things.","So there we were, Father, Mother and I, walking in the pouring rain, each of us with a schoolbag and a shopping bag filled to the brim with the most varied assortment of items.","So we walked in the pouring rain. Daddy, Mummy, and I, each with a school satchel and shopping bag filled to the brim with all kinds of things thrown together anyhow."
Turkije in de oorlog. Grote opwinding. Wachten met spanning de radioberichten af.,Turkey in the war. Great excitement. Waiting anxiously for the radio messages.,Turkey’s entered the war. Great excitement. Anxiously awaiting radio reports.,Turkey is in the war. Great excitement. Waiting in suspense for the news.
"H.: ‘U kunt me veel vertellen, ik geloof er niets van!’","H.: ""You can tell me a lot, I don't believe any of it!""","Jan: “You can say what you like, I just don’t believe it.”","K: “Tell that to the Marines, I just don’t believe it!”"
"Ik ben wijzer geworden en moeders zenuwen zijn wat gekalmeerd. Ik houd meestal mijn mond als ik me erger en zij doet dat eveneens en daardoor gaat het ogenschijnlijk veel beter. Want van moeder zó echt houden met de aanhankelijke liefde van een kind, dat kan ik niet, daarvoormis ik het gevoel.","I have become wiser and Mother's nerves have calmed down a bit. I usually keep my mouth shut when I'm getting worse and so does she and apparently things get a lot better because of it. Because loving mother so real with the affectionate love of a child, I can't do that, I miss the feeling for that.","I’ve grown wiser and Mother’s nerves are a bit steadier. Most of the time I manage to hold my tongue when I’m annoyed, and she does too; so on the surface, we seem to be getting along better. But there’s one thing I can’t do, and that’s to love Mother with the devotion of a child.","I have grown wiser and Mummy ’s nerves are not so much on edge. I usually keep my mouth shut if I get annoyed, and so does she, so we appear to get on much better together. I can’t really love Mummy in a dependent childlike way—I just don’t have that feeling."
"Lieve Kitty,","Dear kitty,",The Best Little Table,"Dear Kitty,"
"Van papa en mama heb ik een heleboel gekregen en ook door onze vele kennissen ben ik erg verwend. Zo ontving ik o.a. de Camera Obscura, een gezelschapsspel, veel snoep, chocola, een puzzle, een broche, Nederlandse Sagen en Legenden door Joseph Cohen, Daisy's Bergvacantie, een enig boek, en wat geld, zodat ik me Mythen van Griekenland en Rome kan kopen, fijn!","I got a lot from mom and dad and also because of our many acquaintances I was very spoiled. For example, I received the Camera Obscura, a board game, lots of candy, chocolate, a puzzle, a brooch, Dutch Legends and Legends by Joseph Cohen, Daisy's Bergvacantie, an only book, and some money, so that I can remember Myths of Greece and Rome buy, great!","Still, I think he’s terrific, because he’s very funny. Emiel Bonewit is G.Z.’s admirer, but she doesn’t care. He’s pretty boring. Rob Cohen used to be in love with me too, but I can’t stand him anymore.","I got masses of things from Mummy and Daddy and was thoroughly spoiled by various friends. Among other things I was given the book Camera Obscura, also Dutch Sagas and Legends, a party game, lots of sweets, chocolates, a puzzle, a brooch, Daisy goes to the Mountains (another terrific book), and some money."
"Mevrouw: ‘Dat is niet waar. De invasie was er vorig jaar al, de Finnen hadden al vrede, Italië was in de winter afgelopen, de Russen hadden Lemberg al, o neen, om jouw voorspellingen geef ik niet veel’.","Madam: ""That's not true. The invasion was already there last year, the Finns were already at peace, Italy was over in winter, the Russians already had Lemberg, oh no, I don't care much about your predictions.""","Mrs. van D.: “ No they haven’t. You said the invasion was going to start last year, the Finns were supposed to have been out of the war by now, the Italian campaign ought to have been over by last winter, and the Russians should already have captured Lemberg. Oh no, I don’t set much store by your predictions.”","Mrs. van Daan: “That’s not true. The invasion was to have come last year, and the Finns were to have been out of the war by now. Italy was finished in the winter, and the Russians should already have had Lemberg, Oh! no, I don’t think much of your prophecies.”"
Je Anne.,your Anne.,"Yours, Anne","Yours, Anne"
Ik verheug me er van 's ochtends tot 's avonds op Peter te zien.,I look forward to seeing Peter from morning to night.,"Morning, noon and night, I look forward to seeing Peter.","From morning till night, I look forward to seeing Peter."
"Verder zal ik je onze gesprekken sparen, ik ben heel rustig en trek me van alle drukte niets aan. Ik ben zover gekomen, dat het me niet veel meer kan schelen of ik doodga of blijf leven. De wereld zak ook zonder mij verder draaien en ik kan me tegen de gebeurtenissen toch niet verzetten.","Furthermore, I will spare you our conversations, I am very calm and don't care about all the hustle and bustle. I've come to the point where I don't really care if I die or live. The world will continue to turn without me and I cannot resist the events.","So should I actually feel more sympathy for Mother? Should I help her? And Father?—I can’t, I’m always imagining another mother. I just can’t.—How could I? She hasn’t told me anything about herself, and I’ve never asked her to. What do we know of each other’s thoughts? I can’t talk to her, I can’t look lovingly into those cold eyes, I can’t. Not ever!—If","I will spare you further examples of these conversations,’ I myself keep very quiet and don’t take any notice of all the fuss and excitement. I have now reached the stage that I don’t care much whether I live or die. The world will still keep on turning without me; what is going to happen, will happen, and anyway it’s no good trying to resist."
Weinig groente en aardappelen. Weer slecht. Aanhoudende zware bombardementen op Pas de Calais en Franse kust.,Few vegetables and potatoes. Bad again. Continued heavy bombing of Pas de Calais and French coast.,Very few potatoes and vegetables. One loaf of bread was moldy. Scharminkeltje (name of new warehouse cat) can’t stand pepper. She sleeps in the cat box and does her business in the wood shavings. Impossible to keep her. Bad weather. Continuous bombing of Pas de Calais and the west coast of France. No one buying dollars. Gold even less interesting. The bottom of our black moneybox is in sight. What are we going to live on next month?,Very few vegetables and potatoes. Bad weather. Heavy bombardments of the French coast and Pas de Calais continue.
Ik nam het briefje van het papier en las:,I took the note from the paper and read:,I removed the note and read it aloud:,I took the letter from the paper and read:
En nu weet ik dat moed en blijheid het eerst nodig zijn.,And now I know that courage and joy are needed first.,I now know that courage and happiness are needed first!,And now I know that first and foremost I shall require courage and cheerfulness!
Overigens vind ik dat Cissy van Marxveldt knal schrijft. Ik zal haar boeken beslist ook aan mijn kinderen laten lezen.,"Incidentally, I think Cissy van Marxveldt writes brilliantly. I will definitely pass her books on to my children as well.","Anyway, the same words can be found in both books, which makes sense because they’re written by the same author. Cissy van Marxveldt is a terrific writer. I’m definitely going to let my own children read her books too.","As a matter of fact, I think Cissy van Marxveldt is a first-rate writer. I shall definitely let my children read her books."
"We spraken over de meest verborgen dingen, maar over de dingen waarvan mijn hart vol was en is, hebben we tot nu toe gezwegen. Ik kan nog steeds niet goed uit Peter wijs, is hij oppervlakkig, of is het verlegenheid die hem zelfs tegenover mij tegenhoudt? Maar dat achterwege gelaten, ik heb één fout begaan door alle andere mogelijkheden om tot vriendschap te komen uit te schakelen en door te trachten met intimiteiten hem nader te komen. Hij hunkert naar liefde en hij begint me elke dag liever te vinden, dat merk ik heel goed. Hem geven onze ontmoetingen bevrediging, bij mij werken ze alleen maar de drang uit om het steeds weer opnieuw met hem te proberen. En toch kom ik er niet toe de onderwerpen aan te raken, die ik zo graag aan het licht zou laten komen. Ik heb Peter, meer dan hijzelf weet, met geweld naar mij toegehaald. Nu houdt hij zich aan me vast en ik zie voorlopig nog geen afdoend middel hem weer van me te scheiden en op eigen benen te zetten. Toen ik namelijk al heel gauw bemerkte, dat hij geen vriend voor mijn begrip kon zijn, heb ik er naar gestreefd hem dan tenminste op te heffen uit zijn bekrompenheid en hem groot te maken in zijn jeugd.","We talked about the most hidden things, but about the things my heart was and is full of, we have been silent until now. I still can't quite figure out Peter, is he superficial, or is it shyness holding him back even towards me? But that aside, I've made one mistake by eliminating all other possibilities for befriending and by trying to approach him with intimacies. He craves love and he starts to like me more every day, I can see that very well. Our encounters give him satisfaction, for me they only work out the urge to try again and again with him. And yet I do not get around to touching the subjects that I would so much like to bring to light. I have brought Peter to me by force, more than he knows himself. Now he clings to me and for the time being I see no effective means of separating him from me again and putting him on his own two feet. For when I soon realized that he could not be a friend to my understanding, I tried at least to lift him out of his narrowness and to make him great in his youth.","We talked about the most private things, but we haven’t yet touched upon the things closest to my heart. I still can’t make head or tail of Peter. Is he superficial, or is it shyness that holds him back, even with me? But putting all that aside, I made one mistake: I used intimacy to get closer to him, and in doing so, I ruled out other forms of friendship. He longs to be loved, and I can see he’s beginning to like me more with each passing day. Our time together leaves him feeling satisfied, but just makes me want to start all over again. I never broach the subjects I long to bring out into the open. I forced Peter, more than he realizes, to get close to me, and now he’s holding on for dear life. I honestly don’t see any effective way of shaking him off and getting him back on his own two feet. I soon realized he could never be a kindred spirit, but still tried to help him break out of his narrow world and expand his youthful horizons.","We talked about the most private things, and yet up till now we have never touched on those things that filled, and still fill, my heart and soul most deeply. I still don’t know quite what to make of Peter; is he superficial, or does he still feel shy, even of me? But dropping that, I committed one error in my desire to make a real friendship: I switched over and tried to get close to him by developing it into a more intimate relation, not leaving open all other possibilities. He longs to be loved and I can see that he’s beginning to be more and more in love with me. He gets satisfaction out of our meetings, whereas they just have the effect of making me want to start again. And I don’t seem able to touch on the subjects that I’m so longing to bring out into the daylight. I drew Peter towards me, far more than he realises. Now he clings to me for dear life, I don’t see any way of shaking him off and putting him on his own feet. I soon realised that he could not be a friend for my understanding, but thought I would at least try to lift him out of his narrow- mindedness and make something of his youth."
"Lieve Kitty,","Dear kitty,","Dearest Kitty,","Dear Kitty,"
"Zondag, 12 Maart 1944","Sunday, March 12, 1944","WEDNESDAY, MARCH 8, 1944 Margot and I have been writing each other notes, just for fun, of course. Anne: It’s strange, but I can only remember the day after what has happened the night before. For example, I suddenly remembered that Mr. Dussel was snoring loudly last night. (It’s now quarter to three on Wednesday afternoon and Mr. Dussel is snoring again, which is why it flashed through my mind, of course.) When I had to use the potty, I deliberately made more noise to get the snoring to stop. Margot: Which is better, the snoring or the gasping for air? Anne: The snoring’s better, because it stops when I make noise, without waking the person in question. What I didn’t write to Margot, but what I’ll confess to you, dear Kitty, is that I’ve been dreaming of Peter a great deal. The night before last I dreamed I was skating right here in our living room with that little boy from the Apollo ice-skating rink; he was with his sister, the girl with the spindly legs who always wore the same blue dress. I introduced myself, overdoing it a bit, and asked him his name. It was Peter. In my dream I wondered just how many Peters I actually knew! Then I dreamed we were standing in Peter’s room, facing each other beside the stairs. I said something to him; he gave me a kiss, but replied that he didn’t love me all that much and that I shouldn’t flirt. In a desperate and pleading voice I said, “I’m not flirting, Peter!” When I woke up, I was glad Peter hasn’t said it after all. Last night I dreamed we were kissing each other, but Peter’s cheeks were very disappointing: they weren’t as soft as they looked. They were more like Father’s cheeks—the cheeks of a man who already shaves. FRIDAY, MARCH 10, 1944","Sunday, 12 March, 1944"
Gymnastiekoefeningen: dagelijks.,Gymnastics Exercises: Daily.,"Calisthenics: Daily. Singing: Only softly, and after 6 P.M. Movies: Prior arrangements required. Classes:",Lessons: One written shorthand lesson per week.
"Dan praten. Of er iemand luistert, of het iemand interesseert of niet, dat komt er schijnbaar niet op aan, zij denkt zeker: ‘wat mevrouw Van Daan zegt, interesseert iedereen ...’","Then talk. Whether someone is listening, whether someone is interested or not, that doesn't seem to matter, she certainly thinks: 'What Mrs Van Daan says, everyone is interested ...'","Her second watchword is: keep talking. As long as somebody’s listening, it doesn’t seem to occur to her to wonder whether they’re interested. She must think that whatever Mrs. van Daan says will interest everyone.","Then talking. Whether anyone is interested, whether they are listening or not, that doesn’t seem to matter. I suppose she thinks, “Everyone is interested  in what Mrs. van Daan says.”"
"Vrijdag, 23 Juni 1944","Friday, June 23, 1944","FRIDAY, JUNE 23, 1944","Friday, 23 June, 1944"
Je Anne.,your Anne.,I still haven’t gotten around to writing amusing sketches that I could read aloud at a later date.,"Yours, Anne"
"Lieve Kitty,","Dear kitty,","Dearest Kitty,","Dear Kitty,"
Je Anne.,your Anne.,"Yours, Anne","Yours, Anne"
"En werkelijk, om acht uur gingen we allen de houten trap af, door de stikdonkere gang (ik griezelde en wenste me alweer veilig boven) naar het kabinetje. Daar konden we licht aansteken, omdat dit vertrekje geen ramen heeft. Toen dat gebeurd was, deed vader de grote kast open. ‘Oh, wat leuk’, riepen we allemaal. In de hoek stond een grote mand met Sint Nicolaaspapier versierd en bovenop was een Pietmombakkes bevestigd.","And really, at eight o'clock we all went down the wooden stairs, through the pitch-dark corridor (I shuddered and wished myself safely upstairs again) to the cabinet. There we could turn on a light, because this room has no windows. When that was done, Father opened the large closet. ""Oh, how nice,"" we all exclaimed. In the corner was a large basket decorated with Saint Nicholas paper and a Pietmombakkes was attached on top.","Sure enough, at eight o’clock we all trooped downstairs through the hall in pitch darkness (it gave me the shivers, and I wished I was safely back upstairs!) to the alcove. We could switch on the light, since this room doesn’t have any windows. When that was done, Father opened the big cabinet. “Oh, how wonderful!” we all cried. In the corner was a large basket decorated with colorful paper and a mask of Black Peter.","At 8 o’clock we all filed down the wooden staircase through the passage in pitch-darkness (it made me shudder and wish that I was safely upstairs again) into the little dark room. There, as there are no windows, we were able to turn on a light. When that was done. Daddy opened the big cupboard. “Oh! how lovely,” we all cried. A large basket decorated with St. Nicholas paper stood in the corner and on top there was a mask of Black Peter."
"Ik voel me zo ellendig als in maanden niet het geval is geweest, zelfs niet na de inbraak was ik zo van binnen en buiten kapot. Aan de ene kant de groenteman, de Jodenkwestie, die in het hele huis uitvoerig besproken wordt, de uitblijvende invasie, het slechte eten, de spanning, de miserabele stemming, de teleurstelling om Peter en aan de andere kant, Elli's verloving, Pinksterreceptie, bloemen, Kralers verjaardag, taarten en verhalen van cabarets, films en concerten. Dat verschil, dat grote verschil, dat is er altijd, de ene dag lachen we om het humoristische van onze onderduik-situatie, maar de andere dag en nog veel meer dagen zijn we bang en staan angst, spanning en wanhoop op ons gezicht te lezen.","I feel as miserable as I haven't been in months, not even after the break-in I was so broken inside and out. On the one hand the greengrocer, the Jewish question, which is discussed at length throughout the house, the lack of invasion, the bad food, the tension, the miserable mood, the disappointment about Peter and on the other hand, Elli's engagement, Pentecost reception, flowers , Kralers birthday, cakes and stories from cabarets, films and concerts. That difference, that big difference, it is always there, one day we laugh at the humorous nature of our hiding place, but the next day and many more days we are afraid and we can read fear, tension and despair on our faces .","I feel more miserable than I have in months. Even after the break-in I didn’t feel so utterly broken, inside and out. On the one hand, there’s the news about Mr. van Hoeven, the Jewish question (which is discussed in detail by everyone in the house), the invasion (which is so long in coming), the awful food, the tension, the miserable atmosphere, my disappointment in Peter. On the other hand, there’s Bep’s engagement, the Pentecost reception, the flowers, Mr. Kugler’s birthday, cakes and stories about cabarets, movies and concerts. That gap, that enormous gap, is always there. One day we’re laughing at the comical side of life in hiding, and the next day (and there are many such days), we’re frightened, and the fear, tension and despair can be read on our faces.","I feel so miserable, I haven’t felt like this for months; even after the burglary I didn’t feel so utterly broken. On the one hand, the vegetable man, the Jewish question (which is being discussed minutely over the whole house), the invasion delay, the bad food, the strain, the miserable atmosphere, my disappointment in Peter, and on the other hand, Elli’s engagement, the Whitsun reception, uowers, Kugler’s birthday, fancy cakes, and stories about cabarets, films, and concerts. That difference, that huge difference, it’s always there; one day we laugh and see the funny side of the situation, but the next we are afraid, fear, suspense, and despair evident on our faces."
"‘Ja natuurlijk, we blijven hier, hier is het het veiligst. We zullen proberen Koophuis over te halen om met zijn familie hier te komen wonen. We zullen zien een zak houtwol te krijgen, dan kunnen we op de grond slapen. Laat Miep en Koophuis alvast dekens hierheen brengen’.","""Yes, of course, we'll stay here, it's safest here. We will try to persuade Koophuis to come and live here with his family. We will see to get a bag of wood wool, then we can sleep on the floor. Have Miep and Koophuis bring blankets here.”","“Of course we’ll stay here. This is the safest place. We’ll try to talk Kleiman and his family into coming here to live with us. We’ll somehow get hold of a bag of wood shavings, so we can sleep on the floor. Let’s ask Miep and Kleiman to bring some blankets, just in case.","“Yes, naturally, we shall stay here, since this is the safest place. We’ll try and fetch Kleiman and his family over here to come and live with us. We’ll try and get hold of a sack of wood wool, then we can sleep on the uoor. Let’s ask Miep and Kleiman to start bringing blankets here.”"
"Lieve Kitty,","Dear kitty,","Dearest Kitty,","Dear Kitty,"
"Het is heel goed, dat ik eens uit mijn onbereikbare hoogte neergehaald ben, dat mijn trots eens een beetje geknakt is, want ik was weer veel te ingenomen met mezelf. Wat mejuffrouw Anne doet is nog lang niet altijd goed! Iemand die een ander, waarvan hij zegt te houden, zo'n verdriet aandoet en dat nog wel opzettelijk, is laag, heel laag!","It is very good that I was once brought down from my unreachable height, that my pride has broken a little, for I was again much too pleased with myself. What Miss Anne does is not always right! One who causes such grief to another, whom he says he loves, and that on purpose, is low, very low!","It’s good that somebody has finally cut me down to size, has broken my pride, because I’ve been far too smug. Not everything Mistress Anne does is good! Anyone who deliberately causes such pain to someone they say they love is despicable, the lowest of the low!","no, that was too low for words. It’s right that for once I’ve been taken down from my inaccessible pedestal, that my pride has been shaken a bit, for I was becoming much too taken up with myself again. What Miss Anne does is by no means always right! Anyone who can cause such unhappiness to someone else, someone she professes to love, and on purpose, too, is low, very low!"
