Source,GoogleTranslate,human1,human2
"Ce dernier discours détermina Candide; il alla se jeter aux pieds de son charitable anabaptiste Jacques, et lui fit une peinture si touchante de l’état où son ami était réduit que le bonhomme n’hésita pas à recueillir le docteur Pangloss; il le fit guérir à ses dépens. Pangloss, dans la cure, ne perdit qu’un oeil et une oreille. Il écrivait bien et savait parfaitement l’arithmétique. L’anabaptiste Jacques en fit son teneur de livres. Au bout de deux mois, étant obligé d’aller à Lisbonne pour les affaires de son commerce, il mena dans son vaisseau ses deux philosophes. Pangloss lui expliqua comment tout était on ne peut mieux. Jacques n’était pas de cet avis. « Il faut bien, disait-il, que les hommes aient un peu corrompu la nature, car ils ne sont point nés loups, et ils sont devenus loups. Dieu ne leur a donné ni canon de vingt-quatre ni baïonnettes, et ils se sont fait des baïonnettes et des canons pour se détruire. Je pourrais mettre en ligne de compte les banqueroutes, et la justice qui s’empare des biens des banqueroutiers pour en frustrer les créanciers. — Tout cela était indispensable, répliquait le docteur borgne, et les malheurs particuliers font le bien général, de sorte que plus il y a de malheurs particuliers, et plus tout est bien. » Tandis qu’il raisonnait, l’air s’obscurcit, les vents soufflèrent des quatre coins du monde et le vaisseau fut assailli de la plus horrible tempête à la vue du port de Lisbonne.","This last speech determined Candide; he went and threw himself at the feet of his charitable Anabaptist Jacques, and painted for him such a touching picture of the state in which his friend was reduced that the worthy man did not hesitate to take in Doctor Pangloss; he healed him at his expense. Pangloss, in the cure, lost only one eye and one ear. He wrote well and knew arithmetic perfectly. The Anabaptist Jacques made him his bookkeeper. At the end of two months, being obliged to go to Lisbon on business, he took his two philosophers in his ship. Pangloss explained to him how everything could not have been better. Jacques disagreed. “Men must have corrupted nature a little, he said, for they were not born wolves, and they became wolves. God gave them neither twenty-four cannons nor bayonets, and they made themselves bayonets and cannons to destroy themselves. I could put bankruptcies into account, and the justice that seizes the property of bankrupts to frustrate their creditors. ""All that was indispensable,"" replied the one-eyed doctor, ""and particular misfortunes do the general good, so that the more particular misfortunes there are, the better everything is."" As he reasoned, the air darkened, the winds blew from the four corners of the world, and the ship was beset by the most horrible storm in sight of the port of Lisbon.","This last speech had its effect on Candide. He flew to the charitable Anabaptist James. He flung himself at his feet, and gave him so striking a picture of the miserable situation of his friend, that the good man, without any further hesitation, agreed to take Dr. Pangloss into his house and to pay for his cure. During the course of the cure Pangloss lost only one eye and one ear. Since his handwriting was good and he understood accounts tolerably well, the Anabaptist made him his bookkeeper. At the end of two months, being obliged to go to Lisbon about some mercantile affairs, he took the two philosophers with him in the same ship. Pangloss during the course of the voyage explained to him how everything was so constituted that it could not be better. James did not quite agree with him on this point. “Mankind,” said he, “must in some things have deviated from their original innocence; for they were not born wolves, and yet they worry one another like those beasts of prey. God never gave them twenty-four pounders nor bayonets, and yet they have made cannon and bayonets to destroy one another. To this list I might add not only bankruptcies, but the law which seizes on the effects of bankrupts, only to cheat the creditors.” 4 “All this was indispensably necessary,” replied the one-eyed doctor; “for private misfortunes are public benefits; so that the more private misfortunes there are the greater is the general good.” While he was arguing in this manner the sky was overcast, the winds blew from the four quarters of the compass, and the ship was assailed by a most terrible tempest within sight of the port of Lisbon.","These last words decided Candide; he hastened to implore the help of his charitable Anabaptist, Jacques, and painted such a moving picture of his friend’s wretched state that the good man did not hesitate to take in Pangloss and have him cured at his own expense. In the course of the cure, Pangloss lost only an eye and an ear. Since he wrote a fine hand and knew arithmetic, the Anabaptist made him his bookkeeper. At the end of two months, being obliged to go to Lisbon on business, he took his two philosophers on the boat with him. Pangloss still maintained that everything was for the best, but Jacques didn’t agree with him. —It must be, said he, that men have somehow corrupted Nature, for they are not born wolves, yet that is what they become. God gave them neither twenty-four-pound cannon nor bayonets, yet they have manufactured both in order to destroy themselves. Bankruptcies have the same effect, and so does the justice which seizes the goods of bankrupts in order to prevent the creditors from getting them.17 —It was all indispensable, replied the one-eyed doctor, since private misfortunes make for public welfare, and therefore the more private misfortunes there are, the better everything is. While he was reasoning, the air grew dark, the winds blew from all directions, and the vessel was attacked by a horrible tempest within sight of Lisbon harbor."
"Le troisième dit: « Je suis Charles-Édouard, roi d’Angleterre; mon père m’a cédé ses droits au royaume; j’ai combattu pour les soutenir; on a arraché le coeur à huit cents de mes partisans, et on leur en a battu les joues. J’ai été mis en prison; je vais à Rome faire une visite au roi mon père, détrôné ainsi que moi et mon grand-père, et je suis venu passer le carnaval à Venise. »","The third said, “I am Charles Edward, King of England; my father ceded his rights to the kingdom to me; I fought to support them; they tore out the hearts of eight hundred of my partisans, and beat their cheeks with it. I was put in jail; I am going to Rome to pay a visit to the king my father, dethroned like me and my grandfather, and I have come to spend the carnival in Venice. »","The third said: “I am Charles-Edward, King of England;cf my father ceded his royal rights to me. I have fought in defence of my rights, and near a thousand of my friends have had their hearts taken out of their bodies alive, and thrown into their faces. I have myself been confined in a prison.","The third said: —I am Charles Edward, king of England;102 my father yielded me his rights to the kingdom, and I fought to uphold them; but they tore out the hearts of eight hundred of my partisans, and flung them in their faces. I have been in prison; now I am going to Rome, to visit the king, my father, dethroned like me and my grandfather; and I have come to pass the carnival season at Venice."
Voyage de Candide à Constantinople.,Candide's Journey to Constantinople.,Candide’s Voyage to Constantinople,Candide’s Trip to Constantinople
"D’abord deux filles jolies et proprement mises servirent du chocolat qu’elles firent très bien mousser. Candide ne put s’empêcher de les louer sur leur beauté, sur leur bonne grâce et sur leur adresse. « Ce sont d’assez bonnes créatures, dit le sénateur Pococurante; je les fais quelquefois coucher dans mon lit, car je suis bien las des dames de la ville, de leurs coquetteries, de leurs jalousies, de leurs querelles, de leurs humeurs, de leurs petitesses, de leur orgueil, de leurs sottises, et des sonnets qu’il faut faire ou commander pour elles; mais, après tout, ces deux filles commencent fort à m’ennuyer. »","First two pretty and neatly dressed girls served chocolate which they frothed very well. Candide could not refrain from praising them for their beauty, their good grace and their address. ""They're pretty good creatures,"" said Senator Pococurante; I sometimes make them sleep in my bed, for I am very tired of the ladies of the city, of their coquetry, their jealousies, their quarrels, their humors, their pettiness, their pride, their foolishness, and sonnets that must be made or commissioned for them; but, after all, these two girls are beginning to bore me very much. »","As soon as they were seated, two very pretty girls, neatly dressed, brought in chocolate, which was extremely well frothed. Candide could not help praising their beauty and grace. “They are pretty good creatures,” said the senator. “I make them my companions, for I am tired of the ladies of the town, their coquetry, their jealousy, their quarrels, their humours, their meannesses, their pride, and their folly. I am weary of making sonnets, or of paying for sonnets to be made on them; but after all, these two girls are beginning to bore me.”","First two pretty and neatly dressed girls served chocolate, which they whipped to a froth. Candide could not forbear praising their beauty, their grace, their skill. —They are pretty good creatures, said Pococurante; I sometimes have them into my bed, for I’m tired of the ladies of the town, with their stupid tricks, quarrels, jealousies, fits of ill humor and petty pride, and all the sonnets one has to make or order for them; but, after all, these two girls are starting to bore me too."
"Ce procédé acheva de désespérer Candide; il avait à la vérité essuyé des malheurs mille fois plus douloureux; mais le sang-froid du juge, et celui du patron dont il était volé, alluma sa bile, et le plongea dans une noire mélancolie. La méchanceté des hommes se présentait à son esprit dans toute sa laideur; il ne se nourrissait que d’idées tristes. Enfin, un vaisseau français étant sur le point de partir pour Bordeaux, comme il n’avait plus de moutons chargés de diamants à embarquer, il loua une chambre du vaisseau à juste prix, et fit signifier dans la ville qu’il payerait le passage, la nourriture, et donnerait deux mille piastres à un honnête homme qui voudrait faire le voyage avec lui, à condition que cet homme serait le plus dégoûté de son état et le plus malheureux de la province.","This proceeding completed Candide's despair; he had, in truth, suffered misfortunes a thousand times more painful; but the sangfroid of the judge, and that of the patron from whom he was robbed, kindled his bile, and plunged him into a black melancholy. The wickedness of men presented itself to his mind in all its ugliness; he fed only on sad ideas. Finally, a French vessel being on the point of leaving for Bordeaux, as he had no more sheep laden with diamonds to embark, he rented a room in the vessel at a fair price, and made it known in the city that he would pay the passage. , food, and would give two thousand piastres to an honest man who would like to travel with him, on condition that this man would be the most disgusted with his condition and the most unfortunate in the province.","This treatment completed Candide’s despair. It is true he had suffered misfortunes a thousand times more grievous; but the cool insolence of the judge and the villainy of the skipper raised his anger and threw him into a deep melancholy. The villainy of mankind presented itself to his mind in all its deformity, and his mind dwelt only on gloomy thoughts. After some time, hearing that the captain of a French ship was ready to set sail for Bordeaux, as he had no more sheep loaded with diamonds to put on board, he took a cabin at a fair price; and made it known in the town that he would pay the passage and board of any honest man who would keep him company during the voyage, besides making him a present of ten thousand piastres, on condition that such person must be the most disgusted with his own condition, and the most unhappy in the whole province.","This legal proceeding completed the despair of Candide. In fact he had experienced miseries a thousand times more painful, but the coldness of the judge, and that of the merchant who had robbed him, roused his bile and plunged him into a black melancholy. The malice of men rose up before his spirit in all its ugliness, and his mind dwelt only on gloomy thoughts. Finally, when a French vessel was ready to leave for Bordeaux, since he had no more diamond-laden sheep to transport, he took a cabin at a fair price, and made it known in the town that he would pay passage and keep, plus two thousand piastres, to any honest man who wanted to make the journey with him, on condition that this man must be the most disgusted with his own condition and the most unhappy man in the province."
Chapitre 26,Chapter 26,XXVI,CHAPTER 26
Chapitre 20,Chapter 20,XX,CHAPTER 20
"Candide ne s’arrêta dans Bordeaux qu’autant de temps qu’il en fallait pour vendre quelques cailloux du Dorado, et pour s’accommoder d’une bonne chaise à deux places; car il ne pouvait plus se passer de son philosophe Martin. Il fut seulement très fâché de se séparer de son mouton, qu’il laissa à l’Académie des sciences de Bordeaux, laquelle proposa pour le sujet du prix de cette année de trouver pourquoi la laine de ce mouton était rouge; et le prix fut adjugé à un savant du Nord, qui démontra par A plus B, moins C, divisé par Z, que le mouton devait être rouge, et mourir de la clavelée.","Candide stopped in Bordeaux only as long as it took to sell a few pebbles from the Dorado, and to put up with a good two-seater chair; for he could no longer do without his philosopher Martin. He was only very sorry to part with his sheep, which he left to the Bordeaux Academy of Sciences, which proposed for the subject of this year's prize to find why the wool of this sheep was red; and the prize was awarded to a scholar from the North, who proved by A plus B, minus C, divided by Z, that the sheep must be red, and die of sheep pox.","Candide stayed at Bordeaux only long enough to sell a few of the pebbles he had brought from El Dorado, and to provide himself with a carriage for two persons, for he could no longer do without his philosopher Martin. The only thing that upset him was having to part with his sheep, which he entrusted to the care of the Academy of Sciences at Bordeaux, who proposed, as a theme for that year’s prize contest, to prove why the wool of this sheep was red; and the prize was awarded to a northern sage, who demonstrated by A plus B minus C, divided by Z, why the sheep must necessarily be red, and die of the mange.be","Candide paused in Bordeaux only long enough to sell a couple of Dorado pebbles and to fit himself out with a fine two-seater carriage, for he could no longer do without his philosopher Martin; only he was very unhappy to part with his sheep, which he left to the academy of science in Bordeaux. They proposed, as the theme of that year’s prize contest, the discovery of why the wool of the sheep was red; and the prize was awarded to a northern scholar who demonstrated by A plus B minus C divided by Z that the sheep ought to be red and die of sheep rot.69"
"Monsieur le baron était un des plus puissants seigneurs de la Vestphalie, car son château avait une porte et des fenêtres. Sa grande salle même était ornée d’une tapisserie. Tous les chiens de ses basses-cours composaient une meute dans le besoin; ses palefreniers étaient ses piqueurs; le vicaire du village était son grand aumônier. Ils l’appelaient tous monseigneur, et ils riaient quand il faisait des contes.","Monsieur le baron was one of the most powerful lords in Vestphalia, for his castle had a door and windows. Its very great hall was adorned with a tapestry. All the dogs in his backyards made up a pack in need; his grooms were his piqueurs; the vicar of the village was his grand chaplain. They all called him monseigneur, and they laughed when he told stories.","The baron was one of the most powerful lords in Westphalia, for his castle had not only a gate, but even windows, and his great hall was hung with tapestry. He used to hunt with his mastiffs and spaniels instead of greyhounds; his groom served him for huntsman, and the parson of the parish officiated as his grand almoner. He was called “My Lord” by all his people, and everyone laughed at his stories.","The Baron was one of the most mighty lords of Westphalia, for his castle had a door and windows. His great hall was even hung with a tapestry. The dogs of his courtyard made up a hunting pack on occasion, with the stableboys as huntsmen; the village priest was his grand almoner. They all called him “My Lord,” and laughed at his stories."
"Candide, apercevant un Milton, lui demanda s’il ne regardait pas cet auteur comme un grand homme. « Qui? dit Pococurante, ce barbare qui fait un long commentaire du premier chapitre de la Genèse en dix livres de vers durs? ce grossier imitateur des Grecs, qui défigure la création, et qui, tandis que Moïse représente l’Être éternel produisant le monde par la parole, fait prendre un grand compas par le Messiah dans une armoire du ciel pour tracer son ouvrage? Moi, j’estimerais celui qui a gâté l’enfer et le diable du Tasse; qui déguise Lucifer tantôt en crapaud, tantôt en pygmée; qui lui fait rebattre cent fois les mêmes discours; qui le fait disputer sur la théologie; qui, en imitant sérieusement l’invention comique des armes à feu de l’Arioste, fait tirer le canon dans le ciel par les diables? Ni moi, ni personne en Italie, n’a pu se plaire à toutes ces tristes extravagances. Le Mariage du Péché et de la Mort et les couleuvres dont le péché accouche font vomir tout homme qui a le goût un peu délicat, et sa longue description d’un hôpital n’est bonne que pour un fossoyeur. Ce poème obscur, bizarre et dégoûtant, fut méprisé à sa naissance; je le traite aujourd’hui comme il fut traité dans sa patrie par les contemporains. Au reste, je dis ce que je pense, et je me soucie fort peu que les autres pensent comme moi. » Candide était affligé de ces discours; il respectait Homère, il aimait un peu Milton. « Hélas! dit-il tout bas à Martin, j’ai bien peur que cet homme-ci n’ait un souverain mépris pour nos poètes allemands. — Il n’y aurait pas grand mal à cela, dit Martin. — Oh, quel homme supérieur! disait encore Candide entre ses dents, quel grand génie que ce Pococurante! rien ne peut lui plaire. »","Candide, seeing a Milton, asked him if he did not regard this author as a great man. "" Which? said Pococurante, that barbarian who makes a long commentary on the first chapter of Genesis in ten books of hard verse? this gross imitator of the Greeks, who disfigures creation, and who, while Moses represents the Eternal Being producing the world by the word, has the Messiah take a large compass from a cupboard in heaven to trace his work? I would esteem him who spoiled Tasso's hell and devil; which disguises Lucifer sometimes as a toad, sometimes as a pygmy; which makes him repeat the same speeches a hundred times; which makes him argue about theology; who, in earnest imitation of Ariosto's comic invention of firearms, makes the devils fire the cannon into the sky? Neither I nor anyone in Italy could enjoy all these sad extravagances. The Marriage of Sin and Death and the snakes from which sin gives birth make any man of delicate taste vomit, and its long description of a hospital is good only for a gravedigger. This obscure, bizarre and disgusting poem was despised at its birth; I treat him today as he was treated in his homeland by his contemporaries. Besides, I say what I think, and I care very little that others think like me. Candide was distressed by these speeches; he respected Homer, he liked Milton a little. “Alas! he said quietly to Martin, I'm afraid this man has a sovereign contempt for our German poets. ""There wouldn't be much harm in that,"" said Martin. ""Oh, what a superior man!"" said Candide again between his teeth, what a great genius this Pococurante is! nothing can please him. »","Candide, seeing an edition of a Milton,cc asked the senator if he did not consider that author a great man. “Who?” said Pococuranté sharply. “That barbarian, who writes a tedious commentary, in ten books of rambling verse, on the first chapter of Genesis! That slovenly imitator of the Greeks, who disfigures creation by making the Messiah take a pair of compasses from Heaven’s cupboard in order to plan the world while Moses represents the Deity as creating the world with a word! You expect me to admire a writer who has spoiled Tasso’s hell and devil; who transforms Lucifer, sometimes into a toad, and at other times into a pigmy; who makes him say the same thing a hundred times over; who makes him argue theology : and who, by an absurdly serious imitation of Ariosto’s comic invention of fire-arms, has the devils firing cannon in heaven! Neither I, nor any other Italian, can possibly take pleasure in such melancholy reveries. But the marriage of sin and death, and snakes that sin gives birth to, are enough to make any person sick whose taste is at all refined. This obscene, whimsical, and disagreeable poem met with the disdain that it deserved at its first publication; and I only treat the author now as he was treated in his own country by his contemporaries.” Candide was grieved at this speech, as he had a great respect for Homer and was very fond of Milton. “Alas!” said he very softly to Martin, “I am afraid this man holds our German poets in great contempt.” “There would be no great harm in that,” said Martin. “Oh, what a surprising man!” said Candide to himself; “what a great genius this Pococuranté must be! Nothing can please him.”","Candide, noting a Milton, asked if he did not consider this author a great man. —Who? said Pococurante. That barbarian who made a long commentary on the first chapter of Genesis in ten books of crabbed verse? That clumsy imitator of the Greeks, who disfigures creation itself, and while Moses represents the eternal being as creating the world with a word, has the messiah take a big compass out of a heavenly cupboard in order to design his work? You expect me to admire the man who spoiled Tasso’s hell and devil? who disguises Lucifer now as a toad, now as a pigmy? who makes him rehash the same arguments a hundred times over? who makes him argue theology? and who, taking seriously Ariosto’s comic story of the invention of firearms, has the devils shooting off cannon in heaven? Neither I nor anyone else in Italy has been able to enjoy these gloomy extravagances.99 The marriage of Sin and Death, and the monster that Sin gives birth to, will nauseate any man whose taste is at all refined; and his long description of a hospital is good only for a gravedigger. This obscure, extravagant, and disgusting poem was despised at its birth; I treat it today as it was treated in its own country by its contemporaries. Anyhow, I say what I think, and care very little whether other people agree with me. Candide was a little cast down by these diatribes; he respected Homer, and had a little affection for Milton. —Alas, he said under his breath to Martin, I’m afraid this man will have a supreme contempt for our German poets. —No harm in that, said Martin. — Oh what a superior man, said Candide, still speaking softly, what a great genius this Pococurante must be! Nothing can please him."
