Source,GoogleTranslate,human1,human2
"Ils voguèrent quelques lieues entre des bords tantôt fleuris, tantôt arides, tantôt unis, tantôt escarpés. La rivière s’élargissait toujours; enfin elle se perdait sous une voûte de rochers épouvantables qui s’élevaient jusqu’au ciel. Les deux voyageurs eurent la hardiesse de s’abandonner aux flots sous cette voûte. Le fleuve, resserré en cet endroit, les porta avec une rapidité et un bruit horrible. Au bout de vingt-quatre heures ils revirent le jour; mais leur canot se fracassa contre les écueils; il fallut se traîner de rocher en rocher pendant une lieue entière; enfin ils découvrirent un horizon immense, bordé de montagnes inaccessibles. Le pays était cultivé pour le plaisir comme pour le besoin; partout l’utile était agréable. Les chemins étaient couverts ou plutôt ornés de voitures d’une forme et d’une matière brillante, portant des hommes et des femmes d’une beauté singulière, traînés rapidement par de gros moutons rouges qui surpassaient en vitesse les plus beaux chevaux d’Andalousie, de Tétuan et de Méquinez.","They sailed for a few leagues between shores that were sometimes flowery, sometimes arid, sometimes smooth, sometimes steep. The river kept widening; finally it was lost under a vault of terrible rocks which rose to the sky. The two travelers had the boldness to abandon themselves to the waves under this vault. The river, constricted in this place, carried them with a horrible rapidity and noise. At the end of twenty-four hours they saw the light again; but their canoe crashed against the rocks; we had to drag ourselves from rock to rock for a whole league; finally they discovered an immense horizon, bordered by inaccessible mountains. The country was cultivated for pleasure as well as for need; everywhere the useful was agreeable. The roads were covered, or rather adorned, with carriages of a brilliant shape and material, bearing men and women of singular beauty, dragged swiftly by great red sheep, which surpassed in speed the finest horses of Andalusia. , Tetuan and Méquinez.","They rowed a few leagues down the river, the banks of which in some places were covered with flowers, in others barren; in some parts smooth and level, and in others steep and rugged. The stream widened as they went farther on, till at length it passed under one of the frightful rocks whose summits seemed to reach the clouds. Here our two travellers had the courage to commit themselves to the stream, which, narrowing at this point, hurried them along with a dreadful noise and speed. At the end of twenty-four hours they saw daylight again; but their canoe was smashed to pieces against the rocks. They had to creep along from rock to rock for the length of one league, till at length a spacious plain came into sight. This place was ringed by a chain of inaccessible mountains. The country appeared cultivated for pleasure as well as to produce the necessaries of life. The useful was joined to the agreeable. The roads were covered, or rather adorned, with carriages formed of glittering materials, in which were men and women of surprising beauty, drawn with great speed by red sheep of a very large size, which far surpassed the finest horses of Andalusia, Tetuan, or Mecquinez.","They floated some leagues between banks sometimes flowery, sometimes sandy, now steep, now level. The river widened steadily; finally it disappeared into a chasm of frightful rocks that rose high into the heavens. The two travelers had the audacity to float with the current into this chasm.53 The river, narrowly confined, drove them onward with horrible speed and a fearful roar. After twenty-four hours, they saw daylight once more; but their canoe was smashed on the snags. They had to drag themselves from rock to rock for an entire league; at last they emerged to an immense horizon, ringed with remote mountains. The countryside was tended for pleasure as well as profit; everywhere the useful was joined to the agreeable.54 The roads were covered, or rather decorated, with elegantly shaped carriages made of a glittering material, carrying men and women of singular beauty, and drawn by great red sheep which were faster than the finest horses of Andalusia, Tetuan, and Mequinez.55"
"— Eh bien! mon cher Pangloss, lui dit Candide, quand vous avez été pendu, disséqué, roué de coups, et que vous avez ramé aux galères, avez-vous toujours pensé que tout allait le mieux du monde? — Je suis toujours de mon premier sentiment, répondit Pangloss, car enfin je suis philosophe: il ne me convient pas de me dédire, Leibnitz ne pouvant pas avoir tort, et l’harmonie préétablie étant d’ailleurs la plus belle chose du monde, aussi bien que le plein et la matière subtile. »","- Well! my dear Pangloss, said Candide to him, when you were hanged, dissected, beaten, and rowed in the galleys, did you always think that everything was going for the best in the world? ""I am still of my first feeling,"" replied Pangloss, ""because after all I am a philosopher: it does not suit me to retract myself, Leibnitz cannot be wrong, and pre-established harmony being moreover the most beautiful thing in the world, as well as the full and the subtle matter. »","THE CRUCIAL INCISION “Well, my dear Pangloss,” Candide said to them, “when you were hanged, dissected, whipped, and tugging at the oar, did you continue to think that everything in this world happens for the best?” “I have always abided by my first opinion,” answered Pangloss ; “for, after all, I am a philosopher, and it would not become me to retract my sentiments, especially since Leibniz could not be wrong, and besides pre-established harmony is the finest thing in the world, as well as a plenum and the materia subtilis.”30","—Well, my dear Pangloss, Candide said to him, now that you have been hanged, dissected, beaten to a pulp, and sentenced to the galleys, do you still think everything is for the best in this world? —I am still of my first opinion, replied Pangloss; for after all I am a philosopher, and it would not be right for me to recant since Leibniz could not possibly be wrong, and besides pre-established harmony is the finest notion in the world, like the plenum and subtle matter.112"
"L’abbé écoutait attentivement, et paraissait un peu rêveur. Il prit bientôt congé des deux étrangers, après les avoir tendrement embrassés. Le lendemain Candide reçut à son réveil une lettre conçue en ces termes:","The abbot listened attentively, and seemed a little dreamy. He soon took leave of the two strangers, after having tenderly embraced them. The next day Candide received on his awakening a letter in these terms:","The artful Abbé did not let a word of all this escape him, though he seemed to be musing upon something else. He soon took his leave of the two adventurers, after having embraced them with the greatest cordiality. The next morning, almost as soon as his eyes were open, Candide received the following letter:—","The abbé listened carefully, and looked a bit dreamy. He soon took his leave of the two strangers, after embracing them tenderly. Next day Candide, when he woke up, received a letter, to the following effect:"
"— Voilà qui est admirable, dit Candide, mais il faut vous faire guérir. — Et comment le puis-je? dit Pangloss; je n’ai pas le sou, mon ami; et dans toute l’étendue de ce globe, on ne peut ni se faire saigner ni prendre un lavement sans payer, ou sans qu’il y ait quelqu’un qui paye pour nous. »","""That's admirable,"" said Candide, ""but you have to get cured."" ""And how can I?"" said Pangloss; I have no money, my friend; and in all the extent of this globe, we cannot be bled or taken an enema without paying, or without there being someone who pays for us. »","“Very surprising indeed,” said Candide, “but you must get cured.” “Lord help me! how can I?” cried Pangloss. “My dear friend, I have not a penny in the world; and you know one cannot be bled or have an enema without a fee.”","—Remarkable indeed, said Candide, but we must see about curing you. —And how can I do that, said Pangloss, seeing I don’t have a cent to my name? There’s not a doctor in the whole world who will let your blood or give you an enema without demanding a fee. If you can’t pay yourself, you must find someone to pay for you."
"Cependant, à force de médecines et de saignées, la maladie de Candide devint sérieuse. Un habitué du quartier vint avec douceur lui demander un billet payable au porteur pour l’autre monde; Candide n’en voulut rien faire. Les dévotes l’assurèrent que c’était une nouvelle mode; Candide répondit qu’il n’était point homme à la mode. Martin voulut jeter l’habitué par les fenêtres. Le clerc jura qu’on n’enterrerait point Candide. Martin jura qu’il enterrerait le clerc s’il continuait à les importuner. La querelle s’échauffa; Martin le prit par les épaules et le chassa rudement; ce qui causa un grand scandale, dont on fit un procès-verbal.","However, by dint of medicine and bloodletting, Candide's illness became serious. A regular in the neighborhood came gently to ask him for a ticket payable to bearer for the other world; Candide didn't want to do anything about it. The devotees assured her that it was a new fashion; Candide replied that he was not a fashionable man. Martin wanted to throw the regular out of the windows. The clerk swore that Candide would not be buried. Martin swore he would bury the clerk if he continued to bother them. The quarrel heated up; Martin took him by the shoulders and chased him away roughly; which caused a great scandal, of which a report was made.","However, as a result of the purging and bleeding,bg Candide’s condition became very serious. The priest of the parish came with all imaginable politeness to ask for a note payable to the bearer in the other world.bh Candide refused to comply with his request, but the two pious ladies assured him that it was a new fashion. Candide replied that he was not one to follow fashion. Martin wanted to throw the priest out of the window. The cleric swore that Candide would not have Christian burial. Martin swore in his turn that he would bury the cleric alive if he continued to bother them any longer. The dispute grew heated; Martin took him by the shoulders and turned him out of the room, which caused a great scandal and developed into a legal case.","However, as a result of medicines and bleedings, Candide’s illness became serious. A resident of the neighborhood came to ask him politely to fill out a ticket, to be delivered to the porter of the other world.71 Candide wanted nothing to do with it. The pious ladies assured him it was a new fashion; Candide replied that he wasn’t a man of fashion. Martin wanted to throw the resident out the window. The cleric swore that without the ticket they wouldn’t bury Candide. Martin swore that he would bury the cleric if he continued to be a nuisance. The quarrel grew heated; Martin took him by the shoulders and threw him bodily out the door; all of which caused a great scandal, from which developed a legal case."
Chapitre 30,Chapter 30,XXX,CHAPTER 30
"Pendant que Candide, le baron, Pangloss, Martin et Cacambo contaient leurs aventures, qu’ils raisonnaient sur les événements contingents ou non contingents de cet univers, qu’ils disputaient sur les effets et les causes, sur le mal moral et sur le mal physique, sur la liberté et la nécessité, sur les consolations que l’on peut éprouver lorsqu’on est aux galères en Turquie, ils abordèrent sur le rivage de la Propontide à la maison du prince de Transylvanie. Les premiers objets qui se présentèrent furent Cunégonde et la vieille, qui étendaient des serviettes sur des ficelles pour les faire sécher.","While Candide, the baron, Pangloss, Martin and Cacambo related their adventures, while they reasoned about the contingent or non-contingent events of this universe, while they disputed about effects and causes, about moral evil and evil physics, on freedom and necessity, on the consolations that one can feel when one is at the galleys in Turkey, they landed on the shore of the Propontis at the house of the Prince of Transylvania. The first objects that presented themselves were Cunégonde and the old woman, who were spreading towels on strings to dry them.","While Candide, the Baron, Pangloss, Martin, and Cacambo were relating their adventures, and reasoning on the contingent or non-contingent events of this world,31 on causes and effects, on moral and physical evil, on free-will and necessity, and on the consolation available to a slave on a Turkish galley, they arrived at the house of the Transylvanian prince on the coasts of the Propontis. The first objects they saw there were Miss Cunégonde and the old woman, who were hanging out some table-cloths on a line to dry.","While Candide, the baron, Pangloss, Martin, and Cacambo were telling one another their stories, while they were disputing over the contingent or non-contingent events of this universe, while they were arguing over effects and causes, over moral evil and physical evil, over liberty and necessity, and over the consolations available to one in a Turkish galley, they arrived at the shores of Propontis and the house of the prince of Transylvania. The first sight to meet their eyes was Cunégonde and the old woman, who were hanging out towels on lines to dry."
"Un soir que Candide, suivi de Martin, allait se mettre à table avec les étrangers qui logeaient dans la même hôtellerie, un homme à visage couleur de suie l’aborda par-derrière, et, le prenant par le bras, lui dit: « Soyez prêt à partir avec nous… n’y manquez pas. » Il se retourne, et voit Cacambo. Il n’y avait que la vue de Cunégonde qui pût l’étonner et lui plaire davantage. Il fut sur le point de devenir fou de joie. Il embrasse son cher ami. « Cunégonde est ici, sans doute, où est-elle? Mène-moi vers elle, que je meure de joie avec elle. — Cunégonde n’est point ici, dit Cacambo, elle est à Constantinople. — Ah, Ciel! à Constantinople! mais, fût-elle à la Chine, j’y vole, partons. — Nous partirons après souper, reprit Cacambo, je ne peux vous en dire davantage; je suis esclave, mon maître m’attend; il faut que j’aille le servir à table: ne dites mot; soupez et tenez-vous prêt. »","One evening when Candide, followed by Martin, was going to sit down to table with the strangers who lodged in the same hostelry, a man with a face the color of soot approached him from behind, and, taking him by the arm, said to him: Get ready to go with us…don't miss it. He turns around, and sees Cacambo. Only the sight of Cunégonde could astonish and please her more. He was about to go mad with joy. He kisses his dear friend. “Cunegonde is here, no doubt, where is she? Lead me to her, that I die of joy with her. ""Cunegonde is not here,"" said Cacambo, ""she is in Constantinople."" “Ah, Sky! in Constantinople! but, were it in China, I fly there, let us leave. 'We'll leave after supper,' resumed Cacambo, 'I can't tell you more; I am a slave, my master awaits me; I must serve him at table: don't say a word; eat supper and get ready. »","One evening when Candide and Martin were going to sit down to supper with some foreigners who lodged at the same inn where they were staying, a man, with a face the colour of soot, came behind him, and taking him by the arm, said “Be ready to leave with us; don’t miss this.” He turned around and saw Cacambo. Nothing but the sight of Miss Cunégonde could have given him greater joy and surprise. He was almost beside himself. After embracing this dear friend, “Cunégonde!” he said, “Cunégonde has come with you, no doubt! Where, where is she? Take me to her this instant so that I may die of joy in her presence.” “Cunégonde is not here,” answered Cacambo, “she is at Constantinople.” “Good heavens, at Constantinople! But no matter if she were in China, I would fly there. Quick, quick, dear Cacambo, let’s go.” “We will leave after eating,” said Cacambo. “I cannot at present say anything more to you. I am a slave, and my master waits for me: I must go and wait on him at table. But mum! say not a word; only get your supper, and be ready.”","One evening when Candide, accompanied by Martin, was about to sit down for dinner with the strangers staying in his hotel, a man with a soot-colored face came up behind him, took him by the arm, and said: —Be ready to leave with us, don’t miss out. He turned and saw Cacambo. Only the sight of Cunégonde could have astonished and pleased him more. He nearly went mad with joy. He embraced his dear friend. —Cunégonde is here, no doubt? Where is she? Bring me to her, let me die of joy in her presence. —Cunégonde is not here at all, said Cacambo, she is at Constantinople. —Good Heavens, at Constantinople! but if she were in China, I must fly there, let’s go. —We will leave after supper, said Cacambo; I can tell you no more; I am a slave, my owner is looking for me, I must go wait on him at table; mum’s the word; eat your supper and be prepared."
"Ce qu’il advint de Cunégonde, de Candide, du grand inquisiteur et d’un juif.","What happened to Cunégonde, Candide, the Grand Inquisitor and a Jew.","What happened to Cunégonde, Candide, the Grand Inquisitor, and the Jew","What Happened to Cunégonde, Candide, the Grand Inquisitor, and a Jew"
"Les Oreillons trouvèrent ce discours très raisonnable; ils députèrent deux notables pour aller en diligence s’informer de la vérité; les deux députés s’acquittèrent de leur commission en gens d’esprit, et revinrent bientôt apporter de bonnes nouvelles. Les Oreillons délièrent leurs deux prisonniers, leur firent toutes sortes de civilités, leur offrirent des filles, leur donnèrent des rafraîchissements, et les reconduisirent jusqu’aux confins de leurs États, en criant avec allégresse: « Il n’est point jésuite, il n’est point jésuite! »","The Oreillons found this speech very reasonable; they deputed two notables to go hastily to inquire into the truth; the two deputies acquitted themselves of their commission like men of intelligence, and soon returned with good news. The Oreillons untied their two prisoners, paid them all sorts of courtesies, offered them girls, gave them refreshments, and escorted them to the confines of their States, shouting with joy: ""He is not a Jesuit, he is not a Jesuit. is not a Jesuit! »","This speech appeared very reasonable to the Oreillons. They sent AN OREILLON RECEPTION two of their people to inquire into the truth of this affair, who performed the task like men of sense, and soon returned with good news for our distressed adventurers. Upon this they were both freed, and those who were so recently going to roast and boil them, now showed them all sorts of civilities, offered them girls, gave them refreshments, and led them back to the border of their country, crying all the way, in token of joy: “He is no Jesuit, he is no Jesuit.”","The Biglugs found this discourse perfectly reasonable; they appointed chiefs to go posthaste and find out the truth; the two messengers performed their task like men of sense, and quickly returned bringing good news. The Biglugs untied their two prisoners, treated them with great politeness, offered them girls, gave them refreshments, and led them back to the border of their state, crying joyously: — He isn’t a Jesuit, he isn’t a Jesuit!"
"— Ô Pangloss! s’écria Candide, tu n’avais pas deviné cette abomination; c’en est fait, il faudra qu’à la fin je renonce à ton optimisme. — Qu’est-ce qu’optimisme? disait Cacambo. — Hélas! dit Candide, c’est la rage de soutenir que tout est bien quand on est mal. » Et il versait des larmes en regardant son nègre, et en pleurant il entra dans Surinam.","“O Pangloss! exclaimed Candide, you had not divined this abomination; it's all over, I'll have to give up your optimism in the end. — What is optimism? said Cacambo. — Alas! said Candide, it is the rage to maintain that all is well when one is badly. And he shed tears looking at his negro, and weeping he entered Surinam.","“O Pangloss!” cried out Candide, “such horrid doings never entered your imagination. Here is an end of the matter; I find myself, after all, obliged to renounce your optimism.” “Optimism,” said Cacambo, “what is that?” “Alas!” replied Candide , “it is the obstinacy of maintaining that everything is best when it is worst”; and so saying, he turned his eyes towards the poor negro, and shed a flood of tears; and in this weeping mood he entered the town of Surinam.","—Oh Pangloss! cried Candide, you had no notion of these abominations! I’m through , I must give up your optimism after all. —What’s optimism? said Cacambo. —Alas, said Candide, it is a mania for saying things are well when one is in hell.62 And he shed bitter tears as he looked at his negro, and he was still weeping as he entered Surinam."
"En parlant ainsi, il ne laissait pas de manger. Le soleil se couchait. Les deux égarés entendirent quelques petits cris qui paraissaient poussés par des femmes. Ils ne savaient si ces cris étaient de douleur ou de joie; mais ils se levèrent précipitamment avec cette inquiétude et cette alarme que tout inspire dans un pays inconnu. Ces clameurs partaient de deux filles toutes nues qui couraient légèrement au bord de la prairie, tandis que deux singes les suivaient en leur mordant les fesses. Candide fut touché de pitié; il avait appris à tirer chez les Bulgares, et il aurait abattu une noisette dans un buisson sans toucher aux feuilles. Il prend son fusil espagnol à deux coups, tire, et tue les deux singes. « Dieu soit loué, mon cher Cacambo! j’ai délivré d’un grand péril ces deux pauvres créatures; si j’ai commis un péché en tuant un inquisiteur et un jésuite, je l’ai bien réparé en sauvant la vie à deux filles. Ce sont peut-être deux demoiselles de condition, et cette aventure nous peut procurer de très grands avantages dans le pays. »","Speaking thus, he did not stop eating. The sun was setting. The two strays heard a few small cries which seemed to be uttered by women. They did not know if these cries were of pain or of joy; but they got up hastily with that uneasiness and that alarm which everything inspires in an unknown country. These shouts came from two naked girls running lightly along the edge of the meadow, while two monkeys followed them, biting their buttocks. Candide was touched with pity; he had learned to shoot with the Bulgarians, and he would have cut down a nut in a bush without touching the leaves. He takes his Spanish double-barreled gun, shoots, and kills the two monkeys. “God be praised, my dear Cacambo! I delivered these two poor creatures from a great peril; if I committed a sin by killing an inquisitor and a Jesuit, I made good on it by saving the lives of two girls. They are perhaps two young ladies of condition, and this adventure can bring us very great advantages in the country. »","While he was making these reflections he still continued eating. The sun was now at the point of setting when our two wanderers heard cries which seemed to be uttered by a female voice. They could not tell whether these were cries of grief or joy; however, they instantly started up, full of that inquietude and apprehension which a strange place naturally inspires. The cries came from two young women who were tripping stark naked along the meadow while two monkeys followed close at their heels, biting their backs. Candide was moved to pity; he had learned to shoot while he was among the Bulgarians, and he could hit a nut off a bush without touching a leaf. Accordingly he took up his double-barrel Spanish rifle, pulled the trigger, and killed the two monkeys. “God be praised, my dear Cacambo, I have rescued two poor creatures from a perilous situation. If I have committed a sin in killing an Inquisitor and a Jesuit, I made ample amends by saving the lives of these two distressed girls. Perhaps they are young ladies of rank, and this assistance I have been so happy to give them may gain us great advantages in this country.”","Though he talked this way, he did not neglect the food. Night fell. The two wanderers heard a few weak cries which seemed to be voiced by women. They could not tell whether the cries expressed grief or joy; but they leaped at once to their feet, with that uneasy suspicion which one always feels in an unknown country. The outcry arose from two girls, completely naked, who were running swiftly along the edge of the meadow, pursued by two monkeys who snapped at their buttocks. Candide was moved to pity; he had learned marksmanship with the Bulgars, and could have knocked a nut off a bush without touching the leaves. He raised his Spanish rifle, fired twice, and killed the two monkeys. —God be praised, my dear Cacambo! I’ve saved these two poor creatures from great danger. Though I committed a sin in killing an inquisitor and a Jesuit, I’ve redeemed myself by saving the lives of two girls. Perhaps they are two ladies of rank, and this good deed may gain us special advantages in the country."
Chapitre 10,Chapter 10,X,CHAPTER 10
