Source,GoogleTranslate,human1,human2
"Je ne sais comment cela m’arrive ; depuis quelque temps mes chapitres finissent toujours sur un ton sinistre. En vain je fixe en les commençant mes regards sur quelque objet agréable, – en vain je m’embarque par le calme, j’essuie bientôt une bourrasque qui me fait dériver. – Pour mettre fin à cette agitation, qui ne me laisse pas le maître de mes idées, et pour apaiser les battements de mon cœur, que tant d’images attendrissantes ont trop agité, je ne vois d’autre remède qu’une dissertation. – Oui, je veux mettre ce morceau de glace sur mon cœur.","I don't know how it happens to me; for some time now my chapters have always ended in a sinister tone. In vain do I fix my gaze on beginning them on some agreeable object – in vain do I embark calmly, I soon experience a squall which makes me drift. – To put an end to this agitation, which does not leave me the master of my ideas, and to calm the beating of my heart, which so many touching images have agitated too much, I see no other remedy than a dissertation. – Yes, I want to put this piece of ice on my heart.","Painting and Music. I DO not know how it is, but of late my chapters have always ended in a mournful strain. In vain do I begin by fixing my eyes on some agreeable object; in vain do I embark when all is calm: a sudden gale soon drifts me away. To put an end to an agitation which deprives me of the mastery of my ideas, and to quiet the beating of a heart too much disturbed by so many touching images, I see no remedy but a dissertation. Yes, thus will I steel my heart.","I do not know how it happens, but for some time now my chapters all end on an ominous note. In vain I fix my gaze, at the start of each, on some agreeable object;—in vain I set sail in calm waters, only to meet with a squall which sets me adrift.—To put an end to these disturbances, which leave me unable to master my thoughts, and to pacify my racing heart, which so many touching images have overly excited , I see no other remedy than to give a disquisition.—Yes, I wish to put such a block of ice on my heart."
"Ma bibliothèque donc est une composée de romans, puisqu’il faut vous le dire, – oui, de romans et de quelques poètes choisis.","My library, therefore, is made up of novels, since I must tell you, – yes, of novels and a few selected poets.","My library, then, is composed of novels, if I must make the confession; of novels and a few choice poets.","My library, then, is made up of novels, if you must know;—yes, of novels, and a few choice poets."
"« Mais apprenez-nous, dit-elle, pourquoi les femmes d’aujourd’hui semblent plutôt avoir des habillements pour se cacher que pour se vêtir : à peine laissent-elles apercevoir leur visage, auquel seul on peut reconnaître leur sexe, tant les formes de leur corps sont défigurées par les plis bizarres des étoffes ! De toutes les figures qui sont représentées dans ces feuilles, aucune ne laisse à découvert la gorge, les bras et les jambes : comment vos jeunes guerriers n’ont-ils pas tenté de détruire de semblables costumes ? Apparemment, ajouta-t-elle, la vertu des femmes d’aujourd’hui, qui se montre dans tous leurs habillements, surpasse de beaucoup celle de mes contemporaines ? » En finissant ces mots, Aspasie me regardait et semblait me demander une réponse. – Je feignis de ne pas m’en apercevoir ; – et pour me donner un air de distinction, je poussai sur la braise, avec des pincettes, les restes de la perruque du docteur qui avaient échappé à l’incendie. – M’apercevant ensuite qu’une des bandelettes qui serraient le brodequin d’Aspasie était dénouée : « Permettez, lui dis-je, charmante personne » et, en parlant ainsi, je me baissai vivement, portant les mains vers la chaise où je croyais voir ces deux jambes qui firent jadis extravaguer de grands philosophes.","""But teach us,"" she said, ""why today's women seem to wear clothes for hiding rather than for dressing themselves: they barely allow their faces to be seen, by which only one can recognize their sex, so much the the shapes of their bodies are disfigured by the bizarre folds of the fabrics! Of all the figures which are represented in these sheets, none leaves the throat, the arms and the legs uncovered: how did your young warriors not try to destroy similar costumes? Apparently, she added, the virtue of women today, which shows itself in all their dress, far surpasses that of my contemporaries? As she finished these words, Aspasie looked at me and seemed to ask me for an answer. “I pretended not to notice it; – and to give myself an air of distinction, I pushed on the embers, with tweezers, the remains of the doctor's wig which had escaped the fire. – Then noticing that one of the bandages which tightened Aspasie's boot was undone: ""Allow me, I said to her, charming person"" and, while speaking thus, I bent down quickly, putting my hands towards the chair where I I thought I saw those two legs that once made great philosophers extravagant.","“But do explain,” she said, “why women of the present day seem to wear dresses to hide rather than to clothe them. They scarcely allow their faces to be seen, those faces by which alone their sex is to be guessed, so strangely are their bodies disfigured by the eccentric folds of their garments. Among all the figures represented in these pages, I do not find one with the neck, arms, and legs bare. How is it your young warriors are not tempted to put an end to such a fashion? It would appear,” she added, “that the virtue of the women of this age, which they parade in all their articles of dress, greatly surpasses that of my contemporaries.” As she ended these words, Aspasia turned her eyes on me as if to ask a reply. I pretended not to notice this, and in order to give myself an absent air, took up the tongs and pushed away among the embers the shreds of the doctor’s wig which had escaped the flames. Observing presently afterwards that one of the bandelets which clasped Aspasia’s buskin had come undone, “Permit me,” said I, “charming lady,”—and eagerly stooping, stretched out my hands towards the chair on which I had fancied I saw those legs about which even great philosophers went into ecstacies.","“But tell us,” she said, “why do today’s women seem to wear clothes to hide themselves rather than to dress themselves? They hardly even show their faces, though that is the sole means whereby one might tell their sex, so misshapen are their figures by the bizarre pleats of the fabrics they wear. Of all the fashions presented in these pages, not one leaves the throat, arms, or legs uncovered: why have your young warriors not attempted to destroy such a custom? Apparently,” she added, “the virtue of today’s women, which can be seen in all their clothing, is far greater than that of my contemporaries. ”—In finishing this statement, Aspasia looked at me as if expecting a reply.—I pretended not to notice;—and to give the appearance of distraction, I took the tongs and pushed the remainder of the doctor’s wig, which had escaped the fire, onto the hot embers.—Then I noticed, however, that one of the thongs fastening Aspasia’s buskin had come untied. “My lovely lady,” I said, “please allow me”—and so saying, I bent down briskly, bringing my hands to the chair where I truly believed I was seeing the legs that long ago had made great philosophers rave."
"Ma chère Rosine, qui ne m’a point offert de service, me rend le plus grand service qu’on puisse rendre à l’humanité : elle m’aimait jadis, et m’aime encore aujourd’hui. Aussi, je ne crains point de le dire, je l’aime avec une portion du même sentiment que j’accorde à mes amis.","My dear Rosine, who has offered me no service, renders me the greatest service that can be rendered to humanity: she loved me in the past, and still loves me today. Also, I am not afraid to say it, I love him with a portion of the same feeling that I grant to my friends.","Poor Rose, who has made me no promises, renders me the greatest service that can be bestowed upon humanity, for she has always loved her master, and loves him still. And this is why I do not hesitate to say that she shares with my other friends the affection I feel towards them.","My dear Rosine, who has never offered me any service, has done me the greatest service that can be rendered to humanity: she has loved me before, and she still loves me now. Moreover—and I am not afraid to say it"
Je les vis tous s’asseoir sur les sièges encore rangés autour du feu ; Périclès seul resta debout pour lire les gazettes.,I saw them all sit down on the seats still arranged around the fire; Pericles alone remained standing to read the gazettes.,I saw them all seat themselves in chairs ranged around the fire. Pericles alone remained standing to read the newspapers.,"I saw them all sit down in the chairs still arranged around the fire; Pericles alone remained standing, to read the gazettes."
"J’ai promis un dialogue, je tiens parole. – C’était le matin à l’aube du jour : les rayons du soleil doraient à la fois le sommet du mont Viso et celui des montagnes les plus élevées de l’île qui est à nos antipodes ; et déjà elle était éveillée, soit que son réveil prématuré fût l’effet des visions nocturnes qui la mettent souvent dans une agitation aussi fatigante qu’inutile, soit que le carnaval, qui tirait alors vers sa fin, fût la cause occulte de son réveil, ce temps de plaisir et de folie ayant une influence sur la machine humaine comme les phases de la lune et de la conjonction de certaines planètes. – Enfin, elle était éveillée et très éveillée, lorsque mon âme se débarrassa elle-même des liens du sommeil.","I promised a dialogue, I keep my word. – It was morning at daybreak: the rays of the sun gilded both the summit of Mount Viso and that of the highest mountains of the island which is at our antipodes; and she was already awake, either because her premature awakening was the effect of the nocturnal visions which often put her in an agitation as tiring as it was useless, or because the carnival, which was then drawing towards its end, was the occult cause of her awakening. , this time of pleasure and madness having an influence on the human machine like the phases of the moon and the conjunction of certain planets. “Finally, she was awake, and wide awake, when my soul rid itself of the bonds of sleep.","A Dialogue. I PROMISED a dialogue, and I will keep my word. It was daybreak. The rays of the sun were gilding the summit of Mount Viso, and the tops of the highest hills on the island beneath our feet. My soul was already awake. This early awakening may have been the effect of those night visions which often excite in her a fatiguing and useless agitation: or perhaps the carnival, then drawing to a close, was the secret cause; for this season of pleasure and folly influences the human organization much as do the phases of the moon and the conjunction of certain planets. However this may be, my soul was awake, and wide awake, when she shook off the bands of sleep.","I promised a dialogue, and I will keep my word.—One morning, at daybreak, as the sun’s rays were gilding the peaks of Mount Viso and of the highest mountains of the island at our antipodes,* he was already awake, having been prematurely roused either by the nocturnal visions that often put him in an agitated state as fatiguing as it is useless, or by the carnival that was then drawing to a close—this time of pleasure and folly having an influence on the human organism comparable to that of phases of the moon and the conjunction of certain planets.—In short, he was awake, quite awake, in fact, when my soul also decided to shake off the bonds of sleep."
"Messieurs et mesdames, soyez fiers de votre intelligence tant qu’il vous plaira ; mais défiez-vous beaucoup de l’autre surtout quand vous êtes ensemble !","Gentlemen and ladies, be proud of your intelligence as long as you please; but be very suspicious of each other, especially when you are together!","Ladies and gentlemen! Be as proud of your intellect as you please, but be very suspicious of the OTHER, especially when you are together.","Ladies and Gentlemen, be as proud of your intelligence as you please, but beware of that other—especially when you are together."
"Je finis par perdre patience, et, ne pouvant plus résister au dépit qui me dévorait, je posai le miroir que je tenais à la main, et je sortis d’un air de colère, et sans prendre congé.","I ended by losing patience, and, no longer able to resist the spite that was devouring me, I put down the mirror which I held in my hand, and I left with an air of anger, and without taking my leave.","In a word, I must confess that my rose and I cut a very poor figure. At last I lost all patience, and unable longer to control the vexation that preyed upon me, I put down the looking-glass I had been holding, and went out angrily without taking leave.","In short, shall I say it?—we were a sorry sight, my rose and I. In the end I lost patience and, unable any longer to resist the resentment eating away at me, I set down the mirror and exited angrily, without saying goodbye."
"Le docteur Cigna sourit ; et, comme les esprits ne sauraient se refuser à l’évidence ni taire la vérité, non seulement il fut de l’avis d’Hippocrate, mais il avoua même, en rougissant à la manière des intelligences, qu’il s’en était toujours douté.","Doctor Cigna smiled; and, as minds cannot deny themselves the evidence or conceal the truth, not only did he agree with Hippocrates, but he even confessed, blushing like intelligences, that he was wrong. always doubted.","Doctor Cigna smiled; and as spirits can neither withstand evidence, nor silence truth, he not only agreed with Hippocrates, but, blushing after the manner of disembodied intelligences, he protested that he had himself always had his doubts.","Doctor Cigna smiled. And as ghosts could never turn a blind eye to the facts, nor silence the truth, not only did he agree with Hippocrates, but he actually confessed, blushing the way spirits blush, that he had always suspected it was so."
"Mais, permettez-moi de vous le demander, messieurs, vous amusez-vous autant qu’autrefois au bal et à la comédie ? Pour moi, je vous l’avoue, depuis quelque temps, toutes les assemblées nombreuses m’inspirent une certaine terreur. – J’y suis assailli par un songe sinistre. – En vain je fais mes efforts pour le chasser, il revient toujours, comme celui d’Athalie. – C’est peut-être parce que l’âme, inondée aujourd’hui d’idées noires et de tableaux déchirants, trouve partout des sujets de tristesse – comme un estomac vicié convertit en poisons les aliments les plus sains. Quoi qu’il en soit, voici mon songe : – Lorsque je suis dans une de ces fêtes, au milieu de cette foule d’hommes aimables et caressants qui dansent, qui chantent, – qui pleurent aux tragédies, qui n’expriment que la joie, la franchise et la cordialité, je me dis : – Si dans cette assemblée polie il entrait tout à coup un ours blanc, un philosophe, un tigre, ou quelque autre animal de cette espèce, et que, montant à l’orchestre, il s’écriât d’une voix forcenée : – « Malheureux humains ! écoutez la vérité qui vous parle par ma bouche : vous êtes opprimés, tyrannisés ; vous êtes malheureux ; vous vous ennuyez. – Sortez de cette léthargie !","But, allow me to ask you, gentlemen, do you enjoy the ball and the comedy as much as you used to? As for me, I confess to you, for some time now, all large assemblies have inspired a certain terror in me. – I am assailed by a sinister dream. – In vain do I try to chase it away, it always comes back, like Athalie’s. – It is perhaps because the soul, inundated today with dark thoughts and heartrending pictures, finds subjects of sadness everywhere – as a stale stomach converts the healthiest foods into poisons. Be that as it may, here is my dream: – When I am at one of these parties, in the midst of this crowd of pleasant and caressing men who dance, who sing, – who cry at tragedies, who express only the joy, frankness and cordiality, I said to myself: – If in this polite assembly there suddenly entered a white bear, a philosopher, a tiger, or some other animal of this species, and that, going up to the orchestra, he exclaimed in a frenzied voice: “Unfortunate humans! listen to the truth that speaks to you through my mouth: you are oppressed, tyrannized; you are unhappy; you're bored. – Get out of this lethargy!","Misanthropy. BUT, gentlemen, allow me to ask a question. Do you enjoy balls and plays as much as you used to do? As for me, I avow that for some time past crowded assemblies have inspired me with a kind of terror. When in their midst, I am assailed by an ominous dream. In vain I try to shake it off; like the dream of Athalie, it constantly returns. Perhaps this is because the soul, overwhelmed at the present moment by dark fancies and painful pictures, sees nothing but sadness around it, just as a disordered stomach turns the most wholesome food into poison. However this may be, my dream is as follows. When I am at one of these fêtes, among a crowd of kind, good-natured men, who dance and sing, who weep at tragedies, and are full of frankness and cordiality, I say to myself:— “If suddenly a white bear, a philosopher, a tiger, or some other animal of this kind were to enter, and ascending to the orchestra, were to shout out furiously: ‘Wretched beings! Listen to the truth that comes from my lips! You are oppressed! You are the slaves of tyrants! You are wretched and heart-sick! Awake from your lethargy!","But allow me, Gentlemen, to ask you a question: Do you enjoy yourselves as much as you used to at a ball or at the theatre?—For my part, I must say that for some time now, any large gathering of people inspires a kind of terror in me.—I am, in such circumstances, assailed by a sinister dream.—Try as I might to banish it from my mind, it always comes back, like Athaliah’s dream. * This is perhaps because the soul, now inundated with so many dark ideas and heartrending spectacles, everywhere finds causes for sorrow;—like a tainted stomach that turns even the most wholesome foods to poison.—Be that as it may, my dream is as follows: When I am at one of those balls, amidst that crowd of amiable, handsome people dancing and singing—people who weep at tragedies, who express only joy, candor, and cordiality—I say to myself:—What if suddenly a white bear, a philosopher, a tiger, or some other animal of that sort were to join this polite gathering, go up to the orchestra, and shout out madly: “Wretched humans! Harken to the truth that speaks through me: you are oppressed and tyrannized; you are unhappy; you are bored.—Rouse yourselves from your sleep."
"Le soir, lorsqu’elle a été grondée, elle se retire tristement et sans murmurer : le lendemain, à la pointe du jour, elle est auprès de mon lit, dans une attitude respectueuse ; et, au moindre mouvement de son maître, au moindre signe de réveil, elle annonce sa présence par les battements précipités de sa queue sur ma table de nuit.","In the evening, when she has been scolded, she retires sadly and without a murmur: the next day, at daybreak, she is by my bed, in a respectful attitude; and, at the slightest movement of her master, at the slightest sign of awakening, she announces her presence by the hasty beats of her tail on my bedside table.","In the evening, if she has been scolded she withdraws sadly and without a murmur. The next morning at daybreak, she stands near my bed in a respectful attitude, and at her master’s slightest movement, at the first sign of his being awake, she makes her presence known by rapidly tapping my little table with her tail.","In the evening, when she has been scolded, she retires gloomily and without a sound; the following day, at sunrise, she is at my bedside in an attitude of respect, and at the slightest movement from her master, at the first sign of waking, she announces her presence with the rapid thumping of her tail against my night table."
"J’ai voulu dire quelque chose de ces malheureux dans mon voyage, parce que l’idée de leur misère est souvent venue me distraire en chemin. Quelquefois, frappé de la différence de leur situation et de la mienne, j’arrêtais tout à coup ma berline, et ma chambre me paraissait prodigieusement embellie. Quel luxe inutile ! Six chaises, deux tables, un bureau, un miroir, quelle ostentation ! Mon lit surtout, mon lit couleur de rose et blanc, et mes deux matelas, me semblaient défier la magnificence et la mollesse des monarques de l’Asie. – Ces réflexions me rendaient indifférents les plaisirs qu’on m’avait défendus ; et, de réflexions en réflexions, mon accès de philosophie devenait tel que j’aurais entendu le son des violons et des clarinettes sans remuer de ma place – j’aurais entendu de mes deux oreilles la voix mélodieuse de Marchesini, cette voix qui m’a si souvent mis hors de moi-même, – oui, je l’aurais entendue sans m’ébranler ; – bien plus, j’aurais regardé sans la moindre émotion la plus belle femme de Turin, Eugénie elle-même, parée de la tête aux pieds par les mains de mademoiselle Rapous. – Cela n’est cependant pas bien sûr.","I wanted to say something about these unfortunates on my journey, because the idea of their misery has often distracted me on the way. Sometimes, struck by the difference between their situation and mine, I suddenly stopped my carriage, and my room seemed to me prodigiously embellished. What unnecessary luxury! Six chairs, two tables, a desk, a mirror, what ostentation! My bed especially, my pink and white bed, and my two mattresses, seemed to defy the magnificence and softness of the monarchs of Asia. “These reflections made me indifferent to the pleasures that I had been forbidden; and, from reflection to reflection, my access to philosophy became such that I would have heard the sound of violins and clarinets without moving from my place – I would have heard with my two ears the melodious voice of Marchesini, this voice that so often pissed me off – yes, I would have heard it without flinching; – even more, I would have looked without the slightest emotion at the most beautiful woman in Turin, Eugenie herself, adorned from head to foot by the hands of Mademoiselle Rapous. – However, that is not certain.","I COULD not help saying a word in my journey about those poor creatures, for the thought of them has often come across me on my way, and turned the current of my reflections. Sometimes, struck with the difference between their case and my own, I have suddenly stopped my travelling-carriage, and thought my chamber extravagantly embellished! What superfluous luxury! Six chairs, two tables, a bureau, and a looking-glass! What vain display! My bed above all things, my rose and white bed, with its two mattresses, seemed to rival the magnificence and effeminacy of Asiatic monarchs. These meditations made me indifferent to the pleasures that had been forbidden me. And, as I went on from one reflection to another, my fit of philosophy became so serious that I could have seen a ball going on in the next room, and heard the sound of violins and flutes without stirring. I could have heard Marchesini’s melodious voice, that voice which has so often transported me, yes, I could have listened to it without being moved. Nay, more, I could have gazed upon the most beauteous woman in Turin, upon Eugénie herself, adorned from head to foot by the hands of Mademoiselle Rapoux,[4] without emotion. But, of this last, I must confess myself not quite sure.","I wanted to say something about those unfortunate people during my voyage, because the thought of their misery has often distracted me along the road. Several times, struck by the difference between their situation and my own, I have stopped my coach at once, and my room has suddenly seemed prodigiously lavish. What useless luxury! Six chairs, two tables, a writing desk, a mirror! What ostentation! My bed especially: my pink-and-white bed, with its two mattresses, seemed to outdo the monarchs of the East in magnificence and voluptuousness.—Such reflections made me indifferent to the pleasures that had been forbidden me. And after reflection upon reflection, my outburst of philosophy became so great that, had I seen a ball in the neighboring room , had I heard the sounds of violins and clarinets, I should not have stirred from my place;—I could have heard with my own ears the melodious voice of Marchesini, a voice that has often transported me outside myself, and still I should not have moved;—even more than this, I could have gazed upon the most beautiful woman in Turin, Eugénie herself, decked out from head to toe by Mme Repous,* and felt nothing at all.—That, however, is not a good thing."
