Source,GoogleTranslate,human1,human2
"Si le lecteur réfléchit sur la conduite de mon domestique, il pourra se convaincre que, dans certaines affaires délicates, du genre de celle-ci, la simplicité et le bon sens valent infiniment mieux que l’esprit le plus adroit. J’ose assurer que le discours le plus étudié sur les inconvénients de la parole ne me déciderait pas à sortir aussi promptement de mon lit que le reproche muet de M. Joannetti.","If the reader reflects on the conduct of my servant, he will be able to convince himself that, in certain delicate matters, such as this, simplicity and common sense are infinitely better than the most skilful mind. I dare to assure you that the most studied discourse on the inconveniences of speech would not persuade me to get out of bed as quickly as the mute reproach of M. Joannetti.","If the reader will reflect upon the behavior of my servant, he will convince himself that in certain delicate matters of this kind, simplicity and good sense are much better than the sharpest wit. I dare assert that the most studied discourse on the impropriety of sloth would not make me spring so readily from my bed as the silent reproach of Monsieur Joannetti.","If the reader reflects a moment on my valet’s conduct, he will realize that, in certain delicate matters such as the one at hand, simplicity and common sense are of infinitely greater value than the cleverest mind. I assure you that the most elaborate speech on the disadvantages of laziness would never convince me to get out of my bed so promptly as does the mute disapproval of Monsieur Joanetti."
"Ô ma bête, ma pauvre bête, prends garde à toi.","O my beast, my poor beast, take care of yourself.",Poor ANIMAL!,Poor animal!
Qui pourrait donc lui disputer le rang que je lui accorde parmi les chefs-d’œuvre de l’art d’Apelles ?,Who could dispute with it the rank I grant it among the masterpieces of the art of Apelles?,Who then can dispute the rank that I accord to it among the masterpieces of the art of Apelles?,"Who, therefore, could possibly object to my ranking it with the masterpieces of the art of Apelles?"
Je laisse à penser au lecteur ce qui serait arrivé si elle était entrée toute seule chez une aussi belle dame.,I leave the reader to think what would have happened if she had entered such a beautiful lady alone.,Now I leave the reader to fancy what might have been the consequence had the truant visited so beautiful a lady alone.,"I shall leave it to the reader to imagine what would have happened had I let my beast enter, alone, the house of so lovely a lady."
"J’espère avoir suffisamment développé mes idées dans les chapitres précédents pour donner à penser au lecteur, et pour le mettre à même de faire des découvertes dans cette brillante carrière ; il ne pourra qu’être satisfait de lui, s’il parvient un jour à savoir faire voyager son âme toute seule ; les plaisirs que cette faculté lui procurera balanceront du reste les quiproquo qui pourront en résulter. Est-il une jouissance plus flatteuse que celle d’étendre ainsi son existence, d’occuper à la fois la terre et les cieux, et de doubler, pour ainsi dire, son être ? – Le désir éternel et jamais satisfait de l’homme n’est-il pas d’augmenter sa puissance et ses facultés, de vouloir être où il n’est pas, de rappeler le passé et de vivre dans l’avenir ? – Il veut commander aux armées, présider aux académies ; il veut être adoré des belles, et, s’il possède tout cela, il regrette alors les champs et la tranquillité, et porte envie à la cabane des bergers : ses projets, ses espérances échouent sans cesse contre les malheurs réels attachés à la nature humaine ; il ne saurait trouver le bonheur. Un quart d’heure de voyage avec moi lui en montrera le chemin.","I hope I have sufficiently developed my ideas in the preceding chapters to give the reader thought, and to enable him to make discoveries in this brilliant career; he can only be satisfied with himself, if he manages one day to know how to make his soul travel alone; the pleasures that this faculty will procure for him will moreover balance the misunderstandings that may result from it. Is there a more flattering enjoyment than that of thus extending one's existence, of occupying both the earth and the heavens, and of doubling, so to speak, one's being? – Is not the eternal and never satisfied desire of man to increase his power and his faculties, to want to be where he is not, to remember the past and to live in the future? – He wants to command the armies, preside over the academies; he wants to be adored by the fair ones, and if he possesses all that, then he misses the fields and the tranquility, and is envious of the hut of the shepherds: his projects, his hopes constantly fail against the real misfortunes attached to nature. human; he cannot find happiness. A quarter of an hour of travel with me will show him the way.","I HOPE I have sufficiently developed my ideas in the foregoing chapters to furnish you, good reader, with matter for thought, and to enable you to make discoveries along the brilliant career before you. You cannot be other than highly satisfied with yourself if you succeed in the long run in making your soul travel alone. The pleasure afforded by this power will amply counterbalance any inconvenience that may arise from it. What more flattering delight is there than the being able thus to expand one’s existence, to occupy at once earth and heaven, to double, so to speak, one’s being? Is it not man’s eternal, insatiable desire to augment his strength and his faculties, to be where he is not, to recall the past, and live in the future? He would fain command armies, preside over learned societies, and be the idol of the fair. And, if he attain to all this, then he regrets the tranquillity of a rural life, and envies the shepherd’s cot. His plans, his hopes, are constantly foiled by the ills that flesh is heir to. He can find happiness nowhere. A quarter of an hour’s journey with me will show him the way to it.","I hope that in the preceding chapters I have set forth my ideas well enough to give the reader food for thought and enable him to make discoveries of his own in this luminous realm. He could not help but be pleased with himself should he succeed one day in making his soul travel all by herself; the delights that this ability will bring to him will more than outweigh the misunderstandings that might result from it. Indeed, could there be any joy more gratifying than that of thus stretching one’s existence, of inhabiting the earth and the heavens at once, of doubling, as it were, one ’s being?—Is it not man’s eternal and forever unfulfilled wish to increase his power and abilities, to be where he is not, to recall the past and to live in the future? He wants to command armies and preside over academies; he wants to be worshiped by beautiful women; yet if he has all this, he misses the calm of the countryside, and envies the shepherd his cabin. His plans and hopes are forever doomed to founder against the real sorrows inherent in human nature: he cannot find happiness.—A quarter of an hour’s travel with me will show him the way."
"Je n’ajouterai qu’un conseil pour vous, messieurs : c’est de vous mettre bien dans l’esprit qu’un jour de bal votre maîtresse n’est plus à vous.","I will only add one piece of advice for you, gentlemen: it is to bear in mind that one day at the ball your mistress is no longer yours.","I will only add, gentlemen, a word of counsel. Impress well upon your minds this fact, that your mistress is no longer yours on the day of a ball.","I shall add only a bit of advice for you, Gentlemen: Never forget that on the day of a ball, your mistress is no longer yours."
"S’il est utile et agréable d’avoir une âme dégagée de la matière au point de la faire voyager toute seule lorsqu’on le juge à propos, cette faculté a aussi ses inconvénients. C’est à elle, par exemple, que je dois la brûlure dont j’ai parlé dans les chapitres précédents. – Je donne ordinairement à ma bête le soin des apprêts de mon déjeuner ; c’est elle qui fait griller mon pain et le coupe en tranches. Elle fait à merveille le café, et le prend même très souvent sans que mon âme s’en mêle, à moins que celle-ci ne s’amuse à la voir travailler ; mais cela est rare et très difficile à exécuter : car il est aisé, lorsqu’on fait quelque opération mécanique, de penser à toute autre chose ; mais il est extrêmement difficile de se regarder agir, pour ainsi dire ; – ou, pour m’expliquer suivant mon système, d’employer son âme à examiner la marche de sa bête, et de la voir travailler sans y prendre part. – Voilà le plus étonnant tour de force métaphysique que l’homme puisse exécuter.","If it is useful and pleasant to have a soul freed from matter to the point of making it travel on its own when it is deemed appropriate, this faculty also has its drawbacks. It is to her, for example, that I owe the burning of which I have spoken in the preceding chapters. “I usually give my animal the care of preparing my breakfast; she is the one who toasts my bread and cuts it into slices. She makes coffee wonderfully, and even takes it very often without my soul getting involved, unless my soul enjoys watching her work; but this is rare and very difficult to perform: for it is easy, when performing some mechanical operation, to think of quite another thing; but it is extremely difficult to watch oneself act, so to speak; – or, to explain myself according to my system, to employ his soul to examine the progress of his animal, and to see it working without taking part in it. – This is the most astonishing metaphysical tour de force that man can perform.","The Animal. IF it is both useful and agreeable to have a soul so disengaged from matter that we can let it travel alone whenever we please, this has also its disadvantages. Through this, for instance, I got the burn I spoke of a few chapters back. I generally leave my animal to prepare my breakfast. Its care it is to slice and toast my bread. My coffee it makes admirably, and helps itself thereto without my soul’s concerning herself in the transaction. But this is a very rare and nice performance to execute; for though it is easy enough while busied in a mechanical operation, to think of something quite different, it is extremely difficult, so to speak, to watch one’s self-work, or, if I express myself systematically, to employ one’s soul to examine the animal’s progress, and to watch its work without taking part in it. This is the most extraordinary metaphysical feat a man can execute.","If it is useful and agreeable to have a soul so disengaged from matter that one can let her travel alone as one sees fit, this faculty also has its inconveniences. It was, for example, to blame for the burn I mentioned a few chapters back.—Customarily I leave to my beast the task of preparing my breakfast: he toasts and slices my bread, makes excellent coffee, and often drinks it without the participation of my soul, unless the latter wishes to amuse herself while watching the other work, but that happens rarely, and is very difficult to carry out; for it is easy, when one is performing a mechanical operation, to have one’s mind on something else entirely, but it is extremely difficult to watch oneself working, so to speak, or—to put it more clearly in terms of my system—to use one’s soul to observe the working of the beast without taking part.—For that is the most stunning metaphysical tour de force that man can perform."
Chapitre 20,Chapter 20,XX.,CHAPTER XX
"Je m’acheminais insensiblement à une dissertation sur la médecine et sur les progrès qu’elle a faits depuis Hippocrate. – Je me demandais si les personnages fameux de l’antiquité qui sont morts dans leur lit, comme Périclès, Platon, la célèbre Aspasie et Hippocrate lui-même, étaient morts comme des gens ordinaires, d’une fièvre putride, inflammatoire ou vermineuse ; si on les avait saignés et bourrés de remèdes.","I was heading imperceptibly towards a dissertation on medicine and the progress it has made since Hippocrates. – I wondered if the famous people of antiquity who died in their beds, like Pericles, Plato, the famous Aspasia and Hippocrates himself, had died like ordinary people, of a putrid, inflammatory or verminous fever; if they had been bled and stuffed with medicine.","I travelled insensibly to a dissertation on medicine and the progress it has made since the time of Hippocrates. I asked myself whether the famous personages of antiquity who died in their beds, as Pericles, Plato, the celebrated Aspasia, and Hippocrates, died, after the manner of ordinary mortals, of some putrid or inflammatory fever; and whether they were bled, and crammed with specifics.","I had embarked unawares on a disquisition on medicine and the advances it has made since Hippocrates.—I wondered whether the famous figures of antiquity who died in their beds, such as Pericles, Plato, the celebrated Aspasia, and Hippocrates himself, had died like ordinary people, of worms, inflammations, or putrid fever, and had been bled and plied with endless cures."
"Que de protestations, que d’offres de services ! Je pouvais compter sur leur fortune, sur une amitié éternelle et sans réserve !","What protests, what offers of services! I could count on their fortune, on an eternal and unreserved friendship!","And yet what protestations they made, what offers of assistance! Their purse was at my disposal, and they begged me to depend upon their eternal and entire friendship!","All those declarations, those offers of services! Oh, I could count on them, on their fortunes, on their eternal, unconditional friendship!"
"J’ai fait je ne sais combien d’expériences sur l’union de ces deux créatures hétérogènes. Par exemple, j’ai reconnu clairement que l’âme peut se faire obéir par la bête, et que, par un fâcheux retour, celle-ci oblige très souvent l’âme d’agir contre son gré. Dans les règles, l’une a le pouvoir législatif, et l’autre le pouvoir exécutif ; mais ces deux pouvoirs se contrarient souvent. – Le grand art d’un homme de génie est de savoir bien élever sa bête, afin qu’elle puisse aller seule, tandis que l’âme, délivrée de cette pénible accointance, peut s’élever jusqu’au ciel.","I have done I don't know how many experiments on the union of these two heterogeneous creatures. For example, I clearly recognized that the soul can make itself obeyed by the beast, and that, by an unfortunate return, the latter very often obliges the soul to act against its will. In the rules, one has the legislative power, and the other the executive power; but these two powers often contradict each other. – The great art of a man of genius is to know how to raise his animal well, so that it can go alone, while the soul, freed from this painful acquaintance, can rise to heaven.","I have experimented I know not how oft, upon the union of these two heterogeneous creatures. I have, for instance, clearly ascertained that the soul can make herself obeyed by the animal, and that, by way of retaliation, the animal makes the soul act contrary to its own inclination. The one, as a rule, has the legislative, the other the executive power, but these two are often at variance. The great business of a man of genius is to train his animal well, in order that it may go alone, while the soul, delivered from this troublesome companion, can raise herself to the skies.","I have conducted I know not how many experiments on the union of these two heterogeneous creatures. For example, I have clearly determined that the soul can command obedience from the beast, and that, by an unfortunate reciprocity, the latter can very often compel the soul to act against her will. According to the rules, the one has legislative power, the other executive power; but very often these powers oppose each other.—The great skill of a man of genius lies in knowing how to bring his beast up well, so that he may go his own way in the world while the soul, released from this distressing intimacy, raises herself to the heavens. *"
"Enfin, dans la classe des hommes parmi lesquels je vis, combien n’en est-il pas qui, se voyant parés d’un uniforme, se croient fermement officiers, – jusqu’au moment où l’apparition inattendue de l’ennemi les détrompe ? – Il y a plus : s’il plaît au roi de permettre à l’un d’eux d’ajouter à son habit une certaine broderie, voilà qu’il se croit un général, et toute l’armée lui donne ce titre, sans rire, tant l’influence de l’habit est forte sur l’imagination humaine.","Finally, in the class of men among whom I live, how many are there who, seeing themselves decked out in uniform, believe themselves firmly to be officers - until the moment when the unexpected appearance of the enemy correct? – There is more: if the king pleases to allow one of them to add a certain embroidery to his coat, he thinks himself a general, and the whole army gives him this title, without laughing, so strong is the influence of clothing on the human imagination.","And in the class of men among whom I live, how many there are who, finding themselves clothed in uniform, firmly believe they are officers, until the unexpected appearance of the enemy shows them their mistake. And more than this, if it be the king’s good pleasure to allow one of them to add to his coat a certain trimming, he straightway believes himself to be a general, and the whole army gives him the title without any notion of making fun of him! So great an influence has a coat upon the human imagination!","In short, among the class of men in whose midst I live, how many are there who, seeing themselves clad in a uniform, firmly believe themselves to be officers—until the sudden appearance of the enemy undeceives them?—Or worse still, if it pleases the king to allow one of them to add some embroidery to his dress, suddenly he thinks he’s a general, and the whole army also gives him this title without laughing,—so great is clothing’s influence on the human imagination."
"Qu’il est glorieux d’ouvrir une nouvelle carrière et de paraître tout à coup dans le monde savant, un livre de découvertes à la main, comme une comète inattendue étincelle dans l’espace !","How glorious it is to open a new career and suddenly appear in the learned world, a book of discoveries in hand, like an unexpected comet flashing in space!","WHAT more glorious than to open for one’s self a new career,—to appear suddenly before the learned world with a book of discoveries in one’s hand, like an unlooked-for comet blazing in the empyrean!","How glorious it is to blaze a new trail, and suddenly to appear in learned society, a book of discoveries in one’s hand, like an unforeseen comet flashing through space!"
"Lorsque les spacieuses et triples portes des Enfers s’ouvrirent tout à coup devant lui à deux battants, et que la profonde fosse du néant et de la nuit parut à ses pieds dans toute son horreur, – il parcourut d’un œil intrépide le sombre empire du chaos, et, sans hésiter, ouvrant ses larges ailes, qui auraient pu couvrir une armée entière, il se précipita dans l’abîme.","When the spacious triple gates of Hell suddenly opened double before him, and the deep pit of nothingness and night appeared at his feet in all its horror, - he looked fearlessly into the dark empire of chaos, and without hesitation, opening its wide wings, which could have covered an entire army, it rushed into the abyss.","When the thrice-threefold gates of hell fly open before him, and the dark, boundless ocean discloses itself in all its horror at his feet, with undaunted eye he surveys the realm of chaos, and then, opening his sail-broad wings, precipitates himself into the abyss.[10]","When the vast, threefold gates of hell flew open before him, and the pit of night and the void yawned in all its horror at his feet, he ran his intrepid eye over chaos’s dark empire and, without hesitation, spreading his tremendous wings, which could have covered a whole army, cast himself into the abyss."
"On concevra facilement, après avoir lu ce préambule, pourquoi ma tête tomba sur ma poitrine, et comment les muscles du pouce et de l’index de la main droite, n’étant plus irrités par ce fluide, se relâchèrent au point qu’un volume des œuvres du marquis Caraccioli, que je tenais serré entre ces deux doigts, m’échappa sans que je m’en aperçusse, et tomba sur le foyer.","It will be easy to understand, after reading this preamble, why my head fell on my chest, and how the muscles of the thumb and index finger of the right hand, no longer being irritated by this fluid, relaxed to the point that a volume of the works of the Marquis Caraccioli, which I held tight between these two fingers, escaped me without my noticing it, and fell on the hearth.","After reading this preamble, you will easily understand why my head fell on my chest, and why the muscles of the thumb and forefinger of my right hand, being no longer excited by the electric fluid, became so relaxed that a volume of the works of the Marquis Caraccioli, which I was holding tightly between these two fingers, imperceptibly eluded my grasp, and fell upon the hearth.","* Having read this preamble, one will have little difficulty conceiving why my head fell onto my chest or how the muscles of the thumb and index finger of my right hand, being no longer quickened by that fluid, relaxed to the point that a volume of the marquis Caraccioli,* which I was holding between that very thumb and finger, slipped out without my noticing and fell onto the hearthstone."
"Un jour (l’avouerai-je ?) sans ce fidèle domestique qui la rattrapa au bas de l’escalier, l’étourdie s’acheminait vers la cour sans épée, aussi hardiment que le grand maître des cérémonies portant l’auguste baguette.","One day (shall I admit it?) without this faithful servant who caught up with her at the bottom of the stairs, the scatterbrain made her way towards the court without a sword, as boldly as the grand master of ceremonies bearing the august wand.","One day, I must confess, had it not been for this faithful servant, who caught it up just at the bottom of the staircase, the silly creature would have presented itself at court without a sword, as boldly as if it had been the chief gentleman-usher, bearing the august rod.","One day (shall I admit it?), before the intervention of this faithful servant, the scatterbrain was headed to the Court without his sword, as fearlessly as a master of ceremonies wielding his august wand."
"Au moment où la parure commence, l’amant n’est plus qu’un mari, et le bal seul devient l’amant.","The moment the adornment begins, the lover is no more than a husband, and the ball alone becomes the lover.","As soon as dressing begins, a lover is no more thought of than a husband would be; and the ball takes the place of a lover.","The moment the dressing begins, the lover becomes nothing more than a husband: the ball alone is the lover."
