Source,GoogleTranslate,human1,human2
"« Joannetti, fermez les portes et les fenêtres. – Je ne veux plus voir la lumière ; qu’aucun homme n’entre dans ma chambre ; – mettez mon sabre à la portée de ma main ; – sortez vous-même, et ne reparaissez plus devant moi !","“Joannetti, close the doors and windows. “I no longer want to see the light; let no man enter my room; – put my saber within reach of my hand; – come out yourself, and do not appear before me again!","Joannetti! shut the door and windows! I do not wish to see the light! Let no one enter my room. Put my sword within reach. Go out yourself, and keep away from me.","* “Joanetti! Shut all the doors and windows.—I no longer wish to see the light of day; let no man enter my room;—place my sabre within my reach;—you too, leave, and never show your face again.”"
Chapitre 15,Chapter 15,XV.,CHAPTER XV
"Comment et pourquoi cette rose sèche se trouve sur une tablette de mon bureau, c’est ce que je ne dirai certainement pas, parce que j’ai déclaré qu’une rose sèche ne mérite pas un chapitre.","How and why this dry rose is on a shelf in my office, I will certainly not say, because I have declared that a dry rose does not deserve a chapter.","Why and wherefore that rose is upon my shelf, I shall certainly not explain, for, as I said before, a withered rose does not deserve a chapter.","How and why this withered rose happens to be on a shelf over my desk, I certainly shall never tell, for I said that a withered rose did not merit a chapter."
Chapitre 34,Chapter 34,XXXIV. Correspondence.,CHAPTER XXXIV
"J’avais couché mes pincettes sur la braise pour faire griller mon pain ; et, quelque temps après, tandis que mon âme voyageait, voilà qu’une souche enflammée roule sur le foyer : – ma pauvre bête porta la main aux pincettes, et je me brûlai les doigts.","I had laid my tongs on the coals to toast my bread; and, some time later, while my soul was traveling, behold, a flaming stump rolls over the hearth: – my poor beast put his hand to the tongs, and I burned my fingers.","I had rested my tongs on the embers to toast my bread, and some little time afterwards, while my soul was travelling, a burning stick fell on the hearth: my poor animal seized the tongs, and I burnt my fingers. IX.","I had laid my tongs down on the embers, to toast the bread, and a little while later, as my soul was traveling, a flaming log suddenly rolled onto the hearth—my poor beast set his hand to the tongs, and I burned my fingers."
"L’agitation de la plus noble partie de moi-même se communiquait à l’autre, et celle-ci à son tour agissait puissamment sur mon âme. – J’étais parvenu tout entier à un état difficile à décrire, lorsque enfin mon âme, soit par sagacité, soit par hasard, trouva la manière de se délivrer des gazes qui la suffoquaient. Je ne sais si elle rencontra une ouverture, ou si elle s’avisa tout simplement de les relever, ce qui est plus naturel ; le fait est qu’elle trouva l’issue du labyrinthe. Les tresses de cheveux en désordre étaient toujours là ; mais ce n’était plus un obstacle, c’était plutôt un moyen : mon âme le saisit, comme un homme qui se noie s’accroche aux herbes du rivage ; mais le collier de perles se rompit dans l’action, et les perles se défilant roulèrent sur le sofa et de là sur le parquet de Mme de Hautcastel : car mon âme, par une bizarrerie dont il serait difficile de rendre raison, s’imaginait être chez cette dame ; un gros bouquet de violettes tomba par terre, et mon âme, s’éveillant alors, rentra chez elle, amenant à sa suite la raison et la réalité. Comme on l’imagine, elle désapprouva fortement tout ce qui s’était passé en son absence, et c’est ici que commence le dialogue qui fait l’objet de ce chapitre.","The agitation of the noblest part of myself was communicated to the other, and this in its turn acted powerfully on my soul. – I had completely arrived at a state difficult to describe, when at last my soul, either by sagacity or by chance, found the way to free itself from the gauzes which were suffocating it. I don't know if she encountered an opening, or if she simply took it into her head to pick them up, which is more natural; the fact is that she found the exit from the labyrinth. The messy hair braids were still there; but it was no longer an obstacle, it was rather a means: my soul seized it, as a drowning man clings to the grass of the shore; but the string of pearls broke in the action, and the unraveling pearls rolled onto the sofa and thence onto Madame de Hautcastel's floor: for my soul, by some oddity for which it would be difficult to explain, imagined to be with this lady; a large bouquet of violets fell to the ground, and my soul, waking then, returned home, bringing reason and reality in its wake. As one can imagine, she strongly disapproved of everything that had happened in her absence, and this is where the dialogue that is the subject of this chapter begins.","The agitation of the nobler part of myself communicated itself to the OTHER; and the latter, in its turn, reacted powerfully upon my soul. I worked myself, at last, into a state which it would be hard to describe, while my soul, either sagaciously or by chance, hit upon a way of escaping from the gauzes by which it was being suffocated. I know not whether she discovered an outlet, or whether, which is a more natural conclusion, it occurred to her to raise them: at all events, she found a means of egress from the labyrinth. The tresses of disheveled hair were still there; but they were now rather help than hindrance; my soul seized them, as a drowning man clutches the sedge on a river’s bank, but the pearl necklace broke in the act, and the unstrung pearls rolled on the sofa, and from the sofa to Madame Hautcastel’s floor (for my soul, by an eccentricity for which it would be difficult to give a reason, fancied she was at that lady’s house); then a great bunch of violets fell to the ground, and my soul, which then awoke, returned home, bringing with her common sense and reality. She strongly disapproved, as you will readily imagine, of all that had passed in her absence; and here it is that the dialogue begins which forms the subject of this chapter.","The agitation of the noblest part of myself was imparted to the other, and then he, in turn, exerted his own powerful influence upon my soul.—I had fully reached a state difficult to describe, when my soul, either by cleverness or by chance, suddenly discovered the way to free herself from the veils that were suffocating her. I do not know whether she found an opening or simply took it upon herself to remove them, which would have been more natural; in any event, she found her way out of the labyrinth. The tangled braids of hair were still there, but they were no longer an obstacle; they were, rather, a means of escape: my soul seized them as a drowning man fastens on to the grasses of the riverbank, but the pearl necklace broke in the process, and the pearls came unstrung, rolling onto the sofa and thence onto the parquet of Mme de Hautcastel;—for my soul, in an extravagance that would be difficult to explain, imagined she was at that Lady’s home: a large bouquet of violets fell to the floor, and my soul, then waking, returned home, bringing reason and reality with her. As one may imagine, she strongly disapproved of all that had happened in her absence; and here begins the dialogue that is the subject of this chapter."
"Est-il en effet d’être assez malheureux, assez abandonné, pour n’avoir pas de réduit où il puisse se retirer et se cacher à tout le monde ? Voilà tous les apprêts du voyage.","Is it indeed to be unhappy enough, abandoned enough, not to have a retreat where he can withdraw and hide from everyone? Here are all the preparations for the trip.",Surely there is no being so miserable as to be without a retreat to which he can withdraw and hide himself from the world. Such a hiding-place will contain all the preparations our journey requires.,"Indeed, is there anyone so wretched, so forlorn as not to have some sort of garret in which to withdraw and hide from the world? For such is all that is required for travel."
"Lorsque j’ai assez pleuré et fait l’amour, je cherche quelque poète, et je pars de nouveau pour un autre monde.","When I have cried and made love enough, I look for some poet, and I leave again for another world.","When I have had enough of tears and love, I turn to some poet, and set out again for a new world.","When, on the other hand, I have had enough of weeping and wooing, I seek out some poet and depart anew for another world."
Chapitre 8,Chapter 8,VIII.,CHAPTER VIII
"Le soir, le docteur Ranson lui trouvait le pouls concentré, et ordonnait la saignée pour le lendemain. Si le service avait duré un mois de plus, c’en était fait du malade.","In the evening, Dr. Ranson found his pulse concentrated, and ordered bloodletting for the next day. If the service had lasted another month, the patient was over.","In the evening Dr. Ranson[11] found his pulse hard and feverish, and ordered him to be bled next day. If the campaign had lasted a month longer, the sick man’s case would have been past cure.","In the evening, Doctor Ranson* found his pulse to be somewhat concentrated, and ordered that he be bled the following day. Had his tour of duty lasted more than a month, that would have been the end of the patient."
"Et pourquoi refuserais-je mon affection à cet être caressant qui n’a jamais cessé de m’aimer depuis l’époque où nous avons commencé de vivre ensemble ? Ma mémoire ne suffirait pas à faire l’énumération des personnes qui se sont intéressées à moi et qui m’ont oublié. J’ai eu quelques amis, plusieurs maîtresses, une foule de liaisons, encore plus de connaissances ; – et maintenant je ne suis plus rien pour tout ce monde, qui a oublié jusqu’à mon nom.","And why would I refuse my affection to this caressing being who has never stopped loving me since the time when we began to live together? My memory would not suffice to enumerate the persons who have taken an interest in me and who have forgotten me. I had a few friends, several mistresses, a host of liaisons, even more acquaintances; – and now I am nothing to everyone who has forgotten even my name.","And why should I refuse my affection to this good-natured creature that has never ceased to love me ever since we have lived together? My memory would not enable me to enumerate all the people who have interested themselves in me but to forget me. I have had some few friends, several lady-loves, a host of acquaintances; and now I am to all these people as if I had never lived; they have forgotten my very name.","How could I ever deny affection to this tender creature that has never ceased loving me since the day we began living together? It would be beyond my memory’s power to enumerate all the people who once took an interest in me only to forget me. I have had a few friends, several mistresses, a host of affairs, and even more acquaintances—but now I am nothing to all these people, who have forgotten even my name."
"Mais l’aube matinale commence à blanchir le ciel ; les noires idées qui m’agitaient s’évanouissent avec la nuit, et l’espérance renaît dans mon cœur. – Non, celui qui inonde ainsi l’orient de lumière ne l’a point fait briller à mes regards pour me plonger bientôt dans la nuit du néant. Celui qui étendit cet horizon incommensurable, celui qui éleva ces masses énormes, dont le soleil dore les sommets glacés, est aussi celui qui a ordonné à mon cœur de battre et à mon esprit de penser.","But the morning dawn begins to whiten the sky; the dark ideas which agitated me vanish with the night, and hope is reborn in my heart. – No, he who thus floods the Orient with light has not made it shine before my eyes to plunge me soon into the night of nothingness. The one who extended this immeasurable horizon, the one who raised these enormous masses, whose icy summits the sun gilds, is also the one who ordered my heart to beat and my mind to think.","But day-break begins to whiten the sky. The gloomy thoughts that troubled me vanish with the darkness, and hope awakens again in my heart. No! He who thus suffuses the east with light, has not made it to shine upon my eyes only to plunge me into the night of annihilation. He who has spread out that vast horizon, who raised those lofty mountains whose icy tops the sun is even now gilding, is also He who made my heart to beat, and my mind to think.","But the glow of daybreak now begins to brighten the sky; the dark thoughts troubling me vanish with the night, and hope is reborn in my heart.—No, he who thus floods the East with light does not make it shine in my eyes only to plunge me shortly into the night of nothingness. He who laid out this boundless horizon, who raised these enormous masses of stone, whose sun begilds the icy summits, also commanded my heart to beat and my mind to think."
On conviendra sans doute qu’il doit être compté pour une des merveilles de la contrée où je me promène.,It will no doubt be agreed that it must be counted as one of the marvels of the country where I walk.,You will at once admit that it should be regarded as one of the wonders of the world.,"You will, no doubt, agree that it must be counted as one of the marvels of the country I am traveling through."
Les efforts sont vains ; il faut remettre la partie et séjourner ici malgré moi : c’est une étape militaire,Efforts are in vain; you have to put off the game and stay here in spite of myself: it's a military stopover,"A Halt. MY efforts are useless. I must sojourn here awhile, whether I will or not. The “Halt!” is irresistible.",CHAPTER XIV
Chapitre 11,Chapter 11,XI. Rose and White.,CHAPTER XI
"Pendant ce temps, Joannetti, ayant rassemblé les restes de mon dîner, qui étaient destinés pour le sien, les donna sans hésiter à Jacques.","Meanwhile, Joannetti, having collected the remains of my dinner, which were intended for hers, gave them without hesitation to Jacques.","Meanwhile, Joannetti, who had gathered together what was left of my dinner, his own share, gave it at once to Jem.","Meanwhile Joanetti, who had gathered the leavings of my meal, which were destined for him, gave them without hesitation to Jacques."
"Lorsque je veux me donner ensuite une scène d’enthousiasme, et jouir de toutes les forces de mon imagination, je m’attache hardiment aux plis de la robe flottante du sublime aveugle d’Albion, au moment où il s’élance dans le ciel, et qu’il ose approcher du trône de l’Éternel. – Quelle muse a pu le soutenir à cette hauteur, où nul homme avant lui n’avait osé porter ses regards ? – De l’éblouissant parvis céleste que l’avare Mammon regardait avec des yeux d’envie, je passe avec horreur dans les vastes cavernes du séjour de Satan ; – j’assiste au conseil infernal, je me mêle à la foule des esprits rebelles, et j’écoute leurs discours.","When I want to give myself afterwards a scene of enthusiasm, and enjoy all the forces of my imagination, I attach myself boldly to the folds of the floating dress of the sublime blind man of Albion, at the moment when he soars into the sky. , and dare to approach the throne of the Lord. – What muse could support him at this height, where no man before him had dared to raise his gaze? – From the dazzling celestial court which the miser Mammon gazed with eyes of envy, I pass with horror into the vast caverns of Satan's abode; – I attend the infernal council, I mingle with the crowd of rebellious spirits, and I listen to their speeches.","When I would visit a scene full of enthusiasm, and put forth all the strength of my imagination, I cling boldly to the flowing robe of the sublime blind poet of Albion at the moment when he soars heavenward, and dares approach the throne of the Eternal. What muse was able to sustain him in a flight so lofty that no man before him ever ventured to raise his eyes so high? From heaven’s dazzling pavement which avaricious Mammon looked down upon with envious eyes, I pass, horror-stricken, to the vast caverns of Satan’s sojourn. I take my place at the infernal council, mingle with the host of rebellious spirits, and listen to their discourse.","Then, when I wish to afford myself a view of divine inspiration and to delight in all the powers of my imagination, I cling fearlessly to the flowing robe of Albion’s sublime blind poet as he prepares to soar heavenward and dares to approach the throne of the Eternal.—What Muse could have sustained him at such a lofty height, whither no man before him had ever dared lift his eyes?—And from Heaven’s dazzling vault upon which Mammon gazed with eyes of envy, I descend, in horror, into the vast caverns of Satan’s abode;—I take part in the Infernal Council; I join the crowd of rebellious spirits and listen to their speeches.—"
"Mais pour son élégante amie, j’avoue humblement que ce fut l’autre qui lui fit signe. – Cependant, quand j’y pense, je serais tenté d’éprouver un petit mouvement d’orgueil ; car il est clair que dans ce songe la balance en faveur de la raison était de quatre contre un. – C’est beaucoup pour un militaire de mon âge.","But for her elegant friend, I humbly confess that it was the other who beckoned her. – However, when I think of it, I would be tempted to experience a little movement of pride; for it is clear that in this dream the balance in favor of reason was four to one. “That’s a lot for a soldier my age.","But as to his graceful friend, I humbly own that it was the OTHER who beckoned her to come. Still, however, when I think of the interview, I am tempted to feel some little pride, for it is evident that in this dream the balance in favor of reason was as four to one. Pretty fair this, methinks, for a lieutenant.","As for his lovely companion,* I humbly confess that it was the other who had called her to mind. When I think about it, however, I feel a tempting flutter of pride; for it is clear that in this daydream, the balance was four to one in favor of reason.—No small thing for a lieutenant. Be that as it may, as I abandoned myself to these reflections, my eyes managed to shut and I fell into a deep sleep; yet as I closed my eyes, the images of the people I had been thinking of remained painted on that fine canvas that we call memory, and as these images mingled in my brain with the idea of the evocation of the dead, I soon saw arrive, one after another, Hippocrates, Plato, Pericles, Aspasia, and Doctor Cigna in his wig."
"Malgré la supériorité qu’il en acquérait sur moi, il ne sentit pas le moindre mouvement d’orgueil, et ne chercha point à profiter de son avantage. – Après un petit moment de silence, il prit le portrait, le remit à sa place, et se retira légèrement sur la pointe du pied. – Il sentait bien que sa présence était une espèce d’humiliation pour moi, et sa délicatesse lui suggéra de se retirer sans m’en laisser apercevoir. – Sa conduite, dans cette occasion, m’intéressa vivement, et le plaça toujours plus avant dans mon cœur. Il aura sans doute une place dans celui du lecteur ; et s’il en est quelqu’un assez insensible pour la lui refuser après avoir lu le chapitre suivant, le ciel lui a sans doute donné un cœur de marbre.","Despite the superiority he acquired over me, he did not feel the slightest movement of pride, and did not seek to take advantage of his advantage. – After a moment of silence, he took the portrait, put it back in its place, and retired slightly on tiptoe. “He felt that his presence was a kind of humiliation for me, and his delicacy suggested that he withdraw without letting me notice. “His conduct, on this occasion, interested me deeply, and placed him always nearer in my heart. It will undoubtedly have a place in that of the reader; and if there is one so insensitive as to refuse it to him after reading the next chapter, heaven has doubtless given him a heart of marble.","Notwithstanding the superiority he had hereby gained over me, he felt no movement of pride, and did not seek to profit by his advantage. After a moment’s silence, he took the picture, put it back in its place, and withdrew softly on tip-toe. He felt that his presence was a sort of humiliation to me, and his delicacy of feeling led him thus to retire unobserved. His behavior on this occasion interested me greatly, and gave him a higher place than ever in my affections. And he will have too, without doubt, a place in the heart of my readers. If there be one among them who will refuse it him after reading the next chapter, such a one must surely have a heart of stone.","Despite the advantage he thus gained over me, he felt not the slightest hint of pride, and made no attempt to profit from this ascendancy.—After a brief moment of silence, he took the portrait, returned it to its place, and withdrew lightly on tiptoe.—He was keenly aware that his presence was a sort of humiliation for me, and his sense of tact told him he should withdraw, without my noticing.—His behavior on this occasion impressed me greatly and brought him forever closer to my heart. No doubt he will also find a place in the reader’s heart; and if, after reading the chapter to follow, there is anyone so insensitive to deny him that, then heaven must have given him a heart of stone."
"Le trouble de l’amour, l’espoir du bonheur n’inondent-ils pas notre cœur de sensations aussi vives que variées !","The trouble of love, the hope of happiness, do they not flood our hearts with sensations as lively as they are varied!","The excitement of love, and the anticipation of happiness, do they not fill our hearts to the brim with emotions no less lively and various?","Do not love’s turmoil and the hope of happiness flood our hearts with sensations as keen as they are diverse?—The spectacle of nature, its contemplation as a whole and in its details, affords the mind a vast, open field of delights."
"Comme si je n’avais pas assez de mes maux, je partage encore volontairement ceux de mille personnages imaginaires, et je les sens aussi vivement que les miens : que de larmes n’ai-je pas versées pour cette malheureuse Clarisse et pour l’amant de Charlotte !","As if I did not have enough of my troubles, I still voluntarily share those of a thousand imaginary characters, and I feel them as keenly as mine: what tears have I not shed for this unfortunate Clarisse and for the Charlotte lover!","As if I had not troubles enough of my own, I share those of a thousand imaginary personages, and I feel them as acutely as my own. How many tears have I shed for that poor Clarissa,[7] and for Charlotte’s[8] lover!","As if I didn’t have enough troubles of my own, I willingly share those of a thousand imaginary characters as well, and feel them as keenly as I do mine: how many tears have I not shed for the unhappy Clarissa and for Charlotte’s lover? *"
