Source,GoogleTranslate,human1,human2
"Périclès, qui s’était approché de la fenêtre, fit un gros soupir, dont je devinai la cause. Il lisait un numéro du Moniteur qui annonçait la décadence des arts et des sciences ; il voyait des savants illustres quitter leurs sublimes spéculations peur inventer de nouveaux crimes ; et il frémissait d’entendre une horde de cannibales se comparer aux héros de la généreuse Grèce, en faisant périr sur l’échafaud, sans honte et sans remords, des vieillards vénérables, des femmes, des enfants, et commettant de sang-froid les crimes les plus atroces et les plus inutiles.","Pericles, who had approached the window, heaved a deep sigh, the cause of which I guessed. He was reading a number of the Moniteur which announced the decadence of the arts and sciences; he saw illustrious scholars abandon their sublime speculations in order to invent new crimes; and he shuddered to hear a horde of cannibals compare themselves to the heroes of generous Greece, by putting to death on the scaffold, without shame and without remorse, venerable old men, women, children, and committing in cold blood the the most heinous and unnecessary crimes.","Pericles, who had drawn near the window, heaved a deep sigh, the cause of which I divined. He was reading a number of the “Moniteur,” which announced the decadence of the arts and sciences. He saw illustrious scholars desert their sublime conceptions to invent new crimes, and shuddered at hearing a rabble herd compare themselves with the heroes of generous Greece; and this, forsooth, because they put to death, without shame or remorse, venerable old men, women, and children, and coolly perpetrated the blackest and most useless crimes.","Pericles, who had approached the window, heaved a great sigh, of which I guessed the cause. He was reading an issue of Le Moniteur, which announced the decline of the arts and sciences; he saw illustrious scholars abandoning their sublime speculations to invent new crimes, and shuddered to hear a horde of cannibals compare themselves to the heroes of valiant Greece as without shame or remorse they sent venerable old men and women and children to their death on the scaffold, committing, in cold blood, the most atrocious and useless crimes."
Chapitre 31,Chapter 31,XXXI. Inventory.,CHAPTER XXXI
Chapitre 6,Chapter 6,VI.,CHAPTER VI
"« Croirai-je, lui répondis-je alors, que ces grands hommes ignorent tout ce que vous venez de leur dire, et que leur âme dégagée des entraves de la matière, trouve quelque chose d’obscur dans toute la nature ? – Ah ! quelle est votre erreur ! s’écria le proto-médecin du Péloponèse ; les mystères de la nature sont cachés aux morts comme aux vivants ; celui qui a créé et qui dirige tout sait lui seul le grand secret auquel les hommes s’efforcent en vain d’atteindre : voilà ce que nous apprenons de certain sur les bords du Styx ; et, croyez-moi, ajouta-t-il en adressant la parole au docteur, dépouillez-vous de ce reste d’esprit de corps que vous avez apporté du séjour des mortels ; et puisque les travaux de mille générations et toutes les découvertes des hommes n’ont pu allonger d’un seul instant leur existence ; puisque Caron passe chaque jour dans sa barque une égale quantité d’ombres, ne nous fatiguons plus à défendre un art qui, chez les morts où nous sommes, ne serait pas même utile aux médecins. » Ainsi parla le fameux Hippocrate, à mon grand étonnement.","“Shall I believe,” I answered him then, “that these great men are unaware of everything you have just told them, and that their soul, freed from the shackles of matter, finds something obscure in all nature? – Ah! what is your mistake! cried the proto-doctor of Peloponnesus; the mysteries of nature are hidden from the dead as well as from the living; he who created and who directs everything alone knows the great secret which men strive in vain to reach: this is what we learn for certain on the banks of the Styx; and, believe me,” he added, speaking to the doctor, “divest yourself of that remnant of esprit de corps which you have brought from mortal abode; and since the work of a thousand generations and all the discoveries of men have not been able to lengthen their existence for a single instant; since Caron spends an equal number of shadows in his boat every day, we no longer tire ourselves of defending an art which, among the dead where we are, would not even be useful to doctors. So spoke the famous Hippocrates, to my astonishment.","“But am I to believe,” I replied, “that these great men were ignorant of all you have been telling them, and that their souls, having shuffled off this mortal coil, still meet with any obscurities in nature?” “Ah! how great is your error!” exclaimed the proto-physician[12] of the Peloponnesus. The mysteries of nature are as closely hidden from the dead as from the living. Of one thing we who linger on the banks of the Styx are certain, that He who created all things alone knows the great secret which men vainly strive to solve. “And,” added he, turning to the doctor, “do be persuaded by me to divest yourself of what still clings to you of the party-spirit you have brought with you from the sojourn of mortals. And since, seeing that Charon daily ferries over in his boat as many shades as heretofore, the labors of a thousand generations and all the discoveries men have made have not been able to prolong their existence, let us not uselessly weary ourselves in defending an art which, among the dead, cannot even profit its practitioners.” Thus, to my great amazement, spoke the famous Hippocrates.","“Am I to believe,” I replied to him, “that these great men know nothing of what you have just told them, and that their souls, released from the shackles of matter, find all of nature somewhat obscure?” “Ah, how mistaken you are!” exclaimed the protophysician* of the Peloponnesus. “The mysteries of nature are concealed from the dead as from the living. Only he who created and rules all knows the great secret that men strive in vain to attain: that is the only sure thing we learn on the banks of the Styx. And take my advice,” he said, turning to the doctor, “cast aside that remnant of esprit de corps that you have brought with you from the realm of the living. Since the labors of a thousand generations, and all the discoveries man has ever made, have not prolonged human life by so much as an instant, and since Charon each day ferries an equal number of shades in his bark, let us cease to trouble ourselves uselessly defending an art that, in the land of the dead where we are, would not be of any use even to doctors.” Thus spoke the celebrated Hippocrates, to my great astonishment."
"Mon âme vit bien qu’elle ne jouait pas le meilleur rôle dans cette occasion ; – elle commençait d’ailleurs à s’apercevoir que la chaleur de la dispute en avait supprimé la cause, et profitant de la circonstance pour faire une diversion : « Faites du café », dit-elle à Joannetti, qui entrait dans la chambre. – Le bruit des tasses attirant toute l’attention de l’insurgente, dans l’instant elle oublia tout le reste. C’est ainsi qu’en montrant un hochet aux enfants, on leur fait oublier les fruits malsains qu’ils demandent en trépignant.","My soul saw well that it did not play the best part on this occasion; – she was beginning, moreover, to perceive that the heat of the argument had removed the cause, and taking advantage of the circumstance to make a diversion: “Make some coffee,” she said to Joannetti, who entered the room. – The noise of the cups attracting all the attention of the insurgent, in an instant she forgot all the rest. This is how by showing a rattle to children, we make them forget the unhealthy fruits they ask for while stamping their feet.","My soul saw very well that the part she was playing on this occasion was no flattering one. She began, too, to perceive that the warmth of the dispute had put the cause of it out of sight. Profiting from this circumstance, she caused a further distraction by saying to Joannetti, who at that moment entered the room, “Make some coffee!” The noise of the cups attracted all the rebel’s attention, who forthwith forgot everything else. In like manner we show children a toy to make them forget the unwholesome fruit for which they beg and stamp.","My soul saw clearly that she was not playing the better part on this occasion;—she was beginning, moreover, to realize that the heat of the dispute had effaced the cause, and so, taking advantage of the circumstance to create a diversion, “Go make some coffee,” she said to Joanetti, as he entered the room. Once the tinkling of the cups attracted the insurgent’s full attention, he quickly forgot all the rest. In the same way, one shows a child a toy to make him forget the unwholesome fruit he demands with stamping feet."
"Je me garde encore avec plus de soin d’en tirer des conséquences générales sur la réalité, la force et la durée de l’affection des dames pour leurs amis. – Je me contente de jeter ce chapitre (puisque c’en est un), de le jeter, dis-je, dans le monde, avec le reste du voyage, sans l’adresser à personne, et sans le recommander à personne.","I am even more careful not to draw any general conclusions from it on the reality, the strength and the duration of the affection of ladies for their friends. – I content myself with throwing away this chapter (since it is one), throwing it, I say, into the world, with the rest of the voyage, without addressing it to anyone, and without recommending it to anyone.","I take special care to deduce therefrom no general conclusions about the reality, the strength, and the duration of the affection of ladies for their friends. I am content to cast this chapter (since it is one) into the world with the rest of my journey, without addressing it to any one, and without recommending it to any one.","I am even more careful not to draw any general conclusions as to the reality, the intensity, and the duration of the affections of Ladies for their friends. I shall limit myself to sending this chapter (since it is, after all, a chapter)—to sending it, I say, out into the world with the rest of the voyage, without addressing it, or recommending it, to anyone."
"Lorsque je porte la main dans ce réduit, il est rare que je m’en tire de toute la journée. C’est ainsi que le voyageur traverse rapidement quelques provinces d’Italie, en faisant à la hâte quelques observations superficielles, pour se fixer à Rome pendant des mois entiers. – C’est la veine la plus riche de la mine que j’exploite. Quel changement dans mes idées et dans mes sentiments ! quelle différence dans mes amis ! Lorsque je les examine alors et aujourd’hui, je les vois mortellement agités par des projets qui ne les touchent plus maintenant. Nous regardions comme un grand malheur un événement ; mais la fin de la lettre manque, et l’événement est complètement oublié : je ne puis savoir de quoi il était question. – Mille préjugés nous assiégeaient ; le monde et les hommes nous étaient totalement inconnus ; mais aussi quelle chaleur dans notre commerce ! quelle liaison intime ! quelle confiance sans bornes !","When I carry my hand in this den, it is rare that I get out of it all day. It is thus that the traveler rapidly crosses several provinces of Italy, hastily making a few superficial observations, to settle in Rome for whole months. – It is the richest vein of the mine that I operate. What a change in my ideas and feelings! what a difference in my friends! When I examine them then and now, I see them mortally agitated by projects that no longer touch them now. We regarded an event as a great misfortune; but the end of the letter is missing, and the event is completely forgotten: I cannot know what it was about. – A thousand prejudices besieged us; the world and men were totally unknown to us; but also what warmth in our business! what an intimate connection! what boundless confidence!","When I put my hand into this recess, I seldom leave the spot for the whole day. In like manner, a traveller will pass rapidly through whole provinces of Italy, making a few hurried and trivial observations on the way, and upon reaching Rome will take up his abode there for months. This is the richest vein in the mine I am exploring. How changed I find my ideas and sentiments, and how altered do my friends appear when I examine them as they were in days gone by, and as they are now! In these mirrors of the past I see them in mortal agitation about plans which no longer disturb them. Here I find an event announced which we evidently looked upon as a great misfortune; but the end of the letter is wanting, and the circumstance is so entirely forgotten that I cannot now make out what the matter was which so concerned us. We were possessed by a thousand prejudices. We knew nothing of the world, and of men. But then, how warm was our intercourse! How intimate our friendship! How unbounded our confidence!","When I put my hand inside that nook, rarely do I escape before the end of the day. Thus does the traveler pass quickly through a few Italian provinces, look at a few things in haste and superficially, only to settle in Rome for months at a time.—I work the mine’s richest vein: how my ideas have changed, and my feelings too! How different my friends are, when I look at them then and now! I see them madly driven by schemes that no longer move them at all! There was one event that we considered a great calamity—but the end of the letter is missing, and the event has been competely forgotten. I shall never know what it was.—We were besieged by a thousand preconceptions: we knew nothing of the world or the people in it; but on the other hand, what fervor in our intercourse! What intimate ties! What boundless confidence!"
"Mon âme, surprise de tant de vivacité et d’éloquence, ne savait que répondre. – Pour arranger l’affaire, elle entreprit de couvrir du voile de la bienveillance les reproches qu’elle venait de se permettre, et, afin de ne pas avoir l’air de faire les premiers pas vers la réconciliation, elle imagina de prendre aussi le ton de la cérémonie. – « Madame, » dit-elle à son tour avec une cordialité affectée… – (Si le lecteur a trouvé ce mot déplacé lorsqu’il s’adressait à mon âme, que dira-t-il maintenant, pour peu qu’il veuille se rappeler le sujet de la dispute ? – Mon âme ne sentit point l’extrême ridicule de cette façon de parler, tant la passion obscurcit l’intelligence !) – Madame, dit-elle donc, je vous assure que rien ne me ferait autant de plaisir que de vous voir jouir de tous les plaisirs dont votre nature est susceptible, quand même je ne les partagerais pas, si ces plaisirs ne vous étaient pas nuisibles et s’ils n’altéraient pas l’harmonie qui… » Ici mon âme fut interrompue vivement : « Non, non, je ne suis point la dupe de votre bienveillance supposée : – le séjour forcé que nous faisons ensemble dans cette chambre où nous voyageons ; la blessure que j’ai reçue, qui a failli me détruire et qui saigne encore ; tout cela n’est-il pas le fruit de votre orgueil extravagant et de vos préjugés barbares ? Mon bien-être et mon existence même sont comptés pour rien lorsque vos passions vous entraînent – et vous prétendez vous intéresser à moi, et vos reproches viennent de votre amitié ! »","My soul, surprised at so much vivacity and eloquence, did not know what to answer. – To settle the matter, she undertook to cover with the veil of benevolence the reproaches she had just allowed herself, and, in order not to appear to be taking the first steps towards reconciliation, she imagined taking too the tone of the ceremony. – “Madame,” she said in her turn with affected cordiality… – (If the reader found this word out of place when addressing my soul, what will he say now, if he wants to remember the subject of the argument?—My soul did not feel the extreme ridiculousness of this way of speaking, so much does passion obscure intelligence!)—Madame, she said, I assure you that nothing would do me so much of pleasure than to see you enjoy all the pleasures of which your nature is susceptible, even if I would not share them, if these pleasures were not harmful to you and if they did not alter the harmony which…” Here my soul was interrupted quickly: “No, no, I am not the dupe of your supposed benevolence: – the forced stay we make together in this room where we travel; the wound I received, which almost destroyed me and which still bleeds; is not all this the fruit of your extravagant pride and your barbarous prejudices? My well-being and my very existence are counted for nothing when your passions carry you away – and you pretend to be interested in me, and your reproaches come from your friendship! »","My soul, surprised at so much vivacity and eloquence, did not know how to reply. In order to settle the dispute amicably, she endeavored to veil with the semblance of good-nature the reproaches that had escaped her. But, that she might not seem to take the first steps towards reconciliation, she affected a formal tone. “Madame,” she said, with assumed cordiality.... If the reader thought the word misplaced when addressed to my soul, what will he say of it now, if he call to mind the cause of the quarrel? But my soul did not feel the extreme absurdity of this mode of expression, so much does passion obscure the intellect! “Madame,” she said, “nothing, be assured, would give me so much pleasure as to see you enjoy those pleasures of which your nature is susceptible, if even I did not participate in them, were it not that such pleasures are harmful to you, injuriously affecting the harmony which....” Here my soul was rudely interrupted, “No, no, I am not the dupe of your pretended kindness. The sojourn we are compelled to make together in this room in which we travel; the wound which I received, which still bleeds, and which nearly destroyed me,—is not all this the fruit of your overweening conceit and your barbarous prejudices? My comfort, my very existence, is counted as nothing when your passions sway you: and then, forsooth, you pretend that you take an interest in my welfare, and that your insults spring from friendship.”","My soul, surprised by such spirit and eloquence, did not know what to reply.—To settle the matter, she attempted to cover in a veil of benevolence the reproaches to which she had just given vent; and to avoid the appearance of taking the first steps toward reconciliation, she likewise thought to assume a tone of ceremony.—“Monsieur,” she said in turn, with affected cordiality.—If the reader found such formality out of place when addressed to my soul, what will he say now, though he may well have no wish to recall the subject of the dispute?—My soul had no idea of the utter ridiculousness of this manner of speaking , so thoroughly does passion obfuscate the intellect!—“Monsieur,” she said, “I assure you that nothing would please me more than to see you enjoy all the pleasures of which your nature is capable, even when I may not share them, if these pleasures were not harmful to you and did not threaten the harmony that—” Here my soul was forcefully interrupted:—“No, no, I’ll not be fooled by your pretended benevolence;—our compulsory stay in this room of our voyage, the wound I received, which nearly destroyed me, and which still bleeds,—are not all these things the fruit of your immoderate pride and your barbarous prejudices? My well-being, indeed, my very existence count for nothing when you are swept away by your passions—and you claim to care about me? And that your reproaches are dictated by our friendship?”"
Mais il faut que j’avoue ici une faiblesse que je me suis souvent reprochée.,But I must confess here a weakness for which I have often reproached myself.,But here I must confess a weakness for which I have often reproached myself.,But here I must confess to a weakness for which I have often reproached myself.
"Non, non, reste, Joannetti ; reste, pauvre garçon ; et toi aussi, ma Rosine, toi qui devines mes peines et qui les adoucis par tes caresses ; viens, ma Rosine, viens. – V consonne et séjour.","No, no, stay, Joannetti; stay, poor boy; and you too, my Rosine, you who guess my sorrows and who soften them with your caresses; come, my Rosine, come. – V consonant and stay.","Consolation. NO, no! Stay, Joannetti, my good fellow! And you too, Rose, you who guess what are my sorrows, and soften them by your caresses, come! V forms the resting-place.","“No, no, please stay, Joanetti, stay, poor boy—and you too, dear Rosine; you who can sense my troubles and allay them with your affections, come, Rosine, come to your letter V and rest.”"
Chapitre 27,Chapter 27,XXVII.,CHAPTER XXVII
"Dire pourquoi je songeai à ces quatre personnages plutôt qu’à d’autres, c’est ce qui ne me serait pas possible. – Qui peut rendre raison d’un songe ? Tout ce que je puis dire, c’est que ce fut mon âme qui évoqua le docteur de Cos, celui de Turin et le fameux homme d’Etat qui fit de si belles choses et de si grandes fautes.","To say why I thought of these four characters rather than others would not be possible for me. – Who can explain a dream? All I can say is that it was my soul that evoked the Doctor of Cos, that of Turin, and the famous statesman who did such fine things and such great faults.","To say why these four personages came into my mind rather than any others, is out of my power; for who can give reasons for what he dreams? All that I can say is that my soul summoned the doctor of Cos, the doctor of Turin, and the famous statesman who did such great things, and committed such grave faults.",It would be impossible to say exactly why I mused upon these four personages instead of others.—Who can explain the reasons for a daydream?—All I can say is that it was my soul that called forth the doctors of Cos and Turin and the famous statesman who had done such wonderful things and made such great mistakes.
