Source,GoogleTranslate,human1,human2
"Não a matei por não ter à mão ferro nem corda, pistola nem punhal; mas os olhos que lhe deitei, se pudessem matar, teriam suprido tudo. Um dos erros da Providência foi deixar ao homem unicamente os braços e os dentes, como armas de ataque, e as pernas como armas de fuga ou de defesa. Os olhos bastavam ao primeiro efeito. Um mover deles faria parar ou cair um inimigo ou um rival, exerceriam vingança pronta, com este acréscimo que, para desnortear a justiça, os mesmos olhos matadores seriam olhos piedosos, e correriam a chorar a vítima. Prima Justina escapou aos meus; eu é que não escapei ao efeito da insinuação, e no domingo, às onze horas, corri à rua dos Inválidos.","I didn't kill her because I didn't have iron or rope, pistol or dagger at hand; but the eyes that I cast him, if they could kill, would have supplied everything. One of the mistakes of Providence was to leave to man only the arms and teeth, as weapons of attack, and the legs as weapons of escape or defense. The eyes were enough for the first effect. A move by them would stop or fall an enemy or a rival, they would exercise ready revenge, with this addition that, to bewilder justice, the same murderous eyes would be pitying eyes, and they would run to weep for the victim. Cousin Justina escaped mine; it was I who did not escape the effect of the insinuation, and on Sunday, at eleven o'clock, I ran to Rua dos Invalidos.","I didn’t kill her because I didn’t have steel or cord, a pistol or a dagger at hand; but the look I gave her, if it could have killed, would have made up for all these things. One of the mistakes of Providence was to have given men only their arms and teeth as offensive weapons, and their legs as means of flight or defense. For the first of these, the eyes should be enough. A single movement of them would make an enemy or a rival stop or fall to the ground, they would carry out swift vengeance, with the added advantage that, to delude justice, these same murderous eyes would be full of mercy, and would make haste to weep for the victim. Cousin Justina escaped mine; but I did not escape from the effect of her insinuation, and on Sunday at eleven, I ran to the Rua dos Inválidos.","I didn’t kill her because I didn’t have handy either steel or cord, pistol or dagger, but the look I threw at her, if it could have killed, would have made up for their lack. One of Providence’s errors is to have given man only his arms and his teeth as weapons of attack and his legs as a means of flight or defence. For the first his eyes ought to be sufficient. One glance from them would halt or fell an enemy or rival and would execute prompt vengeance, with the additional advantage that, to circumvent justice, those same lethal eyes could become tender and hasten to weep for the victim. Cousin Justina escaped from mine, but I did not escape from the effect of her insinuation, and at eleven o’clock on Sunday I ran to the Rua dos Invalidos."
"— Se eu disser a mesma cousa, retorquiu ele sorrindo, perde a graça; parece que estou repetindo. Mas a verdade é que não tenho aqui relações com ninguém, você é o primeiro e creio que já notaram; mas eu não me importo com isso.","—If I say the same thing, he retorted with a smile, it loses the fun; I seem to be repeating. But the truth is that I don't have relationships with anyone here, you are the first and I believe they have already noticed; but I don't care about that.","“If I say the same thing,” he replied with a smile, “it won’t seem so spontaneous; it’ll look as if I’m repeating you. But it’s true that here I have no intimate friends , you are the first, and I think they have already noticed; but that doesn’t matter to me.”","‘If I tell you the same thing,’ he answered with a smile, ‘it won’t sound so good; it will seem as if I am just repeating your words. But it’s true – here I have made friends with no one. You are the first, and I think they have noticed it, but that doesn’t worry me.’"
"Sorriu vexado, e respondeu-me que as mulheres eram criaturas tão da moda e do dia que nunca haviam de entender uma ruína de trinta séculos. Eram dous colegas da universidade. Prometi-lhe recursos, e dei-lhe logo os primeiros dinheiros precisos. Comigo disse que uma das consequências dos amores furtivos do pai era pagar eu as arqueologias do filho; antes lhe pagasse a lepra… Quando esta ideia me atravessou o cérebro, senti-me tão cruel e perverso que peguei no rapaz, e quis apertá-lo ao coração, mas recuei; encarei-o depois, como se faz a um filho de verdade; os olhos que ele me deitou foram ternos e agradecidos.","He smiled vexedly, and replied that women were creatures so fashionable and of the day that they would never understand a ruin of thirty centuries. They were two colleagues from the university. I promised him resources, and I immediately gave him the first necessary monies. He said to me that one of the consequences of his father's furtive love affairs was that I had to pay for his son's archeologies; I would rather pay him for leprosy... When this idea crossed my mind, I felt so cruel and perverse that I took hold of the boy, and wanted to hold him to my heart, but I recoiled; I looked at him afterwards, as one does with a real child; the eyes he gave me were tender and grateful.","He smiled embarrassed, and answered that women were such creatures of fashion and of the present moment, that they would never understand a ruin thirty centuries old. They were two fellow students from the university. I promised him resources, and immediately gave him an advance on the money he needed. To myself I said that one of the consequences of the secret loves of the father was that I was paying for the son’s archaeology; I’d rather have paid for a dose of leprosy … When this idea passed through my brain, I felt so cruel and perverse that I took hold of the lad, and went to embrace him to my heart, but I retreated; then I looked at him, as one does a real son; the look he gave me was tender and grateful.","He smiled but looked annoyed and replied that women were creatures of fashion, so wrapped up in the present that they could never understand a ruin thirty centuries old. They were two university friends. I promised him money and later gave him the necessary funds. To myself I said that one of the consequences of his father’s furtive love affairs was that I should pay for his son to become an archaeologist ; I’d rather he became a leper … No sooner did this thought enter my head than I felt so cruel and perverse that I seized him and would have hugged him to me, but I held back. I gazed at him as one would one’s own son, and the look he gave me was one of tenderness and gratitude."
CXXXII,CXXXII,CXXXII,132
"E, voltando-se para mim:","And, turning to me:","And, turning round to me:","Then, turning to me, he said, ‘It’s a privilege I won’t give up."
— Ele esteve cá?,'Has he been here?',“Has he been here?”,‘Has he been here?’
"Leitor, houve aqui um gesto que eu não descrevo por havê-lo inteiramente esquecido, mas crê que foi belo e trágico. Efetivamente, a figura do pequeno fez-me recuar até dar de costas na estante. Ezequiel abraçou-me os joelhos, esticou-se na ponta dos pés, como querendo subir e dar-me o beijo do costume; e repetia, puxando-me:","Reader, there was a gesture here that I do not describe because I have completely forgotten it, but you believe it was beautiful and tragic. Indeed, the figure of the little one made me back up until my back was against the bookcase. Ezekiel embraced my knees, stretched out on tiptoe, as if wanting to go up and give me the usual kiss; and repeated, pulling me:","Reader, at this point there was a gesture that I won’t describe because I’ve completely forgotten it, but believe me that it was beautiful and tragic. For the figure of the boy made me retreat until I backed into the bookcase. Ezequiel hugged my knees, stood up on the tips of his toes, as if to climb up and give me his usual kiss; and he repeated, tugging at me:","Reader, at this point something happened that I shall not describe since I have completely forgotten it, though it must have been both beautiful and tragic. At the boy’s entrance I retreated until my back was against the bookcase. Ezequiel hugged my knees and stretched up on his toes as if wanting to climb up and give me his customary kiss. He went on tugging at me and repeating, ‘Papa!"
"— Também eu fiquei gostando de todos, mas se é possível fazer distinção, confesso-lhe que sua mãe é uma senhora adorável.","""I liked them all too, but if it's possible to make a distinction, I confess that your mother is a lovely lady.""","“I liked everyone too, but if had to choose between them, I confess that your mother is an adorable lady.”","‘I liked them, too, but if I had to state a preference I must say that I find your mother an adorable lady.’"
"Capitu, a princípio não disse nada. Recolheu os olhos, meteu-os em si e deixou-se estar com as pupilas vagas e surdas, a boca entreaberta, toda parada. Então eu, para dar força às afirmações, comecei a jurar que não seria padre. Naquele tempo jurava muito e rijo, pela vida e pela morte. Jurei pela hora da morte. Que a luz me faltasse na hora da morte se fosse para o seminário. Capitu não parecia crer nem descrer, não parecia sequer ouvir; era uma figura de pau. Quis chamá-la, sacudi-la, mas faltou-me ânimo. Essa criatura que brincara comigo, que pulara, dançara, creio até que dormira comigo, deixava-me agora com os braços atados e medrosos. Enfim, tornou a si, mas tinha a cara lívida, e rompeu nestas palavras furiosas:","Capitu, at first said nothing. He withdrew his eyes, put them to himself and remained with the pupils vacant and deaf, the mouth half-open, completely still. So, to give strength to the statements, I began to swear that I would not be a priest. At that time I swore a lot and sternly, by life and by death. I swore by the hour of death. That the light would fail me at the time of death if I went to the seminary. Capitu didn't seem to believe or disbelieve, didn't even seem to hear; it was a stick figure. I wanted to call out to her, shake her, but I didn't have the courage. This creature that had played with me, that had jumped, danced, I think even slept with me, now left me with my arms tied and afraid. Finally, he came to his senses, but his face was livid, and broke into these furious words:","Capitu at first said nothing. She withdrew her eyes, turned them inwards, and stayed that way, with her pupils vague and sightless, her mouth half open, stock still. Then, to back up what I had said, I began to swear that I would never be a priest. In those days I swore a great deal, each oath more extreme than the last, even by life and death. I swore by the hour of my death. Let the light be taken from me at the hour of my death if I went to the seminary. Capitu seemed neither to believe or disbelieve me: she seemed not even to hear me; it was as if she were made of wood. I wanted to speak to her, to shake her, but I hadn’t the courage. This girl who had been my playmate, jumping around and dancing—I think she’d even slept in the same bed—now left me with my arms paralyzed and afraid. Finally, she came back from her trance, but her face was livid, and she broke out with these furious words:","At first Capitu said nothing. She withdrew her gaze from me and remained still, her eyes expressionless, her mouth half open. Then, to give greater force to my protestations, I swore to her that I would not be a priest. In those days it was the custom to swear up hill and down dale, by one’s life and by one’s death. I swore by the hour of my death that at the moment of my death the light would be taken from me if I went to the seminary. Capitu seemed neither to believe nor disbelieve me; she seemed not even to hear me but stood there like a block. The girl who had played with me, who had jumped and danced and I even think had slept with me, left me now helpless and half scared. Finally she recovered her composure, but her face was livid, and she spat out furiously, ‘Sanctimonious simpleton!"
— Coitado de Manduca!,— Poor Manduca!,“Poor Manduca!”,"Before passing through, just as I had remembered the words of the dead boy’s father, I now heard those of his mother, and I murmured them to myself: ‘Poor Manduca!’"
"Agora é que o lance é o mesmo; mas se conto aqui, tais quais, os dous lances de há quarenta anos, é para mostrar que Capitu não se dominava só em presença da mãe; o pai não lhe meteu mais medo. No meio de uma situação que me atava a língua, usava da palavra com a maior ingenuidade deste mundo. A minha persuasão é que o coração não lhe batia mais nem menos. Alegou susto, e deu à cara um ar meio enfiado; mas eu, que sabia tudo, vi que era mentira e fiquei com inveja. Foi logo falar ao pai, que apertou a minha mão, e quis saber por que a filha falava em protonotário apostólico. Capitu repetiu-lhe o que ouvira de mim, e opinou logo que o pai devia ir cumprimentar o padre em casa dele; ela iria à minha. E coligindo os petrechos da costura, enfiou pelo corredor, bradando infantilmente:","Now the bid is the same; but if I recount the two moves from forty years ago, as they were, it is to show that Capitu did not dominate herself only in the presence of her mother; his father no longer scared him. In the midst of a situation that tied my tongue, I used the word with the greatest naivety in the world. My persuasion is that her heart didn't beat more or less. He claimed to be frightened, and gave his face a half-shrugged look; but I, who knew everything, saw that it was a lie and was jealous. He immediately went to speak to his father, who shook my hand, and wanted to know why his daughter spoke in protonotary apostolic. Capitu repeated to him what he had heard from me, and immediately suggested that his father should go and greet the priest at his house; she would go to mine. And gathering up her sewing supplies, she went down the hall, crying childishly:","Now the scene is the same as the previous one; but if I recount here, after forty years, the twin situations just as they happened, it is to show that Capitu was not only able to control herself in her mother’s presence; she was no more afraid of her father. In the midst of a crisis which left me tongue-tied, she expressed herself as innocently as could be. I am persuaded that her heart beat no faster or slower. She said she had been startled, and put on a rather annoyed look; but I, who knew what had happened, saw it was a pretence and felt envious. She went to greet her father, who shook my hand and wanted to know why his daughter was talking about protonotaries apostolic. Capitu repeated to him what she had heard from me, and immediately expressed the opinion that he ought to go and congratulate the priest at his house; she would go to mine. And so, gathering her sewing things, she ran down the corridor, shouting like a child:","Her performance was the same as before, and if I describe them both here after an interval of forty years, it is to show that Capitu could control herself not only in the presence of her mother but that her father inspired no greater fear. In a situation that left me tongue-tied, she could converse with the most disarming innocence. I am convinced that her heart beat neither faster nor slower. She claimed she had had a fright and assumed a slightly shocked expression; but I, who knew the truth, saw that it was a sham and could only feel envious. I went up to her father, who shook me by the hand and wanted to know why his daughter was talking about an apostolic protonotary. Capitu repeated what I had told her, saying that she thought he should go and congratulate the priest in his own house; she would do so in mine. So saying, she gathered up her sewing things and ran into the corridor, crying out in a childish manner, ‘Mamma, let’s have dinner."
"Nos dias seguintes, continuou a entrar e sair de casa, cosido à parede, cara no chão. Não era o mesmo homem que estragava o chapéu em cortejar a vizinhança, risonho, olhos no ar, antes mesmo da administração interina. Vieram as semanas, a ferida foi sarando. Pádua começou a interessar-se pelos negócios domésticos, a cuidar dos passarinhos, a dormir tranquilo as noites e as tardes, a conversar e dar notícias da rua. A serenidade regressou; atrás dela veio a alegria, um domingo, na figura de dous amigos, que iam jogar o solo, a tentos. Já ele ria, já brincava, tinha o ar do costume; a ferida sarou de todo.","Over the next few days, he continued to walk in and out of the house, sewn to the wall, face down. He was not the same man who spoiled his hat in courting the neighborhood, smiling, eyes in the air, even before the interim administration. The weeks came, the wound was healing. Padua began to take an interest in domestic affairs, taking care of the birds, sleeping peacefully at night and in the afternoon, talking and giving news from the street. Serenity returned; behind her came joy, one Sunday, in the figure of two friends, who were going to play the soil, trying to play. Already he was laughing, already joking, he had the usual air; the wound has completely healed.","On the next few days, he went in and out of the house, as if he were trying to hide, and with his eyes on the ground. He was not the same man who wore his hat out greeting the neighbors, smiling, looking straight ahead of him, even before the temporary directorship. As the weeks went by, the wound began to heal. Pádua began to take an interest in the home again, to look after his birds, to sleep well at night and during the siesta, to chat and retail local gossip. His serenity came back; and in its wake came happiness, in the form of two friends, who came round one Sunday to play a game of solo, with tokens instead of money. He laughed, he joked, he was his usual self; the wound had healed completely.","In the days that followed he would enter and leave the house glued to the wall, with his head down. He was no longer the same man who wore out his hat in greeting the neighbours, beaming round him happily, even before his temporary directorship. As the weeks passed Pádua slowly recovered. He began to interest himself in domestic matters, to care for his birds, to sleep peacefully every night and afternoon, to converse and bring back news from town. His serenity returned and with it some cheerfulness apparent when two friends came one Sunday to play solo for counters. Once again he was laughing, joking in his old habitual manner. The wound was completely cured."
— Então parece-lhe…?,"""So it seems to you…?""",“So you think…?”,‘Do I really look … ?’
— Diga se promete.,- Tell me if you promise.,“Say you promise.”,‘Say you’ll promise.’
"Concertou a capinha e ergueu-se. Suspirou, creio que suspirou, enquanto eu, que não pedia outra cousa mais que a plena justificação dela, disse-lhe não sei que palavras adequadas a este fim. Capitu olhou para mim com desdém, e murmurou:","He fixed the cape and stood up. She sighed, I think she sighed, while I, who asked for nothing more than her full justification, spoke to her I don't know what words were adequate for this purpose. Capitu looked at me with disdain, and muttered:","She adjusted her short cape and stood up. She sighed, I think she sighed, while I, who wanted nothing more than her complete vindication, said some words I can’t remember to this effect. Capitu looked at me disdainfully, and murmured:","She adjusted her shawl and stood up. She sighed , at least I think she sighed, while I, who wanted nothing other than a full acquittal, muttered some words to this effect. Capitu gave me a look of contempt and murmured, ‘I know the reason."
"Em tudo isso mostrava a minha amiga tanta lucidez que eu bem podia deixar de citar um terceiro exemplo, mas os exemplos não se fizeram senão para ser citados, e este é tão bom que a omissão seria um crime. Foi à minha terceira ou quarta vinda à casa. Minha mãe depois que lhe respondi às mil perguntas que me fez sobre o tratamento que me davam, os estudos, as relações, a disciplina, e se me doía alguma cousa, e se dormia bem, tudo o que a ternura das mães inventa para cansar a paciência de um filho, concluiu voltando-se para José Dias.","In all this my friend showed so much lucidity that I could well have failed to mention a third example, but the examples were only made to be cited, and this one is so good that the omission would be a crime. It was my third or fourth visit to the house. My mother, after I answered the thousand questions she asked me about the treatment they gave me, studies, relationships, discipline, and if anything hurt me, and if I slept well, everything that the tenderness of mothers invents to tire me out. the patience of a son, he concluded, turning to José Dias.","In all this my companion gave evidence of such clear thinking that there is almost no need for me to cite a third example, but what are examples for but citing, and this is such a good one that it would be a crime to omit it. It was on my third or fourth visit home. My mother, after I had replied to a thousand questions about the way I was treated, my studies, my friendships, the discipline, and if anything was hurting, if I was sleeping well, everything that a mother’s tenderness can invent to try the patience of her son, ended by turning to José Dias:","In all this Capitu showed such good sense that I might well omit citing a third example, but what are examples for if not to be cited? And this one is so good that to omit it would be a crime. It was my third or fourth visit home. After I had replied to the thousand questions my mother asked concerning how I was treated, my studies, my friends, the discipline, whether I felt ill, whether I slept well and everything else that a mother’s tenderness can invent to exhaust the patience of a son, she turned to José Dias and said, ‘Senhor José Dias, do you still have doubts about them making him into a good priest?’"
— Hoje não dei lição; tive férias.,— I didn't teach today; I had a vacation.,“I didn’t have a lesson today; I got a holiday.”,‘I didn’t have a lesson today.
"— As promessas devem ser cumpridas conforme Deus quer. Suponha que Nosso Senhor nega disposição a seu filho, e que o costume do seminário não lhe dá o gosto que me concedeu a mim, é que a vontade divina é outra. A senhora não podia pôr em seu filho, antes de nascido, uma vocação que Nosso Senhor lhe recusou…","— Promises must be fulfilled as God wills. Suppose Our Lord denies his son his disposition, and that the seminary custom does not give him the pleasure he gave me, it is because the divine will is different. You could not put in your child, before it was born, a vocation that Our Lord refused him...","“Promises should be fulfilled as God wills it. Suppose that Our Lord refuses to incline your son to the Church, and that he does not get the pleasure from the habits of seminary life that God gave me, then it must be that God’s will is otherwise. You could not have given your son, before he was born, a vocation that Our Lord has refused him …”","‘Promises must be kept, as God requires. Now, supposing God withholds this disposition from your son and the seminary does not inspire in him that enthusiasm which He granted to me, it is because the divine will sees otherwise. You cannot instil into your unborn son a vocation that Our Lord himself has refused.’"
— Vou fazer uma visita.,“I'm going to pay a visit.,“I’m going to pay a visit.”,‘I’m going to pay a visit.’
"— Escobar é muito meu amigo, Capitu!","— Escobar is a very good friend of mine, Capitu!","“Escobar is my very good friend, Capitu!”","‘Escobar is my best friend, Capitu.’"
LXXIX,LXXIX,LXXIX,79
"Tínhamos outra vez andado, subimos ao terraço, e olhamos para o mar.","We had walked again, went up to the terrace, and looked out to sea.","We had gone on again: we went up to the terrace, and looked out towards the sea.","We set off again, walked up on to the terrace and gazed out over the sea."
