Source,GoogleTranslate,human1,human2
"— Ainda que você case com outra, cumprirei o meu juramento, não casando nunca.","""Even if you marry another, I will keep my oath, never marrying.""","“Even if you marry someone else, I’ll keep my oath, and never marry.”",She swore twice and then added a third: ‘Even if you marry someone else I shall keep my vow and never marry.’
— Vou pedir a mamãe.,“I'll ask Mom.,“I’ll ask Mamma.”,‘I’ll go and ask my mother.’
— Olha o comandante! Olha o cavalo do comandante! Olha os soldados!,— Look at the commander! Look at the commander's horse! Look at the soldiers!,“Look at the commander! Look at his horse! Look at the soldiers!”,‘Look at the captain! Look at the captain’s horse! Look at the soldiers!’
— Fiquemos ainda mais amigos que até aqui.,— Let's become even more friends than we have been.,“Let’s be even firmer friends than we have been up to now.”,‘We’ll be closer friends than ever before.’
"— Vamos, são horas…","""Come on, it's time...","“Come, it’s time …”",‘It’s time we left.’
LXVI,LXVI,LXVI,66
"— Um moço sem gosto nenhum à vida eclesiástica pode acabar por ser muito bom padre; tudo é que Deus o determine. Não me quero dar por modelo, mas aqui estou eu que nasci com a vocação da medicina; meu padrinho, que era coadjutor de Santa Rita, teimou com meu pai para que eu me metesse no seminário; meu pai cedeu. Pois, senhor, tomei tal gosto aos estudos e à companhia dos padres, que acabei ordenando-me. Mas, suponha que não acontecia assim, e que eu não mudava de vocação, o que é que acontecia? Tinha estudado no seminário algumas matérias que é bom saber, e são sempre melhor ensinadas naquelas casas.","— A young man with no taste for ecclesiastical life can end up being a very good priest; everything is for God to determine. I don't want to use myself as a model, but here I am who was born with the vocation of medicine; my godfather, who was a coadjutor of Santa Rita, insisted with my father for me to enter the seminary; my father gave in. Well, sir, I took such a liking to studies and the company of priests that I ended up being ordained. But suppose it didn't happen that way, and I didn't change my vocation, what would happen? I had studied in the seminary some subjects that are good to know, and they are always better taught in those houses.","“A boy with no taste for the life of the church may well end up by being a very good priest; all is as God determines. I don’t want to set myself up as an example, but look at me : I was born with a vocation for medicine; my godfather, who was curate at the church of Santa Rita, kept on at my father to send me to the seminary, and my father gave way. Well, sir, I enjoyed the lessons and the company of the priests so much that I ended up taking orders. But suppose things had not happened that way, and that I had not changed my vocation, what would have happened? I would have studied some subjects it is useful to know, and which are always better taught in such places.”","‘A young man with no inclination for the Church can turn out to be a very good priest; all is as God determines. I don’t wish to set myself up as an example, but it happens that I was born with a vocation for medicine. My godfather, who was coadjutor of Santa Rita, insisted that my father should send me to the seminary, and my father agreed. Well, senhor, I found so much pleasure in my studies and the company of the priests that I ended up being ordained. But suppose things hadn’t worked out like that and I hadn’t changed my vocation, what would have happened? I should have studied some subjects which it is useful to know and which are always better taught in those schools.’"
"Os olhos com que me disse isto eram embuçados, como espreitando um gesto de recusa ou de espera. Contava com a minha debilidade ou com a própria incerteza em que eu podia estar da paternidade do outro, mas falhou tudo. Acaso haveria em mim um homem novo, um que aparecia agora, desde que impressões novas e fortes o descobriam? Nesse caso era um homem apenas encoberto. Respondi-lhe que ia pensar, e faríamos o que eu pensasse. Em verdade vos digo que tudo estava pensado e feito.","The eyes with which he said this to me were hooded, as if watching for a gesture of refusal or waiting. I was counting on my weakness or on the very uncertainty that I could be in the paternity of the other, but everything failed. Was there a new man in me, one who appeared now, since new and strong impressions discovered him? In this case it was just a covert man. I replied that I would think about it, and we would do what I thought. Truly I say to you that everything was thought and done.","The eyes with which she said this were veiled, as if looking out for a gesture of refusal or postponement. She was counting on my weakness or even on any uncertainty I might have as to the paternity of the boy, but everything failed. Perhaps there was a new man inside me, who came to the surface now, now that new and strong feelings had flushed him out? In that case the new man had merely been hidden. I replied that I was going to think, and we would do whatever I decided. In truth, I can tell you that everything had been thought out and concluded on.","Her eyes, as she said this, were hesitant, as if expecting a refusal or a plea for delay. She was counting on my weakness or possible uncertainty regarding the paternity of the child, but she failed completely. Was there now within me a different man, one who was only revealed after the impact of new, powerful emotions? If so it was a shadowy figure. I replied that I would think about it, and we would do whatever I decided was best. To be frank with you, my mind was already made up."
"Ganha-se a vida, perde-se a batalha!","Life is won, battle is lost!","“The battle may be lost, but life is won!”","Though the battle may be lost, life is won!"
Ideia sem pernas e ideia sem braços,Idea without legs and idea without arms,"Idea without Legs, Idea without Arms",FLIGHTS OF THE IMAGINATION
"— A vida é uma ópera e uma grande ópera. O tenor e o barítono lutam pelo soprano, em presença do baixo e dos comprimários, quando não são o soprano e o contralto que lutam pelo tenor, em presença do mesmo baixo e dos mesmos comprimários. Há coros numerosos, muitos bailados, e a orquestração é excelente…","— Life is an opera and a grand opera. The tenor and the baritone fight for the soprano, in the presence of the bass and the primaries, when it is not the soprano and the alto that fight for the tenor, in the presence of the same bass and the same primaries. There are numerous choirs, many ballets, and the orchestration is excellent…","“Life is an opera, and grand opera at that. The tenor and the baritone contend for the soprano, in the presence of the bass and the supporting cast, unless it’s the soprano and the contralto contending for the tenor, in the presence of the same bass and the same supporting cast. There are numerous choruses and ballets, the orchestration is excellent.…”","One night, after a generous helping of Chianti, he repeated his customary assertion, and when I said that life might just as well be a sea voyage or a battle as an opera, he shook his head and replied, ‘Life is an opera: a grand opera. The tenor and the baritone contend for the soprano in the presence of the bass and supporting cast, or else it is the soprano and the contralto who contend for the tenor in the presence of the same bass and the same supporting cast. There are numerous choruses and ballets, and the orchestration is magnificent"
"José Dias correu os dedos pelos suspensórios com um gesto de impaciência, apertou os beiços, até que formalmente rejeitou o alvitre.","José Dias ran his fingers over his suspenders with a gesture of impatience, pressed his lips together, until he formally rejected the suggestion.","José Dias ran his fingers up and down his braces with an impatient gesture, pursed his lips, and then formally rejected the notion.","José Dias ran his fingers up and down his braces with a gesture of impatience, keeping his lips firmly compressed until he formally rejected the suggestion."
"… As invejas morreram, as esperanças nasceram, e não tardou que viesse ao mundo o fruto delas. Não era escasso nem feio, como eu já pedia, mas um rapagão robusto e lindo.","… Envy died, hopes were born, and it was not long before their fruit came into the world. He wasn't sparse or ugly, as I was already asking, but a robust and handsome young man.","… Our envy died, hopes were born, it was not long before their fruit came into the world. He wasn’t thin or ugly, as I had begged, but a handsome, robust, healthy boy.","Our envy came to an end; hopes were born and before long their fruit made its appearance in the world. It was neither wretched nor ugly, as I had asked, but a fine, strapping boy."
"— Mas, sr. José Dias, tenho visto os pequenos brincando, e nunca vi nada que faça desconfiar. Basta a idade; Bentinho mal tem quinze anos. Capitu fez catorze à semana passada; são dous criançolas. Não se esqueça que foram criados juntos, desde aquela grande enchente, há dez anos, em que a família Pádua perdeu tanta cousa; daí vieram as nossas relações. Pois eu hei de crer…? Mano Cosme, você que acha?","— But, Mr. José Dias, I've seen the little ones playing, and I've never seen anything that makes them suspicious. Just age; Bentinho is barely fifteen years old. Capitu turned fourteen last week; they are two children. Don't forget that they were raised together, ever since that great flood ten years ago when the Padua family lost so much; that's where our relationships came from. Well, shall I believe…? Bro Cosme, what do you think?","“But, Senhor José Dias, I’ve seen the two children playing together, and I’ve never seen anything suspicious. Look at their ages: Bento’s hardly fifteen. Capitu was fourteen last week; they’re two children. Don’t forget, they’ve been brought up together, after that great flood, ten years ago , when the Páduas lost so much; that’s how we came to know one another. And now you expect me to believe…? What do you think, brother Cosme?”","‘But, Senhor José Dias, I’ve seen the two playing together and noticed nothing whatever suspicious. Think of their age: Bentinho is barely fifteen, and Capitu was fourteen only last week. They are only children. Don’t forget they have been brought up together ever since that great flood in which the Pádua family lost so much. That was when we got to know each other. And now you expect me to believe … What do you think, Brother Cosme?’"
"— Mas falou à toa? perguntei, a ver se ela contava a denúncia do meu namoro com a vizinha.","'But did you speak for nothing?' I asked, to see if she told the complaint about my relationship with the neighbor.","“But did he just speak for no special reason?” I asked, to see if she would talk about his revelation of my dalliance with our nextdoor neighbor.","‘Was it just gossip?’ I asked, to find out whether she would mention his accusation about my relations with Capitu."
"Capitu fitou-me rindo, e replicou que a culpa de romper o segredo era minha. Ergueu-se, foi ao quarto e voltou com dez libras esterlinas, na mão; eram as sobras do dinheiro que eu lhe dava mensalmente para as despesas.","Capitu looked at me laughing, and replied that it was my fault for breaking the secret. He got up, went to his room, and returned with ten pounds sterling in his hand; it was the leftover money I gave him monthly for expenses.","Capitu looked at me laughing, and answered that I was the one to blame for breaking the secret. She got up, went into the room, and came back with ten pounds sterling in her hand; it was the leftovers from the money I gave her monthly for household expenses.","Capitu looked up at me and laughed and said that it was my fault for breaking the secret. Then she got up, went to the bedroom and returned with ten pounds sterling in her hand; they were what she had saved from the housekeeping money I gave her every month."
"— Que há de ser? Quem é que não sabe tudo?… Aquela intimidade de vizinhos tinha de acabar nisto, que é verdadeiramente uma benção do céu, porque ela é um anjo, é um anjíssimo… Perdoe a cincada, Bentinho, foi um modo de acentuar a perfeição daquela moça. Cuidei o contrário, outrora; confundi os modos de criança com expressões de caráter, e não vi que essa menina travessa e já de olhos pensativos era a flor caprichosa de um fruto sadio e doce… Por que é que não me contou também o que outros sabem, e cá em casa está mais que adivinhado e aprovado?","— What is it to be? Who doesn't know everything?... That intimacy between neighbors had to end with this, which is truly a blessing from heaven, because she's an angel, she's an angel... Forgive the cincada, Bentinho, it was a way of accentuating the girl's perfection. . I took care of the opposite, in the past; I confused childish ways with expressions of character, and I didn't see that this mischievous girl with already thoughtful eyes was the capricious flower of a healthy and sweet fruit... Why didn't you also tell me what others know, and here at home is it more than guessed and approved?","“What do you think? Who doesn’t know all about it? … That neighborly intimacy was bound to end in this, and it is truly a blessing from heaven, for she is an angel, the angelest … Pardon the solecism, Bentinho, it’s a way of underlining the young lady’s perfection. Years ago, I thought differently; I confused her childish ways with expressions of character, and didn’t see that that mischievous girl, already with her thoughtful eyes, was the capricious bloom which would produce such a sweet, wholesome fruit … Why didn’t you tell me what others know, and is well known and approved of here at home?”","‘What could be the matter? Who is there who doesn’t know all about it? Being such close neighbours it could only end up like this, which is really a blessing from heaven since she is an angel, the most blessed of angels … Forgive the exaggeration, Bentinho, it was just a way of emphasizing the girl’s perfections. I used to think otherwise, but I mistook the ways of a child for expressions of character, not realizing that the mischievous girl with the thoughtful eyes was the capricious blossom of a sweet, wholesome fruit. Why didn’t you tell me what everyone else knows and what is common knowledge here at home and generally approved?’"
"— Não acha? continuou ele. Consulte sobre isto o protonotário; ele lhe dirá se não é a mesma cousa, ou eu mesmo consulto, se quer; e se ele hesitar, fala-se ao sr. bispo.","- Do not you think? he continued. Consult the protonotary on this; he'll tell you if it's not the same thing, or I'll consult it myself, if he wants to; and if he hesitates, speak to mr. Bishop.","“Don’t you think so? ,” he went on, “ Consult the protonotary about it; he’ll tell you if it’s not the same thing, and I’ll consult him myself, if you want; and if he hesitates, we’ll speak to the bishop.”","‘Don’t you agree?’ he went on. ‘ Speak to the Protonotary about it. He’ll tell you whether or not it’s the same thing, or if you like I’ll speak to him. If he demurs, speak to the bishop.’"
A amizade de Escobar fez-se grande e fecunda; a de José Dias não lhe quis ficar atrás. Na primeira semana disse-me este em casa:,Escobar's friendship became great and fruitful; that of José Dias did not want to be left behind. In the first week he told me this at home:,"Escobar’s friendship became great and fruitful; that of José Dias refused to lag far behind. The next week he said to me, at home:","My friendship with Escobar became close and fruitful and that with José Dias scarcely less so. During the first week the latter said to me at home, ‘It’s now certain that you’ll be leaving the seminary.’"
O desespero,The despair,Despair,DESPERATION
LXXXVIII,LXXXVIII,LXXXVIII,88
— Posso confessar?,— May I confess?,“Can I admit that in confession?”,‘Can I say that in confession?’
"Não lhe arranquei mais nada. Os outros todos, como se houvessem passado palavra, repetiam a mesma cantilena. Talvez esse discreto silêncio sobre os textos roídos, fosse ainda um modo de roer o roído.","I didn't take anything from him anymore. All the others, as if they had passed the word, repeated the same chant. Perhaps this discreet silence about the gnawed texts was still a way of gnawing the gnawed.","I could get no more out of him. As if the word had been passed along, all the others told the same story. Perhaps this discreet silence about the texts they were chewing was another way of chewing what had already been chewed.","I could get nothing more from him. And all the others, as if by mutual consent, repeated the same story. Perhaps this discreet silence concerning the eaten texts was just another way of devouring again what had already been eaten."
— Não; é porque Ezequiel imita os gestos dos outros.,- No; it is because Ezekiel imitates the gestures of others.,“No; it’s because Ezequiel imitates other people’s gestures.”,"‘No, it’s because Ezequiel likes to imitate other people,’ I explained."
Uma vela aos sábados,A candle on Saturdays,A Candle on Saturdays,A CANDLE ON SATURDAYS
"— E era inocente, vinha eu dizendo rua abaixo; — que faria o público, se ela deveras fosse culpada, tão culpada como Capitu? E que morte lhe daria o mouro? Um travesseiro não bastaria; era preciso sangue e fogo, um fogo intenso e vasto, que a consumisse de todo, e a reduzisse a pó, e o pó seria lançado ao vento, como eterna extinção…","— And he was innocent, I was saying down the street; — what would the public do, if she were indeed guilty, as guilty as Capitu? And what death would the Moor give him? A pillow would not suffice; it took blood and fire, an intense and vast fire, that would consume it completely, and reduce it to dust, and the dust would be thrown to the wind, like eternal extinction...","“And she was innocent,” I said over and over as I walked down the street, “what would the public do if she were really guilty, as guilty as Capitu? And what death would the moor give her then? A pillow would not be enough; he would need blood and fire, a vast, intense fire, which would consume her completely, reduce her to dust, and the dust would be thrown to the winds, extinguished for ever …”","And she was innocent, I said to myself as I walked home. What would the audience do if she had been guilty, as guilty as Capitu? And how would the Moor kill her? A pillow would not serve; it would need blood and fire, a huge roaring fire to consume her entirely, reduce her to dust – a dust that the wind would whirl away to everlasting extinction …"
"Tomamos depressa. Durante ele, Escobar olhava para mim desconfiado, como se cuidasse que eu recusava a circunstância nova por forrar-me a escrevê-la; mas tal suspeita não ia com a nossa amizade.","We take it quickly. During it, Escobar looked at me suspiciously, as if he thought I was refusing the new circumstance because I was forced to write it; but such suspicion did not go with our friendship.","We did so. While we were having it, Escobar was looking at me warily, as if he thought that I was rejecting this new circumstance to avoid having to write it out; but such a suspicion was unworthy of our friendship.","‘We’ll have a quick cup.’ We did so, and while we were drinking it Escobar looked at me as though he thought I rejected his information to save myself the trouble of noting it down, but we were too close friends for him to have such a suspicion."
"O nosso castelo era sólido, mas um domingo… Na véspera tínhamos passado a noite no Flamengo, não só os dous casais inseparáveis, como ainda o agregado e prima Justina. Foi então que Escobar, falando-me à janela, disse-me que fôssemos lá jantar no dia seguinte; precisávamos falar de um projeto em família, um projeto para os quatro.","Our castle was solid, but on a Sunday… The day before, we had spent the night in Flamengo, not only the two inseparable couples, but also our partner and cousin Justina. It was then that Escobar, speaking to me at the window, told me to go there for dinner the next day; we needed to talk about a family project, a project for the four of us.","Our castle was solid, but one Sunday … The previous day we had spent the evening at Flamengo, not only the two inseparable couples, but also the dependent and cousin Justina. It was then that Escobar, speaking to me in the window, invited us for dinner there the next evening; he wanted us to talk about a family project, a project for the four of us.","Our castle was solidly built, but one Sunday … The day before, we had spent the evening at Flamengo, not just the two inseparable couples but also José Dias and Cousin Justina. It was then that Escobar spoke to me by the window, inviting us to have dinner with them next day to discuss a family project; a project for the four of us."
A mão de Sancha,Sancha's hand,Sancha’s Hand,SANCHA’S HAND
XXXIV,XXXIV,XXXIV,34
"— Anda apanhar um capotinho, Capitu, dizia-lhe ele.","—Go get a little cloak, Capitu, he would tell her.","“Come and get a drubbing, Capitu,” he would say to her.","‘Come and let me give you a good drubbing, Capitu,’ he would say to her."
"— Não há de ser assim, continuei. Dizem que não estamos em idade de casar, que somos crianças, criançolas, — já ouvi dizer criançolas. Bem; mas dous ou três anos passam depressa. Você jura uma cousa? Jura que só há de casar comigo?","""It doesn't have to be that way,"" I continued. They say we're not of marriageable age, that we're children, childish — I've heard childish. Well; but two or three years pass quickly. Do you swear to something? Do you swear you'll only marry me?","“I’m not having it,” I went on. “They say that we’re not old enough to marry, that we’re children, youngsters—that’s what I’ve heard them say, youngsters. Fine: but two or three years will soon be over. Will you swear something? Swear that you’ll marry no one but me?”","‘It doesn’t have to be like that,’ I went on. ‘They say that we aren’t old enough to marry, that we’re just children, whippersnappers – I’ve heard them say whippersnappers. Anyway, two or three years soon pass. Will you swear one thing? Will you swear that you’ll marry nobody but me?’"
"— Quem [se] importará com datas, filiação, nem nomes, depois que eu acabar?","“Who [cares] about dates, parentage, or names, after I'm done?","“Who’ll care about dates, parentage, and names, when I go?”","‘Who will worry about dates, parentage or names once I am gone?’"
"Poucos teriam ânimo de confessar aquele meu pensamento da rua de Matacavalos. Eu confessarei tudo o que importar à minha história. Montaigne escreveu de si: ce ne sont pas mes gestes que j’écris; c’est moi, c’est mon essence. Ora, há só um modo de escrever a própria essência, é contá-la toda, o bem e o mal. Tal faço eu, à medida que me vai lembrando e convindo à construção ou reconstrução de mim mesmo. Por exemplo, agora que contei um pecado, diria com muito gosto alguma bela ação contemporânea, se me lembrasse, mas não me lembra; fica transferida a melhor oportunidade.","Few would have the courage to confess that thought of mine on Rua de Matacavalos. I will confess everything that matters to my story. Montaigne wrote of himself: ce ne sont pas mes gestes que j'écris; c'est moi, c'est mon essence. Now, there is only one way to write the essence itself, and that is to tell it all, the good and the bad. This I do, as it reminds me and invites me to construct or reconstruct myself. For example, now that I have recounted a sin, I would gladly say some beautiful contemporary action, if I remembered, but I don't; the best opportunity is transferred.","Few would have the courage to confess that thought I had in the Rua de Matacavalos. I will confess everything of importance to my story. Montaigne wrote of himself: ce ne sont pas mes gestes que j’escris; c’est moi, c’est mon essence. * Well, there is only one way of putting one’s essence onto paper, and that is by telling it all, the good and the bad. That is what I am doing, as I remember it and as it fits into the construction or reconstruction of my self. For example, now that I have recounted a sin, I would happily tell the story of some good deed done at that time, if I could remember one, but I can’t; it can wait for a better opportunity.","Few would have the courage to confess the thought that came to me in the Rua de Matacavalos, but my intention is to confess everything of importance to my story. Montaigne wrote of himself: Ces ne sont pas mes gestes que j’écris; c’est moi, c’est mon essence. Now, there is only one way to write one’s very essence, and that is to include everything, the good and the bad. That is what I am doing in so far as I remember whatever is pertinent to the creation or re-creation of myself. For example, now that I have confessed a sin, nothing would please me more than to relate some fine action of mine at that time, if I could remember one; but I can’t remember any. I’ll postpone it until I find a better opportunity."
