Source,GoogleTranslate,human1,human2
"- Oggi però questa stanza è mia - disse il burattino - e se vuoi farmi un vero piacere, vattene subito, senza nemmeno voltarti indietro.","- Today, however, this room is mine - said the puppet - and if you want to do me a real pleasure, leave immediately, without even looking back.","“Well it’s my room now,” said the puppet, “and if you’d like to do me a big favor, leave right now and don’t look back.”","""Now, however, this room is mine,"" said the puppet, ""and if you would do me a pleasure go away at once, without even turning round."""
"- E rimase lì perplesso. A ogni modo, bisognava prendere una risoluzione: o a scuola, o a sentire i pifferi.","And he stood there perplexed. In any case, a resolution had to be made: either at school, or listening to the fifes.","And there he stood, uncertain. One thing was sure: he had to do something, either go to school or listen to the fifes.","And he remained irresolute. It was, however, necessary to come to a decision."
- La Fata dorme e non vuol essere svegliata.,- The Fairy sleeps and does not want to be awakened.,“The Fairy is sleeping and doesn’t wish to be disturbed.”,"""The Fairy is asleep and must not be wakened."""
"E tornò a guardarlo attentamente, e dopo averlo guardato ben bene per ogni verso, finì col dire:","And he looked at him carefully again, and after having looked at him well in every direction, he ended by saying:","And he looked him over carefully again, and after scrutinizing him from every angle, he declared, “I know—","And he looked at him again attentively, and having examined him well all over, he ended by saying:"
"- Buone queste triglie! - disse, guardandole e annusandole con compiacenza. E dopo averle annusate, le scaraventò in una conca senz'acqua.","- These mullet are good! he said, looking at them and smelling them complacently. And after sniffing them, he threw them into a waterless basin.","“Tasty, these goatfish!” he said, eyeing them and sniffing them with pleasure. After sniffing them, he tossed them into a big bucket with no water in it.","""These mullet are good!"" he said, looking at them and smelling them complacently. And after he had smelt them he threw them into a pan without water."
- Ho lo stesso male anch'io.,- I have the same pain too.,“I’ve got the same pain myself.”,"""Mine is also paining me."""
"Perché bisogna sapere che, mentre tutti gli uomini, quando si sentono impietositi per qualcuno, o piangono, o per lo meno fanno finta di rasciugarsi gli occhi, Mangiafoco, invece, ogni volta che s'inteneriva davvero aveva il vizio di starnutire. Era un modo come un altro, per dare a conoscere agli altri la sensibilità del suo cuore.","Because you need to know that, while all men, when they feel pity for someone, or cry, or at least pretend to wipe their eyes, Fire Eater, on the other hand, every time he really got tender had the habit of sneezing. It was a way like any other, to let others know the sensitivity of his heart.","It’s important to know that while most people cry when they feel sorry for someone, or at least make a show of wiping their eyes, Fire-Eater was in the habit, when deeply moved, of sneezing. It was as good a way as any to show other people what he felt in his heart.","For you must know that whilst most men, when they feel compassion for somebody, either weep or at least pretend to dry their eyes, Fire-eater, on the contrary, whenever he was really overcome, had the habit of sneezing."
- Povera Fata! Che ha paura forse che ti mangino i pipistrelli?,- Poor Fairy! Who is afraid that bats will eat you?,“Poor Fairy! I guess maybe she’s scared you’ll get eaten by bats?”,"""Poor Fairy! Is she afraid that the bats will eat you?"""
- Ne toccherai quanto un somaro!...,- You will touch it as much as a donkey! ...,“We’ll beat you like a donkey!”,"""You will get as many blows as a donkey! . . ."""
- Io sono un burattino.,- I am a puppet.,“I’m a puppet.”,"""I am a puppet."""
- Cioè?,- That is?,“Meaning?”,"""In what way?"""
"- No, ragazzi, avete sbagliato. C'era una volta un pezzo di legno.","- No, guys, you were wrong. Once upon a time there was a piece of wood.","No, children, you’re wrong. Once upon a time there was a piece of wood.","No children, you are wrong. There was once upon a time a piece of wood."
- Ma io non voglio fare né arti né mestieri...,- But I don't want to do arts or crafts ...,“But I don’t want to do any art or any trade.”,"""But I do not wish to follow either an art or a trade."""
"- Ve lo dirò io, miei cari e piccoli lettori: la sorpresa fu che a Pinocchio, svegliandosi, gli venne fatto naturalmente di grattarsi il capo; e nel grattarsi il capo si accòrse...","- I'll tell you, my dear little readers: the surprise was that when Pinocchio woke up, he was naturally made to scratch his head; and in scratching his head he noticed ...","I’ll tell you, my dear little readers: the surprise was that Pinocchio, when he woke up, naturally gave his head a scratch, and as he was scratching, he noticed—","I will tell you, my dear little readers. The surprise was that Pinocchio when he awoke scratched his head; and in scratching his head he discovered."
- Cioè?,- That is?,“What is it?”,"""What is it?"""
Capitolo X,Chapter X,10,THE BOOK WAS SOLD THERE AND THEN. CHAPTER X
"E in meno d'un'ora, i piedi erano bell'e fatti: due piedini svelti, asciutti e nervosi, come se fossero modellati da un artista di genio.","And in less than an hour, the feet were beautiful and made: two quick, lean and nervous feet, as if they were modeled by a genius artist.","In less than an hour, the two little feet were finished, and they were as nimble, lean, and sinewy as if they had been fashioned by a brilliant artist.","In less than an hour the feet were finished: two little feet—swift, well-knit, and nervous. They might have been modelled by an artist of genius."
"- Mai, mai, mai!","- Never, never, never!","“Never, never, never!”","""Never, never, never!"""
- Io non ho che veder nulla coi pesci. Io sono un burattino.,- I have nothing but to see with fish. I am a puppet.,“I have nothing to do with fish. I’m a puppet.”,"""I have nothing in common with fish. I am a puppet."""
- Io no: io voglio andare a scuola.,- Not me: I want to go to school.,“Not me. I want to go to school.”,"""No; I am going to school."""
"- Tre campi distante di qui c'è l'ortolano Giangio, che tiene le mucche. Va' da lui e troverai il latte che cerchi. -","- Three fields away from here is the gardener Giangio, who keeps the cows. Go to him and you will find the milk you are looking for. -",“Three fields away there’s a man named Giangio who has a small farm with some cows. Go to him and you’ll find the milk you seek.”,"""Three fields off from here there lives a gardener called Giangio who keeps cows. Go to him and you will get the milk you are in want of."""
"- Dunque addio, e salutami tanto le scuole ginnasiali!... e anche quelle liceali, se le incontri per la strada.","- So goodbye, and say hello to high school! ... and high school too, if you meet them on the street.","“Farewell then, and give my best regards to the elementary schools—and the high schools, too, if you pass them on the street!”","""Good-bye, then, and give my compliments to all the boys at the gymnasiums, and also to those of the lyceums, if you meet them in the street."""
"- Ma io non sono come gli altri: io, quando dico una cosa, la mantengo.","- But I'm not like the others: when I say something, I keep it.","“But I’m not like other children: when I say something, I stick to it.”","""But I am not like other boys. When I say a thing, I do it."""
"E la Volpe, nel dir così, si asciugò una lagrima.","And the Fox, in saying this, wiped away a tear.","As he said this, the Fox dabbed at a tear.","And the Fox, in relating this, dried a tear."
"Povero Merlo, non l'avesse mai detto! Il Gatto, spiccando un gran salto, gli si avventò addosso, e senza dargli nemmeno il tempo di dire ohi, se lo mangiò in un boccone, con le penne e tutto.","Poor Merlo, he never said that! The Cat, taking a big leap, rushed at him, and without even giving him the time to say hey, he ate it in one bite, with feathers and all.","Poor Blackbird—if only he had said nothing! The Cat leapt high in the air and pounced on him, swallowing him whole, feathers and all, before he could even say “ouch!”","Poor Blackbird! If only he had not spoken! The Cat, with a great leap, sprang upon him, and without even giving him time to say Oh! ate him in a mouthful, feathers and all."
- O la borsa o la vita! -,- Either the purse or the life! -,"But before he had taken a single step, his arms were seized and he heard two horrible, cavernous voices saying, “Your money or your life!”","""Your money or your life!"""
- E se io volessi seguitare a studiare?,- What if I want to continue studying?,“And what if I want to keep studying?”,"""And if I wish to continue my studies?"""
- Davvero: perché voglio andare a scuola e mettermi a studiare a buono.,- Really: because I want to go to school and start studying well.,“Indeed. Because I want to go to school and be a good student.”,"""Yes indeed: for I wish to go to school to study in earnest."""
"Pinocchio si addormenta coi piedi sul caldano, e la mattina dopo si sveglia coi piedi tutti bruciati.","Pinocchio falls asleep with his feet on the caldano, and the next morning he wakes up with his feet all burned.","IT TURNED out to be a truly hellish night: thunder roared, lightning seemed to set fire to the sky, and a bitter, blustery wind whistled furiously, kicking up dust clouds and making the trees groan and creak across the countryside.","Pinocchio Falls Asleep Pinocchio falls asleep with his feet on the brazier, and wakes in the morning to find them burnt off."
"- J-a, j-a, il fieno mi fa dolere il corpo!...","- J-a, j-a, the hay makes my body ache! ...","“Hee-haw, hee-haw, hay makes my tummy ache!”","""J-a, j-a , hay gives me a pain in my stomach."""
"Cammina, cammina, cammina, alla fine sul far della sera arrivarono stanchi morti all'osteria del Gambero Rosso.","Walk, walk, walk, at the end of the evening they arrived dead tired at the Gambero Rosso tavern.","THEY WALKED and walked and walked, and at dusk they finally arrived, dead tired, at the Red Crayfish Inn.","THEY walked, and walked, and walked, until at last, towards evening, they arrived dead tired at the inn of The Red Craw-fish."
"Allora Pinocchio, offrendo il suo braccio a Geppetto, che aveva appena il fiato di reggersi in piedi, gli disse:","Then Pinocchio, offering his arm to Geppetto, who barely had breath to stand up, said to him:","As he offered his arm to Geppetto, who was so tired he could barely stand, Pinocchio said, “Just lean on my arm, dear Daddy, and let’s be on our way.","Pinocchio then offering his arm to Geppetto, who had scarcely breath to stand, said to him:"
"- Ebbene, io ti propongo gli stessi patti, che avevo col defunto Melampo: e sarai contento.","Well, I propose the same pacts I had with the late Melampus: and you will be happy.","“Okay then, I’ll offer you the same terms I had with the late Tiresias—you’ll be pleased.”","""Well, then, I will offer you the same conditions that we made with the deceased Melampo, and I am sure you will be satisfied with them."""
"Fatto sta che il compratore, appena pagati i venti soldi, condusse il ciuchino sulla riva del mare; e messogli un sasso al collo e legatolo per una zampa con una fune che teneva in mano, gli diè improvvisamente uno spintone e lo gettò nell'acqua.","The fact is that the buyer, as soon as he paid the twenty sous, led the donkey to the seashore; and putting a stone around his neck and tying him by the leg with a rope which he held in his hand, he suddenly gave him a shove and threw him into the water.","And indeed the buyer, as soon as he had paid his twenty nickels, led the donkey to the seashore. Then, after hanging a large stone around his neck and tying a rope to one of his feet, he gave him a quick shove, knocking him into the water.","As soon as the purchaser had paid his twenty pence he conducted the little donkey to the seashore. He then put a stone round his neck, and tying a rope, the end of which he held in his hand, round his leg, he gave him a sudden push and threw him into the water."
"- Vedi, dunque, se avevo ragione? - ripigliava quest'ultimo. - E dire che tu non volevi partire! E pensare che t'eri messo in capo di tornartene a casa dalla tua Fata, per perdere il tempo a studiare!... Se oggi ti sei liberato dalla noia dei libri e delle scuole, lo devi a me, ai miei consigli, alle mie premure, ne convieni? Non vi sono che i veri amici che sappiano rendere di questi grandi favori.","- So you see if I was right? - the latter resumed. - And to say that you didn't want to leave! And to think that you had decided to go home to your Fairy, to waste your time studying! ... my concerns, do you agree? There are only true friends who know how to render these great favors.","“You see, was I right or what?” Lampwick always replied. “And to think you didn’t want to come! To think that you had gotten it into your head to go back home to your Fairy, to waste your time studying! If you’re now free from the boredom of books and school, you owe it to me, to my advice, to my kindness— don’t you think? Only our truest friends can do us such great favors.”","""See, then, if I was not right?"" replied the other. "" And to think that you did not want to come! To think that you had taken it into your head to return home to your Fairy, and to lose your time in studying! . . . If you are at this moment free from the bother of books and school, you must acknowledge that you owe it to me, to my advice and to my persuasions. It is only friends who know how to render such great services."""
"- Povero gonzo! Hai voluto fare a modo tuo, ma te ne pentirai! -","- Poor gonzo! You wanted to do it your way, but you will regret it! -","But as the donkeys galloped and the coach sped over the cobblestones of the main road, the puppet thought he heard a soft, barely audible voice that said, “Poor sap! You wanted to do as you pleased, but you’ll regret it!”","""Poor fool! you would follow your own way, but you will repent it!"""
"Fatto sta che dopo quel calcio e quella gomitata, Pinocchio acquistò subito la stima e la simpatia di tutti i ragazzi di scuola: e tutti gli facevano mille carezze e tutti gli volevano un ben dell'anima.","The fact is that after that kick and that elbow, Pinocchio immediately acquired the esteem and sympathy of all the school children: and they all caressed him a thousand and they all wanted a good of the soul.","The fact is that after that kick and that elbow, Pinocchio swiftly gained the admiration and the sympathy of all the boys in school. They all took a heartfelt liking to him and began showering him with affection.",But nevertheless the kick and the blow acquired at once for Pinocchio the sympathy and the esteem of all the boys in the school. They all made friends with him and liked him heartily.
"Venne finalmente il giorno, in cui il suo padrone poté annunziare uno spettacolo veramente straordinario. I cartelloni di vario colore, attaccati alle cantonate delle strade, dicevano così:","The day finally came when his master was able to announce a truly extraordinary spectacle. The billboards of various colors, attached to the corners of the streets, read like this:","At last the day came when his master could announce a truly extraordinary event. Notices of various colors, posted on street corners, said this:",At last a day came when his master was able to announce that he would give a really extraordinary representation. The many-coloured placards stuck on the street corners were thus worded:
"- Devi prendere a noia, anche tu, la scuola, la lezione e il maestro, che sono i nostri tre grandi nemici.","- You too have to get bored, the school, the lesson and the teacher, who are our three great enemies.","“You have to be fed up, like us, with the school and the lessons and the teacher—our three great enemies.”","""You must follow our example and hate school, lessons, and the master—our three greatest enemies."""
- E io sempre le bugie.,- And I always lie.,“And I’m always telling lies.”,". . ."" ""And I always tell lies."""
"- Dimmi - soggiunse allora il Colombo - non conosci per caso fra i tuoi compagni, un burattino, che ha nome Pinocchio?","""Tell me,"" added the Columbus, ""don't you happen to know a puppet among your companions, whose name is Pinocchio?""","“Say,” added the Pigeon, “you wouldn’t by any chance happen to know someone—a puppet—named Pinocchio?”","""Tell me,"" continued the Pigeon, ""amongst your companions, do you happen to know a puppet who is called Pinocchio?"""
- Fino da domani - soggiunse la Fata - tu comincerai coll'andare a scuola. -,- Until tomorrow - added the Fairy - you will start by going to school. -,"“—and tomorrow,” added the Fairy, “you’ll start going to school—”","""To-morrow,"" rejoined the Fairy, ""you will begin to go to school."
- E perché dovrei rifarti i piedi? Forse per vederti scappar di nuovo da casa tua?,- And why should I redo your feet? Maybe to see you run away from your house again?,"But Geppetto, as punishment for his pranks, let him cry and despair for half a day, then said, “And why should I make you new feet? So I can see you run away from home again?”","""Why should I make you new feet? To enable you, perhaps, to escape again from home?"""
"Allora il giudice, accennando Pinocchio ai giandarmi, disse loro:","Then the judge, referring Pinocchio to the giandarmes, said to them:","Pointing to Pinocchio, the judge said to them, “That poor devil has been robbed of four gold coins—therefore seize him, and put him in jail at once.”","The judge then, pointing to Pinocchio, said to them:"
- Scioccherie! - gridò Pinocchio.,- Nonsense! cried Pinocchio.,“Nonsense!” shouted Pinocchio.,"""That is all nonsense!"" cried Pinocchio."
"- Oramai ho fatto tardi!... e tornare a casa un'ora prima o un'ora dopo, è lo stesso.","- By now I'm late! ... and going home an hour earlier or an hour later, it's the same.","“At this point, I’m already running late! One hour more or less won’t make any difference.”","""It is already late. . . . If I return home an hour sooner or an hour later it will be all the same."""
- E che febbre sarebbe?,- And what fever would that be?,“What kind of fever?”,". . ."" ""What fever is it?"""
"- Mille grazie, signor Pinocchio, d'avermi risparmiata la fatica di rompere il guscio! Arrivedella, stia bene e tanti saluti a casa! -","- Thank you very much, Signor Pinocchio, for saving me the trouble of breaking the shell! Goodbye, be well and best regards at home! -","But instead of egg white and egg yolk, out came a very cheerful and refined Chick, who bowed handsomely as he said, “A thousand thanks, Sir Pinocchio, for having saved me the trouble of breaking the shell myself! Farewell, take care, and all my best to your family.”","""A thousand thanks, Master Pinocchio, for saving me the trouble of breaking the shell. Adieu until we meet again. Keep well, and my best compliments to all at home!"""
- È morto questa mattina.,- He died this morning.,“He died this morning.”,"""He died this morning."""
- Felicità! - disse Pinocchio.,- Happiness! said Pinocchio.,“Bless you!” said Pinocchio.,"""Bless you!"" said Pinocchio."
"Da principio voleva dire e voleva fare; ma poi, quando vide il suo Pinocchio sdraiato in terra e rimasto senza piedi davvero, allora sentì intenerirsi; e presolo subito in collo, si dètte a baciarlo e a fargli mille carezze e mille moine, e, coi luccioloni che gli cascavano giù per le gote, gli disse singhiozzando:","At the beginning it meant and wanted to do; but then, when he saw his Pinocchio lying on the ground and really left without feet, then he felt softened; and immediately taking him on the neck, he starts kissing him and giving him a thousand caresses and a thousand coaxing, and, with the fireflies falling down his cheeks, he said sobbing:","He was ready to say and do certain things, but when he saw that his Pinocchio, sprawled there on the ground, really had lost his feet, his heart melted.","He was very angry, and at first he did nothing but scold; but when he saw his Pinocchio lying on the ground and really without feet he was quite overcome. He took him in his arms and began to kiss and caress him and to say a thousand endearing things to him, and as the big tears ran down his cheeks, he said, sobbing:"
- Davvero?... Che sia quel medesimo Pesce-cane di quando affogò il mio povero babbo?,- Really? ... Could it be that same Dog-fish as when my poor father drowned?,“Really?” “We’re going to the beach to see it.,"""Not really? Can it be the same Dog-fish that was there when my poor papa was drowned?"""
"E Pinocchio, duro!","And Pinocchio, tough!",But Pinocchio refused!,But Pinocchio was obdurate.
- Che cos'altro ti dà noia?,- What else is bothering you?,“What else is bothering you?”,"""What is the matter now?"""
- Ho capito: dev'essere un granchio di mare. -,- I get it: it must be a sea crab. -,this must be a sea slug.”,"""I know: he must be a craw-fish."""
- Il maestro si lascia dire. È pagato apposta per brontolare tutti i giorni.,- The teacher lets himself be told. He is paid on purpose to grumble every day.,“The teacher can say whatever he likes. He’s paid to spend his days grumbling.”,"""The master may say what he likes. He is paid on purpose to grumble all day."""
"Intanto cominciava a baluginare il giorno e si rincorrevano sempre; quand'ecco che Pinocchio si trovò improvvisamente sbarrato il passo da un fosso largo e profondissimo, tutto pieno di acquaccia sudicia, color del caffè e latte. Che fare? «Una, due, tre!» gridò il burattino, e slanciandosi con una gran rincorsa, saltò dall'altra parte. E gli assassini saltarono anche loro, ma non avendo preso bene la misura, patatunfete!... cascarono giù nel bel mezzo del fosso. Pinocchio che sentì il tonfo e gli schizzi dell'acqua, urlò ridendo e seguitando a correre:","Meanwhile the day was beginning to flicker and they were always chasing each other; when Pinocchio suddenly found himself barred from his way by a wide and very deep ditch, all full of filthy water, the color of coffee and milk. What to do? ""One, two, three!"" cried the puppet, and rushing with a great run, jumped to the other side. And the killers jumped too, but not having taken the measure well, patatunfete! ... they fell down in the middle of the ditch. Pinocchio, who heard the splash and splash of water, shouted laughing and continuing to run:","Day was beginning to break, with the murderers still in pursuit, when Pinocchio found his path blocked by an enormous ditch full of filthy water that was the muddy color of coffee with milk. What was he to do? “One, two, three!” yelled the puppet, and with a running start he leapt to the opposite bank. The murderers jumped, too, but not having judged the distance properly, they fell—kersplash!—smack in the middle of the ditch. When Pinocchio heard them flailing in the water, he shouted through his laughter, “Enjoy your bath, Mr. Murderers!”","The day began to break and they were still pursuing him. Suddenly Pinocchio found his way barred by a wide deep ditch full of dirty water the colour of coffee. What was he to do? "" One! two! three!"" cried the puppet, and making a rush he sprang to the other side. The assassins also jumped, but not having measured the distance properly—splash, splash! . . . they fell into the very middle of the ditch. Pinocchio, who heard the plunge and the splashing of the water, shouted out, laughing, and without stopping:"
"- In questo caso - gridò fieramente Pinocchio, rizzandosi e gettando via il suo berretto di midolla di pane - in questo caso conosco qual è il mio dovere. Avanti, signori giandarmi! Legatemi e gettatemi là fra quelle fiamme. No, non è giusta che il povero Arlecchino, il vero amico mio, debba morire per me! -","'In this case,' cried Pinocchio proudly, standing up and throwing off his bread-marrow cap, 'in this case I know what my duty is. Come on, gentlemen giandarmi! Bind me and throw me there in those flames. No, it is not right that poor Harlequin, my true friend, should die for me! -","“In that case,” cried Pinocchio proudly, standing and throwing off his bread-crumb cap, “in that case, I know what I must do. Come, guards! Tie me up and throw me into those flames. No, it isn’t fair for poor Harlequin, my true friend, to die in my place.”","""In that case,"" cried Pinocchio proudly, rising and throwing away his cap of bread crumb—""in that case I know my duty. Come on, gendarmes! Bind me and throw me amongst the flames. No, it is not just that poor Harlequin, my true friend, should die for me! . . ."""
- E questi riguardi sarebbero?...,- And these regards would be? ...,“Which means what?”,"""And this attention? . . ."""
"- Se volete che le mangi, fatemi il piacere di sbucciarle.","- If you want me to eat them, do me the pleasure of peeling them.","“If you want me to eat them, please peel them for me first.”","""If you wish me to eat them, be kind enough to peel them for me."""
"Si accòrse con suo grandissimo stupore, che gli orecchi gli erano cresciuti più d'un palmo.",To his astonishment he realized that his ears had grown more than a hand.,"He noticed, to his great shock, that his ears were now bigger than his hands.",He discovered to his great astonishment that his ears had grown more than a hand.
