Source,GoogleTranslate,human1,human2
- Oh babbo mio! se tu fossi qui!... -,- Oh my father! if you were here!... -,"But when, after waiting and waiting, he saw that no one was coming, no one at all, then he thought of his poor father—and there at death’s door he stammered, “Oh, if only you were here, Daddy!”",". . he stammered out: ""Oh, papa! papa! if only you were here!"""
- Voglio salvare il mio babbo! -,- I want to save my dad! -,"Just then they heard a desperate cry, and looking back they saw a little boy throwing himself from a high rock into the sea, shouting, “I will save my daddy!”","""I will save my papa!"""
"Fatto sta che in un batter d'occhio si era tanto allontanato, che non si vedeva quasi più; ossia, si vedeva solamente sulla superficie del mare un puntolino nero, che di tanto in tanto rizzava le gambe fuori dell'acqua e faceva capriòle e salti, come un delfino in vena di buon umore.","The fact is that in the blink of an eye he was so far away that he was hardly to be seen any more; that is to say, only a black speck could be seen on the surface of the sea, which occasionally raised its legs out of the water and did somersaults and leaps, like a dolphin in a good mood.","And so it was that, before long, he had swum so far out that he was scarcely visible from shore. Or rather, all that was visible was a little black dot on the surface of the sea, a dot that every now and then lifted its legs out of the water to jump up and do flips, like a dolphin in a frisky mood.",In the twinkling of an eye he had swum so far off that he was scarcely visible. All that could be seen of him was a little black speck on the surface of the sea that from time to time lifted its legs out of the water and leapt and capered like a dolphin enjoying himself.
"- A quest'ora l'avrà inghiottito il terribile pesce-cane, che da qualche giorno è venuto a spargere lo sterminio e la desolazione nelle nostre acque.","- By now the terrible dog-fish will have swallowed it, which a few days ago came to spread extermination and desolation in our waters.","“By now he has probably been swallowed by the terrible Shark, who came to our waters several days ago to spread death and woe.”","""He must have been swallowed by the terrible Dog-fish who for some days past has been spreading devastation and ruin in our waters."""
"- Addio, mascherine! Ricordatevi del proverbio che dice: «La farina del diavolo va tutta in crusca.»","- Goodbye, masks! Remember the proverb that says: ""The devil's flour goes all in bran.""","“Goodbye, charlatans! Remember the proverb that says: The devil’s flour turns out to be chaff.”","Begone, impostors!"""
"- Oggi, alla scuola, voglio subito imparare a leggere: domani poi imparerò a scrivere, e domani l'altro imparerò a fare i numeri. Poi, colla mia abilità, guadagnerò molti quattrini e coi primi quattrini che mi verranno in tasca, voglio subito fare al mio babbo una bella casacca di panno. Ma che dico di panno? Gliela voglio fare tutta d'argento e d'oro, e coi bottoni di brillanti. E quel pover'uomo se la merita davvero: perché, insomma, per comprarmi i libri e per farmi istruire, è rimasto in maniche di camicia... a questi freddi! Non ci sono che i babbi che sieno capaci di certi sacrifizi!... -","- Today, at school, I immediately want to learn to read: tomorrow I will learn to write, and the day after tomorrow I will learn to do numbers. Then, with my skill, I will earn a lot of money and with the first money that will come into my pocket, I want to make my father a nice cloth coat right away. But what about cloth? I want to make it all in silver and gold, and with diamond buttons. And that poor man really deserves it: because, in short, to buy me books and to get me educated, he stayed in his shirt sleeves ... these colds! There are only fathers who are capable of certain sacrifices! ... -","Conversing with himself, he said, “Today, at school, I’ll quickly learn to read; then tomorrow I’ll learn to write; and the day after tomorrow I’ll learn my numbers. Then, with all that knowledge, I’ll make a lot of money, and with the first money that comes into my hands I’ll buy my daddy a fine wool coat. But what am I saying, ‘wool’? I’ll buy him a coat made of silver and gold, with diamond buttons. And that poor man truly deserves it—because, after all, in order to buy me books and send me to school, he’s going around in shirtsleeves. In this cold! There are some sacrifices only a father would make!”","""To-day at school I will learn to read at once; then to-morrow I will begin to write, and the day after to-morrow to cipher. Then with my acquirements I will earn a great deal of money, and with the first money I have in my pocket I will immediately buy for my papa a beautiful new cloth coat. But what am I saying? Cloth, indeed! It shall be all made of gold and silver, and it shall have diamond buttons. That poor man really deserves it; for to buy me books and have me taught he has remained in his shirt sleeves. . . . And in this cold! It is only fathers who are capable of such sacrifices! . . ."""
"La storia di Pinocchio col Grillo-parlante, dove si vede come i ragazzi cattivi hanno a noja di sentirsi correggere da chi ne sa più di loro.","The story of Pinocchio with the Talking Cricket, where you can see how bad guys have a bore of being corrected by those who know more than them.","WHAT HAPPENED next, children, is that while poor, innocent Geppetto was being led off to jail, that rascal Pinocchio, freed from the policeman’s clutches, went sprinting across the fields to get home as fast as he could.","The Talking-Cricket The story of Pinocchio and the Talking-cricket, from which we see that naughty boys cannot endure to be corrected by those who know more than they do."
"- Com'ero buffo, quand'ero un burattino! e come ora son contento di esser diventato un ragazzino perbene!... -",- How funny I was when I was a puppet! and how happy I am now to have become a decent boy! ... -,"And after staring at it for a little while, he said to himself, with enormous satisfaction, “How funny I was, when I was a puppet! And how happy I am now that I’ve become a proper little boy!”","""How ridiculous I was when I was a puppet! and how glad I am that I have become a well-behaved little boy! . . ."""
- E quant'è che siete chiuso qui dentro? - domandò Pinocchio.,- And how long have you been locked in here? asked Pinocchio.,“And how long have you been trapped in here?” asked Pinocchio.,"""And how long have you been shut up here?"" asked Pinocchio."
"Fatti gli occhi, figuratevi la sua maraviglia quando si accòrse che gli occhi si movevano e che lo guardavano fisso fisso.","Without his eyes, imagine his amazement when he noticed that his eyes were moving and that they were staring fixedly at him.","Imagine his surprise when, as soon as the eyes were finished, he saw that they could move and were staring straight at him.","The eyes being finished, imagine his astonishment when he peceived that they moved and looked fixedly at him."
- Pinocchio mio! La povera Fata giace in un fondo di letto allo spedale!...,- My Pinocchio! The poor Fairy is lying in a bed at the hospital! ...,"To all these questions, asked in a rush and without pausing for breath, the Snail replied with her usual cool, “My dear Pinocchio! The poor Fairy is bedridden in a poorhouse!”","""My dear Pinocchio, the poor Fairy is lying in bed at the hospital!"
Capitolo XVI,Chapter XVI,16,CHAPTER XVI
"- Con questo libro.- E il burattino raccattò di terra il Trattato di Aritmetica, rilegato in cartone e cartapecora, per mostrarlo al carabiniere.","- With this book. - And the puppet picked up the Treatise on Arithmetic from earth, bound in cardboard and parchment, to show it to the carabiniere.",“With this book.”,"""With this book. "" And the puppet picked up from the ground the Treatise on Arithmetic, bound in cardboard and parchment, and showed it to the carabineer."
- Altro che pronti! Sono partiti due ore fa.,- Other than ready! They left two hours ago.,“More than ready! They left two hours ago.”,"""Ready! Why, they left two hours ago."""
- Vieni con noi e staremo allegri - gridarono altre quattro voci di dentro al carro.,"""Come with us and we'll be happy,"" shouted four other voices from inside the wagon.",“Come with us and we’ll have fun!” shouted several other voices from inside the coach. “Come with us and we’ll have fun!”,"""Come with us, and we shall have such fun,"" cried four other voices from the inside of the coach."
- A fuggire?... e come?,- To escape? ... and how?,“Escape? How?”,"""Of escaping? . . . and how?"""
"Il suo viso pareva trasfigurito, e perfino la punta del naso, di paonazza come era quasi sempre, gli era diventata turchina dalla gran paura.","His face seemed transfigured, and even the tip of his nose, purple as it almost always was, had turned blue with great fear.","His face seemed misshapen, and even the tip of his nose, which was nearly always purple, had turned bright blue with fright.","His face was quite changed, even the end of his nose, instead of being crimson, as it was nearly always, had become blue from fright."
"- Pazienza! - disse Pinocchio, e fece l'atto di andarsene.","- Patience! said Pinocchio, and made a move to leave.","“Oh well!” said Pinocchio, turning to leave.","""I must have patience!"" said Pinocchio, and he turned to go."
"- Salvami, Alidoro! Se non mi salvi, son fritto!... -","- Save me, Alidoro! If you don't save me, I'm fried! ... -","If you don’t save me, I’m going to fry!”","""Save me, Alidoro! If you do not save me I shall be fried! . . ."""
"- Mangiarmi? ma la vuol capire che io non sono un pesce? O non sente che parlo, e ragiono come lei?","- Eat me? but do you want to understand that I am not a fish? Or does he not hear that I speak, and do I think like you?",“Eat me? But can’t you understand that I’m not a fish? Can’t you hear that I speak and reason like you?”,"""Eat me! but will you understand that I am not a fish? Do you hear that I talk and reason as you do?"""
- Aspetta altri due minuti.,- Wait another two minutes.,“Wait two more minutes.”,"""Wait another two minutes."""
- Questo legno è capitato a tempo; voglio servirmene per fare una gamba di tavolino. -,- This wood happened in time; I want to use it to make a table leg. -,I think I’ll use it to make me a table leg.”,"""This wood has come at the right moment; it will just do to make the leg of a little table."""
"- Lo so: ed è per questo che ti ho perdonato. La sincerità del tuo dolore mi fece conoscere che tu avevi il cuore buono: e dai ragazzi buoni di cuore, anche se sono un po' monelli e avvezzati male, c'è sempre da sperar qualcosa: ossia, c'è sempre da sperare che rientrino sulla vera strada. Ecco perché son venuta a cercarti fin qui. Io sarò la tua mamma...","- I know: and that is why I have forgiven you. The sincerity of your pain made me know that you had a good heart: and from the good-hearted boys, even if they are a little naughty and badly accustomed, there is always something to hope: that is, there is always to hope that return to the true path. That is why I have come looking for you this far. I will be your mom ...","“I do know. That’s why I’ve forgiven you. The sincerity of your grief showed me that you had a good heart. And with good-hearted children, even if they’re a bit naughty and have some bad habits, there’s always some hope—hope that they’ll mend their ways, I mean. That’s why I came all the way here to look for you. I’ll be your mother—”","""I know it, and it is on that account that I have forgiven you. I saw from the sincerity of your grief that you had a good heart; and when boys have good hearts, even if they are scamps and have got bad habits, there is always something to hope for: that is, there is always hope that they will turn to better ways. That is why I came to look for you here. I will be your mamma."
"- Non posso star ritto, credetelo. Oh! povero me! povero me, che mi toccherà a camminare coi ginocchi per tutta la vita!... -","- I can't stand up, believe it. Oh! poor me! poor me, I'll have to walk on my knees all my life! ... -","“I can’t stand up, believe me. Oh, poor me, poor me! I’ll have to walk on my knees for the rest of my life!”","""If you don't, when I get into the house you shall have the cat from me!"" ""Oh! Poor me! I shall have to walk on my knees for the rest of my life!"" ""I cannot stand up, believe me. Oh, poor me! poor me! I shall have to walk on my knees for the rest of my life! . . ."" ""OH! POOR ME! I SHALL HAVE TO WALK ON MY KNEES FOR THE REST OF MY LIFE!"""
- Fra un'ora prometto di esser bell'e ritornato - replicò il burattino.,"""I promise to be back in an hour,"" replied the puppet.","“I promise to be back in an hour or so,” replied the puppet.","""I promise to be back in an hour,"" answered the puppet."
"- Mi duole di contraddire il mio illustre amico e collega - soggiunse la Civetta - ma per me quando il morto piange, è segno che gli dispiace a morire. -","- I am sorry to contradict my illustrious friend and colleague - added the Owl - but for me when the dead man cries, it is a sign that he is sorry to die. -","“It grieves me to contradict my illustrious friend and colleague,” added the Owl, “but I believe that when a dead person cries, it’s a sign that he doesn’t like dying.”","""I grieve to contradict my illustrious friend and colleague,"" added the Owl; ""but for me, when the dead person cries, it is a sign that he is sorry to die."""
"- E dopo, caro mio, rimarremo tutt'e due al bujo.","- And afterwards, my dear, we will both be left in the dark.","“And then, my dear, we’ll both be left in the dark.”","""After that, dear boy, we shall both remain in the dark."""
- Polendina! -,- Polendina! -,“Corn Head!”,"""Polendina!"""
"- Io sono un ragazzo, e non compro nulla dai ragazzi - gli rispose il suo piccolo interlocutore, che aveva più giudizio di lui.","- I am a boy, and I do not buy anything from boys - answered his little interlocutor, who had more judgment than him.","“I’m just a child, and I don’t buy things from other children,” replied his little interlocutor, who had more sense than Pinocchio did.","""I am a boy and I don't buy from boys,"" replied his little interlocutor, who had much more sense than he had."
- Venti lire.,- Twenty lire.,“Twenty dollars.”,"""Twenty francs."""
"E senza indugiare un minuto, riprese a correre per il bosco a carriera distesa. E gli assassini sempre dietro.","And without delaying a minute, he resumed running through the woods with an extended career. And the killers always behind.","Not wasting a moment, he started running at full speed again, toward the forest. The murderers were still behind him.","And without delaying an instant, he recommenced running for his life through the wood, and the assassins after him."
"Il Colombo, a questa risposta, si calò velocemente e venne a posarsi a terra. Era più grosso di un tacchino.","The Columbus, at this response, dropped quickly and came to rest on the ground. It was bigger than a turkey.","Hearing this, the Pigeon swooped down and landed on the ground. He was larger than a turkey.",The Pigeon at this answer descended rapidly to the ground. He was larger than a turkey.
Capitolo XVII,Chapter XVII,"“It grieves me to contradict my illustrious friend and colleague,” added the Owl, “but I believe that when a dead person cries, it’s a sign that he doesn’t like dying.”",CHAPTER XVII
"- Ora sarà morto!... - interruppe Pinocchio, con gran dolore.","- Now he will be dead! ... - interrupted Pinocchio, with great pain.","“Now he’s dead!” interjected Pinocchio, with great sorrow.","""And now he is dead! . . ."" interrupted Pinocchio with great sorrow."
"A quell'abbaiata, il contadino saltò il letto, e preso il fucile e affacciatosi alla finestra, domandò:","At that barking, the peasant jumped out of bed, and took his rifle and leaned out of the window, asked:","Hearing the barks, the farmer jumped out of bed, grabbed his rifle, and stuck his head out the window.","BOW-WOW-WOW. Hearing the barking the peasant jumped out of bed, and taking his gun he came to the window and asked:"
"- Addio, burattino: e buona fortuna.","- Goodbye, puppet: and good luck.","“Goodbye, puppet, and good luck.”","""Good-bye, puppet, and good fortune attend you."""
"Fra questi libri, v'era un volume rilegato in cartoncino grosso, colla costola e colle punte di cartapecora. Era un Trattato di Aritmetica. Vi lascio immaginare se era peso di molto!","Among these books, there was a volume bound in thick cardboard, with the spine and points of parchment. It was a Treatise on Arithmetic. I let you imagine if it was a lot of weight!",Among these books was one that had a thick hard cover and vellum on the spine and corners. It was called Treatise on Arithmetic. I’ll let you imagine how heavy it was!,Amongst the books there was one bound in strong cardboard with the back and points of parchment. It was a Treatise on Arithmetic. I leave you to imagine if it was big or not!
"Il burattino, sentendosi mortificato da quelle parole, non rispose: ma prese il suo bicchiere di latte quasi caldo, e se ne tornò alla capanna.","The puppet, feeling mortified by those words, did not answer: but took his glass of almost hot milk, and went back to the hut.","The puppet, mortified by these words, did not reply. He took his glass of warm milk and went back to the Cricket’s hut.","The puppet, who felt much mortified at these words, did not answer; but taking his tumbler of milk, still quite warm, he returned to the hut."
"Pinocchio obbedì senza rifiatare. Il carro riprese la sua corsa: e la mattina, sul far dell'alba, arrivarono felicemente nel «Paese dei balocchi».","Pinocchio obeyed without breathing back. The chariot resumed its run: and in the morning, as dawn broke, they arrived happily in the ""Toyland"".","Pinocchio obeyed without another word. The coach resumed its course, and in the morning, near dawn, they happily reached Toyland.","Pinocchio obeyed without another word. In the morning about daybreak they arrived safely in the ""Land of Boobies."""
- Vi dirò... era un mio amico!...,- I'll tell you ... he was a friend of mine! ...,“I can explain: he was a friend of mine.”,"""I must tell you . . . he was my friend!"""
"Questo paese non somigliava a nessun altro paese del mondo. La sua popolazione era tutta composta di ragazzi. I più vecchi avevano 14 anni: i più giovani ne avevano 8 appena. Nelle strade, un'allegria, un chiasso, uno strillìo da levar di cervello! Branchi di monelli da per tutto: chi giocava alle noci, chi alle piastrelle, chi alla palla, chi andava in velocipede, chi sopra un cavallino di legno: questi facevano a mosca-cieca, quegli altri si rincorrevano: altri, vestiti da pagliacci, mangiavano la stoppa accesa: chi recitava, chi cantava, chi faceva i salti mortali, chi si divertiva a camminare colle mani in terra e colle gambe in aria: chi mandava il cerchio, chi passeggiava vestito da generale coll'elmo di foglio e lo squadrone di cartapesta: chi rideva, chi urlava, chi chiamava, chi batteva le mani, chi fischiava, chi rifaceva il verso alla gallina quando ha fatto l'ovo: insomma un tal pandemonio, un tal passeraio, un tal baccano indiavolato, da doversi mettere il cotone negli orecchi per non rimanere assorditi. Su tutte le piazze si vedevano teatrini di tela, affollati di ragazzi dalla mattina alla sera, e su tutti i muri delle case si leggevano scritte col carbone delle bellissime cose come queste: viva i balocci! (invece di balocchi): non vogliamo più schole (invece di non vogliamo più scuole): abbasso Larin Metica (invece di l'aritmetica) e altri fiori consimili.","This country resembled no other country in the world. Its population was all made up of boys. The oldest were 14 years old: the youngest were just 8. In the streets, a joy, a noise, a shriek to take the mind off! Flocks of urchins from all over: those who played walnuts, who at tiles, who at the ball, who went on a velocipede, who on a wooden pony: these were doing blind-fly, those others chasing each other: others, dressed as clowns, ate the lighted tow: those who recited, those who sang, those who jumped flips, those who enjoyed walking with their hands on the ground and with their legs in the air: those who sent the circle, those who walked dressed as a general with the helmet and the squadron of papier-mache: who laughed, who screamed, who called, who clapped their hands, who whistled, who remade the hen when she laid the egg: in short, such a pandemonium, such a sparrow, such a frenzied din, that one had to put cotton in the ears so as not to be deafened. On all the squares you could see canvas theaters, crowded with kids from morning to night, and on all the walls of the houses you could read beautiful things like these written with coal: long live the toys! (instead of toys): we don't want schools anymore (instead of we don't want schools anymore): down with Larin Metica (instead of arithmetic) and other similar flowers.","This country resembled no other country in the world. Its population was composed entirely of children. The oldest were fourteen years of age; the youngest were barely eight. In the streets, such joy, such racket, such screeching as might take the top of your head off! Hordes of rascals everywhere. Some were playing ball, some marbles, some bowls; some were riding bicycles, others wooden horses; some were playing blindman’s buff, some tag; some, dressed as clowns, were eating fire; some were acting, some singing, some doing flips; some amused themselves by walking with their hands on the ground and their feet in the air; some rolled hoops; some strolled about dressed as generals, with newspaper helmets and papier-mâché swords; some laughed, some yelled, some called to friends; some clapped and some whistled and some clucked like hens that had just laid eggs—such a pandemonium, in other words, such a din, such an infernal hullabaloo, that you’d have to stuff your ears with cotton to keep from going deaf. Every square hosted little canvas theaters that were packed with kids from dawn till dusk, and the walls of every house bore phrases scrawled in charcoal that said splendid things like: Toys are grate! (instead of great), No more skools! (instead of schools), Down with Ritt Matick! (instead of arithmetic), and other such gems.","It was a country unlike any other country in the world. The population was composed entirely of boys. The oldest were fourteen, and the youngest scarcely eight years old. In the streets there was such merriment, noise, and shouting, that it was enough to turn anybody's head. There were troops of boys everywhere. Some were playing with nuts, some with battledores, some with balls. Some rode velocipedes, others wooden horses. A party were playing at hide and seek, a few were chasing each other. Boys dressed in straw were eating lighted tow; some were reciting, some singing, some leaping. Some were amusing themselves with walking on their hands with their feet in the air; others were trundling hoops, or strutting about dressed as generals, wearing leaf helmets and commanding a squadron of cardboard soldiers. Some were laughing, some shouting, some were calling out; others clapped their hands, or whistled, or clucked like a hen who has just laid an egg. To sum it all up, it was such a pandemonium, such a bedlam, such an uproar, that not to be deafened it would have been necessary to stuff one's ears with cotton wool. In every square, canvas theatres had been erected, and they were crowded with boys from morning till evening. On the walls of the houses there were inscriptions written in charcoal: "" Long live playthings, we will have no more schools: down with arithmetic:"" and similar other fine sentiments all in bad spelling."
"- Perché sei un burattino e, quel che è peggio, perché hai la testa di legno. -","- Because you are a puppet and, what is worse, because you have a wooden head. -","“Because you’re a puppet and, what’s worse, you’re a blockhead.”","""Because you are a puppet and, what is worse, because you have a wooden head."""
"- Povero figliuolo! - replicò la Lucciola, fermandosi impietosita a guardarlo. - Come mai sei rimasto colle gambe attanagliate fra codesti ferri arrotati?","- Poor son! - Replied the Firefly, stopping pityingly to look at him. - How come you remained with your legs gripped between these sharpened irons?","“Poor child!” replied the Firefly, pausing, moved to pity by the sight of him. “How on earth did your legs end up in that sharp trap?”","""Poor boy!"" said the Firefly, stopping and looking at him with compassion, ""but how could your legs have been caught by those sharp irons?"""
Capitolo XXIII,Chapter XXIII,23,CHAPTER XXIII
"Il burattino, vedendosi balenare la morte dinanzi agli occhi, fu preso da un tremito così forte, che nel tremare, gli sonavano le giunture delle sue gambe di legno e i quattro zecchini che teneva nascosti sotto la lingua.","The puppet, seeing death flash before his eyes, was seized by a tremor so strong that when he trembled, the joints of his wooden legs and the four sequins which he kept hidden under his tongue rang out.","The puppet, seeing death flashing before his eyes, trembled so hard that the joints of his wooden legs and the four gold coins hidden beneath his tongue all rattled.","The puppet, seeing death staring him in the face, was taken with such a violent fit of trembling that the joints of his wooden legs began to creak, and the sovereigns hidden under his tongue to clink."
