Source,GoogleTranslate,human1,human2
- E a me la scuola mi fa venire i dolori di corpo. Ma da oggi in poi voglio mutar vita.,- And school gives me body aches. But from now on I want to change my life.,“And school gives me a stomachache. But from now on I’m going to change my life.”,". . ."" ""And school gives me pain all over my body. But from to-day I will change my life."""
Capitolo XXXIV,Chapter XXXIV,34,CHAPTER XXXIV
"Mangiate o, per dir meglio, divorate le tre pere, Pinocchio fece un lunghissimo sbadiglio e disse piagnucolando:","Eat or, to put it better, devour the three pears, Pinocchio gave a very long yawn and said whimpering:","Having eaten, or to put it a better way, devoured the three pears, Pinocchio yawned widely and said with a whine, “I’m still hungry!”","Having eaten, or rather having devoured the three pears, Pinocchio yawned tremendously, and then said in a fretful tone:"
"Pinocchio ci pensò un poco, e poi disse risolutamente:","Pinocchio thought for a while, and then said resolutely:","Pinocchio thought on this for a moment before replying firmly, “No, I don’t want to come.","Pinocchio reflected a moment, and then he said resolutely:"
- Conosco bene il tuo babbo.,- I know your dad well.,“I know your father well.”,"""I know your father well."""
Indovinate un po' di che cosa si accòrse?,Guess what he noticed?,"Well, can you guess what he noticed?",. . . Can you guess in the least what he discovered?
- Ma dunque - soggiunse Pinocchio - tu sei veramente sicuro che in quel paese non ci sono punte scuole?...,"`` So then, '' added Pinocchio, `` are you really sure that there are no schools in that country? ...","“But tell me,” Pinocchio said, “are you really sure that in that country there are no schools at all?”","""But now,"" continued Pinocchio, are you really certain that there are no schools in that country?"
- Sarà effetto dell'acqua del mare. Il mare ne fa di questi scherzi.,- It will be the effect of the sea water. The sea makes these jokes.,“The salt water must have done it. The sea plays funny tricks.”,"""It must have been the effect of sea-water. The sea makes extraordinary changes."""
- Deliziose queste sogliole!...,- These sole are delicious! ...,"Delectable, these sole!","""These soles are delicious! . . . """
Figuratevi la risatona impertinente e sgangherata di tutti quei ragazzi presenti alla scena.,Imagine the cheeky and rickety laugh of all those guys present at the scene.,"Imagine the mischievous, boisterous laughter of all those kids who were watching.",You can imagine the impertinent and immoderate laughter of all the boys who witnessed this scene.
"Pinocchio ha fame e cerca un uovo per farsi una frittata; ma sul più bello, la frittata gli vola via dalla finestra.","Pinocchio is hungry and looks for an egg to make an omelette; but at the best, the omelette flies out of the window.","MEANWHILE darkness had begun to fall, and Pinocchio, who hadn’t had a thing to eat, noticed a faint grumbling in his stomach, which felt exactly like appetite.",Pinocchio Is Hungry Pinocchio is hungry and searches for an egg to make himself an omelet; but just at the most interesting moment the omelet flies out of the window.
- Era in maniche di camicia e tremava dal freddo.,He was in shirt sleeves and shivering from the cold.,“He was in shirtsleeves and was shivering from the cold.”,"""He was in his shirt sleeves and shivering with cold."""
- Felicità! - disse Pinocchio.,- Happiness! said Pinocchio.,“Bless you!” said Pinocchio.,"""Bless you!"" said Pinocchio."
- E io l'ho provato! - disse Pinocchio. - Ma ora non ci ricasco più!,- And I've tried it! said Pinocchio. - But now I'm not going to do it again!,“As I know from experience!” said Pinocchio. “But I’ll never be guilty of such folly again!”,"""I have experienced that,"" said Pinocchio. ""But I shall never make that mistake again."""
"Giunto dinanzi a casa, trovò l'uscio di strada socchiuso. Lo spinse, entrò dentro, e appena ebbe messo tanto di paletto, si gettò a sedere per terra, lasciando andare un gran sospirone di contentezza.","Arriving in front of the house, he found the street door ajar. He pushed it, went inside, and as soon as he had put so much of the stake, he threw himself down on the ground, letting go a great sigh of contentment.","When he got back home, the front door was ajar. He pushed it open and went inside, and as soon as he had bolted the door behind him, he plopped down onto the floor with a great sigh of satisfaction.","Having arrived at the house he found the street door ajar. He pushed it open, went in, and having secured the latch threw himself seated on the ground and gave a great sigh of satisfaction."
"Dopo poco tornò: e quando tornò, aveva in mano l'Abbecedario per il figliuolo, ma la casacca non l'aveva più. Il pover'uomo era in maniche di camicia, e fuori nevicava.","After a while he returned: and when he returned, he was holding the Abbecedario for his son, but he no longer had the coat. The poor man was in shirt sleeves, and it was snowing outside.","He soon returned, and when he came in the door he had his son’s spelling book in his hands, but no coat. The poor man was in shirtsleeves, though it was snowing outside.","He returned shortly, holding in his hand a Spelling-book for Pinocchio, but the old coat was gone. The poor man was in his shirt sleeves, and out of doors it was snowing."
"- Sappiate dunque che io ero un burattino di legno, come sono oggi: ma mi trovavo a tocco e non tocco di diventare un ragazzo, come in questo mondo ce n'è tanti: se non che per la mia poca voglia di studiare e per dar retta ai cattivi compagni, scappai di casa... e un bel giorno, svegliandomi, mi trovai cambiato in un somaro con tanto d'orecchi... e con tanto di coda!... Che vergogna fu quella per me!... Una vergogna, caro padrone, che Sant'Antonio benedetto non la faccia provare neppure a voi! Portato a vendere sul mercato degli asini, fui comprato dal Direttore di una compagnia equestre, il quale si messe in capo di far di me un gran ballerino e un gran saltatore di cerchi: ma una sera, durante lo spettacolo, feci in teatro una brutta cascata e rimasi zoppo da tutt'e due le gambe. Allora il Direttore, non sapendo che cosa farsi d'un asino zoppo, mi mandò a rivendere, e voi mi avete comprato!...","- Know then that I was a wooden puppet, as I am today: but I was touched and not touched to become a boy, as there are so many in this world: except for my little desire to study and to to listen to the bad companions, I ran away from home ... and one day, waking up, I found myself changed into a donkey with a lot of ears ... and with a lot of tail! ... What a shame that was for me !. .. A shame, dear master, that the blessed Saint Anthony does not let you feel it either! Brought to sell on the donkey market, I was bought by the Director of an equestrian company, who made it his business to make me a great dancer and a great hover of hoops: but one evening, during the show, I did a bad I fell and was lame on both legs. Then the Director, not knowing what to do with a lame donkey, sent me to resell, and you bought me! ...","“So you see, I used to be a wooden puppet, as I am today. And I was just about to become a real boy, like so many others in this world, but instead I ran away from home, because I wasn’t crazy about studying and because I was listening to my ne’er-do-well friends. And then one fine day I woke up to find myself turned into a jackass, ears and all—right down to the tail! I was so ashamed! I wouldn’t want blessed Saint Anthony to make anyone, even you, feel such shame! Then I was taken to the donkey market and sold to the Ringmaster of a horse circus, who got the notion to turn me into a great dancer and hoop-jumper. But one evening, during the show, I had a bad fall in the ring and injured two of my legs. So the Ringmaster, not knowing what to do with a lame donkey, sent me back to market, and then you bought me!”","""You must know that I was once a puppet as I am now, and I was on the point of becoming a boy like the many that there are in the world. But instead, induced by my dislike to study and the advice of bad companions, I ran away from home . . . and one fine day when I awoke I found myself changed into a donkey with long ears . . . and a long tail! . . . What a disgrace it was to me!—a disgrace, dear master, that the blessed St Anthony would not inflict even upon you! Taken to the market to be sold I was bought by the director of an equestrian company, who took it into his head to make a famous dancer of me, and a famous leaper through hoops. But one night during a performance I had a bad fall in the circus and lamed both my legs. Then the director, not knowing what to do with a lame donkey, sent me to be sold, and you were the purchaser! . . ."""
"E perché si divincolava come un'anguilla e faceva sforzi incredibili, per isgusciare dalle grinfie del pescatore verde, questi prese una bella buccia di giunco, e dopo averlo legato per le mani e per i piedi, come un salame, lo gettò in fondo alla conca cogli altri.","And because he wriggled like an eel and made incredible efforts to get out of the clutches of the green fisherman, he took a beautiful reed husk, and after tying it by the hands and feet, like a salami, threw it at the bottom of the conca with others.","And since he was wriggling like an eel and trying incredibly hard to slither out of the green fisherman’s clutches, the fisherman took a nice length of reed, tied Pinocchio’s hands and legs together like sausage ends, and threw him into the bucket with the others.","But it was useless: the fisherman took a long strip of rush, and having bound his hands and feet as if he had been a sausage, he threw him into the pan with the other fish."
"- Come stai, mio caro Lucignolo?","- How are you, my dear Candlewick?","Smiling and pretending not to notice anything, he asked, “How are you doing, my dear Lampwick?”","""How are you, my dear Candlewick?"""
- E dopo?...,- And then?...,“And then?”,"""And after that?"""
Pinocchio ritrova in corpo al Pesce-cane... chi ritrova? Leggete questo capitolo e lo saprete.,Pinocchio finds in the body of the Dog-fish ... who does he find? Read this chapter and you will know.,"AS SOON as Pinocchio said goodbye to his good friend Tuna, he began fumbling his way on tiptoes through the darkness of the Shark’s belly, putting one foot in front of the other, heading for the faint light he could see glowing far in the distance.","What Pinocchio Finds in the Dog-Fish Pinocchio,finds in the body of the Dog-fish . . . whom does he find? Read this chapter and you will know."
- E nemmeno i maestri?,- And not even the masters?,"“And no teachers, either?”","""And no masters either? . . ."""
- Insegno l'abbaco alle formicole.,- I teach the tingles abacus.,“I’m teaching the ants to count.”,"""I am teaching the alphabet to the ants."""
"Pinocchio piange la morte della bella Bambina dai capelli turchini: poi trova un Colombo, che lo porta sulla riva del mare, e là si getta nell'acqua per andare in aiuto del suo babbo Geppetto.","Pinocchio mourns the death of the beautiful little girl with blue hair: then he finds a Columbus, who takes him to the seashore, and there he throws himself into the water to go to the aid of his father Geppetto.",AS SOON,"Pinocchio Flies with a Pigeon to the Ocean Pinocchio mourns the death of the beautiful Child with the blue hair. He then meets with a pigeon who flies with him to the seashore, and there he throws himself into the water to go to the assistance of his father Geppetto."
"La bella Bambina dai capelli turchini fa raccogliere il burattino: lo mette a letto, e chiama tre medici per sapere se sia vivo o morto.","The beautiful little girl with blue hair has the puppet picked up: she puts him to bed, and calls three doctors to find out if he is dead or alive.","POOR PINOCCHIO: having been hung by murderers from a branch of the Big Oak, he now seemed more dead than alive.",Pinocchio Is Found and Put to Bed The beautiful Child with blue hair has the puppet taken down: has been put to bed and calls in three doctors to know if he is alive or dead.
"A sentirsi chiamar Polendina, compar Geppetto diventò rosso come un peperone dalla bizza, e voltandosi verso il falegname, gli disse imbestialito:","On hearing himself called Polendina, Geppetto turned red as a pepper from the bizza, and turning to the carpenter, he said furiously:","Hearing himself called Corn Head, dear Geppetto turned as red as a hot pepper, and approaching the carpenter he said furiously, “Why are you insulting me?”","Hearing himself called Polendina Geppetto became as red as a turkey-cock from rage, and turning to the carpenter he said in a fury:"
"Senza aggiungere altre parole, il burattino salutò la sua buona Fata, che era per lui una specie di mamma, e cantando e ballando uscì fuori dalla porta di casa.","Without adding any more words, the puppet greeted his good Fairy, who was a kind of mother to him, and singing and dancing went out the door of the house.","With that, the puppet said goodbye to the good Fairy, who was a sort of mother to him, and sang and danced his way out of the house.","Without saying more the puppet took leave of his good Fairy, who was like a mamma to him, and went out of the house singing and dancing."
"La mattina, sul far del giorno, finalmente la porta si aprì. Quella brava bestiòla della Lumaca, a scendere dal quarto piano fino all'uscio di strada, ci aveva messo solamente nove ore. Bisogna proprio dire che avesse fatto una sudata.","In the morning, at dawn, the door finally opened. That good beast of the Snail, to go down from the fourth floor to the street door, had only taken nine hours. It must be said that he had made a sweat.","In the morning, near dawn, the door finally opened. That good creature the Snail had taken only nine hours to descend from the fourth floor to the front door. It must be said that she had worked up a sweat.",The following morning at daybreak the door was at last opened. That clever little Snail had taken only nine hours to come down from the fourth story to the house door. It is evident that her exertions must have been great.
"Appena si fu vestito, gli venne fatto naturalmente di mettere le mani nelle tasche e tirò fuori un piccolo portamonete d'avorio, sul quale erano scritte queste parole: «La Fata dai capelli turchini restituisce al suo caro Pinocchio i quaranta soldi e lo ringrazia tanto del suo buon cuore.» Aperto il portafoglio, invece dei 40 soldi di rame, vi luccicavano quaranta zecchini d'oro, tutti nuovi di zecca.","As soon as he was dressed, he was naturally made to put his hands in his pockets and took out a small ivory purse, on which were written these words: ""The Fairy with blue hair returns the forty sous to her dear Pinocchio and thanks him so much. of his good heart. "" Opened the wallet, instead of the 40 copper sous, forty gold sequins glistened in it, all brand new.","As soon as he was dressed, he naturally thrust his hands into his pockets, and there he found a little ivory coin purse, on which was written these words: The Fairy with Sky-Blue Hair returns to her dear Pinocchio his forty nickels and thanks him very much for his good heart. But when he opened the coin purse, instead of forty nickels, he found forty shining gold pieces, all fresh from the mint.","He was hardly dressed when he naturally put his hands in his pockets, and pulled out a little ivory purse on which these words were written: ""The Fairy with blue hair returns the forty pence to her dear Pinocchio, and thanks him for his good heart."" He opened the purse, and instead of forty copper pennies he saw forty shining gold pieces fresh from the mint."
"Il solo difetto che avesse era quello di bazzicare troppi compagni: e fra questi, c'erano molti monelli conosciutissimi per la loro poca voglia di studiare e di farsi onore.","The only defect he had was that of hanging out with too many companions: and among these, there were many urchins well known for their little desire to study and to be honored.",His only fault was knocking about with too many of his schoolmates. Among them were a bunch of rogues notorious for their lack of interest in studying or doing well in school.,But he had one fault: he made too many friends; and amongst them were several young rascals well known for their dislike to study and love of mischief.
E il conduttore del carro?...,And the driver of the wagon? ...,And the coachman?,And the coachman? . . . AND THE COACHMAN
"Voi sapete che il burattino, fin dalla nascita, aveva gli orecchi piccini piccini: tanto piccini che, a occhio nudo, non si vedevano neppure! Immaginatevi dunque come restò, quando dové toccar con mano che i suoi orecchi, durante la notte, erano così allungati, che parevano due spazzole di padule.","You know that the puppet, from birth, had very small ears: so small that, with the naked eye, they could not even be seen! Imagine, then, how he felt, when he had to feel that his ears, during the night, were so elongated, that they looked like two brushes of marshes.","All his life, you see, the puppet had had tiny little ears—so tiny they couldn’t be seen with the naked eye! So imagine his reaction when he touched his ears and found that, during the night, they had grown so long they looked like two leaves on a corn stalk.",You know that the puppet from his birth had always had very small ears—so small that they were not visible to the naked eye. You can imagine then what he felt when he found that during the night his ears had become so long that they seemed like two brooms.
LA STELLA DELLA DANZA,THE STAR OF DANCE,THE STAR OF THE DANCE,"On that evening, as you may imagine, an hour before the play was to begin the theatre was crammed."
- Ma sei proprio sicuro che in quel paese tutte le settimane sieno composte di sei giovedì e di una domenica?,- But are you really sure that in that country every week consists of six Thursdays and one Sunday?,"But then, stopping and turning back toward his friend, he asked, “But are you really positive that every week is made up of six Thursdays and one Sunday?”","""But are you quite certain that in that country all the weeks consist of six Thursdays and one Sunday?"""
- Non lo buttar via: tutto in questo mondo può far comodo.,- Do not throw it away: everything in this world can be convenient.,“But I would certainly never eat the core!”,"""Do not throw it away; in this world everything may be of use."""
"Pinocchio restò a bocca aperta, e non volendo credere alle parole del Pappagallo, cominciò colle mani e colle unghie a scavare il terreno che aveva annaffiato. E scava, scava, scava, fece una buca così profonda, che ci sarebbe entrato per ritto un pagliaio: ma le monete non c'erano più.","Pinocchio remained speechless, and not wanting to believe the Parrot's words, he began with his hands and nails to dig up the ground he had watered. And he digs, he digs, he digs, he made a hole so deep that a haystack would have gone straight in: but the coins were gone.","Pinocchio’s jaw dropped. Not wanting to believe the Parrot’s words, he started clawing at the dirt he had just watered. He dug and he dug and he dug, making a hole so deep you could have stood a haystack in it—but the coins were no longer there.","Pinocchio remained with his mouth open, and not choosing to believe the Parrot's words he began with his hands and nails to dig up the earth that he had watered. And he dug, and dug, and dug, and made such a deep hole that a rick of straw might have stood upright in it: but the money was no longer there."
- È Pinocchio davvero! - grida Pulcinella.,- It's really Pinocchio! - shouts Pulcinella.,“It truly is Pinocchio!” shouts Punchinello.,"""It is indeed Pinocchio!"" cried Punchinello."
"- Domani, dunque, ti aspetto a colazione a casa mia.","- Tomorrow, therefore, I'll wait for you for breakfast at my house.","“Tomorrow, then, I’ll expect you for breakfast at my house.”","""To-morrow, therefore, I expect you to breakfast at my house."""
Pinocchio guardò la brocca e non rispose né sì né no.,Pinocchio looked at the pitcher and answered neither yes nor no.,Pinocchio looked at the jug but didn’t say either yes or no.,Pinocchio looked at the can and answered neither yes nor no.
"- Nessuna paura!... Piuttosto morire, che bevere quella medicina cattiva. -",- No fear! ... Rather die than drink that bad medicine. -,“Not at all! I’d rather die than drink that nasty medicine.”,"""Are you not afraid of death?"" ""I am not in the least afraid! . . . I would rather die than drink that bitter medicine."""
"Detto fatto, gli legarono le mani dietro le spalle, e, passatogli un nodo scorsoio intorno alla gola, lo attaccarono penzoloni al ramo di una grossa pianta detta la Quercia grande.","Having said that, they tied his hands behind his shoulders, and, passing a slipknot around his throat, they attached him dangling to the branch of a large plant called the Big Oak.","They wasted no time tying his hands behind his back and slipping a noose over his head, and then they strung him up from a branch of a large tree called the Big Oak.","Without loss of time they tied his arms behind him, passed a running noose round his throat, and then hung him to the branch of a tree called the Big Oak."
"Come andò che Maestro Ciliegia, falegname, trovò un pezzo di legno, che piangeva e rideva come un bambino.","How did it happen that Master Cherry, carpenter, found a piece of wood, which was crying and laughing like a child.",,THIS TIME MASTER CHERRY WAS PETRIFIED. Master Cherry Finds a Piece of Wood How it came to pass that Master Cherry the carpenter found a piece of wood that laughed and cried like a child.
- La nottata è scura...,- The night is dark ...,“The night is dark!”,"""The night is dark! . . ."""
- E io invece voglio andare avanti.,- And I want to go on instead.,“But I want to keep going.”,"""On the contrary, I am determined to go on."""
"Al rumore di quelle grida acutissime, entrò nella stanza una bella Marmottina, che abitava il piano di sopra: la quale, vedendo il burattino in così grandi smanie, gli domandò premurosamente:","At the sound of those piercing cries, a beautiful little Marmot entered the room, who lived on the floor above: who, seeing the puppet in such great fears, asked him earnestly:","At the sound of those piercing cries, his door opened and in came a pretty little marmot, who lived upstairs from him, and who, seeing the puppet in such a frenzy, asked him gently, “What’s wrong, my dear housemate?”",At the sound of his loud outcries a beautiful little Marmot that lived on the first floor came into the room. Seeing the puppet in such grief she asked earnestly:
"Quand'ecco che gli parve di vedere nel monte della spazzatura qualche cosa di tondo e di bianco, che somigliava tutto a un uovo di gallina. Spiccare un salto e gettarvisi sopra, fu un punto solo. Era un uovo davvero.","Suddenly he thought he saw something round and white in the garbage heap, all resembling a hen's egg. Taking a leap and jumping on it was only one point. It really was an egg.","Just then he thought he glimpsed, atop a heap of sweepings, something roundish and white that looked very much like a chicken egg. He was up and on it in a single motion—it really was an egg.",Just then he thought he saw something in the dust-heap—something round and white that looked like a hen's egg. To give a spring and seize hold of it was the affair of a moment. It was indeed an egg.
"- Che cosa comandate, mia graziosa Fata? - disse il Falco abbassando il becco in atto di riverenza (perché bisogna sapere che la Bambina dai capelli turchini non era altro in fin dei conti che una bonissima Fata, che da più di mill'anni abitava nelle vicinanze di quel bosco).","- What do you command, my pretty Fairy? - Said the Hawk, lowering his beak in an act of reverence (because you must know that the little girl with blue hair was nothing more than a very good Fairy, who had lived in the vicinity of that forest for more than a thousand years).","“What is your command, my lovely Fairy?” said the Falcon, lowering his beak in a gesture of reverence. (For it just so happens that the Girl with Sky-Blue Hair was nothing other than the kindest of fairies, one who had dwelt in and around that forest for more than a thousand years.)","""What are your orders, gracious Fairy?"" he asked, inclining his beak in sign of reverence—for I must tell you that the Child with blue hair was no more and no less than a beautiful Fairy, who for more than a thousand years had lived in the wood."
"- Allora mangia il fieno! - replicò il padrone, che intendeva benissimo il dialetto asinino.","- Then eat the hay! replied the master, who understood the asinine dialect very well.","replied his master, who understood asinine dialect quite well.","""Then eat hay!"" said his master, who understood perfectly the asinine dialect."
