Source,GoogleTranslate,human1,human2
"Pinocchio capì questa risposta a volo, e non potendo frenare l'impeto del suo buon cuore, saltò al collo di Geppetto e cominciò a baciarlo per tutto il viso.","Pinocchio understood this response quickly, and not being able to restrain the impetus of his good heart, he jumped on Geppetto's neck and began to kiss him all over the face.","Pinocchio quickly grasped what his answer meant, and he couldn’t resist the good-hearted impulse to throw his arms around Geppetto’s neck and begin covering his face with kisses.","Pinocchio understood this answer in an instant, and unable to restrain the impulse of his good heart he sprang up, and throwing his arms round Geppetto's neck he began kissing him again and again."
"Appena riebbe l'uso della parola, cominciò a dire tremando e balbettando dallo spavento:","As soon as he got back to the use of the word, he began to say, trembling and stammering with fright:","When he regained the use of speech, he said, trembling and stammering with fear, “That little voice that said ouch, where could it have come from?","As soon as he had recovered the use of his speech, he began to say, stuttering and trembling with fear:"
"Pinocchio aveva una gran paura dei tuoni e dei lampi: se non che la fame era più forte della paura: motivo per cui accostò l'uscio di casa, e presa la carriera, in un centinaio di salti arrivò fino al paese, colla lingua fuori e col fiato grosso, come un cane da caccia.","Pinocchio was very afraid of thunder and lightning: if not that hunger was stronger than fear: which is why he approached the door of the house, and took his career, in a hundred leaps he reached the town, with his tongue out. and out of breath, like a hunting dog.","Pinocchio was terribly afraid of thunder and lightning, but his hunger was greater than his fear. And so he dashed out the door at top speed, and after a hundred or so leaping strides he reached the village, panting, his tongue hanging out like a hunting dog.","Pinocchio had a great fear of thunder, but hunger was stronger than fear. He therefore closed the house door and made a rush for the village, which he reached in a hundred bounds, with his tongue hanging out and panting for breath, like a dog after game."
"A tutte queste domande, fatte precipitosamente e senza ripigliar fiato, la Lumaca rispose con la sua solita flemma:","To all these questions, asked hastily and without catching his breath, the Snail replied with his usual phlegm:","To all these questions, asked in a rush and without pausing for breath, the Snail replied with her usual cool, “My dear Pinocchio!","To all these rapid, breathless questions the Snail replied in her usual phlegmatic manner:"
"- Io no, io no! - gridò Pinocchio, singhiozzando. - Io sono entrato nel campo per prendere soltanto due grappoli d'uva!","- Not me, not me! cried Pinocchio, sobbing. - I entered the field to take only two bunches of grapes!","“Not me, not me!” shouted Pinocchio, sobbing. “I only came into the field to take a few grapes!”","""No, it is not I; indeed it is not!"" cried Pinocchio, sobbing. ""I only came into the field to take two bunches of grapes! . . ."""
Capitolo XXVII,Chapter XXVII,27,CHAPTER XXVII
"Pinocchio montò: e il carro cominciò a muoversi: ma nel tempo che i ciuchini galoppavano e che il carro correva sui ciottoli della via maestra, gli parve al burattino di sentire una voce sommessa e appena intelligibile, che gli disse:","Pinocchio got on: and the chariot began to move: but while the donkeys were galloping and the chariot ran over the cobblestones of the main road, the puppet thought he heard a soft and barely intelligible voice, which said to him:",Pinocchio mounted. And the coach began to move.,"Pinocchio mounted, and the coach started. Whilst the donkeys were galloping and the coach was rattling over the stones of the high road, the puppet thought that he heard a low voice that was scarcely intelligible saying to him:"
"Non era un legno di lusso, ma un semplice pezzo da catasta, di quelli che d'inverno si mettono nelle stufe e nei caminetti per accendere il fuoco e per riscaldare le stanze.","It was not a luxury piece of wood, but a simple piece from a pile, of the kind that in winter are put in stoves and fireplaces to light the fire and to heat the rooms.","It wasn’t a fancy piece of wood, just a regular woodpile log, the kind you might put in your stove or fireplace to stoke a fire and heat your room.",This wood was not valuable: it was only a common log like those that are burnt in winter in the stoves and fireplaces to make a cheerful blaze and warm the rooms.
- Quale?,- Which?,“What is it?”,"""What is it?"""
"E i medici arrivarono subito uno dopo l'altro: arrivò, cioè, un Corvo, una Civetta e un Grillo-parlante.","And the doctors arrived immediately one after the other: that is, a Crow, an Owl and a Talking Cricket arrived.","The doctors soon arrived, one after the other. The first was a crow, the second an owl, and the third a talking cricket.","The doctors came immediately one after the other: namely a Crow, an Owl, and a Talking-cricket. THE DOCTORS CAME IMMEDIATELY . . . A CROW, AN OWL, A TALKING-CRICKET."
"- Mi farebbe il piacere di dirmi se in quest'isola vi sono dei paesi dove si possa mangiare, senza pericolo d'esser mangiati?","- Would you like to tell me if there are towns on this island where you can eat, without danger of being eaten?","“Would you be so kind as to tell me if there are villages on this island where one might get something to eat, without the danger of getting eaten?”","""Will you be kind enough to tell me if there are villages in this island where it would be possible to obtain something to eat, without running the danger of being eaten?"""
"Basti dire che il burattino sentiva dietro di sé, alla distanza d'un palmo, l'ansare affannoso di quella bestiaccia, e ne sentiva perfino la vampa calda delle fiatate.","Suffice it to say that the puppet felt behind him, at the distance of a palm, the panting of that beast, and even felt the warm blaze of its breaths.","Let’s just say that the puppet could hear, a handbreadth away, the labored panting of that nasty beast, and he could even feel the hot blasts of his smelly breath.","The puppet could hear the panting of the dreadful beast close behind him; there was not a hand's breadth between them, he could even feel the dog's hot breath."
"- Pietà, signor Cavaliere!...","- Have mercy, Mr. Cavaliere! ...","“Have mercy, noble knight!”","""Have pity, Sir Knight! . . ."""
"- Io rimango - rispose Pinocchio. - Io voglio tornarmene a casa mia: voglio studiare e voglio farmi onore alla scuola, come fanno tutti i ragazzi perbene.","""I'm staying,"" replied Pinocchio. - I want to go back to my house: I want to study and I want to do my homework, like all good boys do.","“I’m staying,” replied Pinocchio. “I want to go back home. I want to study and I want to do well in school, as all proper boys do.”","""I remain behind,"" answered Pinocchio. ""I am going home. I intend to study and to earn a good character at school, as all well-conducted boys do."""
"- Smettetela, birichini che non siete altro! Queste guerre manesche fra ragazzi e ragazzi raramente vanno a finir bene. Qualche disgrazia accade sempre!... -","- Stop it, you naughty people who are nothing else! These manesche wars between boys and boys rarely turn out well. Some misfortune always happens! ... -","Meanwhile, as the battle was growing fiercer and fiercer, a large Crab, who had crawled ever so slowly out of the water and onto the beach, shouted out in an ugly voice that sounded like a trombone with a cold, “Cut it out, you incorrigible rascals! These fistfights between boys and boys never end well. They always end in disaster!”","""Have done with that, you young ruffians, for you are nothing else! These hand-to-hand fights between boys seldom finish well. Some disaster is sure to happen!"
Allora Geppetto disse al burattino:,Then Geppetto said to the puppet:,"Geppetto then told the puppet, “Close your eyes and go to sleep!”",Geppetto then said to the puppet:
"- Anche troppo bene!... - rispose Pinocchio: e tentennò il capo in un certo modo minaccioso, come se avesse voluto dire: - Fra poco ci riparleremo!... -","- Even too well! ... - replied Pinocchio: and shook his head in a certain threatening way, as if he wanted to say: - We will talk again soon! ... -","replied Pinocchio, nodding his head in an almost threatening way, as if to say: This isn’t over yet!",""" answered Pinocchio, and he shook his head threateningly as much as to say: ""You shall hear of this shortly!"""
- E dove hanno detto di aspettarmi quei buoni amici?,- And where did those good friends say they are waiting for me?,"Then he asked, “And where did those dear friends of mine say I should meet them?”","""And where did my good friends say they would wait for me?"""
Una mattina disse a suo padre:,One morning he said to his father:,"One morning he said to his father, “I’m going to the nearby market, to buy myself a jacket, a cap, and a pair of shoes.",One morning he said to his father:
"A questa risposta fu tale e tanta la contentezza di Pinocchio, che prese le mani alla Fata e cominciò a baciargliele con tanta foga, che pareva quasi fuori di sé. Poi, alzando il viso e guardandola amorosamente, le domandò:","At this reply, Pinocchio was so happy that he took the Fairy's hands and began to kiss them with such enthusiasm that he seemed almost beside himself. Then, raising his face and looking at her lovingly, he asked her:","On hearing these words Pinocchio was nearly beside himself with happiness, so much so that he grabbed the Fairy’s hands and began fervently kissing them. Then lifting his face and looking lovingly at her, he asked, “So tell me, dear mother, it isn’t true that you were dead?”","At this answer Pinocchio was so delighted that he took the Fairy's hands and began to kiss them with such fervour that he seemed beside himself. Then raising his face and looking at her lovingly, he asked:"
"Arrivati in piazza, trovarono subito il compratore, il quale domandò al garzone di stalla:","Arriving in the square, they immediately found the buyer, who asked the stable boy:","Once they reached the market square, they quickly found a buyer, who asked the stableboy, “How much do you want for that lame donkey?”",When they reached the market a purchaser was found at once. He asked the stable-boy:
- Ma davvero è proprio così? - domandò singhiozzando il burattino.,"- But is it really so? asked the puppet, sobbing.","“Is that really true?” asked the puppet, sobbing.","""But is it really so?"" asked the puppet, sobbing."
"È impossibile figurarsi gli abbracciamenti, gli strizzoni di collo, i pizzicotti dell'amicizia e le zuccate della vera e sincera fratellanza, che Pinocchio ricevé in mezzo a tanto arruffìo dagli attori e dalle attrici di quella compagnia drammatico-vegetale.","It is impossible to imagine the hugs, the squeezes of the neck, the pinches of friendship and the blows of true and sincere brotherhood, which Pinocchio received in the midst of so much ruffling from the actors and actresses of that dramatic-vegetable company.","You can’t imagine all the hugging and embracing, the friendly pinches and the sincere head butts of brotherhood that Pinocchio received amid this mayhem from the actors and actresses of that plant-kingdom troupe.","The embraces, the hugs, the friendly pinches, and the demonstrations of warm brotherly affection that Pinocchio received from the excited crowd of actors and actresses of the puppet dramatic company beat description. THE DEMONSTRATION OF WARM BROTHERLY AFFECTION THAT PINOCCHIO RECEIVED"
"- Perché ridete? - gli domandò il burattino, tutto confuso e impensierito di quel suo naso che cresceva a occhiate.","- Why are you laughing? the puppet asked him, all confused and worried about his nose growing with glances.","“Why are you laughing?” asked the puppet, thoroughly confounded and worried about this nose of his that was growing by leaps and bounds.","And the Fairy looked at him and laughed. ""What are you laughing at?"" asked the puppet, very confused and anxious at finding his nose growing so prodigiously."
- Mai!... E tu?,- Never! ... And you?,“Never! And you?”,"""Never! . . . And you?"""
- Si chiama il «Paese dei balocchi». Perché non vieni anche tu?,"- It's called the ""Land of Toys"". Why do not you come too?",“It’s called Toyland. Why don’t you come too?”,"""It is called the 'Land of Boobies.' Why do you not come too?"""
- Vado ad abitare in un paese... che è il più bel paese di questo mondo: una vera cuccagna!...,- I'm going to live in a country ... which is the most beautiful country in this world: a real bonanza! ...,“I’m going to live in a land—in the most beautiful land on earth. A real paradise!”,"""I am going to live in a country . . . the most delightful country in the world: a real land of Cocagne! . . ."""
- Qualcuno si affaccerà. -,- Someone will look out. -,"At this point, Pinocchio, overcome by despair and hunger, ran to the doorbell of a house and began ringing it loudly, telling himself, “Surely someone will come.”","""That will bring somebody."""
- Uno! Due! Tre! -,- One! Two! Three! -,Two! Three!”,"""One! Two! Three!"""
"- Badate, ragazzi: io non son venuto qui per essere il vostro buffone. Io rispetto gli altri e voglio esser rispettato.","- Mind you, boys: I didn't come here to be your fool. I respect others and want to be respected.","But finally, feeling his patience running out, he turned to the ones who were pestering him and making sport of him the most, and he told them sternly, “Watch out, boys, I didn’t come here to be the butt of your jokes. I respect others and I want to be respected.”","""Beware, boys: I am not come here to be your buffoon. I respect others, and I intend to be respected."""
"- Crepa! - gli rispose Pinocchio da lontano, il quale si vedeva oramai sicuro da ogni pericolo.","- Crack! replied Pinocchio from a distance, who now saw himself safe from any danger.","replied Pinocchio from afar, seeing that by now he was safe from danger.","""Drown!"" shouted Pinocchio from a distance, seeing himself safe from all danger."
"Finita la prima parte dello spettacolo, il Direttore della compagnia, vestito in giubba nera, calzoni bianchi a coscia e stivaloni di pelle fin sopra ai ginocchi, si presentò all'affollatissimo pubblico e, fatto un grande inchino, recitò con molta solennità il seguente spropositato discorso:","At the end of the first part of the show, the Director of the company, dressed in a black jacket, white thigh-high trousers and leather boots up to the knees, introduced himself to the crowded audience and, having made a great bow, recited with great solemnity the following disproportionate speech:","When the first portion of the show came to an end, the Ringmaster, dressed in a black tailcoat, tight white pants, and knee-high leather boots, introduced himself to the packed audience, and after a sweeping bow he solemnly intoned the following preposterous speech: “Esteemed public, lords and ladies!","When the first part of the performance was over, the director of the company, dressed in a black coat, white shorts, and big leather boots that came above his knees, presented himself to the public, and after making a profound bow he began with much solemnity the following ridiculous speech:"
"- Non vi date alla disperazione, padrone. Dei ciuchini ce n'è tanti in questo mondo!","- Do not give yourselves to despair, master. There are many donkeys in this world!","“Don’t despair, master. There’s no shortage of donkeys in this world.”","""Don't despair, master. There are such a number of little donkeys in the world!"""
"- Pazienza! - gridò Geppetto tutt'a un tratto rizzandosi in piedi; e infilatasi la vecchia casacca di frustagno, tutta toppe e rimendi, uscì correndo di casa.","- Patience! shouted Geppetto all of a sudden, getting to his feet; and putting on her old whip tunic, all patched and patched, she ran out of the house.","“Don’t worry!” shouted Geppetto, suddenly springing to his feet. He put on his old fustian coat, all patches and darnings, and ran out the door.","""Well, patience!"" exclaimed Geppetto, all at once rising to his feet, and putting on his old fustian coat, all patched and darned, he ran out of the house."
"Si voltò a guardare, e vide nel buio due figuracce nere, tutte imbacuccate in due sacchi da carbone, le quali correvano dietro a lui a salti e in punta di piedi, come se fossero due fantasmi.","He turned to look, and saw in the darkness two black fools, all wrapped up in two coal sacks, who ran after him in leaps and on tiptoes, as if they were two ghosts.","He turned to look, and there, in the dark, he saw two ominous black figures, completely draped in coal sacks. They were bounding toward him on tiptoe, like ghosts.","He turned to look, and saw in the gloom two evil-looking black figures completely enveloped in charcoal sacks. They were running after him on tiptoe, and making great leaps like two phantoms."
- Ecco la colazione che vi manda la Fata - disse la Lumaca.,- Here is the breakfast that the Fairy sends you - said the Snail.,"“Here is the breakfast the Fairy sends you,” said the Snail.","THE SNAIL RETURNED CARRYING A SILVER TRAY ""Here is the breakfast that the Fairy has sent you,"" said the Snail."
"- Ebbene, che cosa vuoi da me?","- Well, what do you want from me?","Hearing himself called Excellency, the puppet master quickly pursed his lips and, having suddenly become gentler and more agreeable, he said to Pinocchio, “Well then, what is it you want from me?”","""Well, what do you want from me?"""
"Nel grand'urto della caduta la candela si spense, e padre e figliuolo rimasero al bujo.","In the great shock of the fall the candle went out, and father and son were left in the dark.","When they landed with a crash, their candle went out and father and son were left in the dark.","Follow me, dear papa, and in a short time we shall be in safety."""
Pinocchio aprì gli occhi e li richiuse subito.,Pinocchio opened his eyes and immediately closed them again.,Pinocchio opened his eyes and quickly shut them again.,". . ."" Pinocchio opened his eyes, but shut them again immediately."
"- Levami una curiosità, mio caro Lucignolo: hai mai sofferto di malattia agli orecchi?","- Raise me a curiosity, my dear Candlewick: have you ever suffered from ear disease?","At last the puppet, in a soft, sweet voice, said to his friend, “I’m curious, my dear Lampwick: have you ever had any problems with your ears?”","""Satisfy my curiosity, my dear Candlewick: have you ever suffered from disease of the ears?"""
"Il carabiniere, senza punto smuoversi, lo acciuffò pulitamente per il naso (era un nasone spropositato, che pareva fatto apposta per essere acchiappato dai carabinieri), e lo riconsegnò nelle proprie mani di Geppetto; il quale, a titolo di correzione, voleva dargli subito una buona tiratina d'orecchi. Ma figuratevi come rimase quando, nel cercargli gli orecchi, non gli riuscì di poterli trovare: e sapete perché? perché, nella furia di scolpirlo, si era dimenticato di farglieli.","The carabiniere, without moving at all, neatly caught him by the nose (he was a disproportionate big nose, which seemed made on purpose to be caught by the carabinieri), and handed him back into Geppetto's own hands; who, by way of correction, wanted to give him a good slap on the ear right away. But imagine how he remained when, in looking for his ears, he could not find them: and do you know why? because, in the fury of sculpting it, he had forgotten to make them.","Without budging an inch, the policeman snatched him up by the nose (it was a prodigiously long nose, one that seemed specially designed to be easily seized by policemen), and delivered him back into Geppetto’s arms. Geppetto’s first impulse was to give him a good ear-pulling, to set him straight. But imagine his reaction when, looking for Pinocchio’s ears, he wasn’t able to find them—and do you know why? Because in his haste to finish carving, he had forgotten to make them.","The carabineer without disturbing himself in the least caught him cleverly by the nose—it was an immense nose of ridiculous proportions that seemed made on purpose to be laid hold of by carabineers —and consigned him to Geppetto. Wishing to punish him, Geppetto intended to pull his ears at once. But imagine his feelings when he could not succeed in finding them. And do you know the reason? It was that, in his hurry to model him, he had forgotten to make them."
- Squisiti questi muggini!...,- These mullets are delicious! ...,"Scrumptious, these mullet!","""What exquisite sardines! . . ."""
"- Ah, ladracchiolo! - disse il contadino incollerito - dunque sei tu che mi porti via le galline?","- Ah, thief! - said the angry farmer - so are you the one who takes the chickens away from me?","“Ah, little thief!” said the furious farmer. “So you’re the one who makes off with my chickens!”","""Ah, little thief!"" said the angry peasant, ""then it is you who carry off my chickens?"""
"A questa terza bugia, il naso gli si allungò in un modo così straordinario, che il povero Pinocchio non poteva più girarsi da nessuna parte. Se si voltava di qui, batteva il naso nel letto o nei vetri della finestra, se si voltava di là, lo batteva nelle pareti o nella porta di camera, se alzava un po' più il capo, correva il rischio di ficcarlo in un occhio alla Fata.","At this third lie, his nose lengthened in such an extraordinary way that poor Pinocchio could no longer turn around. If he turned from here, he tapped his nose on the bed or in the window panes, if he turned away, he hit it on the walls or on the bedroom door, if he raised his head a little more, he ran the risk of sticking it in the eye to the Fairy.","At this third lie, his nose grew to such an extraordinary length that poor Pinocchio could no longer even turn his head. If he turned in one direction, he banged his nose against the bed or into the windowpanes; if he turned in the other, he banged it against the wall or into the door; if he lifted his head a little, he ran the risk of poking the Fairy in the eye.","At this third lie his nose grew to such an extraordinary length that poor Pinocchio could not move in any direction. If he turned to one side he struck his nose against the bed or the window-panes, if he turned to the other he struck it against the walls or the door, if he raised his head a little he ran the risk of sticking it into one of the Fairy's eyes."
"- I tuoi cinque zecchini, dall'oggi al domani sarebbero diventati duemila.","- Your five sequins, overnight would have become two thousand.",“Your five gold coins could become two thousand overnight.”,"""Between to-day and to-morrow your five sovereigns would have become two thousand."""
"- Ah! ora che mi rammento bene - replicò il burattino imbrogliandosi - le quattro monete non le ho perdute, ma senza avvedermene, le ho inghiottite mentre bevevo la vostra medicina. -","- Ah! now that I remember well - replied the puppet, cheating himself - I did not lose the four coins, but without realizing it, I swallowed them while I was drinking your medicine. -","“Ah, now that I think of it,” replied the puppet, getting himself in deeper, “I didn’t lose the four coins, I accidentally swallowed them as I was drinking your medicine.”","""Ah! now I remember all about it,"" replied the puppet, getting quite confused; ""I didn't lose the four gold pieces, I swallowed them inadvertently whilst I was drinking your medicine."""
"- Se le hai perdute nel bosco vicino - disse la Fata - le cercheremo e le ritroveremo: perché tutto quello che si perde nel vicino bosco, si ritrova sempre.",- If you have lost them in the nearby wood - said the Fairy - we will look for them and find them again: because everything that is lost in the nearby wood is always found.,"“If you lost them nearby in the woods,” said the Fairy, “we’ll look for them and find them, because anything that’s lost nearby in the woods is always found again.”","""If you have lost them in the wood near here,"" said the Fairy, ""we will look for them, and we shall find them: because everything that is lost in that wood is always found."""
"- Aprite! Sono l'Omino, sono il conduttore del carro che vi portò in questo paese. Aprite subito, o guai a voi! -","- Open up! I am the Little Man, I am the conductor of the chariot that brought you to this country. Open now, or woe to you! -","Just then there was a knock at the door, and they heard a voice outside say, “Open up! Mini-Man here, the coachman who brought you to this country. Open up at once, or else!”","""Open the door! I am the little man, I am the coachman, who brought you to this country. Open at once, or it will be the worse for you!"""
- Grazie. E il tuo babbo e la tua mamma sono sempre vivi? - gli domandò Mangiafoco.,- Thanks. And your dad and mom are always alive? Fire Eater asked him.,"“Thank you,” said Fire-Eater. “And your father and mother, are they still alive?” “My daddy is.","""Thank you! And your papa and your mamma, are they still alive? "" asked Fire-eater."
